id	text	labels	labels_phrases
756	Buena decoración, comida normal, mucho ruido y algo caro.	['(AMBIENCE#GENERAL, POSITIVE)', '(FOOD#QUALITY, NEUTRAL)', '(AMBIENCE#GENERAL, NEGATIVE)', '(RESTAURANT#PRICES, NEGATIVE)']	"['(AMBIENCE#GENERAL, POSITIVE, ""decoración"")', '(FOOD#QUALITY, NEUTRAL, ""comida"")', '(AMBIENCE#GENERAL, NEGATIVE, ""ruido"")', '(RESTAURANT#PRICES, NEGATIVE, ""NULL"")']"
757	Esta bien, pero creo que trabajan para clientes puntuales, y no repetiré	['(RESTAURANT#GENERAL, NEUTRAL)']	"['(RESTAURANT#GENERAL, NEUTRAL, ""NULL"")']"
758	Por cierto, pagar casi 5€ x los cubiertos me molesta siempre.	['(RESTAURANT#PRICES, NEGATIVE)']	"['(RESTAURANT#PRICES, NEGATIVE, ""NULL"")']"
759	Me ha sorprendido el restaurante; nos han tratado en una manera casual pero profesional; la comida, todos los platos calidad excelente y sabroso; voy a volver pronto!	['(RESTAURANT#GENERAL, POSITIVE)', '(SERVICE#GENERAL, POSITIVE)', '(FOOD#QUALITY, POSITIVE)', '(RESTAURANT#GENERAL, POSITIVE)']	"['(RESTAURANT#GENERAL, POSITIVE, ""restaurante"")', '(SERVICE#GENERAL, POSITIVE, ""NULL"")', '(FOOD#QUALITY, POSITIVE, ""comida"")', '(RESTAURANT#GENERAL, POSITIVE, ""NULL"")']"
760	Un buen ambiente, servicio exquisito y atento, profesionales, platos de calidad, bien cocinados y raciones correctas.	['(AMBIENCE#GENERAL, POSITIVE)', '(SERVICE#GENERAL, POSITIVE)', '(FOOD#QUALITY, POSITIVE)', '(FOOD#STYLE_OPTIONS, POSITIVE)']	"['(AMBIENCE#GENERAL, POSITIVE, ""ambiente"")', '(SERVICE#GENERAL, POSITIVE, ""servicio"")', '(FOOD#QUALITY, POSITIVE, ""platos"")', '(FOOD#STYLE_OPTIONS, POSITIVE, ""raciones"")']"
761	No te importa pagar por estar bien servido y comer bien .	['(SERVICE#GENERAL, POSITIVE)', '(FOOD#QUALITY, POSITIVE)']	"['(SERVICE#GENERAL, POSITIVE, ""NULL"")', '(FOOD#QUALITY, POSITIVE, ""NULL"")']"
762	Muy buen servicio y ambiente.	['(SERVICE#GENERAL, POSITIVE)', '(AMBIENCE#GENERAL, POSITIVE)']	"['(SERVICE#GENERAL, POSITIVE, ""servicio"")', '(AMBIENCE#GENERAL, POSITIVE, ""ambiente"")']"
763	La comida nos gustó a todos.	['(FOOD#QUALITY, POSITIVE)']	"['(FOOD#QUALITY, POSITIVE, ""comida"")']"
764	Un pelo más caro de lo que esperábamos.	['(RESTAURANT#PRICES, NEGATIVE)']	"['(RESTAURANT#PRICES, NEGATIVE, ""NULL"")']"
765	Ambiente muy agradable y animado.	['(AMBIENCE#GENERAL, POSITIVE)']	"['(AMBIENCE#GENERAL, POSITIVE, ""Ambiente"")']"
766	Recomendable.	['(RESTAURANT#GENERAL, POSITIVE)']	"['(RESTAURANT#GENERAL, POSITIVE, ""NULL"")']"
767	Ha sido nuestra prinera visita al Kafka y seguro que repetiremis en nuestras próximas escapadas a Barcelona.	['(RESTAURANT#GENERAL, POSITIVE)']	"['(RESTAURANT#GENERAL, POSITIVE, ""Kafka"")']"
768	Agradable ambiente, muy buen servicio y exquisitos platos.	['(AMBIENCE#GENERAL, POSITIVE)', '(SERVICE#GENERAL, POSITIVE)', '(FOOD#QUALITY, POSITIVE)']	"['(AMBIENCE#GENERAL, POSITIVE, ""ambiente"")', '(SERVICE#GENERAL, POSITIVE, ""servicio"")', '(FOOD#QUALITY, POSITIVE, ""platos"")']"
769	Todo lo que probamos nos encantó.	['(FOOD#QUALITY, POSITIVE)']	"['(FOOD#QUALITY, POSITIVE, ""NULL"")']"
770	Las alcachofas fritas tienen buena fama merecida.	['(FOOD#QUALITY, POSITIVE)']	"['(FOOD#QUALITY, POSITIVE, ""alcachofas fritas"")']"
771	Muy recomendable.	['(RESTAURANT#GENERAL, POSITIVE)']	"['(RESTAURANT#GENERAL, POSITIVE, ""NULL"")']"
772	Realmente 100% recomendable	['(RESTAURANT#GENERAL, POSITIVE)']	"['(RESTAURANT#GENERAL, POSITIVE, ""NULL"")']"
773	Interesante restaurante en el Born, gran calidad en el producto utilizado, tal vez el único pero sería que la sala es un poco ruidosa y las mesas están un poco próximas entre sí.	['(FOOD#QUALITY, POSITIVE)', '(AMBIENCE#GENERAL, NEGATIVE)', '(AMBIENCE#GENERAL, NEGATIVE)', '(RESTAURANT#GENERAL, POSITIVE)']	"['(FOOD#QUALITY, POSITIVE, ""producto"")', '(AMBIENCE#GENERAL, NEGATIVE, ""sala"")', '(AMBIENCE#GENERAL, NEGATIVE, ""mesas"")', '(RESTAURANT#GENERAL, POSITIVE, ""restaurante"")']"
774	No han cambiado nada, bueno si para mejor con los nuevos platos al estilo asiatico, despues de mucho tiempo sin volver,por motivos laborales, sigo pensando que es de lo mejor de barcelona, comida estupenda, servicio inmejorable, vamos que estuvimos 4 horas muy bien aprovechadas ,os lo recomiendo y espero volver pronto.	['(FOOD#QUALITY, POSITIVE)', '(SERVICE#GENERAL, POSITIVE)', '(RESTAURANT#GENERAL, POSITIVE)']	"['(FOOD#QUALITY, POSITIVE, ""comida"")', '(SERVICE#GENERAL, POSITIVE, ""servicio"")', '(RESTAURANT#GENERAL, POSITIVE, ""NULL"")']"
775	Te lo recomendaria!	['(RESTAURANT#GENERAL, POSITIVE)']	"['(RESTAURANT#GENERAL, POSITIVE, ""NULL"")']"
776	Servicio atento y eficiente y una comida estupenda y con muy buena ralacion calidad precio.	['(SERVICE#GENERAL, POSITIVE)', '(FOOD#QUALITY, POSITIVE)', '(FOOD#PRICES, POSITIVE)']	"['(SERVICE#GENERAL, POSITIVE, ""Servicio"")', '(FOOD#QUALITY, POSITIVE, ""comida"")', '(FOOD#PRICES, POSITIVE, ""comida"")']"
777	Cumplió nuestras expectativas.	['(RESTAURANT#GENERAL, POSITIVE)']	"['(RESTAURANT#GENERAL, POSITIVE, ""NULL"")']"
778	Quizá se podría mejorar la distribución de mesas, ya que algunas de ellas están demasiado juntas, y otras están muy cerca de la barra, y por lo tanto, está pasando gente contínuamente por al lado de los comensales.	['(AMBIENCE#GENERAL, NEGATIVE)']	"['(AMBIENCE#GENERAL, NEGATIVE, ""distribución de mesas"")']"
779	El restaurante es muy bonito, el ambiente es agradable y la decoración excepcional así somo el servicio que fue muy amable en todo momento.	['(AMBIENCE#GENERAL, POSITIVE)', '(AMBIENCE#GENERAL, POSITIVE)', '(AMBIENCE#GENERAL, POSITIVE)', '(SERVICE#GENERAL, POSITIVE)']	"['(AMBIENCE#GENERAL, POSITIVE, ""restaurante"")', '(AMBIENCE#GENERAL, POSITIVE, ""ambiente"")', '(AMBIENCE#GENERAL, POSITIVE, ""decoración"")', '(SERVICE#GENERAL, POSITIVE, ""servicio"")']"
780	Lamentablemente la relación calidad-precio me parece mala ya que la comida en mi opinión no está a la altura del precio.	['(FOOD#PRICES, NEGATIVE)', '(FOOD#QUALITY, NEGATIVE)']	"['(FOOD#PRICES, NEGATIVE, ""comida"")', '(FOOD#QUALITY, NEGATIVE, ""comida"")']"
781	Lugar agradable, buen servicio y platos con nota media-alta y con una buena relación calidad-precio.	['(AMBIENCE#GENERAL, POSITIVE)', '(SERVICE#GENERAL, POSITIVE)', '(FOOD#QUALITY, POSITIVE)', '(FOOD#PRICES, POSITIVE)']	"['(AMBIENCE#GENERAL, POSITIVE, ""Lugar"")', '(SERVICE#GENERAL, POSITIVE, ""servicio"")', '(FOOD#QUALITY, POSITIVE, ""platos"")', '(FOOD#PRICES, POSITIVE, ""platos"")']"
782	Recomendado.	['(RESTAURANT#GENERAL, POSITIVE)']	"['(RESTAURANT#GENERAL, POSITIVE, ""NULL"")']"
783	Servicio atento y eficiente, ambiente agradable.	['(SERVICE#GENERAL, POSITIVE)', '(AMBIENCE#GENERAL, POSITIVE)']	"['(SERVICE#GENERAL, POSITIVE, ""Servicio"")', '(AMBIENCE#GENERAL, POSITIVE, ""ambiente"")']"
784	Precios: correctos, lo normal en estos tiempos.	['(RESTAURANT#PRICES, NEUTRAL)']	"['(RESTAURANT#PRICES, NEUTRAL, ""NULL"")']"
785	Plato degustación: un poco abundante de más, pero bien cocinado.	['(FOOD#QUALITY, POSITIVE)', '(FOOD#STYLE_OPTIONS, NEUTRAL)']	"['(FOOD#QUALITY, POSITIVE, ""Plato degustación"")', '(FOOD#STYLE_OPTIONS, NEUTRAL, ""Plato degustación"")']"
786	Únicos comentarios crítico: luz escasa para un restaurante; aquí prima la decoración sobre la función.	['(AMBIENCE#GENERAL, NEGATIVE)']	"['(AMBIENCE#GENERAL, NEGATIVE, ""luz"")']"
787	Por lo demás, muy recomendable.	['(RESTAURANT#GENERAL, POSITIVE)']	"['(RESTAURANT#GENERAL, POSITIVE, ""NULL"")']"
788	Óptima relación calidad-precio en el menú de mediodía, en un local chic muy bien ambientado.	['(FOOD#QUALITY, POSITIVE)', '(FOOD#PRICES, POSITIVE)', '(AMBIENCE#GENERAL, POSITIVE)']	"['(FOOD#QUALITY, POSITIVE, ""menú de mediodía"")', '(FOOD#PRICES, POSITIVE, ""menú de mediodía"")', '(AMBIENCE#GENERAL, POSITIVE, ""local"")']"
789	El ambiente muy agradable, el servicio muy atento y la comida muy buena.	['(AMBIENCE#GENERAL, POSITIVE)', '(SERVICE#GENERAL, POSITIVE)', '(FOOD#QUALITY, POSITIVE)']	"['(AMBIENCE#GENERAL, POSITIVE, ""ambiente"")', '(SERVICE#GENERAL, POSITIVE, ""servicio"")', '(FOOD#QUALITY, POSITIVE, ""comida"")']"
790	Absolutamente recomendable.	['(RESTAURANT#GENERAL, POSITIVE)']	"['(RESTAURANT#GENERAL, POSITIVE, ""NULL"")']"
791	Muy recomendable, por ambiente y comida.	['(AMBIENCE#GENERAL, POSITIVE)', '(FOOD#QUALITY, POSITIVE)']	"['(AMBIENCE#GENERAL, POSITIVE, ""ambiente"")', '(FOOD#QUALITY, POSITIVE, ""comida"")']"
792	Ambiente cálido y agradable.	['(AMBIENCE#GENERAL, POSITIVE)']	"['(AMBIENCE#GENERAL, POSITIVE, ""Ambiente"")']"
793	Servicio amable y cocina muy correcta.	['(SERVICE#GENERAL, POSITIVE)', '(FOOD#QUALITY, POSITIVE)']	"['(SERVICE#GENERAL, POSITIVE, ""Servicio"")', '(FOOD#QUALITY, POSITIVE, ""cocina"")']"
794	Restaurante muy agradable y buena comida.	['(AMBIENCE#GENERAL, POSITIVE)', '(FOOD#QUALITY, POSITIVE)']	"['(AMBIENCE#GENERAL, POSITIVE, ""Restaurante"")', '(FOOD#QUALITY, POSITIVE, ""comida"")']"
795	Estuvimos cenando tres personas y nos gusto mucho.	['(RESTAURANT#GENERAL, POSITIVE)']	"['(RESTAURANT#GENERAL, POSITIVE, ""NULL"")']"
796	Buen ambiente, muy buen servicio y muy buena comida.	['(AMBIENCE#GENERAL, POSITIVE)', '(SERVICE#GENERAL, POSITIVE)', '(FOOD#QUALITY, POSITIVE)']	"['(AMBIENCE#GENERAL, POSITIVE, ""ambiente"")', '(SERVICE#GENERAL, POSITIVE, ""servicio"")', '(FOOD#QUALITY, POSITIVE, ""comida"")']"
797	Y el local esta muy bien decorado y es muy acogedor.	['(AMBIENCE#GENERAL, POSITIVE)']	"['(AMBIENCE#GENERAL, POSITIVE, ""local"")']"
798	Un lugar que te hace sentir como en casa.	['(RESTAURANT#GENERAL, POSITIVE)']	"['(RESTAURANT#GENERAL, POSITIVE, ""lugar"")']"
799	Comida excelente, producto inmejorable y un servicio correcto.	['(FOOD#QUALITY, POSITIVE)', '(FOOD#QUALITY, POSITIVE)', '(SERVICE#GENERAL, POSITIVE)']	"['(FOOD#QUALITY, POSITIVE, ""Comida"")', '(FOOD#QUALITY, POSITIVE, ""producto"")', '(SERVICE#GENERAL, POSITIVE, ""servicio"")']"
800	Si he de encontrar alguna pega las mesas estan demasiado juntas.	['(AMBIENCE#GENERAL, NEGATIVE)']	"['(AMBIENCE#GENERAL, NEGATIVE, ""mesas"")']"
801	Agradable para tomar copas, cockteles y un vinito.	['(DRINKS#QUALITY, POSITIVE)', '(DRINKS#QUALITY, POSITIVE)', '(DRINKS#QUALITY, POSITIVE)']	"['(DRINKS#QUALITY, POSITIVE, ""copas"")', '(DRINKS#QUALITY, POSITIVE, ""cockteles"")', '(DRINKS#QUALITY, POSITIVE, ""vinito"")']"
802	Lo recomiendo, no les dejara indiferente.	['(RESTAURANT#GENERAL, POSITIVE)']	"['(RESTAURANT#GENERAL, POSITIVE, ""NULL"")']"
803	Para empezar el plato y la servilleta tenían carbonilla negra.	['(SERVICE#GENERAL, NEGATIVE)', '(SERVICE#GENERAL, NEGATIVE)']	"['(SERVICE#GENERAL, NEGATIVE, ""plato"")', '(SERVICE#GENERAL, NEGATIVE, ""servilleta"")']"
804	El changet era salmuera.	['(FOOD#QUALITY, NEGATIVE)']	"['(FOOD#QUALITY, NEGATIVE, ""changet"")']"
805	Las croquetas literalmente nos las tiró en la mesa sin decir ni mu la camarera, porque por la puerta estaba entrando un amigo suyo con el cual se sentó a conversar.	['(SERVICE#GENERAL, NEGATIVE)']	"['(SERVICE#GENERAL, NEGATIVE, ""camarera"")']"
806	Cuando llegó el arroz, le recordé la salsa y no se dignó contestarme.	['(SERVICE#GENERAL, NEGATIVE)']	"['(SERVICE#GENERAL, NEGATIVE, ""NULL"")']"
807	Empecé a comer, para que no se enfriase la ración más bien escasa y oh sorpresa  era también una  salmuera anegada en tinta.	['(FOOD#STYLE_OPTIONS, NEGATIVE)', '(FOOD#QUALITY, NEGATIVE)']	"['(FOOD#STYLE_OPTIONS, NEGATIVE, ""ración"")', '(FOOD#QUALITY, NEGATIVE, ""ración"")']"
808	en ese momento se dio cuenta de su comportamiento negligente y ensayo una disculpa por su falta total de profesionalidad y de atención.	['(SERVICE#GENERAL, NEGATIVE)']	"['(SERVICE#GENERAL, NEGATIVE, ""NULL"")']"
809	sorprendente, es como estar en new york y paris a la vez, decoracion espectacular, personal increible y su comida fresca de mercado me fascino, se los recomiendo chicos, suerte.	['(AMBIENCE#GENERAL, POSITIVE)', '(SERVICE#GENERAL, POSITIVE)', '(FOOD#QUALITY, POSITIVE)', '(RESTAURANT#GENERAL, POSITIVE)']	"['(AMBIENCE#GENERAL, POSITIVE, ""decoracion"")', '(SERVICE#GENERAL, POSITIVE, ""personal"")', '(FOOD#QUALITY, POSITIVE, ""comida"")', '(RESTAURANT#GENERAL, POSITIVE, ""NULL"")']"
810	Estaba todo riquísimo y los camareros muy amables	['(FOOD#QUALITY, POSITIVE)', '(SERVICE#GENERAL, POSITIVE)']	"['(FOOD#QUALITY, POSITIVE, ""NULL"")', '(SERVICE#GENERAL, POSITIVE, ""camareros"")']"
811	Hola JOse nosotros hemos estado varías veces en Pelentos de Sandiniés, y opino como tú, que es un comedor muy recomendable.	['(RESTAURANT#GENERAL, POSITIVE)']	"['(RESTAURANT#GENERAL, POSITIVE, ""comedor"")']"
812	Por si quieres actualizar tú  información ahora tienen un Menu de Primavera por 19 euros y menú infantil por 15 euros que esta genial, te recomiendo volver, igual que hago yo y asi a lo mejor se juzga con más equidad (nosotros ya tenemos mesa reservada para el día 28 de Abril, celebramos mi cumple) 	['(RESTAURANT#GENERAL, POSITIVE)', '(FOOD#STYLE_OPTIONS, POSITIVE)', '(FOOD#STYLE_OPTIONS, POSITIVE)']	"['(RESTAURANT#GENERAL, POSITIVE, ""NULL"")', '(FOOD#STYLE_OPTIONS, POSITIVE, ""Menu de Primavera"")', '(FOOD#STYLE_OPTIONS, POSITIVE, ""menú infantil"")']"
813	Fuimos recomendados a cenar en Nochebuena y nos llevamos una gran decepción: no sólo las materias primas dejaban mucho que desear (revuelto de gambas y setas de bolsa precongelada) sino que las cantidades eran irrisorias para el precio.	['(FOOD#QUALITY, NEGATIVE)', '(FOOD#STYLE_OPTIONS, NEGATIVE)', '(RESTAURANT#GENERAL, NEGATIVE)', '(FOOD#PRICES, NEGATIVE)']	"['(FOOD#QUALITY, NEGATIVE, ""materias primas"")', '(FOOD#STYLE_OPTIONS, NEGATIVE, ""cantidades"")', '(RESTAURANT#GENERAL, NEGATIVE, ""NULL"")', '(FOOD#PRICES, NEGATIVE, ""NULL"")']"
814	El bacalao al horno (especialidad de la casa) resultó acorchado y duro, así como el plato de ciervo (26euros el plato) se presentó escaso y apenas sin guarnición.En definitiva, se le presume una calidad avalada por galardones varios y nos hemos encontrado una comida bastante mediocre. 	['(FOOD#QUALITY, NEGATIVE)', '(FOOD#STYLE_OPTIONS, NEGATIVE)', '(FOOD#QUALITY, NEGATIVE)']	"['(FOOD#QUALITY, NEGATIVE, ""bacalao al horno"")', '(FOOD#STYLE_OPTIONS, NEGATIVE, ""plato de ciervo"")', '(FOOD#QUALITY, NEGATIVE, ""comida"")']"
815	Hola , quiero dejar mi opinión sobre este restaurante en la única visita que he hecho , coincido plenamente con el Sr. Aranda en que la cantidad es bastante escasa en algunos platos en relación con su precio .	['(FOOD#STYLE_OPTIONS, NEGATIVE)', '(FOOD#PRICES, NEGATIVE)']	"['(FOOD#STYLE_OPTIONS, NEGATIVE, ""platos"")', '(FOOD#PRICES, NEGATIVE, ""platos"")']"
816	Así mismo he de resaltar que los entrantes estaban en su mayoría fríos y unos pimientos no se podían comer porque simplemente los habían sacado del frigorífico a la mesa.	['(FOOD#STYLE_OPTIONS, NEGATIVE)', '(FOOD#STYLE_OPTIONS, NEGATIVE)']	"['(FOOD#STYLE_OPTIONS, NEGATIVE, ""entrantes"")', '(FOOD#STYLE_OPTIONS, NEGATIVE, ""pimientos"")']"
817	La verdad que la calidad es alta, pero se podrían corregir esos errores para que la satisfacción fuera mayor así como dar una mayor cantidad de producto . 	['(FOOD#QUALITY, POSITIVE)', '(FOOD#STYLE_OPTIONS, NEGATIVE)']	"['(FOOD#QUALITY, POSITIVE, ""NULL"")', '(FOOD#STYLE_OPTIONS, NEGATIVE, ""NULL"")']"
818	Ciertamente fue desilusionante, debido, en especial, a la escasez en los segundos platos en relación con los precios.	['(FOOD#STYLE_OPTIONS, NEGATIVE)', '(FOOD#PRICES, NEGATIVE)', '(RESTAURANT#GENERAL, NEGATIVE)']	"['(FOOD#STYLE_OPTIONS, NEGATIVE, ""egundos platos"")', '(FOOD#PRICES, NEGATIVE, ""segundos platos"")', '(RESTAURANT#GENERAL, NEGATIVE, ""NULL"")']"
819	La factura es elevada, lo cual ya esperábamos, aunque no tanto.	['(RESTAURANT#PRICES, NEGATIVE)']	"['(RESTAURANT#PRICES, NEGATIVE, ""factura"")']"
820	No importaba mucho que fuera del grigo, dado que el agua de la zona es excelente; pero por ello se nos facturó 2,50 euros.	['(DRINKS#PRICES, NEGATIVE)']	"['(DRINKS#PRICES, NEGATIVE, ""NULL"")']"
821	Mi esposa, ciertamente, al revisar la factura y descubrir esto último, se llevó un buen disgusto, pues considerábamos a Casa Pelentós uno de nuestros pocos refugios pirenaicos para cuando saliéramos de casa, ya que vivimos muy cerca.	['(RESTAURANT#PRICES, NEGATIVE)']	"['(RESTAURANT#PRICES, NEGATIVE, ""factura"")']"
822	Obviamente, por los 2,50 euros cobrados por el agua del grifo, han perdido a dos clientes. 	['(DRINKS#PRICES, NEGATIVE)']	"['(DRINKS#PRICES, NEGATIVE, ""agua del grifo"")']"
823	¡Excelente cena!	['(FOOD#QUALITY, POSITIVE)']	"['(FOOD#QUALITY, POSITIVE, ""cena"")']"
824	Hacía mucho tiempo que un restaurante en Zaragoza no me sorprendía de esta manera: Gran calidad del producto, numerosos detalles, puntos de cocción perfectos en casi todos los platos, raciones abundantes y un precio elevado pero ajustado a la calidad.El servicio fue atento y educado aunque tuvo algún pequeño fallo (como servir la segunda botella de vino en las copas en que aún quedaba algo de la anterior)De comienzo una buena variedad de panes (pizza, oliva verde, oliva negra, …) con un cuenquito de aceite de oliva con tomate mozzarella y albahaca.	['(FOOD#QUALITY, POSITIVE)', '(SERVICE#GENERAL, POSITIVE)', '(FOOD#STYLE_OPTIONS, POSITIVE)', '(RESTAURANT#PRICES, NEUTRAL)', '(FOOD#QUALITY, POSITIVE)', '(SERVICE#GENERAL, NEUTRAL)', '(FOOD#QUALITY, POSITIVE)']	"['(FOOD#QUALITY, POSITIVE, ""producto"")', '(SERVICE#GENERAL, POSITIVE, ""detalles"")', '(FOOD#STYLE_OPTIONS, POSITIVE, ""raciones"")', '(RESTAURANT#PRICES, NEUTRAL, ""NULL"")', '(FOOD#QUALITY, POSITIVE, ""NULL"")', '(SERVICE#GENERAL, NEUTRAL, ""servicio"")', '(FOOD#QUALITY, POSITIVE, ""puntos de cocción"")']"
825	Como entrantes compartimos:- un carpaccio de buey de Kobe, excelente, sabrosísimo.- una tempura de comenillas rellenas de foie y alchofas- una cola entera de bogavante a la plancha con salsa de su coral (muy sabrosa, aunque un poco pasada de punto)Antes del segundo la casa nos ofreció un pinco de membrillo y queso en tempura presentado en un palo de canela encendido.	['(FOOD#QUALITY, POSITIVE)', '(FOOD#QUALITY, NEUTRAL)']	"['(FOOD#QUALITY, POSITIVE, ""carpaccio de buey de Kobe"")', '(FOOD#QUALITY, NEUTRAL, ""cola entera de bogavante a la plancha con salsa de su coral"")']"
826	Muy original presentación y muy lograda la combinación.Los segundos fueron un poco más tradicionales:	['(FOOD#STYLE_OPTIONS, POSITIVE)', '(FOOD#STYLE_OPTIONS, POSITIVE)']	"['(FOOD#STYLE_OPTIONS, POSITIVE, ""presentación"")', '(FOOD#STYLE_OPTIONS, POSITIVE, ""combinación"")']"
827	Extraordinario sabor y textura.	['(FOOD#QUALITY, POSITIVE)', '(FOOD#QUALITY, POSITIVE)']	"['(FOOD#QUALITY, POSITIVE, ""sabor"")', '(FOOD#QUALITY, POSITIVE, ""textura"")']"
828	Gran taco de rape cocido en su punto y muy sabroso.	['(FOOD#QUALITY, POSITIVE)']	"['(FOOD#QUALITY, POSITIVE, ""taco de rape"")']"
829	Tal vez pod´ria haber estado un poco menos hecho, pero muy sabroso y también acompañado por un excelente puré.	['(FOOD#QUALITY, POSITIVE)', '(FOOD#QUALITY, NEUTRAL)']	"['(FOOD#QUALITY, POSITIVE, ""puré"")', '(FOOD#QUALITY, NEUTRAL, ""NULL"")']"
830	Espectacular y muy sabroso.	['(FOOD#QUALITY, POSITIVE)']	"['(FOOD#QUALITY, POSITIVE, ""NULL"")']"
831	Sólo pedimos dos postres y la verdad es que fueron lo más flojo de la cena:	['(FOOD#QUALITY, NEUTRAL)']	"['(FOOD#QUALITY, NEUTRAL, ""postres"")']"
832	Un buen sitio, a seguir.	['(RESTAURANT#GENERAL, POSITIVE)']	"['(RESTAURANT#GENERAL, POSITIVE, ""sitio"")']"
833	Si mantienen el nivel de innovación y calidad puede ser un soplo de aire fresco en Zaragoza.	['(RESTAURANT#GENERAL, POSITIVE)']	"['(RESTAURANT#GENERAL, POSITIVE, ""NULL"")']"
834	La verdad es que es un local bastante pequeño.	['(AMBIENCE#GENERAL, NEUTRAL)']	"['(AMBIENCE#GENERAL, NEUTRAL, ""local"")']"
835	Las mesas son grandes y el espacio entre ellas es bastante amplio.	['(AMBIENCE#GENERAL, POSITIVE)']	"['(AMBIENCE#GENERAL, POSITIVE, ""mesas"")']"
836	El restaurante estaba bastante lleno (aunque no completo) y sin embargo estuvimos muy tranquilos, con casi total intimidad.	['(AMBIENCE#GENERAL, POSITIVE)']	"['(AMBIENCE#GENERAL, POSITIVE, ""NULL"")']"
837	Creo que la ventilación era bastante buena, aunque  no sé lo que ocuriría si hubiera mayor número de fumadores o más compulsivos. 	['(AMBIENCE#GENERAL, POSITIVE)']	"['(AMBIENCE#GENERAL, POSITIVE, ""ventilación"")']"
838	Es una cocina bastante tradicional en los conceptos pero los aliña con procedimientos de cocina modernos y bien aplicados, junto con presentaciones creativas.	['(FOOD#STYLE_OPTIONS, POSITIVE)', '(FOOD#STYLE_OPTIONS, POSITIVE)']	"['(FOOD#STYLE_OPTIONS, POSITIVE, ""procedimientos de cocina"")', '(FOOD#STYLE_OPTIONS, POSITIVE, ""presentaciones"")']"
839	Lo más destacable para mí es el uso de la cocción a baja temperatura en muchos platos y presentaciones espetaculares y trabajadas. 	['(FOOD#STYLE_OPTIONS, POSITIVE)', '(FOOD#STYLE_OPTIONS, POSITIVE)']	"['(FOOD#STYLE_OPTIONS, POSITIVE, ""presentaciones"")', '(FOOD#STYLE_OPTIONS, POSITIVE, ""cocción a baja temperatura"")']"
840	Decepcionante experiencia.La carta de vinos que parece completa en la oferta, en el apartado internacional nada de nada no disponen de ninguna de las referencias.	['(RESTAURANT#GENERAL, NEGATIVE)', '(DRINKS#STYLE_OPTIONS, NEGATIVE)']	"['(RESTAURANT#GENERAL, NEGATIVE, ""experiencia"")', '(DRINKS#STYLE_OPTIONS, NEGATIVE, ""carta de vinos"")']"
841	En el resto tres de los vinos que pedimos agotados, ya desesperados pedimos un rioja el que se pudiera, nos traen un Roda ll 2004, bien, el vino se presenta caliente, en fin bochornosa situación.	['(DRINKS#STYLE_OPTIONS, NEGATIVE)', '(DRINKS#QUALITY, NEGATIVE)']	"['(DRINKS#STYLE_OPTIONS, NEGATIVE, ""vinos"")', '(DRINKS#QUALITY, NEGATIVE, ""Roda ll 2004"")']"
842	La carta es poco atractiva, los calamares a la andaluza imposibles, pimientos de cristal con anchoas, nadando en aceite de calidad mediocre, bacalao con crema de puerros, tapado por una exagerada llamémosla ensalada de rucula, el conjunto del plato mal, paletilla de cordero bien en su ejecución, los postres flojos muy flojos.	['(FOOD#STYLE_OPTIONS, NEGATIVE)', '(FOOD#QUALITY, NEGATIVE)', '(FOOD#QUALITY, NEGATIVE)', '(FOOD#QUALITY, NEGATIVE)', '(FOOD#QUALITY, POSITIVE)', '(FOOD#QUALITY, NEGATIVE)']	"['(FOOD#STYLE_OPTIONS, NEGATIVE, ""carta"")', '(FOOD#QUALITY, NEGATIVE, ""calamares a la andaluza"")', '(FOOD#QUALITY, NEGATIVE, ""pimientos de cristal con anchoas"")', '(FOOD#QUALITY, NEGATIVE, ""bacalao con crema de puerros"")', '(FOOD#QUALITY, POSITIVE, ""paletilla de cordero"")', '(FOOD#QUALITY, NEGATIVE, ""postres"")']"
843	El local aco*edor y bien instalado.	['(AMBIENCE#GENERAL, POSITIVE)']	"['(AMBIENCE#GENERAL, POSITIVE, ""local"")']"
844	Entramos con gran expectación y salimos muy decepcionados. 	['(RESTAURANT#GENERAL, NEGATIVE)']	"['(RESTAURANT#GENERAL, NEGATIVE, ""NULL"")']"
845	Buen restaurante, buen servicio y buena cocina.Pero… al ser tan pequeño, el humo del tabaco te arruina toda la cena.	['(RESTAURANT#GENERAL, POSITIVE)', '(SERVICE#GENERAL, POSITIVE)', '(FOOD#QUALITY, POSITIVE)', '(AMBIENCE#GENERAL, NEGATIVE)']	"['(RESTAURANT#GENERAL, POSITIVE, ""restaurante"")', '(SERVICE#GENERAL, POSITIVE, ""servicio"")', '(FOOD#QUALITY, POSITIVE, ""cocina"")', '(AMBIENCE#GENERAL, NEGATIVE, ""humo del tabaco"")']"
846	A ver si cambian pronto la ley y podemos degustar la buena cocina sin alteraciones apestosas como la del tabaco… 	['(FOOD#QUALITY, POSITIVE)', '(AMBIENCE#GENERAL, NEGATIVE)']	"['(FOOD#QUALITY, POSITIVE, ""cocina"")', '(AMBIENCE#GENERAL, NEGATIVE, ""tabaco"")']"
847	En dos palabras?-una mierdaEn mas palabras?Caro, hortera, parece una cueva, raciones minimas y platos de lo mas normales.Lo unico de autor, es la foto que realmente es digna del premio a la vergüenza ajena, (…). 	['(RESTAURANT#GENERAL, NEGATIVE)', '(RESTAURANT#PRICES, NEGATIVE)', '(AMBIENCE#GENERAL, NEGATIVE)', '(FOOD#STYLE_OPTIONS, NEGATIVE)', '(FOOD#STYLE_OPTIONS, NEUTRAL)', '(RESTAURANT#MISCELLANEOUS, NEGATIVE)']	"['(RESTAURANT#GENERAL, NEGATIVE, ""NULL"")', '(RESTAURANT#PRICES, NEGATIVE, ""NULL"")', '(AMBIENCE#GENERAL, NEGATIVE, ""NULL"")', '(FOOD#STYLE_OPTIONS, NEGATIVE, ""raciones"")', '(FOOD#STYLE_OPTIONS, NEUTRAL, ""platos"")', '(RESTAURANT#MISCELLANEOUS, NEGATIVE, ""foto"")']"
848	Una vergüenza lo que nos han cobrado, han sugerido los entrantes y nos han cobrado 9 euros por cada plato de pan con tomate.Hemos ido 12 y hemos pagado caso 700 euros y hemos tenido que pedir que nos invitaran a un chupito.	['(RESTAURANT#PRICES, NEGATIVE)', '(FOOD#PRICES, NEGATIVE)']	"['(RESTAURANT#PRICES, NEGATIVE, ""NULL"")', '(FOOD#PRICES, NEGATIVE, ""plato de pan con tomate"")']"
849	Un plato de jamon de entrante..25 euros??	['(FOOD#PRICES, NEGATIVE)']	"['(FOOD#PRICES, NEGATIVE, ""plato de jamon de entrante"")']"
850	y el pan que no hemos pedido.. en fin os recomiendo a todos que no piseis este sitio porque os cobraran solo por entrar.	['(RESTAURANT#PRICES, NEGATIVE)']	"['(RESTAURANT#PRICES, NEGATIVE, ""sitio"")']"
851	Por este dinero como de verdad en un sitio en condiciones 	['(RESTAURANT#PRICES, NEGATIVE)']	"['(RESTAURANT#PRICES, NEGATIVE, ""NULL"")']"
852	es un restaurate unico en zaragoza, es pequeño, comodo y muy privado, la decoracion es perfecta ya que lo hace muy acojedor, el servicio es normal, pero la comida es muy especial y de muy buena calidad.	['(RESTAURANT#GENERAL, POSITIVE)', '(AMBIENCE#GENERAL, POSITIVE)', '(AMBIENCE#GENERAL, POSITIVE)', '(SERVICE#GENERAL, NEUTRAL)', '(FOOD#QUALITY, POSITIVE)']	"['(RESTAURANT#GENERAL, POSITIVE, ""restaurate"")', '(AMBIENCE#GENERAL, POSITIVE, ""restaurate"")', '(AMBIENCE#GENERAL, POSITIVE, ""decoracion"")', '(SERVICE#GENERAL, NEUTRAL, ""servicio"")', '(FOOD#QUALITY, POSITIVE, ""comida"")']"
853	es un restaurate para repetir mi nota es de 9.	['(RESTAURANT#GENERAL, POSITIVE)']	"['(RESTAURANT#GENERAL, POSITIVE, ""restaurate"")']"
