id	text	labels	labels_phrases
1175	los postres, no aportan nada nuevo, simples, buenos pero nada mas.a los cafes, nada de pettite fours, (lamentable por 175 € de dos personas, sin cobrarnos los cafes). 	['(FOOD#QUALITY, NEUTRAL)', '(DRINKS#STYLE_OPTIONS, NEGATIVE)', '(RESTAURANT#PRICES, NEGATIVE)']	"['(FOOD#QUALITY, NEUTRAL, ""postres"")', '(DRINKS#STYLE_OPTIONS, NEGATIVE, ""cafes"")', '(RESTAURANT#PRICES, NEGATIVE, ""NULL"")']"
1176	La primera sorpresa fue que no nos preguntaran si deseábamos tomar un aperitivo, pero lo que más nos sorprendió que al pedir agua con gas nos dijeran que no se les había acabado.	['(SERVICE#GENERAL, NEGATIVE)', '(DRINKS#STYLE_OPTIONS, NEGATIVE)']	"['(SERVICE#GENERAL, NEGATIVE, ""NULL"")', '(DRINKS#STYLE_OPTIONS, NEGATIVE, ""agua con gas"")']"
1177	Me pareció imperdonable para un restaurante con aspiraciones.	['(DRINKS#STYLE_OPTIONS, NEGATIVE)']	"['(DRINKS#STYLE_OPTIONS, NEGATIVE, ""NULL"")']"
1178	Muy mala organización.Para este momento ya estábamos logrando acomodarnos en las sillas, muy modernas pero difíciles.	['(SERVICE#GENERAL, NEGATIVE)', '(AMBIENCE#GENERAL, NEUTRAL)']	"['(SERVICE#GENERAL, NEGATIVE, ""NULL"")', '(AMBIENCE#GENERAL, NEUTRAL, ""sillas"")']"
1179	Lo más destacable para mí fueron las excelentes verduras que acompañaron todos los platos, con unos puntos de cocción breves y ajustados, muy en la línea de Martín Berasategui.	['(FOOD#QUALITY, POSITIVE)']	"['(FOOD#QUALITY, POSITIVE, ""verduras"")']"
1180	Extraordinario el trabajo en este aspecto.	['(FOOD#QUALITY, POSITIVE)']	"['(FOOD#QUALITY, POSITIVE, ""NULL"")']"
1181	El tomate en texturas estaba muy sabroso, aunque la espuma resultaba un tanto dura.	['(FOOD#QUALITY, POSITIVE)', '(FOOD#QUALITY, NEGATIVE)']	"['(FOOD#QUALITY, POSITIVE, ""tomate en texturas"")', '(FOOD#QUALITY, NEGATIVE, ""espuma"")']"
1182	Los espárragos, las judías verdes, la crema de coliflor, el broccoli,  todos muy bien tratados.	['(FOOD#QUALITY, POSITIVE)', '(FOOD#QUALITY, POSITIVE)', '(FOOD#QUALITY, POSITIVE)', '(FOOD#QUALITY, POSITIVE)']	"['(FOOD#QUALITY, POSITIVE, ""espárragos"")', '(FOOD#QUALITY, POSITIVE, ""judías verdes"")', '(FOOD#QUALITY, POSITIVE, ""crema de coliflor"")', '(FOOD#QUALITY, POSITIVE, ""broccoli"")']"
1183	Las combinaciones muy equilibradas,  tal vez la que menos decía era el tomate con el atún marinado, pero el bogavante y sobre todo el huevo poché, mucho mejor.	['(FOOD#QUALITY, POSITIVE)', '(FOOD#QUALITY, NEUTRAL)', '(FOOD#QUALITY, POSITIVE)', '(FOOD#QUALITY, POSITIVE)']	"['(FOOD#QUALITY, POSITIVE, ""combinaciones"")', '(FOOD#QUALITY, NEUTRAL, ""tomate con el atún marinado"")', '(FOOD#QUALITY, POSITIVE, ""bogavante"")', '(FOOD#QUALITY, POSITIVE, ""huevo poché"")']"
1184	Eso sí, un poco repetitivas las huevas, en los tres primeros platos.	['(FOOD#STYLE_OPTIONS, NEGATIVE)']	"['(FOOD#STYLE_OPTIONS, NEGATIVE, ""huevas"")']"
1185	La merluza bien de punto, aunque un poco sosa, dio paso a lo que para mí fue la sorpresa del día, un trocito de chuletón exquisito de sabor y en su justo punto de cocción que me dejó con ganas de más.Los postres aprobado justito, el primero alrededor del vino tinto, con un sorbete para mí demasiado dominado por la canela y con una espuma de vino de nuevo demasiado consistente.	['(FOOD#QUALITY, NEUTRAL)', '(FOOD#QUALITY, POSITIVE)', '(FOOD#QUALITY, NEGATIVE)', '(FOOD#QUALITY, NEGATIVE)', '(FOOD#QUALITY, NEGATIVE)']	"['(FOOD#QUALITY, NEUTRAL, ""merluza"")', '(FOOD#QUALITY, POSITIVE, ""chuletón"")', '(FOOD#QUALITY, NEGATIVE, ""postres"")', '(FOOD#QUALITY, NEGATIVE, ""sorbete"")', '(FOOD#QUALITY, NEGATIVE, ""espuma de vino"")']"
1186	Muy logrados los orejones y el sorbete.Otro punto negativo en el servicio fue que intente tomar un vino dulce y la respuesta fue decepcionante.	['(FOOD#QUALITY, POSITIVE)', '(FOOD#QUALITY, POSITIVE)', '(SERVICE#GENERAL, NEGATIVE)']	"['(FOOD#QUALITY, POSITIVE, ""orejones"")', '(FOOD#QUALITY, POSITIVE, ""sorbete"")', '(SERVICE#GENERAL, NEGATIVE, ""servicio"")']"
1187	Al final pude tomar una copa de Pedro Ximénez.Con el café, que estaba muy bueno,  no hubo ningún acompañamiento, pobre, muy pobre para este nivel de restaurante.	['(DRINKS#QUALITY, POSITIVE)', '(DRINKS#STYLE_OPTIONS, NEGATIVE)']	"['(DRINKS#QUALITY, POSITIVE, ""café"")', '(DRINKS#STYLE_OPTIONS, NEGATIVE, ""NULL"")']"
1188	El vino con que acompañamos la comida fue un Atteca de Calatayud, recomendación de la casa, excelente.	['(DRINKS#QUALITY, POSITIVE)']	"['(DRINKS#QUALITY, POSITIVE, ""Atteca de Calatayud"")']"
1189	Como curiosidad,  ¡la botella etiquetada sólo en inglés y en francés!En resumen: muy buen nivel técnico, dominio de los puntos de cocción y gran profesionalidad en la cocina, combinaciones estéticamente modernas pero bastante conservadoras en lo que a sabores respecta - salvo en el trato a las verduras.	['(FOOD#QUALITY, POSITIVE)', '(FOOD#QUALITY, POSITIVE)', '(FOOD#QUALITY, POSITIVE)', '(FOOD#QUALITY, NEUTRAL)', '(FOOD#QUALITY, POSITIVE)']	"['(FOOD#QUALITY, POSITIVE, ""NULL"")', '(FOOD#QUALITY, POSITIVE, ""NULL"")', '(FOOD#QUALITY, POSITIVE, ""cocina"")', '(FOOD#QUALITY, NEUTRAL, ""combinaciones"")', '(FOOD#QUALITY, POSITIVE, ""verduras"")']"
1190	De resaltar que todos los precios incluyen el IVA, un detalle que debería ser obligatorio.	['(RESTAURANT#PRICES, POSITIVE)']	"['(RESTAURANT#PRICES, POSITIVE, ""NULL"")']"
1191	En cuanto a defectos: Las cantidades, demasiado escasas.	['(FOOD#STYLE_OPTIONS, NEGATIVE)']	"['(FOOD#STYLE_OPTIONS, NEGATIVE, ""cantidades"")']"
1192	En los postres la ausencia del chocolate me parece personalmente imperdonable, pero eso ya es una cuestión personal.	['(FOOD#STYLE_OPTIONS, NEGATIVE)']	"['(FOOD#STYLE_OPTIONS, NEGATIVE, ""postres"")']"
1193	Lo peor, para mí, el servicio.	['(SERVICE#GENERAL, NEGATIVE)']	"['(SERVICE#GENERAL, NEGATIVE, ""servicio"")']"
1194	Muy justito, con algún fallo grave como el del agua o el del vino dulce, no estuvo a la altura de una estrella.	['(DRINKS#STYLE_OPTIONS, NEGATIVE)', '(RESTAURANT#GENERAL, NEGATIVE)', '(DRINKS#STYLE_OPTIONS, NEGATIVE)']	"['(DRINKS#STYLE_OPTIONS, NEGATIVE, ""agua"")', '(RESTAURANT#GENERAL, NEGATIVE, ""NULL"")', '(DRINKS#STYLE_OPTIONS, NEGATIVE, ""vino dulce"")']"
1195	Yo comí este martes, y de maravilla; como siempre.	['(RESTAURANT#GENERAL, POSITIVE)']	"['(RESTAURANT#GENERAL, POSITIVE, ""NULL"")']"
1196	A mí me decepcionó también el restaurante, y lo que es peor, nos sirvieron un mero casi crudo que no había sido congelado previamente, incumpliendo de forma consciente la norma vigente al respecto (el propietario y cocinero se mostró especialmente “orgulloso” de no congelar los pescados).	['(RESTAURANT#GENERAL, NEGATIVE)', '(FOOD#QUALITY, NEGATIVE)', '(SERVICE#GENERAL, NEGATIVE)', '(SERVICE#GENERAL, NEGATIVE)']	"['(RESTAURANT#GENERAL, NEGATIVE, ""restaurante"")', '(FOOD#QUALITY, NEGATIVE, ""mero"")', '(SERVICE#GENERAL, NEGATIVE, ""propietario"")', '(SERVICE#GENERAL, NEGATIVE, ""cocinero"")']"
1197	Qué pena que no sepan diferenciar entre un pescado cocinado “en su punto” y un pescado directamente crudo, donde la carne no se desprende de la espina por falta de calor y cocción.	['(SERVICE#GENERAL, NEGATIVE)']	"['(SERVICE#GENERAL, NEGATIVE, ""NULL"")']"
1198	Y que conste que me encantan los “sushi” y los “sashimi”, pero una cosa es una preparación específica cumpliendo los requisitos para prevenir la ingesta de anisakis vivos y otra tomar un pescado salvaje poco cocinado, con gran probabilidad de existencia de parasitos activos.	['(FOOD#QUALITY, NEGATIVE)']	"['(FOOD#QUALITY, NEGATIVE, ""pescado"")']"
1199	Qué pena que se confundan las cosas, no hay nada peor que un “enterado” mal informado, como es el caso de este cocinero. 	['(SERVICE#GENERAL, NEGATIVE)']	"['(SERVICE#GENERAL, NEGATIVE, ""cocinero"")']"
1200	Por otro lado me alegro de coincidir con usted en los gustos, no tanto de que ambos saliéramos decepcionados de este restaurante, porque supongo que a usted, igual que a mi, nos hubiera gustado salir contentísimos del Bal d’Onsera, recomendarlo por doquier y no tener la sensación de haber perdido tiempo y dinero, al menos yo.	['(RESTAURANT#GENERAL, NEGATIVE)']	"['(RESTAURANT#GENERAL, NEGATIVE, ""restaurante"")']"
1201	Pocas veces coincide la opinión de uno mismo con la de otros “criticos gastronómicos”, pero pocas veces he podido estar más de acuerdo que con la de D. José Aranda:Mi mujer y yo fuimos el pasado 25 de mayo (martes)a celebrar algo especial a este restaurante y salimos decepcionados.	['(RESTAURANT#GENERAL, NEGATIVE)']	"['(RESTAURANT#GENERAL, NEGATIVE, ""restaurante"")']"
1202	Nos planteamos el porqué de su estrella y nos dolió el bolsillo.	['(RESTAURANT#GENERAL, NEGATIVE)', '(RESTAURANT#PRICES, NEGATIVE)']	"['(RESTAURANT#GENERAL, NEGATIVE, ""NULL"")', '(RESTAURANT#PRICES, NEGATIVE, ""NULL"")']"
1203	La verdad no me acuerdo de ningun plato del menú degustación que tomanos (sintomático).	['(FOOD#QUALITY, NEGATIVE)']	"['(FOOD#QUALITY, NEGATIVE, ""plato"")']"
1204	Tan solo recuerdo una sosísima y poco fresca merluza.Cuando vas a un lugar de estos esperas todo y tal vez te vuelvas menos permisivo que con otros, pero aun con esto no merece la pena el restaurante.	['(FOOD#QUALITY, NEGATIVE)', '(RESTAURANT#GENERAL, NEGATIVE)']	"['(FOOD#QUALITY, NEGATIVE, ""merluza"")', '(RESTAURANT#GENERAL, NEGATIVE, ""restaurante"")']"
1205	A mí personalmente no me gusta ni la calle ni la zona de Zaragoza (debería estar más céntrico), pero dicho esto si que valoro y mucho la amplitud de las mesas redondas (que no me puedo explicar desde el punto de vista económico dado que si todas las mesas se ocupan sólo por dos comensales significa una menor facturación).	['(LOCATION#GENERAL, NEGATIVE)', '(AMBIENCE#GENERAL, POSITIVE)']	"['(LOCATION#GENERAL, NEGATIVE, ""zona"")', '(AMBIENCE#GENERAL, POSITIVE, ""mesas"")']"
1206	Es un gozo y deleite tener una mesa con mantel tan grande para tí y tu acompañante.	['(AMBIENCE#GENERAL, POSITIVE)']	"['(AMBIENCE#GENERAL, POSITIVE, ""mesa"")']"
1207	Para mí el SERVICIO de este restaurante lo valoro como de los mejores porque no molestan.	['(SERVICE#GENERAL, POSITIVE)']	"['(SERVICE#GENERAL, POSITIVE, ""SERVICIO"")']"
1208	Ambas dos muy discretas como se requiere en este tipo de establecimeinto.	['(SERVICE#GENERAL, POSITIVE)']	"['(SERVICE#GENERAL, POSITIVE, ""NULL"")']"
1209	-LA CARTA DE VINOS: Desgraciadamente no me considero un experto  pero dado las dimensiones tan reducidas del local, me parece una carta muy acertada.	['(DRINKS#STYLE_OPTIONS, POSITIVE)']	"['(DRINKS#STYLE_OPTIONS, POSITIVE, ""CARTA DE VINOS"")']"
1210	Además me sorprende la promoción de los mejores vinos de nuestra región, cosa que no he visto apostar por ellos tanto como este restaurante.Los precios?	['(DRINKS#QUALITY, POSITIVE)']	"['(DRINKS#QUALITY, POSITIVE, ""vinos"")']"
1211	Permítame decirle que no puede valer el mismo vino en este establecimiento que en cualquier otro.	['(DRINKS#PRICES, POSITIVE)']	"['(DRINKS#PRICES, POSITIVE, ""NULL"")']"
1212	LA CARTA: En este punto coincido en su acierto de pedir el menú degustación.	['(FOOD#STYLE_OPTIONS, POSITIVE)']	"['(FOOD#STYLE_OPTIONS, POSITIVE, ""menú degustación"")']"
1213	Aquí es donde el cocinero nos puede sorprender y deleitar con su saber hacer.Yo tengo que reconocer que la 1º vez me sorprendió gratamente.	['(SERVICE#GENERAL, POSITIVE)']	"['(SERVICE#GENERAL, POSITIVE, ""NULL"")']"
1214	Experimenté sensaciones diferentes y fue un placer culinario que pocas veces había experimentado.	['(FOOD#QUALITY, POSITIVE)']	"['(FOOD#QUALITY, POSITIVE, ""NULL"")']"
1215	Entonces no tenía la Estrella Michelín pero ya se podía intuir que iba a caer.La cocina es imaginativa, moderna, sofisticada, etc¿Que se quedó con hambre?	['(FOOD#QUALITY, POSITIVE)']	"['(FOOD#QUALITY, POSITIVE, ""cocina"")']"
1216	Pues no me lo creo.	['(FOOD#STYLE_OPTIONS, POSITIVE)']	"['(FOOD#STYLE_OPTIONS, POSITIVE, ""NULL"")']"
1217	Si no te gusta tienes los WOK que es un self-service hasta que no puedas más…  Por terminar, le diré que a este restaurante le faltan cosas.	['(RESTAURANT#GENERAL, NEGATIVE)']	"['(RESTAURANT#GENERAL, NEGATIVE, ""restaurante"")']"
1218	De lo que estoy de acuerdo totalmente con usted es del maridaje de los vinos.	['(SERVICE#GENERAL, NEGATIVE)']	"['(SERVICE#GENERAL, NEGATIVE, ""NULL"")']"
1219	¿Cómo vamos a pedir un  vino si no somos adivinos de los platos que nos van a sacar?En este punto fallan.	['(SERVICE#GENERAL, NEGATIVE)']	"['(SERVICE#GENERAL, NEGATIVE, ""NULL"")']"
1220	Y respecto al precio, pues es el que es.	['(RESTAURANT#PRICES, NEUTRAL)']	"['(RESTAURANT#PRICES, NEUTRAL, ""NULL"")']"
1221	Un último comentario a favor del cocinero es que el pasado año estuvo invitado en la pasada Expo en China (salió en prensa), y los platos que presentó en la semana española eran típicos aragoneses (borraja, ternasco… y todo con vinos aragoneses).Con esto lo único que quiero indicar es mi sorpresa por la propaganda de la comida aragonesa, cosa que me alegro que alguien la defienda ( y lo dice un aragonés español).	['(SERVICE#GENERAL, POSITIVE)']	"['(SERVICE#GENERAL, POSITIVE, ""cocinero"")']"
1222	Para Gonzalo, le voy a contestar brevemente: No me gusta que me peloteen, al personal de sala tampoco le gusta hacerlo, pero a veces hay que reconocer que entra dentro de su “labor” porque hay a quién le gusta, pero es distinto pelotear que interesarse por el bienestar de los comensales, sobre todo cuando se llevan un plato enterito de nuevo a cocina, un “¿no les ha gustado?”, “¿está todo bien?”, a la hora de recoger los platos no molesta,no es peloteo, es educación.	['(SERVICE#GENERAL, NEGATIVE)']	"['(SERVICE#GENERAL, NEGATIVE, ""NULL"")']"
1223	Dice que no me cree cuando comento que no entendía a la persona que me traía los platos cuando los presentaba, pues le puedo asegurar que la chica no hablaba castellano ni a medias, ¿qué quiere que le diga?, si quiere pregunte en el restaurante el personal que tenían para esas fechas, es algo tan sencillo de validar que no merece más palabras.	['(SERVICE#GENERAL, NEGATIVE)']	"['(SERVICE#GENERAL, NEGATIVE, ""chica"")']"
1224	Tampoco se cree que me quedé con hambre, pues sí, me quedé con hambre, y a mi me gusta cuando voy a comer a un restaurante, independientemente del nivel y precio, salir comido, sino no lo llamaría ir a comer… podríamos decir ¿vamos a una exhibición de cocina al restaurante Bal d’ Onsera donde incluso, por 80 euros por persona, nos permiten probar un poquito de cada creación?, pero eso sí, luego a comer nos vamos a casa.	['(FOOD#PRICES, NEGATIVE)', '(FOOD#STYLE_OPTIONS, NEGATIVE)']	"['(FOOD#PRICES, NEGATIVE, ""creación"")', '(FOOD#STYLE_OPTIONS, NEGATIVE, ""NULL"")']"
1225	Buenos días,Soy una cliente habitual de este restaurante y una convencida de este tipo de cocina.	['(RESTAURANT#GENERAL, POSITIVE)']	"['(RESTAURANT#GENERAL, POSITIVE, ""Soy una cliente habitual de este restaurante y una convencida de este tipo de cocina"")']"
1226	(pense).El resultado no pudo ser mas decepcionante.	['(RESTAURANT#GENERAL, NEGATIVE)']	"['(RESTAURANT#GENERAL, NEGATIVE, ""NULL"")']"
1227	Para empezar la puerta parece la del almacen, llamas al portero automatico y te abren (aunque esto me direis que es secundario).	['(AMBIENCE#GENERAL, NEGATIVE)']	"['(AMBIENCE#GENERAL, NEGATIVE, ""puerta"")']"
1228	Una vez dentro la decoracion es como le gustaria a mi mujer que fuera la de nuestra casa: minimalista.Del mobiliario solo decir un par de cosas: las sillas incomodas y las mesas del tamaño de “La Misericordia”, si no acercamos las sillas entre si parece que estoy comiendo enfadado con mi mujer.	['(AMBIENCE#GENERAL, NEGATIVE)']	"['(AMBIENCE#GENERAL, NEGATIVE, ""mobiliario"")']"
1229	Para finalizar con los previos antes de entrar con la comida un comentario: un poquito de musica de ambiente daria intimidad, se oia todo lo que se decia en las otras 5 mesas que estaban ocupadas (todas ellas con parejas con cupones de descuento como nosotros).	['(AMBIENCE#GENERAL, NEGATIVE)']	"['(AMBIENCE#GENERAL, NEGATIVE, ""NULL"")']"
1230	- Carpaccio de bonito: Seria bonito, no lo discuto, pero no me supo a nada, totalmente insipido, tambien tenia remolacha, igual de insipida, y un helado de, creo recordar que de mango, que si tenia algun sabor.	['(FOOD#QUALITY, NEGATIVE)', '(FOOD#QUALITY, NEGATIVE)']	"['(FOOD#QUALITY, NEGATIVE, ""Carpaccio de bonito"")', '(FOOD#QUALITY, NEGATIVE, ""remolacha"")']"
1231	- Vieira y langostino al azafran con verduras de invierno: Si observais en el nombre del plato esta en singular la vieira y el langostino y el motivo no es otro que habia uno de cada, en este caso los sabores, imposible de eliminar, eran correctos, el azafran estar estaria, pero ni me supo ni lo vi.	['(FOOD#STYLE_OPTIONS, NEGATIVE)']	"['(FOOD#STYLE_OPTIONS, NEGATIVE, ""Vieira y langostino al azafran con verduras de invierno"")']"
1232	-Bacalao al pil pil aireado: Ninguna objecion (es lo mejor que puedo decir).	['(FOOD#QUALITY, NEUTRAL)']	"['(FOOD#QUALITY, NEUTRAL, ""Bacalao al pil pil aireado"")']"
1233	-Risotto de hongos trufa y foie: El foie tiene poco misterio una sarten y nada mas, es muy dificil estropearlo,ahora bien el risotto corrio peor suerte, era risotto, de eso estoy seguro, por que lo vi, granos de arroz y demas pero sabor, eso si muy intenso, a nata y solo a nata.	['(FOOD#QUALITY, NEGATIVE)']	"['(FOOD#QUALITY, NEGATIVE, ""Risotto de hongos trufa y foie"")']"
1234	- Carrillera de ternera glaseada: Blanda como la mantequilla pero no sabia a nada de nada, totalmente insulsa.	['(FOOD#QUALITY, NEGATIVE)']	"['(FOOD#QUALITY, NEGATIVE, ""Carrillera de ternera glaseada"")']"
1235	- Limon, mango y moscatel, fresas con vino: El postre estaba bueno (sin mas).Terminamos la comida con un Gin Tonic con preparacion gourmet (ponia en el cupon de descuento): El combinado salio prepado de la cocina.	['(FOOD#QUALITY, POSITIVE)']	"['(FOOD#QUALITY, POSITIVE, ""Limon, mango y moscatel, fresas con vino"")']"
1236	Lamento ser yo quien os diga que los combinados se preparan en la mesa, de la cocina sale el vaso (o lo que sea, en este caso copa) con el hielo y la rodajita de limon, lima o lo que sea y la ginebra se sirve delante del cliente al igual que la tonica, no es por suspicacia es por practica habitual (no se me pasa por la mente dudar de los ingredientes pero no queda bien).	['(DRINKS#STYLE_OPTIONS, NEGATIVE)']	"['(DRINKS#STYLE_OPTIONS, NEGATIVE, ""NULL"")']"
1237	Ahora es el turno del servicio: correcto en el trato pero lento es poco, entre plato y plato unos tiempos de espera inaceptable.He dejado para el final un pequeño detalle, para algunos sin importancia, y es el tamaño de las raciones: Se puede poner menos en cada uno de los platos pero eso es muy muy dificil (menos mal que habiamos tomado el aperitivo en Palomeque donde las raciones si son generosas)Con todo esto mi opinion creo que queda clara y añadire solo una cosa mas: Sali sintiendome estafado 	['(SERVICE#GENERAL, NEGATIVE)', '(FOOD#STYLE_OPTIONS, NEGATIVE)', '(RESTAURANT#GENERAL, NEGATIVE)']	"['(SERVICE#GENERAL, NEGATIVE, ""servicio"")', '(FOOD#STYLE_OPTIONS, NEGATIVE, ""raciones"")', '(RESTAURANT#GENERAL, NEGATIVE, ""NULL"")']"
1238	Al sentarnos a la mesa, ya nos dicen que el solomillo de ternera se les había terminado (principio de semana, primeros en llegar a cenar, con un menú cerrado y avisando con dos semanas de tiempo….), que nos darían chuleta de ternera… primer chasco, creo que no es comparable (y desde luego, no lo fue, requería masticarlo muuucho tiempo).	['(FOOD#STYLE_OPTIONS, NEGATIVE)']	"['(FOOD#STYLE_OPTIONS, NEGATIVE, ""solomillo de ternera"")']"
1239	Seguidamente de advertirnos el cambio, nos pregunta si un vino blanco nos parecía bien para empezar, por lo que, ante esa pregunta, le comenté si no iban a servir los tres vinos que aparecían en el cupón, a lo que nos respondió que una de las bodegas, no les suministraba hasta noviembre…algo que a mi personalmente, me parece estupendo… pero no nos lo iban a servir!!!, ya que habían considerado suficiente dos vinos, uno blanco y uno tinto..  Me parece que cuando has pagado por un menú cerrado, se deberían de ajustar a lo que has comprado, ya que si no, es una estafa, y si luego ven que no tienen margen suficiente, cuando saquen otro bono, que ajusten el menú a lo que les parezca, así el consumidor puede elegir antes de comprar.Pues no acaba todo ahí, le preguntamos por el cava y nos dice, que tampoco lo servían, que creían que el menú está bien así!!!	['(RESTAURANT#GENERAL, NEGATIVE)', '(DRINKS#STYLE_OPTIONS, NEGATIVE)', '(DRINKS#STYLE_OPTIONS, NEGATIVE)']	"['(RESTAURANT#GENERAL, NEGATIVE, ""NULL"")', '(DRINKS#STYLE_OPTIONS, NEGATIVE, ""cava"")', '(DRINKS#STYLE_OPTIONS, NEGATIVE, ""vino blanco"")']"
1240	Por supuesto, como era un momento especial, no quise montar ningún circo, ni pedir el libro de reclamaciones, pero la sensación con la que salí de ese restaurante no fue buena, me sentí estafada.En fin, que no lo aconsejo para nada, el sitio es bonito, la comida buena, pero excesivamente caro para lo que realmente es, y por supuesto, no animo a nadie a que compre cupones para comer allí, puesto que se arriesgan a que les sirvan lo que ellos consideren en ese momento, independientemente de lo que hayas pagado con anterioridad. 	['(RESTAURANT#GENERAL, NEGATIVE)', '(RESTAURANT#GENERAL, NEGATIVE)', '(AMBIENCE#GENERAL, POSITIVE)', '(FOOD#QUALITY, POSITIVE)', '(RESTAURANT#PRICES, NEGATIVE)', '(RESTAURANT#GENERAL, NEGATIVE)']	"['(RESTAURANT#GENERAL, NEGATIVE, ""restaurante"")', '(RESTAURANT#GENERAL, NEGATIVE, ""NULL"")', '(AMBIENCE#GENERAL, POSITIVE, ""sitio"")', '(FOOD#QUALITY, POSITIVE, ""comida"")', '(RESTAURANT#PRICES, NEGATIVE, ""NULL"")', '(RESTAURANT#GENERAL, NEGATIVE, ""NULL"")']"
1241	Estube ayer dia 22 de febrero en el restaurante bal d’osera y mi sorpresa fue que primero se disculpan porque aun no tienen percheros, luego las mesas tambien te dicen que son provisonales (que no hubieran abierto aun, si no podian) porque el precio desde luego no lo han bajado.	['(AMBIENCE#GENERAL, NEGATIVE)', '(AMBIENCE#GENERAL, NEGATIVE)']	"['(AMBIENCE#GENERAL, NEGATIVE, ""percheros"")', '(AMBIENCE#GENERAL, NEGATIVE, ""mesas"")']"
1242	Para mi con esta reforma a perdido encanto, pues estas cenando sin privacidad, viendo y oyendo a la gente que hay en la barra del bar.	['(AMBIENCE#GENERAL, NEGATIVE)']	"['(AMBIENCE#GENERAL, NEGATIVE, ""NULL"")']"
1243	Con lo cual en el comedor tienes que levantar mas la voz para oirte y se forma un ambiente que no lo que se espera de una estrella michelin. 	['(AMBIENCE#GENERAL, NEGATIVE)']	"['(AMBIENCE#GENERAL, NEGATIVE, ""ambiente"")']"
1244	Yo estube el dia 6-12-08 y la verdad muy bien;el ambiente es un poco fasion las paredes toralmente blancas,las sillas muy modernas pero comodas y sin ningun cuadro.	['(AMBIENCE#GENERAL, NEUTRAL)']	"['(AMBIENCE#GENERAL, NEUTRAL, ""ambiente"")']"
1245	Pedimos al a carta y de aperitivo nos sacaron una cucharita de brandada de bacalao con un chupito de caldo de ardo y espuma de almendras,la verdad estaba muy delicado.	['(FOOD#STYLE_OPTIONS, POSITIVE)']	"['(FOOD#STYLE_OPTIONS, POSITIVE, ""aperitivo"")']"
1246	de primero cogimos un risoto de hongos trufa y un super medallon de foie fresco pasado por la plancha y unas borrajas con centollo estaban las dos cosas muy buenas y cocidas al dente.de segundo la merluza a la plancha con juliana de sepia y un solomillo de ternasco al azafran,l amerluza estaba poco hecha por dentro pero caliente y el solomillo poco hecho tambien y con muy poca salsa;y d epostre una seleccion de chocolates en texturas con zumo de naranja reducido y un merenge con helado de chocolate blanco y fresas;muy bueno todo,dos cafes y una botella de agua por 123 euros. 	['(FOOD#QUALITY, POSITIVE)', '(FOOD#QUALITY, POSITIVE)', '(FOOD#QUALITY, NEGATIVE)', '(FOOD#QUALITY, NEGATIVE)', '(FOOD#QUALITY, NEGATIVE)', '(FOOD#QUALITY, NEGATIVE)']	"['(FOOD#QUALITY, POSITIVE, ""risoto de hongos trufa"")', '(FOOD#QUALITY, POSITIVE, ""medallon de foie fresco pasado por la plancha y unas borrajas con centollo"")', '(FOOD#QUALITY, NEGATIVE, ""merluza a la plancha con juliana de sepia"")', '(FOOD#QUALITY, NEGATIVE, ""solomillo de ternasco al azafran"")', '(FOOD#QUALITY, NEGATIVE, ""seleccion de chocolates en texturas con zumo de naranja reducido"")', '(FOOD#QUALITY, NEGATIVE, ""merenge con helado de chocolate blanco y fresas"")']"
1247	Esta reserva fue un acierto.	['(RESTAURANT#MISCELLANEOUS, POSITIVE)']	"['(RESTAURANT#MISCELLANEOUS, POSITIVE, ""NULL"")']"
1248	La relación calidad precio es muy buena.	['(FOOD#PRICES, POSITIVE)']	"['(FOOD#PRICES, POSITIVE, ""NULL"")']"
1249	El servicio excelente.	['(SERVICE#GENERAL, POSITIVE)']	"['(SERVICE#GENERAL, POSITIVE, ""servicio"")']"
1250	Raciones grandes.	['(FOOD#STYLE_OPTIONS, POSITIVE)']	"['(FOOD#STYLE_OPTIONS, POSITIVE, ""Raciones"")']"
1251	Los camareros son atentos y muy amables, el menú calçotada es interminable!	['(SERVICE#GENERAL, POSITIVE)', '(FOOD#STYLE_OPTIONS, POSITIVE)']	"['(SERVICE#GENERAL, POSITIVE, ""camareros"")', '(FOOD#STYLE_OPTIONS, POSITIVE, ""calçotada"")']"
1252	Lo mejor, las alcachofas a la brasa (estaban de lujo) y los calçots con tejas, buenísimos!	['(FOOD#QUALITY, POSITIVE)', '(FOOD#QUALITY, POSITIVE)']	"['(FOOD#QUALITY, POSITIVE, ""alcachofas a la brasa"")', '(FOOD#QUALITY, POSITIVE, ""calçots con tejas"")']"
1253	La salsa estaba muy buena también.	['(FOOD#QUALITY, POSITIVE)']	"['(FOOD#QUALITY, POSITIVE, ""salsa"")']"
1254	Tuvieron un detalle al cambiarme la parrillada de carne por una parrillada de verduras (opción vegetariana).	['(FOOD#STYLE_OPTIONS, POSITIVE)']	"['(FOOD#STYLE_OPTIONS, POSITIVE, ""NULL"")']"
1255	¡Repetiré seguro!	['(RESTAURANT#GENERAL, POSITIVE)']	"['(RESTAURANT#GENERAL, POSITIVE, ""NULL"")']"
