id	text	labels	labels_phrases
390	Hay un listado de sugerencias plastificado y sin precio, incluido en la carta y tan largo como la carta.	['(FOOD#STYLE_OPTIONS, NEGATIVE)']	"['(FOOD#STYLE_OPTIONS, NEGATIVE, ""sugerencias"")']"
391	Además te leen aún más sugerencias.	['(FOOD#STYLE_OPTIONS, NEGATIVE)']	"['(FOOD#STYLE_OPTIONS, NEGATIVE, ""sugerencias"")']"
392	Pedimos varias de las sugerencias del listado, porque la carta normal era muy poco original.¡Todas costaron entre 23 y 28 €, hasta las ensaladas!	['(FOOD#STYLE_OPTIONS, NEGATIVE)', '(FOOD#PRICES, NEGATIVE)']	"['(FOOD#STYLE_OPTIONS, NEGATIVE, ""carta"")', '(FOOD#PRICES, NEGATIVE, ""ensaladas"")']"
393	Muy caro, carísimo para la calidad.	['(RESTAURANT#PRICES, NEGATIVE)']	"['(RESTAURANT#PRICES, NEGATIVE, ""NULL"")']"
394	Además teniendo que correr para salir a tiempo, porque hacen turnos para cenar.	['(SERVICE#GENERAL, NEGATIVE)']	"['(SERVICE#GENERAL, NEGATIVE, ""turnos"")']"
395	¡A estos precios me parece un insulto!	['(RESTAURANT#PRICES, NEGATIVE)']	"['(RESTAURANT#PRICES, NEGATIVE, ""NULL"")']"
396	Yo no voy a volver.	['(RESTAURANT#GENERAL, NEGATIVE)']	"['(RESTAURANT#GENERAL, NEGATIVE, ""NULL"")']"
397	Gracias a los dos por darme la informacion, algun dia he ido de tapeo en la barra pero no me ha dado por bajar, no lo hare porque por lo que poneis mas que bajar al salon, bajas a los infiernos.	['(RESTAURANT#GENERAL, NEGATIVE)']	"['(RESTAURANT#GENERAL, NEGATIVE, ""salon"")']"
398	No esta la economia para que la gente pague 60 euracos en una ensalada y una carne, a falta de vino y postre, por persona segun el vino te vas a 80 euros.	['(FOOD#PRICES, NEGATIVE)', '(FOOD#PRICES, NEGATIVE)']	"['(FOOD#PRICES, NEGATIVE, ""ensalada"")', '(FOOD#PRICES, NEGATIVE, ""carne"")']"
399	Hola,yo he estado en este restaurante dos veces y nos gusto bastante.	['(RESTAURANT#GENERAL, POSITIVE)']	"['(RESTAURANT#GENERAL, POSITIVE, ""restaurante"")']"
400	Casualmente también cenamos la tempura y nos encanto, de segundo yo comi cochinillo, venia con huesos (en otros sitios lo dan deshuesado) pero estaba riquisimo, mi mujer pidió corvina y también le encantó, de postre compartimos un coulant de chocolate.la segunda vez fuimos con mis suegros y también les gusto, fue un domindo a comer, picamos jamón, croquetas y otra vez tempura y de segundo arroz negro, en su punto y muy bueno.	['(FOOD#QUALITY, POSITIVE)', '(FOOD#QUALITY, POSITIVE)', '(FOOD#QUALITY, POSITIVE)', '(FOOD#QUALITY, POSITIVE)']	"['(FOOD#QUALITY, POSITIVE, ""tempura"")', '(FOOD#QUALITY, POSITIVE, ""cochinillo"")', '(FOOD#QUALITY, POSITIVE, ""corvina"")', '(FOOD#QUALITY, POSITIVE, ""arroz negro"")']"
401	las dos veces precio normal para estos sitios.	['(RESTAURANT#PRICES, POSITIVE)']	"['(RESTAURANT#PRICES, POSITIVE, ""sitios"")']"
402	Estuvimos hace unas semanas y no nos gustó nada.	['(RESTAURANT#GENERAL, NEGATIVE)']	"['(RESTAURANT#GENERAL, NEGATIVE, ""NULL"")']"
403	Nos sentaron en zona de paso habiendo reservado con tres semanas de antelación.	['(SERVICE#GENERAL, NEGATIVE)']	"['(SERVICE#GENERAL, NEGATIVE, ""zona de paso"")']"
404	La tempura, un plato treméndamente vulgar en cuanto a su presentación y la calidad.	['(FOOD#STYLE_OPTIONS, NEGATIVE)', '(FOOD#QUALITY, NEGATIVE)']	"['(FOOD#STYLE_OPTIONS, NEGATIVE, ""tempura"")', '(FOOD#QUALITY, NEGATIVE, ""tempura"")']"
405	El cogote y el bacalao aceptable.	['(FOOD#QUALITY, NEUTRAL)', '(FOOD#QUALITY, NEUTRAL)']	"['(FOOD#QUALITY, NEUTRAL, ""cogote"")', '(FOOD#QUALITY, NEUTRAL, ""bacalao"")']"
406	Postre también vulgar.	['(FOOD#QUALITY, NEGATIVE)']	"['(FOOD#QUALITY, NEGATIVE, ""Postre"")']"
407	El servicio más pendiente de una cena de empresa, por tanto no fue bueno el servicio.	['(SERVICE#GENERAL, NEGATIVE)']	"['(SERVICE#GENERAL, NEGATIVE, ""servicio"")']"
408	Mucha apariencia de modernidad pero nada especial.	['(AMBIENCE#GENERAL, NEGATIVE)']	"['(AMBIENCE#GENERAL, NEGATIVE, ""apariencia"")']"
409	Nosotros no volveremos. 	['(RESTAURANT#GENERAL, NEGATIVE)']	"['(RESTAURANT#GENERAL, NEGATIVE, ""NULL"")']"
410	Estuve el otro día y me parecio muy bien.	['(RESTAURANT#GENERAL, POSITIVE)']	"['(RESTAURANT#GENERAL, POSITIVE, ""NULL"")']"
411	El trato fues cordial y la comida esplendida, tuvieron un par de detalles buenos que eso gusta porqeu no en todos los itios lo hacen.	['(SERVICE#GENERAL, POSITIVE)', '(FOOD#QUALITY, POSITIVE)']	"['(SERVICE#GENERAL, POSITIVE, ""trato"")', '(FOOD#QUALITY, POSITIVE, ""comida"")']"
412	Estuvieron encima en todo moneto y no hacia falta llamarles.	['(SERVICE#GENERAL, POSITIVE)']	"['(SERVICE#GENERAL, POSITIVE, ""NULL"")']"
413	La comida estuvo bien en su punto y bien presentada. 	['(FOOD#QUALITY, POSITIVE)']	"['(FOOD#QUALITY, POSITIVE, ""comida"")']"
414	Yo voy bastante a menudo y me encanta.	['(RESTAURANT#GENERAL, POSITIVE)']	"['(RESTAURANT#GENERAL, POSITIVE, ""NULL"")']"
415	El servicio siempre es correctísimo y la comida muy buena.	['(SERVICE#GENERAL, POSITIVE)', '(FOOD#QUALITY, POSITIVE)']	"['(SERVICE#GENERAL, POSITIVE, ""servicio"")', '(FOOD#QUALITY, POSITIVE, ""comida"")']"
416	De entrantes siempre pedimos la tempura que está buenísima (pese a los comentarios anteriores), croqueta trufada que es expectacular y el ravioli con longaniza de Graus que está expectacular también.	['(FOOD#QUALITY, POSITIVE)', '(FOOD#QUALITY, POSITIVE)', '(FOOD#QUALITY, POSITIVE)']	"['(FOOD#QUALITY, POSITIVE, ""tempura"")', '(FOOD#QUALITY, POSITIVE, ""croqueta trufada"")', '(FOOD#QUALITY, POSITIVE, ""ravioli con longaniza de Graus"")']"
417	Los segundos he probado varios, pero siempre buenos.	['(FOOD#QUALITY, POSITIVE)']	"['(FOOD#QUALITY, POSITIVE, ""segundos"")']"
418	Lo único que no me convenció fue el magret de pato que estaba pelín soso.	['(FOOD#QUALITY, NEGATIVE)']	"['(FOOD#QUALITY, NEGATIVE, ""magret de pato"")']"
419	Siempre bebemos cava y nos lo sacan muy frio, como debe ser y en pocos sitios te lo sacan correctamente.	['(DRINKS#QUALITY, POSITIVE)']	"['(DRINKS#QUALITY, POSITIVE, ""cava"")']"
420	El precio es bueno, nada exagerado.	['(RESTAURANT#PRICES, POSITIVE)']	"['(RESTAURANT#PRICES, POSITIVE, ""NULL"")']"
421	Sin duda es un sitio que recomiendo. 	['(RESTAURANT#GENERAL, POSITIVE)']	"['(RESTAURANT#GENERAL, POSITIVE, ""sitio"")']"
422	yo no he tenido el placer de la cocina de este restaurante, pero el trato deja mucho que desear, ayer, con mi bebe de 4 meses y mi pareja intentamos ir al concurso de las tapas que se celebra cada año en zaragoza y nos dijeron de muy malas maneras que en domingo solo se comia a la carta y que no hacian el concurso (que en la propaganda viene anunciado hasta el 25 de noviembre), y ademas nos querían sentar en una zona de paso, con el carrito apartado…en fin, para no volver, y sin probarlo!!!!! 	['(SERVICE#GENERAL, NEGATIVE)', '(RESTAURANT#GENERAL, NEGATIVE)']	"['(SERVICE#GENERAL, NEGATIVE, ""trato"")', '(RESTAURANT#GENERAL, NEGATIVE, ""NULL"")']"
423	No me extraña el comentario de Marta,el propietario de este local debería dedicarse a otros menesteres.	['(SERVICE#GENERAL, NEGATIVE)']	"['(SERVICE#GENERAL, NEGATIVE, ""propietario"")']"
424	La nula educación y su pésima atención son sus credenciales. 	['(SERVICE#GENERAL, NEGATIVE)', '(SERVICE#GENERAL, NEGATIVE)']	"['(SERVICE#GENERAL, NEGATIVE, ""educación"")', '(SERVICE#GENERAL, NEGATIVE, ""atención"")']"
425	El restaurante bien, con una decoración escueta (”minimalista”) muy agradable, el trato correcto comimos muy bien y no me parecio caro para los tres que fuimos.	['(RESTAURANT#GENERAL, POSITIVE)', '(AMBIENCE#GENERAL, POSITIVE)', '(SERVICE#GENERAL, POSITIVE)', '(RESTAURANT#PRICES, POSITIVE)']	"['(RESTAURANT#GENERAL, POSITIVE, ""restaurante"")', '(AMBIENCE#GENERAL, POSITIVE, ""decoración"")', '(SERVICE#GENERAL, POSITIVE, ""trato"")', '(RESTAURANT#PRICES, POSITIVE, ""NULL"")']"
426	En resumen, comida bien-muy bien, servicio correcto y profesional 	['(FOOD#QUALITY, POSITIVE)', '(SERVICE#GENERAL, POSITIVE)']	"['(FOOD#QUALITY, POSITIVE, ""comida"")', '(SERVICE#GENERAL, POSITIVE, ""servicio"")']"
427	Estuvimos muy agusto y cenamos muy bien, el menu de temporada, con algun plato de carta que luego nos ajustaron como de menu.	['(FOOD#QUALITY, POSITIVE)']	"['(FOOD#QUALITY, POSITIVE, ""menu de temporada"")']"
428	Todo muy correcto.	['(RESTAURANT#GENERAL, POSITIVE)']	"['(RESTAURANT#GENERAL, POSITIVE, ""NULL"")']"
429	Creo que es un sitio donde es dificil que algo salga mal, de estos sitios, que siempre aciertas.	['(RESTAURANT#GENERAL, POSITIVE)']	"['(RESTAURANT#GENERAL, POSITIVE, ""sitio"")']"
430	Muy recomedable.	['(RESTAURANT#GENERAL, POSITIVE)']	"['(RESTAURANT#GENERAL, POSITIVE, ""NULL"")']"
431	Nosotros volveremos. 	['(RESTAURANT#GENERAL, POSITIVE)']	"['(RESTAURANT#GENERAL, POSITIVE, ""NULL"")']"
432	Estuvimos hace poco mi pareja y yo comiendo y resultó todo muy bien, tanto la comida, el vino, el trato, la  decoración… nos gustó todo mucho.	['(FOOD#QUALITY, POSITIVE)', '(DRINKS#QUALITY, POSITIVE)', '(SERVICE#GENERAL, POSITIVE)', '(AMBIENCE#GENERAL, POSITIVE)']	"['(FOOD#QUALITY, POSITIVE, ""comida"")', '(DRINKS#QUALITY, POSITIVE, ""vino"")', '(SERVICE#GENERAL, POSITIVE, ""trato"")', '(AMBIENCE#GENERAL, POSITIVE, ""decoración"")']"
433	Por cierto, había niños pequeños y sin problema. 	['(RESTAURANT#MISCELLANEOUS, POSITIVE)']	"['(RESTAURANT#MISCELLANEOUS, POSITIVE, ""NULL"")']"
434	Estuve la semana pasada (entre semana) cenando y fue muy bien.Tanto la atención (muy atentos y dando consejos apropiados), como la comida, y el tiempo de espera.	['(RESTAURANT#GENERAL, POSITIVE)', '(SERVICE#GENERAL, POSITIVE)', '(FOOD#QUALITY, POSITIVE)', '(SERVICE#GENERAL, POSITIVE)']	"['(RESTAURANT#GENERAL, POSITIVE, ""NULL"")', '(SERVICE#GENERAL, POSITIVE, ""atención"")', '(FOOD#QUALITY, POSITIVE, ""comida"")', '(SERVICE#GENERAL, POSITIVE, ""tiempo de espera"")']"
435	Tanto el postre como el vino, fueron consejo del maitre, y la verdad que muy acertados. 	['(SERVICE#GENERAL, POSITIVE)', '(FOOD#QUALITY, POSITIVE)', '(DRINKS#QUALITY, POSITIVE)']	"['(SERVICE#GENERAL, POSITIVE, ""maitre"")', '(FOOD#QUALITY, POSITIVE, ""postre"")', '(DRINKS#QUALITY, POSITIVE, ""vino"")']"
436	Hemos comido de menú de temporada ( 26 € ) : Todo bueno, pero sales con la sensación de haber pagado más de lo que deberías ( y eso que no he pagado yo ) .	['(FOOD#QUALITY, POSITIVE)', '(FOOD#PRICES, NEGATIVE)']	"['(FOOD#QUALITY, POSITIVE, ""menú de temporada"")', '(FOOD#PRICES, NEGATIVE, ""menú de temporada"")']"
437	Y el menú para niños es un cuadra cuentas; el menú sigue la lógica de lo que un niño puede comer sin complicaciones y está todo bueno, pero sigue la tónica del resto: caro.Queda la duda de cómo será comer de carta, pero por cuenta propia, habiendo tantas opciones disponibles, no creo que vuelva para comprobarlo. 	['(FOOD#QUALITY, POSITIVE)', '(FOOD#PRICES, NEGATIVE)']	"['(FOOD#QUALITY, POSITIVE, ""menú para niños"")', '(FOOD#PRICES, NEGATIVE, ""menú para niños"")']"
438	En Zaragoza hay Restaurantes correctos, buenos, muy buenos,Restaurantes a los que no vuelves, los que pasan desapercibidos, mediocres y pésimos como por ejemplo La Scala.	['(RESTAURANT#GENERAL, NEGATIVE)']	"['(RESTAURANT#GENERAL, NEGATIVE, ""La Scala"")']"
439	Afirmar que en ese local se pueden degustar verdaderas delicias es una auténtica temeridad.	['(FOOD#QUALITY, NEGATIVE)']	"['(FOOD#QUALITY, NEGATIVE, ""delicias"")']"
440	Para olvidar. 	['(RESTAURANT#GENERAL, NEGATIVE)']	"['(RESTAURANT#GENERAL, NEGATIVE, ""NULL"")']"
441	Muy bien tanto el servicio como la atención recibida y la cena 	['(SERVICE#GENERAL, POSITIVE)', '(SERVICE#GENERAL, POSITIVE)', '(FOOD#QUALITY, POSITIVE)']	"['(SERVICE#GENERAL, POSITIVE, ""servicio"")', '(SERVICE#GENERAL, POSITIVE, ""atención"")', '(FOOD#QUALITY, POSITIVE, ""cena"")']"
442	Hemos estado muy a gusto, buen servicio, buena comida y buena compañia.	['(SERVICE#GENERAL, POSITIVE)', '(FOOD#QUALITY, POSITIVE)']	"['(SERVICE#GENERAL, POSITIVE, ""servicio"")', '(FOOD#QUALITY, POSITIVE, ""comida"")']"
443	Repetiremos. 	['(RESTAURANT#GENERAL, POSITIVE)']	"['(RESTAURANT#GENERAL, POSITIVE, ""NULL"")']"
444	Escriba aquí su comentario…Todo un descubrimiento.	['(RESTAURANT#GENERAL, POSITIVE)']	"['(RESTAURANT#GENERAL, POSITIVE, ""NULL"")']"
445	Hemos comido fenomenal.	['(FOOD#QUALITY, POSITIVE)']	"['(FOOD#QUALITY, POSITIVE, ""NULL"")']"
446	Nos decidimos por el menú de temporada y fué un acierto.	['(FOOD#QUALITY, POSITIVE)']	"['(FOOD#QUALITY, POSITIVE, ""menú de temporada"")']"
447	Comida elaborada y sabrosa, cantidades generosas y servicio perfecto.	['(FOOD#QUALITY, POSITIVE)', '(FOOD#STYLE_OPTIONS, POSITIVE)', '(SERVICE#GENERAL, POSITIVE)']	"['(FOOD#QUALITY, POSITIVE, ""Comida"")', '(FOOD#STYLE_OPTIONS, POSITIVE, ""cantidades"")', '(SERVICE#GENERAL, POSITIVE, ""servicio"")']"
448	Lo recomiendo totalmente. 	['(RESTAURANT#GENERAL, POSITIVE)']	"['(RESTAURANT#GENERAL, POSITIVE, ""NULL"")']"
449	Todo estupendo, el restaurante estaba lleno y aun así nos atendieron muy bien 	['(SERVICE#GENERAL, POSITIVE)']	"['(SERVICE#GENERAL, POSITIVE, ""restaurante"")']"
450	No se puede encontrar mejor relación calidad/precio en Zaragoza.	['(FOOD#PRICES, POSITIVE)', '(FOOD#QUALITY, POSITIVE)']	"['(FOOD#PRICES, POSITIVE, ""NULL"")', '(FOOD#QUALITY, POSITIVE, ""NULL"")']"
451	Un menú de 25 euros impecable, el local tiene una atmósfera relajante y el servicio es súper amable y profesional.	['(FOOD#QUALITY, POSITIVE)', '(FOOD#PRICES, POSITIVE)', '(AMBIENCE#GENERAL, POSITIVE)', '(SERVICE#GENERAL, POSITIVE)']	"['(FOOD#QUALITY, POSITIVE, ""menú"")', '(FOOD#PRICES, POSITIVE, ""menú"")', '(AMBIENCE#GENERAL, POSITIVE, ""atmósfera"")', '(SERVICE#GENERAL, POSITIVE, ""servicio"")']"
452	El rogout de manitas prueba la existencia de dios padre.	['(FOOD#QUALITY, POSITIVE)']	"['(FOOD#QUALITY, POSITIVE, ""rogout de manitas"")']"
453	Los postres son deliciosos todos.Repetiremos!!!	['(FOOD#QUALITY, POSITIVE)', '(RESTAURANT#GENERAL, POSITIVE)']	"['(FOOD#QUALITY, POSITIVE, ""postres"")', '(RESTAURANT#GENERAL, POSITIVE, ""NULL"")']"
454	Es el primer restaurante de Zaragoza en el que realmente no nos gustó nada.	['(RESTAURANT#GENERAL, NEGATIVE)']	"['(RESTAURANT#GENERAL, NEGATIVE, ""restaurante"")']"
455	De segundo magret de pato y el postre no lo recuerdo, eso sí, recuerdo que ni fu ni fa.	['(FOOD#QUALITY, NEGATIVE)']	"['(FOOD#QUALITY, NEGATIVE, ""postre"")']"
456	La tempura aparte de no estar especialmente buena.	['(FOOD#QUALITY, NEGATIVE)']	"['(FOOD#QUALITY, NEGATIVE, ""tempura"")']"
457	Tanto a mí como  a otras personas que la probaron no nos sentó bien.	['(FOOD#QUALITY, NEGATIVE)']	"['(FOOD#QUALITY, NEGATIVE, ""NULL"")']"
458	El magret nada fino, tenía increíblemente los pelitos del pato.	['(FOOD#QUALITY, NEGATIVE)']	"['(FOOD#QUALITY, NEGATIVE, ""magret"")']"
459	Creo que un restaurante que presenta un estilo moderno, minimalista y bastante snob no puede presentar así un plato, pero claro la salsa y la presentación a primera vista todo lo tapa.	['(AMBIENCE#GENERAL, POSITIVE)', '(FOOD#QUALITY, NEGATIVE)']	"['(AMBIENCE#GENERAL, POSITIVE, ""estilo"")', '(FOOD#QUALITY, NEGATIVE, ""plato"")']"
460	Muy caro, un querer ser y no poder.	['(RESTAURANT#PRICES, NEGATIVE)']	"['(RESTAURANT#PRICES, NEGATIVE, ""NULL"")']"
461	No lo recomiendo para nada 	['(RESTAURANT#GENERAL, NEGATIVE)']	"['(RESTAURANT#GENERAL, NEGATIVE, ""NULL"")']"
462	No noz hicieron el 20% de descuento	['(RESTAURANT#PRICES, NEGATIVE)']	"['(RESTAURANT#PRICES, NEGATIVE, ""NULL"")']"
463	Comimos bien.	['(FOOD#QUALITY, POSITIVE)']	"['(FOOD#QUALITY, POSITIVE, ""NULL"")']"
464	El risotto muy bueno.	['(FOOD#QUALITY, POSITIVE)']	"['(FOOD#QUALITY, POSITIVE, ""risotto"")']"
465	Fueron un poco lentos en el servicio.	['(SERVICE#GENERAL, NEGATIVE)']	"['(SERVICE#GENERAL, NEGATIVE, ""servicio"")']"
466	Perfecto restaurante.	['(RESTAURANT#GENERAL, POSITIVE)']	"['(RESTAURANT#GENERAL, POSITIVE, ""restaurante"")']"
467	la comida esta fabulosa.	['(FOOD#QUALITY, POSITIVE)']	"['(FOOD#QUALITY, POSITIVE, ""comida"")']"
468	"Grandes ventanales para disfrutar de ""Les Rambles""."	['(AMBIENCE#GENERAL, POSITIVE)']	"['(AMBIENCE#GENERAL, POSITIVE, ""ventanales"")']"
469	el servicio muy profesional con la cocina a la vista y donde el chef se tapa la boca con una mascarilla(muy higiénico) .	['(SERVICE#GENERAL, POSITIVE)', '(SERVICE#GENERAL, POSITIVE)']	"['(SERVICE#GENERAL, POSITIVE, ""servicio"")', '(SERVICE#GENERAL, POSITIVE, ""chef"")']"
470	La comida buena y el servicio también.	['(FOOD#QUALITY, POSITIVE)', '(SERVICE#GENERAL, POSITIVE)']	"['(FOOD#QUALITY, POSITIVE, ""comida"")', '(SERVICE#GENERAL, POSITIVE, ""servicio"")']"
471	Al traerme la cuenta no habían aplicado el 20%, pero fue decirselo y me trajeron la cuenta arreglada.	['(RESTAURANT#PRICES, NEUTRAL)']	"['(RESTAURANT#PRICES, NEUTRAL, ""cuenta"")']"
472	Fantástico si vas al teatro Poliorama	['(LOCATION#GENERAL, POSITIVE)']	"['(LOCATION#GENERAL, POSITIVE, ""NULL"")']"
473	Buena ubicación, buen servicio, calidad-precio inmejorable	['(LOCATION#GENERAL, POSITIVE)', '(SERVICE#GENERAL, POSITIVE)', '(FOOD#PRICES, POSITIVE)', '(FOOD#QUALITY, POSITIVE)']	"['(LOCATION#GENERAL, POSITIVE, ""ubicación"")', '(SERVICE#GENERAL, POSITIVE, ""servicio"")', '(FOOD#PRICES, POSITIVE, ""NULL"")', '(FOOD#QUALITY, POSITIVE, ""NULL"")']"
474	La comida fue buena, el servicio un poco lento y tuvimos que reclamar el 20%.	['(FOOD#QUALITY, POSITIVE)', '(SERVICE#GENERAL, NEGATIVE)']	"['(FOOD#QUALITY, POSITIVE, ""comida"")', '(SERVICE#GENERAL, NEGATIVE, ""servicio"")']"
475	Lo único que en la pagina ponen que tienen platos sin gluten y no tienen información ni en la carta ni el mismo camarero... dudaban de todo.	['(FOOD#STYLE_OPTIONS, NEGATIVE)', '(SERVICE#GENERAL, NEGATIVE)']	"['(FOOD#STYLE_OPTIONS, NEGATIVE, ""platos"")', '(SERVICE#GENERAL, NEGATIVE, ""camarero"")']"
476	Buen servicio, con algunos pequeños detalles a mejorar.	['(SERVICE#GENERAL, POSITIVE)']	"['(SERVICE#GENERAL, POSITIVE, ""servicio"")']"
477	Rapidez entre platos.	['(SERVICE#GENERAL, POSITIVE)']	"['(SERVICE#GENERAL, POSITIVE, ""Rapidez"")']"
478	Deben mejorar el control en la cocción de la base de pizza que utlilizan.	['(FOOD#QUALITY, NEGATIVE)']	"['(FOOD#QUALITY, NEGATIVE, ""base de pizz"")']"
479	A veces cruda en algunas zonas.	['(FOOD#QUALITY, NEGATIVE)']	"['(FOOD#QUALITY, NEGATIVE, ""NULL"")']"
480	Buen local, buen ambiente y bastante acogedor.	['(AMBIENCE#GENERAL, POSITIVE)', '(AMBIENCE#GENERAL, POSITIVE)']	"['(AMBIENCE#GENERAL, POSITIVE, ""local"")', '(AMBIENCE#GENERAL, POSITIVE, ""ambiente"")']"
481	Buena relacion calidad precio	['(FOOD#PRICES, POSITIVE)', '(FOOD#QUALITY, POSITIVE)']	"['(FOOD#PRICES, POSITIVE, ""NULL"")', '(FOOD#QUALITY, POSITIVE, ""NULL"")']"
482	Es algo más caro que lo que aparece en la web.	['(RESTAURANT#PRICES, NEGATIVE)']	"['(RESTAURANT#PRICES, NEGATIVE, ""NULL"")']"
483	Al finalizar el menu no querian hacer el descuento porque decían que el descuento era para cenas completa no valia para platos combinados sin postre... 	['(FOOD#PRICES, NEGATIVE)']	"['(FOOD#PRICES, NEGATIVE, ""menu"")']"
484	En el vale descuento no pone nada de esto.	['(SERVICE#GENERAL, NEGATIVE)']	"['(SERVICE#GENERAL, NEGATIVE, ""vale descuento"")']"
485	Increible restaurante, un servicio increíble, un personal magnifico y una comida deliciosa.	['(RESTAURANT#GENERAL, POSITIVE)', '(SERVICE#GENERAL, POSITIVE)', '(FOOD#QUALITY, POSITIVE)', '(SERVICE#GENERAL, POSITIVE)']	"['(RESTAURANT#GENERAL, POSITIVE, ""restaurante"")', '(SERVICE#GENERAL, POSITIVE, ""servicio"")', '(FOOD#QUALITY, POSITIVE, ""comida"")', '(SERVICE#GENERAL, POSITIVE, ""personal"")']"
486	recomendado 100% nosotros volveremos a ir.	['(RESTAURANT#GENERAL, POSITIVE)']	"['(RESTAURANT#GENERAL, POSITIVE, ""NULL"")']"
487	El restaurante era muy bonito, además el servicio muy bueno.	['(AMBIENCE#GENERAL, POSITIVE)', '(SERVICE#GENERAL, POSITIVE)']	"['(AMBIENCE#GENERAL, POSITIVE, ""restaurante"")', '(SERVICE#GENERAL, POSITIVE, ""servicio"")']"
488	Como siempre que hemos ido, La Poma consigue un 10 en relación calidad/precio.	['(FOOD#PRICES, POSITIVE)', '(FOOD#QUALITY, POSITIVE)']	"['(FOOD#PRICES, POSITIVE, ""Poma"")', '(FOOD#QUALITY, POSITIVE, ""Poma"")']"
489	En este día 25/12, apreciamos más lentitud en el servicio seguramente porque había menos personal en un día tan señalado, por lo demás excelente relación calidad/precio.	['(SERVICE#GENERAL, NEGATIVE)', '(FOOD#PRICES, POSITIVE)', '(FOOD#QUALITY, POSITIVE)']	"['(SERVICE#GENERAL, NEGATIVE, ""servicio"")', '(FOOD#PRICES, POSITIVE, ""NULL"")', '(FOOD#QUALITY, POSITIVE, ""NULL"")']"
490	Todo muy muy rico excelente	['(RESTAURANT#GENERAL, POSITIVE)']	"['(RESTAURANT#GENERAL, POSITIVE, ""NULL"")']"
491	Mi opinión sobre el restaurante La Poma es que es correcto, pero no extraordinario.	['(RESTAURANT#GENERAL, POSITIVE)']	"['(RESTAURANT#GENERAL, POSITIVE, ""La Poma"")']"
492	Pedimos un risotto (acceptable) y una pizza (muy mejorable) y postres (lo mejor).	['(FOOD#QUALITY, POSITIVE)', '(FOOD#QUALITY, NEGATIVE)', '(FOOD#QUALITY, POSITIVE)']	"['(FOOD#QUALITY, POSITIVE, ""risotto"")', '(FOOD#QUALITY, NEGATIVE, ""pizza"")', '(FOOD#QUALITY, POSITIVE, ""postres"")']"
493	El servicio era eficiente pero no especialmente amable.	['(SERVICE#GENERAL, NEUTRAL)']	"['(SERVICE#GENERAL, NEUTRAL, ""servicio"")']"
494	Se equivocaron al traer uno de los platos y rectificaron pero hubo que esperar un poco.	['(SERVICE#GENERAL, NEGATIVE)']	"['(SERVICE#GENERAL, NEGATIVE, ""NULL"")']"
495	En la cuenta se olvidaron de hacer el descuento y también fue necesario esperar a la rectificación.	['(SERVICE#GENERAL, NEGATIVE)']	"['(SERVICE#GENERAL, NEGATIVE, ""NULL"")']"
496	La decoración bastante conseguida.	['(AMBIENCE#GENERAL, POSITIVE)']	"['(AMBIENCE#GENERAL, POSITIVE, ""decoración"")']"
497	El local estaba lleno de turistas.	['(AMBIENCE#GENERAL, NEGATIVE)']	"['(AMBIENCE#GENERAL, NEGATIVE, ""local"")']"
498	Excelente comida casera que me recuerda la comida de mi madre.han realizado una gran reforma para satisfacer a sus clientes ¨gracias 	['(FOOD#QUALITY, POSITIVE)', '(AMBIENCE#GENERAL, POSITIVE)']	"['(FOOD#QUALITY, POSITIVE, ""comida"")', '(AMBIENCE#GENERAL, POSITIVE, ""reforma"")']"
499	Lo recomiendo, un lugar en el que disfrutar de comida casera ó también de una buena chuleta de ternera a la piedra dentro de unos precios asequibles, para los que os gusten los buenos vinos, tenéis una gran variedad de ellos con los que acompañar una buena comida, en cuanto a las personas que lo atienden, Ana la propietaria se encarga de hacerte cómoda tu estancia y su madre en la cocina una excelente cocinera y un encanto de mujer. 	['(FOOD#QUALITY, POSITIVE)', '(FOOD#QUALITY, POSITIVE)', '(FOOD#PRICES, POSITIVE)', '(FOOD#PRICES, POSITIVE)', '(DRINKS#STYLE_OPTIONS, POSITIVE)', '(SERVICE#GENERAL, POSITIVE)', '(SERVICE#GENERAL, POSITIVE)']	"['(FOOD#QUALITY, POSITIVE, ""comida"")', '(FOOD#QUALITY, POSITIVE, ""chuleta de ternera"")', '(FOOD#PRICES, POSITIVE, ""chuleta de ternera"")', '(FOOD#PRICES, POSITIVE, ""comida"")', '(DRINKS#STYLE_OPTIONS, POSITIVE, ""vinos"")', '(SERVICE#GENERAL, POSITIVE, ""Ana la propietaria"")', '(SERVICE#GENERAL, POSITIVE, ""madre"")']"
500	Hemos comido el menú a la brasa precio calidad bien, los cayos que hemos probado de 10.	['(FOOD#PRICES, POSITIVE)', '(FOOD#QUALITY, POSITIVE)', '(FOOD#QUALITY, POSITIVE)']	"['(FOOD#PRICES, POSITIVE, ""menú a la brasa"")', '(FOOD#QUALITY, POSITIVE, ""menú a la brasa"")', '(FOOD#QUALITY, POSITIVE, ""cayos"")']"
501	Lo recomendaremos.	['(RESTAURANT#GENERAL, POSITIVE)']	"['(RESTAURANT#GENERAL, POSITIVE, ""NULL"")']"
502	Buen sitio para repetir 	['(RESTAURANT#GENERAL, POSITIVE)']	"['(RESTAURANT#GENERAL, POSITIVE, ""sitio"")']"
503	comimos el domingo 20 de octubre y tenemos que decir que estuvo genial, probamos una ensalada con bonito escabechado de la casa muy bueno, las carnes muy bien elaboradas, los postres casi sobraban, pero había que hacer un esfuerzo que mereció la pena y bastantes vinos para poder elegir.	['(RESTAURANT#GENERAL, POSITIVE)', '(FOOD#QUALITY, POSITIVE)', '(FOOD#QUALITY, POSITIVE)', '(FOOD#QUALITY, POSITIVE)', '(DRINKS#STYLE_OPTIONS, POSITIVE)']	"['(RESTAURANT#GENERAL, POSITIVE, ""NULL"")', '(FOOD#QUALITY, POSITIVE, ""ensalada con bonito escabechado de la casa"")', '(FOOD#QUALITY, POSITIVE, ""carnes"")', '(FOOD#QUALITY, POSITIVE, ""postres"")', '(DRINKS#STYLE_OPTIONS, POSITIVE, ""vinos"")']"
504	muy recomendable y para volver!!! 	['(RESTAURANT#GENERAL, POSITIVE)']	"['(RESTAURANT#GENERAL, POSITIVE, ""NULL"")']"
505	Tuvimos que esperar un poco para sentarnos, pero la comida muy buena, merece la pena. 	['(FOOD#QUALITY, POSITIVE)', '(SERVICE#GENERAL, NEGATIVE)']	"['(FOOD#QUALITY, POSITIVE, ""comida"")', '(SERVICE#GENERAL, NEGATIVE, ""NULL"")']"
506	Excelente la atención de todo el personal, la comida ni hablar toda muy buena sobre todo el ternasco a la brasa uff todavíalo saboreo, muy buena cantidad para el que es comelón, un poco apartado del centro, pero por lo demás lo sabroso hace olvidar lo apartado, de verdad es muy bueno, lo recomiendo a todo aquel de buen paladar. 	['(SERVICE#GENERAL, POSITIVE)', '(FOOD#QUALITY, POSITIVE)', '(FOOD#QUALITY, POSITIVE)', '(LOCATION#GENERAL, NEGATIVE)', '(RESTAURANT#GENERAL, POSITIVE)']	"['(SERVICE#GENERAL, POSITIVE, ""atención"")', '(FOOD#QUALITY, POSITIVE, ""comida"")', '(FOOD#QUALITY, POSITIVE, ""ternasco a la brasa"")', '(LOCATION#GENERAL, NEGATIVE, ""NULL"")', '(RESTAURANT#GENERAL, POSITIVE, ""NULL"")']"
507	Fuimos 7 personas con un niño tanto el trato con la comida fue muy buenaLo recomiendo 	['(SERVICE#GENERAL, POSITIVE)', '(FOOD#QUALITY, POSITIVE)', '(RESTAURANT#GENERAL, POSITIVE)']	"['(SERVICE#GENERAL, POSITIVE, ""trato"")', '(FOOD#QUALITY, POSITIVE, ""comida"")', '(RESTAURANT#GENERAL, POSITIVE, ""NULL"")']"
508	La cena estuvo muy bien.	['(FOOD#QUALITY, POSITIVE)']	"['(FOOD#QUALITY, POSITIVE, ""cena"")']"
