id	text	labels	labels_phrases
1607	Die Crew (alle im gleichen Outfit - alle sprechen italienisch mit den Gästen) soll den Kunden das Gefühl vermitteln wirklich in LOC zu sein…ähnlich kennen wir das aus LOC…hierfür würde ich für die schauspielerische Leistung glatt 3 Punkte vergeben.	['(SERVICE, NEUTRAL)']	"['(SERVICE, NEUTRAL, ""Crew"")']"
1609	Dies könnte dem bei unserem Besuch nicht sehr aufmerksamen Service, sehr kleinen Portionen und vergleichsweise hohen Preisen geschuldet sein.	['(SERVICE, NEGATIVE)', '(FOOD, NEGATIVE)', '(PRICE, NEGATIVE)']	"['(SERVICE, NEGATIVE, ""Service"")', '(FOOD, NEGATIVE, ""Portionen"")', '(PRICE, NEGATIVE, ""Preisen"")']"
1611	Waren zu Mittag im LOC und angenehm vom Ambiente überrascht.	['(AMBIENCE, POSITIVE)']	"['(AMBIENCE, POSITIVE, ""Ambiente"")']"
1615	Das Ambiente ist natürlich besonders.	['(AMBIENCE, POSITIVE)']	"['(AMBIENCE, POSITIVE, ""Ambiente"")']"
1618	Die westfälische Küche, Zwiebelfleisch, und der Rheinische Sauerbraten überzeugen geschmacklich in jeder Hinsicht.	['(FOOD, POSITIVE)', '(FOOD, POSITIVE)', '(FOOD, POSITIVE)']	"['(FOOD, POSITIVE, ""Küche"")', '(FOOD, POSITIVE, ""Zwiebelfleisch"")', '(FOOD, POSITIVE, ""Sauerbraten"")']"
1623	Man sollte auf festes Schuhwerk achten, da einen ansonsten bei dem klebenden Boden die selbigen ausgezogen werden.	['(AMBIENCE, NEGATIVE)']	"['(AMBIENCE, NEGATIVE, ""Boden"")']"
1624	Die Preise sind sehr gehoben, daher wird eher kein regelmäßiger Besuch resultieren.	['(PRICE, NEGATIVE)']	"['(PRICE, NEGATIVE, ""Preise"")']"
1640	Der Service ist eine Katastrophe!	['(SERVICE, NEGATIVE)']	"['(SERVICE, NEGATIVE, ""Service"")']"
1642	Die Speisen sind türkische Standard Küche etwas über dem Durchschnitt.	['(FOOD, POSITIVE)']	"['(FOOD, POSITIVE, ""Speisen"")']"
1647	Service und Essen sind hervorragend.	['(SERVICE, POSITIVE)', '(FOOD, POSITIVE)']	"['(SERVICE, POSITIVE, ""Service"")', '(FOOD, POSITIVE, ""Essen"")']"
1653	Direkt neben der LOC präsentiert sich das LOC mit wunderschönen Räumen.	['(AMBIENCE, POSITIVE)']	"['(AMBIENCE, POSITIVE, ""Räumen"")']"
1660	Auch der Murrejubbel Knödel und vor allem das LOC mit Apfelreduktion war ein Highlight.	['(FOOD, POSITIVE)', '(FOOD, POSITIVE)']	"['(FOOD, POSITIVE, ""Murrejubbel Knödel"")', '(FOOD, POSITIVE, ""LOC mit Apfelreduktion"")']"
1677	Aschenbecher vom Personal auf den Tisch gestellt, wo alte Zigaretten enthalten waren.	['(AMBIENCE, NEGATIVE)', '(SERVICE, NEGATIVE)']	"['(AMBIENCE, NEGATIVE, ""Aschenbecher"")', '(SERVICE, NEGATIVE, ""Personal"")']"
1681	Das war leider das letzte Mal!	['(GENERAL-IMPRESSION, NEGATIVE)']	"['(GENERAL-IMPRESSION, NEGATIVE, ""NULL"")']"
1683	LOC ist zu empfehlen.	['(GENERAL-IMPRESSION, POSITIVE)']	"['(GENERAL-IMPRESSION, POSITIVE, ""LOC"")']"
1687	In einem guten Restaurant wird einem das vorher gesagt, bevor sie auf den Tisch gestellt wird.	['(SERVICE, NEGATIVE)']	"['(SERVICE, NEGATIVE, ""NULL"")']"
1688	Von außen recht unscheinbar entpuppt sich das Haus als gemütliches, uriges und stilecht eingerichtetes Altbiergasthaus mit großem Platzangebot.	['(AMBIENCE, POSITIVE)', '(AMBIENCE, POSITIVE)']	"['(AMBIENCE, POSITIVE, ""Altbiergasthaus"")', '(AMBIENCE, POSITIVE, ""Platzangebot"")']"
1689	Dafür ist die Auswahl an Getränken sehr ordentlich.	['(FOOD, POSITIVE)']	"['(FOOD, POSITIVE, ""Auswahl an Getränken"")']"
1692	Ich hab Salz, Pfeffer, Essig und Öl vermisst.	['(FOOD, NEGATIVE)']	"['(FOOD, NEGATIVE, ""NULL"")']"
1708	Trotz des großen Andrangs ausgesprochen freundlicher, schneller Service.	['(SERVICE, POSITIVE)']	"['(SERVICE, POSITIVE, ""Service"")']"
1717	Auf ein zwei schöne Biere kommen wir sicher wieder, essen werden wir vermutlich nicht mehr.	['(FOOD, POSITIVE)', '(FOOD, NEGATIVE)']	"['(FOOD, POSITIVE, ""Biere"")', '(FOOD, NEGATIVE, ""essen"")']"
1718	Beides wurde einzeln gebracht mit einer Verzögerung von 10min.	['(SERVICE, NEGATIVE)']	"['(SERVICE, NEGATIVE, ""Verzögerung"")']"
1722	Die von meiner Frau gegessenen Parpadelle a'la RESTAURANT_NAME waren ebenfalls zu wenig gewürzt und wurden mit zu wenig geriebenem Parmesan serviert.	['(FOOD, NEGATIVE)']	"['(FOOD, NEGATIVE, ""Parpadelle a\'la RESTAURANT_NAME"")']"
1727	Leider war das Essen nur sehr durchschnittlich.	['(FOOD, NEUTRAL)']	"['(FOOD, NEUTRAL, ""Essen"")']"
1734	Hervorzuheben ist hier auch die angepasste Speisekarte für die Veggies und Veganer.	['(FOOD, POSITIVE)']	"['(FOOD, POSITIVE, ""Speisekarte für die Veggies und Veganer"")']"
1740	Klasse, wie immer.	['(GENERAL-IMPRESSION, POSITIVE)']	"['(GENERAL-IMPRESSION, POSITIVE, ""NULL"")']"
1743	Und es hat sich gelohnt!!	['(GENERAL-IMPRESSION, POSITIVE)']	"['(GENERAL-IMPRESSION, POSITIVE, ""NULL"")']"
1745	Auch wirklich gut und habe ich auch noch nie gegessen.	['(FOOD, POSITIVE)']	"['(FOOD, POSITIVE, ""NULL"")']"
1747	Die schönsten Plätze sind draußen an den Mauern der Kirche!	['(AMBIENCE, POSITIVE)']	"['(AMBIENCE, POSITIVE, ""Plätze"")']"
1748	Das Essen war in Ordnung.	['(FOOD, NEUTRAL)']	"['(FOOD, NEUTRAL, ""Essen"")']"
1759	Von 5 verschiedenen Bestellungen, war eine ungenießbar ( sauer, war gekippt ), ein Teller ungewürzt, zwei noch in Ordnung und ein Essen war gut.	['(FOOD, NEGATIVE)', '(FOOD, POSITIVE)', '(FOOD, NEGATIVE)', '(FOOD, NEUTRAL)']	"['(FOOD, NEGATIVE, ""NULL"")', '(FOOD, POSITIVE, ""Essen"")', '(FOOD, NEGATIVE, ""Teller"")', '(FOOD, NEUTRAL, ""NULL"")']"
1760	lang sehr wohl gefühlt!	['(GENERAL-IMPRESSION, POSITIVE)']	"['(GENERAL-IMPRESSION, POSITIVE, ""NULL"")']"
1765	Bei mir war es nicht viel besser.	['(GENERAL-IMPRESSION, NEGATIVE)']	"['(GENERAL-IMPRESSION, NEGATIVE, ""NULL"")']"
1769	Die Sauce und das Gemüse waren in Ordnung.	['(FOOD, NEUTRAL)', '(FOOD, NEUTRAL)']	"['(FOOD, NEUTRAL, ""Sauce"")', '(FOOD, NEUTRAL, ""Gemüse"")']"
1772	Gutes Essen und toller, freundlicher Service.	['(FOOD, POSITIVE)', '(SERVICE, POSITIVE)']	"['(FOOD, POSITIVE, ""Essen"")', '(SERVICE, POSITIVE, ""Service"")']"
1773	Wir hatten eine sehr freundliche Bedienung.	['(SERVICE, POSITIVE)']	"['(SERVICE, POSITIVE, ""Bedienung"")']"
1787	Ein Service der absoluten Spitzenklasse, so extrem aufmerksam und freundlich, wie es heute nur noch selten anzutreffen ist.	['(SERVICE, POSITIVE)']	"['(SERVICE, POSITIVE, ""Service"")']"
1788	Da war dann immer noch ordentlich Salz drin, aber es war essbar.	['(FOOD, NEUTRAL)', '(FOOD, NEUTRAL)']	"['(FOOD, NEUTRAL, ""drin, aber es war"")', '(FOOD, NEUTRAL, ""NULL"")']"
1794	Gestresste überhebliche Kellner und das Essen nur noch Mittelmass.	['(SERVICE, NEGATIVE)', '(FOOD, NEUTRAL)']	"['(SERVICE, NEGATIVE, ""Kellner"")', '(FOOD, NEUTRAL, ""Essen"")']"
1804	Suppe war nicht heiß, kümmerte den Service aber nicht.	['(SERVICE, NEGATIVE)', '(FOOD, NEGATIVE)']	"['(SERVICE, NEGATIVE, ""Service"")', '(FOOD, NEGATIVE, ""Suppe"")']"
1805	Am LOC gelegen, wird hier leckeres Bier und zünftiges Essen serviert.	['(FOOD, POSITIVE)', '(FOOD, POSITIVE)']	"['(FOOD, POSITIVE, ""Bier"")', '(FOOD, POSITIVE, ""Essen"")']"
1821	Dann LOC Knipp - Knipp, Gurken und Apfelmus fein, kann man nicht viel falsch machen.	['(FOOD, POSITIVE)', '(FOOD, POSITIVE)']	"['(FOOD, POSITIVE, ""Gurken"")', '(FOOD, POSITIVE, ""Apfelmus"")']"
1828	Gepflegtes Bier (0,5 Liter) und süffiger Wein.	['(FOOD, POSITIVE)', '(FOOD, POSITIVE)']	"['(FOOD, POSITIVE, ""Bier"")', '(FOOD, POSITIVE, ""Wein"")']"
1831	Ich weiß nicht was das soll.	['(GENERAL-IMPRESSION, NEGATIVE)']	"['(GENERAL-IMPRESSION, NEGATIVE, ""NULL"")']"
1838	Carpaccio ein Traum 😍 Leider war bei einem Steak der Gargrad falsch, darf eigentlich nicht passieren in so einem Haus.	['(FOOD, POSITIVE)', '(FOOD, NEGATIVE)']	"['(FOOD, POSITIVE, ""Carpaccio"")', '(FOOD, NEGATIVE, ""Steak"")']"
1850	Wir kommen gerne wieder!	['(GENERAL-IMPRESSION, POSITIVE)']	"['(GENERAL-IMPRESSION, POSITIVE, ""NULL"")']"
1875	LOC hat im laufe der Zeit nachgelassen.	['(GENERAL-IMPRESSION, NEGATIVE)']	"['(GENERAL-IMPRESSION, NEGATIVE, ""LOC"")']"
1881	Es wurde alles frisch zubereitet und nach der Bestellung zügig an den Tisch gebracht.	['(FOOD, POSITIVE)', '(SERVICE, POSITIVE)']	"['(FOOD, POSITIVE, ""NULL"")', '(SERVICE, POSITIVE, ""NULL"")']"
1883	Auch der bestellte Wein kam erst nach dem Essen.	['(SERVICE, NEGATIVE)']	"['(SERVICE, NEGATIVE, ""Wein"")']"
1885	Kommen immer wieder gerne!	['(GENERAL-IMPRESSION, POSITIVE)']	"['(GENERAL-IMPRESSION, POSITIVE, ""NULL"")']"
1888	Eine Haxe für EUR 26,50 ist schon preislich ambitioniert.	['(PRICE, NEGATIVE)']	"['(PRICE, NEGATIVE, ""Haxe"")']"
1890	Wir kommen erst Mal laaange Zeit nicht mehr.	['(GENERAL-IMPRESSION, NEGATIVE)']	"['(GENERAL-IMPRESSION, NEGATIVE, ""NULL"")']"
1893	Das können viele besser.	['(GENERAL-IMPRESSION, NEGATIVE)']	"['(GENERAL-IMPRESSION, NEGATIVE, ""NULL"")']"
1894	Wenn da nicht die traumhafte Aussicht wäre …	['(AMBIENCE, POSITIVE)']	"['(AMBIENCE, POSITIVE, ""Aussicht"")']"
1897	Der Service ist gut und freundlich.	['(SERVICE, POSITIVE)']	"['(SERVICE, POSITIVE, ""Service"")']"
1902	Wir waren uns einig: Sooo schlecht wir hier, war das Paket noch nie !	['(GENERAL-IMPRESSION, NEGATIVE)']	"['(GENERAL-IMPRESSION, NEGATIVE, ""NULL"")']"
1911	Die Bestellung wurde aufgegeben und kurze Zeit später wurde unser Essen bereits serviert, heiß, deftig und ein Genuss!	['(FOOD, POSITIVE)']	"['(FOOD, POSITIVE, ""Essen"")']"
1916	Der Service war aufmerksam und zuvorkommend wie immer.	['(SERVICE, POSITIVE)']	"['(SERVICE, POSITIVE, ""Service"")']"
1926	Freundliches und flinkes Personal .	['(SERVICE, POSITIVE)']	"['(SERVICE, POSITIVE, ""Personal"")']"
1941	Das LOC ist ein Haus mit Tradition (seit 1765) und damit für jeden Dresden-Besucher ein absolutes Muss.	['(GENERAL-IMPRESSION, POSITIVE)']	"['(GENERAL-IMPRESSION, POSITIVE, ""LOC"")']"
1944	Tiho, der Beste, hat uns bedient, super freundlich, zuvorkommend und hat uns jeden Wunsch von den Augen abgelesen.	['(SERVICE, POSITIVE)']	"['(SERVICE, POSITIVE, ""Tiho"")']"
1952	Lange drauf gefreut, sehr enttäuscht.	['(GENERAL-IMPRESSION, NEGATIVE)']	"['(GENERAL-IMPRESSION, NEGATIVE, ""NULL"")']"
1957	Die beiden Kellner haben aber auch nach 50 Minuten keine Bestellung aufgenommen, obwohl die Tische neben uns bedient wurden.	['(SERVICE, NEGATIVE)']	"['(SERVICE, NEGATIVE, ""Kellner"")']"
1958	Meinen Vorrednern kann ich mich dahingehend anschließen, dass die bayerische Küche gut und das Augustiner -Bier sehr gepflegt ist.	['(FOOD, POSITIVE)', '(FOOD, POSITIVE)']	"['(FOOD, POSITIVE, ""Küche"")', '(FOOD, POSITIVE, ""Augustiner -Bier"")']"
1964	Dementsprechend voll ist es.	['(AMBIENCE, NEGATIVE)']	"['(AMBIENCE, NEGATIVE, ""NULL"")']"
1973	Kleines Lokal mit unglaublich guter Küche !	['(FOOD, POSITIVE)']	"['(FOOD, POSITIVE, ""Küche"")']"
1974	Wer sich bestrafen möchten bestellt ein Steak Tartare.	['(FOOD, NEGATIVE)']	"['(FOOD, NEGATIVE, ""Steak Tartare"")']"
1978	Wir kommen gerne wieder!	['(GENERAL-IMPRESSION, POSITIVE)']	"['(GENERAL-IMPRESSION, POSITIVE, ""NULL"")']"
1983	Das Essen war lecker, auch die Bedienung hat uns sehr freundlich bedient.	['(FOOD, POSITIVE)', '(SERVICE, POSITIVE)']	"['(FOOD, POSITIVE, ""Essen"")', '(SERVICE, POSITIVE, ""Bedienung"")']"
1984	Das Tischbuffet wird immer nach Wunsch zubereitet und schmeckt wunderbar.	['(FOOD, POSITIVE)']	"['(FOOD, POSITIVE, ""Tischbuffet"")']"
2010	Enttäuschend war für uns alle die Essensqualität.	['(FOOD, NEGATIVE)']	"['(FOOD, NEGATIVE, ""NULL"")']"
2015	Auf diesen recht lieblos angerichteten - und gerade so : essbaren Burger mussten wir über eine Stunde (!!!)	['(SERVICE, NEGATIVE)', '(FOOD, NEGATIVE)']	"['(SERVICE, NEGATIVE, ""NULL"")', '(FOOD, NEGATIVE, ""Burger"")']"
2021	Wenn man in der Nähe ist, kann man hier gut hingehen.	['(GENERAL-IMPRESSION, POSITIVE)']	"['(GENERAL-IMPRESSION, POSITIVE, ""NULL"")']"
2022	Essen lecker, (vielleicht ein klein wenig zu lange gebraucht), Bedienungen freundlich und sauber!	['(FOOD, POSITIVE)', '(SERVICE, POSITIVE)', '(SERVICE, NEGATIVE)']	"['(FOOD, POSITIVE, ""Essen"")', '(SERVICE, POSITIVE, ""Bedienungen"")', '(SERVICE, NEGATIVE, ""NULL"")']"
2024	Vielen lieben Dank, die deutsche Küche in der Form aufzutischen.	['(FOOD, POSITIVE)']	"['(FOOD, POSITIVE, ""Küche"")']"
2027	Übel in der Optik und dem faden Geschmack.	['(FOOD, NEGATIVE)']	"['(FOOD, NEGATIVE, ""NULL"")']"
2028	Stühle etwas unbequem, aber mit Jacke drunter ging auch das.	['(AMBIENCE, NEGATIVE)']	"['(AMBIENCE, NEGATIVE, ""Stühle"")']"
2036	Leider waren wir dieses Mal mit den Speisen nicht zufrieden.	['(FOOD, NEGATIVE)']	"['(FOOD, NEGATIVE, ""Speisen"")']"
2039	Freundliche und flotte Bedienung - das war prima wobei kaum Gäste da waren.	['(SERVICE, POSITIVE)']	"['(SERVICE, POSITIVE, ""Bedienung"")']"
2042	Der Chef konnte nicht gefunden werden.	['(SERVICE, NEGATIVE)']	"['(SERVICE, NEGATIVE, ""Chef"")']"
2051	Über eine Stunde aufs Essen warten, und dann ist bei allen Gerichten mit Salat/Gemüse einiges an Sand im Essen.	['(FOOD, NEGATIVE)', '(SERVICE, NEGATIVE)']	"['(FOOD, NEGATIVE, ""Gerichten mit Salat/Gemüse"")', '(SERVICE, NEGATIVE, ""NULL"")']"
2058	das spätere essen (Pizza) war wirklich gut, aber so viel Zeit während der Woche haben wir nicht und werden deshalb auch nicht wieder kommen.	['(FOOD, POSITIVE)']	"['(FOOD, POSITIVE, ""essen (Pizza)"")']"
2066	Die LOC hat gut geklappt und ist am Wochenende auch zu empfehlen.	['(GENERAL-IMPRESSION, POSITIVE)']	"['(GENERAL-IMPRESSION, POSITIVE, ""NULL"")']"
2070	Für das Ambiente 4 von 5 Sternen- man kann nichts aussetzten, ist halt Geschmackssache.	['(AMBIENCE, POSITIVE)']	"['(AMBIENCE, POSITIVE, ""Ambiente"")']"
2081	Großartige Gerichte, kreiert mit besten Produkten, auch aus der Region; delikat, gradlinig, auf hohem Niveau.	['(FOOD, POSITIVE)', '(FOOD, POSITIVE)']	"['(FOOD, POSITIVE, ""Gerichte"")', '(FOOD, POSITIVE, ""Produkten"")']"
2086	Sehr hübsches bodenständigies Lokal.	['(GENERAL-IMPRESSION, POSITIVE)', '(AMBIENCE, POSITIVE)']	"['(GENERAL-IMPRESSION, POSITIVE, ""Lokal"")', '(AMBIENCE, POSITIVE, ""Lokal"")']"
2093	Auch die Lage ist wie in „ bella Italia“.	['(AMBIENCE, POSITIVE)']	"['(AMBIENCE, POSITIVE, ""Lage"")']"
2098	Leere Getränke wurden nicht abgeräumt, dazugekommene Personen wurden nicht nach Getränken gefragt und generell wirkte es eher so als wäre jede Frage zu viel und die Gäste eher störend.	['(SERVICE, NEGATIVE)']	"['(SERVICE, NEGATIVE, ""NULL"")']"
2103	Eventuell ok wenn man nur etwas trinken möchte für ein Essen mit Freunden nicht zu empfehlen.	['(FOOD, NEGATIVE)', '(FOOD, NEUTRAL)']	"['(FOOD, NEGATIVE, ""Essen"")', '(FOOD, NEUTRAL, ""NULL"")']"
2105	Das Essen ist ebenfalls gut.	['(FOOD, POSITIVE)']	"['(FOOD, POSITIVE, ""Essen"")']"
2117	Kommen sehr gerne wieder!	['(GENERAL-IMPRESSION, POSITIVE)']	"['(GENERAL-IMPRESSION, POSITIVE, ""NULL"")']"
2129	Da kann auch der Service für unsere 50-köpfige Truppe noch so verbesserungswürdig sein ...	['(SERVICE, NEGATIVE)']	"['(SERVICE, NEGATIVE, ""Service"")']"
2133	Am Eingang ist niemand der einem die Abrechnungskarze übergibt, Warten !	['(SERVICE, NEGATIVE)']	"['(SERVICE, NEGATIVE, ""NULL"")']"
2138	Schade!	['(GENERAL-IMPRESSION, NEGATIVE)']	"['(GENERAL-IMPRESSION, NEGATIVE, ""NULL"")']"
2141	Der Fisch war sehr durch, welches vom Kellner ohne Reaktion registriert wurde!	['(SERVICE, NEGATIVE)', '(SERVICE, NEGATIVE)']	"['(SERVICE, NEGATIVE, ""Fisch"")', '(SERVICE, NEGATIVE, ""Kellner"")']"
2143	Meine zuvor angesprochenen Allergien waren wohl nicht weiter von Interesse, entsprechendes Gemüse fand sich trotzdem in meinem Gericht.	['(FOOD, NEGATIVE)', '(SERVICE, NEGATIVE)']	"['(FOOD, NEGATIVE, ""Gericht"")', '(SERVICE, NEGATIVE, ""NULL"")']"
2151	Wir werden nie wieder eine Filiale dieser Gastronomie Kette mit solch asozialem Personal besuchen!	['(GENERAL-IMPRESSION, NEGATIVE)', '(SERVICE, NEGATIVE)']	"['(GENERAL-IMPRESSION, NEGATIVE, ""Gastronomie Kette"")', '(SERVICE, NEGATIVE, ""Personal"")']"
2153	Vielen Dank an das Team der RESTAURANT_NAME :)	['(SERVICE, POSITIVE)']	"['(SERVICE, POSITIVE, ""Team"")']"
3	Wie kann ein Betrieb der uns immer gut gefallen hat, so schnell 3 klassig werden.	['(GENERAL-IMPRESSION, NEGATIVE)']	"['(GENERAL-IMPRESSION, NEGATIVE, ""Betrieb"")']"
13	Im Vergleich zum Personal im Schlüssel und LOC bleibt das Uerige aber doch zurück.	['(GENERAL-IMPRESSION, NEGATIVE)']	"['(GENERAL-IMPRESSION, NEGATIVE, ""Uerige"")']"
14	Immer gerne wieder!	['(GENERAL-IMPRESSION, POSITIVE)']	"['(GENERAL-IMPRESSION, POSITIVE, ""NULL"")']"
15	Bei den Preisen kann man mehr erwarten.	['(PRICE, NEGATIVE)']	"['(PRICE, NEGATIVE, ""Preisen"")']"
22	Speise- und Getränkekarten waren heute Mangelware.	['(SERVICE, NEGATIVE)']	"['(SERVICE, NEGATIVE, ""Speise- und Getränkekarten"")']"
23	Sehr freundlich, auch zu unserem Hund.	['(SERVICE, POSITIVE)']	"['(SERVICE, POSITIVE, ""freundlich"")']"
28	Der Service ist gut… man fühlt sich gut betreut.	['(SERVICE, POSITIVE)']	"['(SERVICE, POSITIVE, ""Service"")']"
31	Super essen deliziös, gute Atmosphäre, freundliche Bedienung, gute Erreichbarkeit und Parkmöglichkeit	['(FOOD, POSITIVE)', '(AMBIENCE, POSITIVE)', '(SERVICE, POSITIVE)', '(AMBIENCE, POSITIVE)', '(AMBIENCE, POSITIVE)']	"['(FOOD, POSITIVE, ""essen"")', '(AMBIENCE, POSITIVE, ""Atmosphäre"")', '(SERVICE, POSITIVE, ""Bedienung"")', '(AMBIENCE, POSITIVE, ""Erreichbarkeit"")', '(AMBIENCE, POSITIVE, ""Parkmöglichkeit"")']"
32	Als die Hauptspeisen kamen waren wir voll zufrieden, die Steaks waren auf den Punkt gebraten und die Beilagen schmackhaft und völlig ausreichend.	['(FOOD, POSITIVE)', '(FOOD, POSITIVE)']	"['(FOOD, POSITIVE, ""Steaks"")', '(FOOD, POSITIVE, ""Beilagen"")']"
35	Über eine Stunde wurde nicht nachgefragt ob wir noch etwas wünschen... Erst auf Reklamation wurde sich um uns gekümmert.	['(SERVICE, NEGATIVE)']	"['(SERVICE, NEGATIVE, ""NULL"")']"
38	Es passte ins Bild, dass uns beim Verlassen, nachdem ich eine deutlich dreistellige Rechnung beglichen hatte, verwehrt wurde, noch ein Törtchen für zu Hause zu kaufen.	['(SERVICE, NEGATIVE)']	"['(SERVICE, NEGATIVE, ""NULL"")']"
39	alles in einem einfach für jeden und immer wieder gern zu empfehlen!!!!	['(GENERAL-IMPRESSION, POSITIVE)']	"['(GENERAL-IMPRESSION, POSITIVE, ""NULL"")']"
42	Wir kommen wieder!	['(GENERAL-IMPRESSION, POSITIVE)']	"['(GENERAL-IMPRESSION, POSITIVE, ""NULL"")']"
43	War ein sehr gemütlicher Abend.	['(AMBIENCE, POSITIVE)']	"['(AMBIENCE, POSITIVE, ""NULL"")']"
50	Genau am Martinstag haben wir hier zum zweiten Mal (nach 2021) Gans gegessen - ein riesiger Unterschied: geradezu winzige Portionen und ungeschultes Personal, dafür aber gesalzene Preise [2021 ca.	['(FOOD, NEGATIVE)', '(SERVICE, NEGATIVE)', '(PRICE, NEGATIVE)']	"['(FOOD, NEGATIVE, ""Portionen"")', '(SERVICE, NEGATIVE, ""Personal"")', '(PRICE, NEGATIVE, ""Preise"")']"
52	"Die Bestuhlung ist recht eng - und ein Zitat kommt zum Tragen: ""und man merkt die Absicht - und man ist verstimmt"" ...."	['(AMBIENCE, NEGATIVE)']	"['(AMBIENCE, NEGATIVE, ""Bestuhlung"")']"
54	Feine und gehobene Gerichte aus Süditalien, LOC vor allem.	['(FOOD, POSITIVE)']	"['(FOOD, POSITIVE, ""Gerichte"")']"
64	LOC, hochwertig eingerichtetes Restaurant in dem auch Montagabend dringt durch die LOC direkt am LOC was los ist.	['(AMBIENCE, POSITIVE)']	"['(AMBIENCE, POSITIVE, ""Restaurant"")']"
82	Wir kamen für einen angenehmen Abend, wurden aber an der Tür in die Hölle geführt.	['(GENERAL-IMPRESSION, NEGATIVE)']	"['(GENERAL-IMPRESSION, NEGATIVE, ""NULL"")']"
96	Freundliche Bedienung.	['(SERVICE, POSITIVE)']	"['(SERVICE, POSITIVE, ""Bedienung"")']"
110	Das Essen war, wie nicht anders zu erwarten, wieder ein Gedicht.	['(FOOD, POSITIVE)']	"['(FOOD, POSITIVE, ""Essen"")']"
113	Wir kommen immer wieder gern zu Euch, weil wir bei euch einen Tag Urlaub in LOC erleben.	['(GENERAL-IMPRESSION, POSITIVE)']	"['(GENERAL-IMPRESSION, POSITIVE, ""NULL"")']"
116	Tolles Ambiente, Blick in die offene Küche, für die wärmeren Jahreszeiten gibt es auch eine Möglichkeit draußen zu sitzen.	['(AMBIENCE, POSITIVE)']	"['(AMBIENCE, POSITIVE, ""Ambiente"")']"
126	Das Preisniveau der Hauptspeisen bewegt sich zumeist bei über 30 Euro, Und ein Pils muss ebensowenig 8 Euro kosten wie ein Grappa 10,00!	['(PRICE, NEGATIVE)', '(PRICE, NEGATIVE)']	"['(PRICE, NEGATIVE, ""Pils"")', '(PRICE, NEGATIVE, ""Grappa"")']"
127	Aber er schmeckte dann doch.	['(FOOD, POSITIVE)']	"['(FOOD, POSITIVE, ""NULL"")']"
129	Insgesamt ein alteingesessenes Lokal das man empfehlen kann.	['(GENERAL-IMPRESSION, POSITIVE)']	"['(GENERAL-IMPRESSION, POSITIVE, ""Lokal"")']"
134	Darauf wurde er unter dem Kopfschütteln der Umstehenden verbal noch aggressiver.	['(SERVICE, NEGATIVE)']	"['(SERVICE, NEGATIVE, ""NULL"")']"
135	Wir kommen gerne wieder.	['(GENERAL-IMPRESSION, POSITIVE)']	"['(GENERAL-IMPRESSION, POSITIVE, ""NULL"")']"
144	Muscheln als Vorspeise fantastisch.	['(FOOD, POSITIVE)']	"['(FOOD, POSITIVE, ""Muscheln"")']"
147	Abwechslungsreich und köstlich zubereitet.	['(FOOD, POSITIVE)']	"['(FOOD, POSITIVE, ""NULL"")']"
149	Ich war mit meiner Freundin da & wir hatten einen sehr schönen und kulinarisch ansprechenden Abend.	['(FOOD, POSITIVE)', '(GENERAL-IMPRESSION, POSITIVE)']	"['(FOOD, POSITIVE, ""NULL"")', '(GENERAL-IMPRESSION, POSITIVE, ""NULL"")']"
170	Vom Ambiente her natürlich toll, RESTAURANT_NAME eben, alles sehr sauber...aber der Empfang war mehr als unfreundlich, der Kellner am Tisch dafür wieder sehr aber nachdem wir von zwei servicekräften sehr unfreundlich begrüßt wurden wären wir fast wieder gegangen, essen war dann leider auch nicht toll, die Burger,waren sehr trocken, würden nicht nochmal wieder kommen...leider	['(AMBIENCE, POSITIVE)', '(SERVICE, NEGATIVE)', '(AMBIENCE, POSITIVE)', '(SERVICE, NEGATIVE)', '(FOOD, NEGATIVE)', '(FOOD, NEGATIVE)', '(GENERAL-IMPRESSION, NEGATIVE)']	"['(AMBIENCE, POSITIVE, ""Ambiente"")', '(SERVICE, NEGATIVE, ""Empfang"")', '(AMBIENCE, POSITIVE, ""NULL"")', '(SERVICE, NEGATIVE, ""servicekräften"")', '(FOOD, NEGATIVE, ""essen"")', '(FOOD, NEGATIVE, ""Burger"")', '(GENERAL-IMPRESSION, NEGATIVE, ""NULL"")']"
183	Alle Gerichte waren sehr lecker, die Portionen groß.	['(FOOD, POSITIVE)']	"['(FOOD, POSITIVE, ""Gerichte"")']"
186	Das Essen ist mega.	['(FOOD, POSITIVE)']	"['(FOOD, POSITIVE, ""Essen"")']"
200	Es gibt wirklich deutlich bessere thailändische Küche in LOC.	['(GENERAL-IMPRESSION, NEGATIVE)']	"['(GENERAL-IMPRESSION, NEGATIVE, ""NULL"")']"
212	Alles in allem ein schöner Sonntagabend.	['(GENERAL-IMPRESSION, POSITIVE)']	"['(GENERAL-IMPRESSION, POSITIVE, ""NULL"")']"
218	auf das Essen warten müssen, weil der Laden so voll ist.	['(SERVICE, NEGATIVE)']	"['(SERVICE, NEGATIVE, ""NULL"")']"
221	Den Empfang und den Service würde ich als „unterkühlt“ bezeichnen, nicht schlimm, aber auch nicht herzlich.	['(SERVICE, NEGATIVE)', '(SERVICE, NEGATIVE)']	"['(SERVICE, NEGATIVE, ""Empfang"")', '(SERVICE, NEGATIVE, ""Service"")']"
236	Feines Essen, nette Bedienung.	['(FOOD, POSITIVE)', '(SERVICE, POSITIVE)']	"['(FOOD, POSITIVE, ""Essen"")', '(SERVICE, POSITIVE, ""Bedienung"")']"
237	Das war der letzte Besuch!	['(GENERAL-IMPRESSION, NEGATIVE)']	"['(GENERAL-IMPRESSION, NEGATIVE, ""NULL"")']"
244	Es ist nicht in Ordnung in so einem historischen Ort und unzulässig gegenüber den Gästen!	['(SERVICE, NEGATIVE)']	"['(SERVICE, NEGATIVE, ""NULL"")']"
246	Furztrocken.	['(FOOD, NEGATIVE)']	"['(FOOD, NEGATIVE, ""NULL"")']"
247	Das brauchen wir nicht wieder.	['(GENERAL-IMPRESSION, NEGATIVE)']	"['(GENERAL-IMPRESSION, NEGATIVE, ""NULL"")']"
248	Die Speisen waren ausreichend, das Salatbuffet gut.	['(FOOD, NEUTRAL)', '(FOOD, POSITIVE)']	"['(FOOD, NEUTRAL, ""Speisen"")', '(FOOD, POSITIVE, ""Salatbuffet"")']"
250	Dario war ein super Kellner und hat den Abend zu einer sehr schönen Erinnerung gemacht.	['(SERVICE, POSITIVE)', '(GENERAL-IMPRESSION, POSITIVE)']	"['(SERVICE, POSITIVE, ""Dario"")', '(GENERAL-IMPRESSION, POSITIVE, ""NULL"")']"
251	Als mein Mann freundlich nachhakte, wurden wir lautstark und aggressiv zurecht gewiesen, dass es das Gleiche sei!!	['(SERVICE, NEGATIVE)']	"['(SERVICE, NEGATIVE, ""NULL"")']"
259	Da tut es ein Fischbrötchen um die Ecke auch.	['(FOOD, NEGATIVE)']	"['(FOOD, NEGATIVE, ""NULL"")']"
268	Das Essen kommt im Minutentakt und ist gerade noch mittelmäßig.	['(FOOD, NEUTRAL)']	"['(FOOD, NEUTRAL, ""Essen"")']"
272	LOC mir wenig Atmosphäre und sehr viel Gewusel.	['(AMBIENCE, NEGATIVE)', '(AMBIENCE, NEGATIVE)']	"['(AMBIENCE, NEGATIVE, ""Atmosphäre"")', '(AMBIENCE, NEGATIVE, ""Gewusel"")']"
273	LOC durchschnittlich.	['(GENERAL-IMPRESSION, NEUTRAL)']	"['(GENERAL-IMPRESSION, NEUTRAL, ""LOC"")']"
275	Beide Optionen einfach unglaublich lecker.	['(FOOD, POSITIVE)']	"['(FOOD, POSITIVE, ""Optionen"")']"
278	Wir wurden am Eingang richtig freundlich in Empfang genommen.	['(AMBIENCE, POSITIVE)']	"['(AMBIENCE, POSITIVE, ""Empfang"")']"
284	Jetzt werde wir nicht mehr hingehen.	['(GENERAL-IMPRESSION, NEGATIVE)']	"['(GENERAL-IMPRESSION, NEGATIVE, ""NULL"")']"
291	Obwohl wir rechtzeitig und lange genug vorher reserviert haben, war kein Platz im LOC für uns reserviert.	['(SERVICE, NEGATIVE)']	"['(SERVICE, NEGATIVE, ""NULL"")']"
306	Auf gehobenem Niveau waren jedoch die Preise.	['(FOOD, NEGATIVE)']	"['(FOOD, NEGATIVE, ""Preise"")']"
309	Ein stolzer Preis sollte sich mit einem Stolzen Essen decken!	['(PRICE, NEGATIVE)', '(FOOD, POSITIVE)']	"['(PRICE, NEGATIVE, ""Preis"")', '(FOOD, POSITIVE, ""Essen"")']"
312	Optisch ein sehr schönes Lokal.	['(AMBIENCE, POSITIVE)']	"['(AMBIENCE, POSITIVE, ""Lokal"")']"
318	Sehr freundlich und professionell, seine Empfehlungen für Essen und Wein waren top!	['(SERVICE, POSITIVE)', '(FOOD, POSITIVE)', '(FOOD, POSITIVE)']	"['(SERVICE, POSITIVE, ""NULL"")', '(FOOD, POSITIVE, ""Essen"")', '(FOOD, POSITIVE, ""Wein"")']"
319	Eine innovative Küche eines engagierten Kochs, wobei man es mögen muss, dass in JEDEM Gang deutliche Fruchtnoten zumindest im Hintergrund, wenn nicht im Vordergrund stehen.	['(FOOD, POSITIVE)', '(SERVICE, POSITIVE)']	"['(FOOD, POSITIVE, ""Küche"")', '(SERVICE, POSITIVE, ""Kochs"")']"
