id	text	labels	labels_phrases
2	Der Burger total durchgebraten und trocken.	['(FOOD, NEGATIVE)']	"['(FOOD, NEGATIVE, ""Burger"")']"
6	Der Kellner läuft planlos durch die Gegend und wirkt überfordert.	['(SERVICE, NEGATIVE)']	"['(SERVICE, NEGATIVE, ""Kellner"")']"
9	Für das Essen 5 von 5 Sternen- war lecker und reichlich, Preislich etwas angehoben.	['(FOOD, POSITIVE)', '(PRICE, NEGATIVE)']	"['(FOOD, POSITIVE, ""Essen"")', '(PRICE, NEGATIVE, ""NULL"")']"
34	Mein Rollo war so ungewürzt … unsere Freunde ließen eine Pfannen-Spezialität des Hauses nach der Hälfte stehen (sonst sei dieses Gericht wirklich gut).	['(FOOD, NEGATIVE)', '(FOOD, NEGATIVE)']	"['(FOOD, NEGATIVE, ""Rollo"")', '(FOOD, NEGATIVE, ""Pfannen-Spezialität"")']"
40	Das LOC ist sehr zu empfehlen und war perfekt Medium Rare.	['(FOOD, POSITIVE)']	"['(FOOD, POSITIVE, ""LOC"")']"
59	Die Platte mit Sushi hervorragend!	['(FOOD, POSITIVE)']	"['(FOOD, POSITIVE, ""Platte mit Sushi"")']"
66	Wir waren angenehm davon überrascht, was uns geboten wurde.	['(GENERAL-IMPRESSION, POSITIVE)']	"['(GENERAL-IMPRESSION, POSITIVE, ""NULL"")']"
75	Der sehr forsche, eher unfreundliche Service rundet das Erlebnis nach unten ab.	['(SERVICE, NEGATIVE)', '(GENERAL-IMPRESSION, NEGATIVE)']	"['(SERVICE, NEGATIVE, ""Service"")', '(GENERAL-IMPRESSION, NEGATIVE, ""NULL"")']"
76	Ansonsten will ich zugute halten, dass eure Preise im Vergleich zu anderen Lokalen wirklich stabil geblieben sind.	['(PRICE, POSITIVE)']	"['(PRICE, POSITIVE, ""Preise"")']"
81	Wir waren an 2 Abende in dieser netten Location und haben mitnetten Freunden ein hervorragendes Menü gegessen.	['(FOOD, POSITIVE)', '(AMBIENCE, POSITIVE)']	"['(FOOD, POSITIVE, ""Menü"")', '(AMBIENCE, POSITIVE, ""Location"")']"
85	Uns hat es allen bestens geschmeckt.	['(FOOD, POSITIVE)']	"['(FOOD, POSITIVE, ""NULL"")']"
88	Das Kartoffelgratin war ebenfalls von trockener Konsistenz.	['(FOOD, NEGATIVE)']	"['(FOOD, NEGATIVE, ""Kartoffelgratin"")']"
90	An der LOC muss noch gefeilt werden, aber alles andere war sehr lecker.	['(FOOD, POSITIVE)', '(AMBIENCE, NEGATIVE)']	"['(FOOD, POSITIVE, ""NULL"")', '(AMBIENCE, NEGATIVE, ""LOC"")']"
92	Ich hatte am 10.07.2023 meinen Geburtstag in der RESTAURANT_NAME gefeiert, die Kellner waren sehr aufmerksam und das Essen ein Traum, ich kann es nur weiterempfehlen.	['(SERVICE, POSITIVE)', '(FOOD, POSITIVE)', '(GENERAL-IMPRESSION, POSITIVE)']	"['(SERVICE, POSITIVE, ""Kellner"")', '(FOOD, POSITIVE, ""Essen"")', '(GENERAL-IMPRESSION, POSITIVE, ""NULL"")']"
99	Aus Spaß habe ich auch einmal in den großen Speisesaal geschaut, in welchem schon ein relativ hoher Lärmpegel herrscht.	['(AMBIENCE, NEGATIVE)', '(AMBIENCE, NEGATIVE)']	"['(AMBIENCE, NEGATIVE, ""Lärmpegel"")', '(AMBIENCE, NEGATIVE, ""Speisesaal"")']"
104	Der Kellner war unfreundlich, langsam und hat uns auch einmal angebrüllt weil wir mehr Alt wollten.	['(SERVICE, NEGATIVE)']	"['(SERVICE, NEGATIVE, ""Kellner"")']"
107	Die Bedienung ist ne Perle (danke, Desiree), das Essen war erstklassig, lecker und reichlich, war ein toller früher Silvesterabend.	['(SERVICE, POSITIVE)', '(FOOD, POSITIVE)']	"['(SERVICE, POSITIVE, ""Bedienung"")', '(FOOD, POSITIVE, ""Essen"")']"
111	Ein sehr freundlicher Service, Essen qualitativ ausgezeichnet!	['(SERVICE, POSITIVE)', '(FOOD, POSITIVE)']	"['(SERVICE, POSITIVE, ""Service"")', '(FOOD, POSITIVE, ""Essen"")']"
114	Totaler Massenbetrieb, macht kein Spass zwischen LOC gesehen dabei zu sein.	['(GENERAL-IMPRESSION, NEGATIVE)']	"['(GENERAL-IMPRESSION, NEGATIVE, ""NULL"")']"
124	Portion direkt bestellt) mit leckeren Knödel.	['(FOOD, POSITIVE)']	"['(FOOD, POSITIVE, ""Knödel"")']"
125	Suppe lauwarm/ wurde aber aufgewärmt war dann gut und lecker.	['(FOOD, POSITIVE)']	"['(FOOD, POSITIVE, ""Suppe"")']"
131	Das Essen und der Service war ausgesprochen gut.	['(FOOD, POSITIVE)', '(SERVICE, POSITIVE)']	"['(FOOD, POSITIVE, ""Essen"")', '(SERVICE, POSITIVE, ""Service"")']"
132	Unsere Reservierung wurde verplant.	['(SERVICE, NEGATIVE)']	"['(SERVICE, NEGATIVE, ""Reservierung"")']"
141	Das Personal war sehr freundlich.	['(SERVICE, POSITIVE)']	"['(SERVICE, POSITIVE, ""Personal"")']"
154	Absolut schlechte Küche!	['(FOOD, NEGATIVE)']	"['(FOOD, NEGATIVE, ""Küche"")']"
159	Gut es war ziemlich voll und somit war alles etwas gestresst, aber unser Kellner war höflich und bemüht.	['(AMBIENCE, NEGATIVE)', '(SERVICE, POSITIVE)']	"['(AMBIENCE, NEGATIVE, ""NULL"")', '(SERVICE, POSITIVE, ""Kellner"")']"
163	Schade!	['(GENERAL-IMPRESSION, NEGATIVE)']	"['(GENERAL-IMPRESSION, NEGATIVE, ""NULL"")']"
175	Wir waren heute zum zweiten Mal da, das erste Mal war wirklich traumhaft.	['(GENERAL-IMPRESSION, POSITIVE)']	"['(GENERAL-IMPRESSION, POSITIVE, ""NULL"")']"
178	Das Ambiente war dementsprechend durchschnittlich und die Umgebungsgeräusche sehr laut.	['(AMBIENCE, NEUTRAL)', '(AMBIENCE, NEGATIVE)']	"['(AMBIENCE, NEUTRAL, ""Ambiente"")', '(AMBIENCE, NEGATIVE, ""Umgebungsgeräusche"")']"
180	Man bekommt nicht mal das Essen was bestellt wurde.	['(SERVICE, NEGATIVE)']	"['(SERVICE, NEGATIVE, ""NULL"")']"
201	Neben den langen Wartezeiten, bekamen wir ein Trinkglas mit Sprung, was wir frühzeitig genug bemerkten.	['(SERVICE, NEGATIVE)']	"['(SERVICE, NEGATIVE, ""Wartezeiten"")']"
204	"Auf Nachfrage war vom ersten Kellner die Antwort ""Das muss so sein"", der 2te wenigstens in die Küche und ja man würde das Ausbessern intern, der 2 Sterne Koche in der küche aber ja wisse was er tut (Wenn das wahr wäre, kenne ich Hinterhofköche die keine verbrannten Produkte raus schicken, heiß servieren oder in Jus ersäufen)."	['(FOOD, NEGATIVE)']	"['(FOOD, NEGATIVE, ""Produkte"")']"
214	Die Gamba waren kalt und kaum aus der Schale zu lösen.	['(FOOD, NEGATIVE)']	"['(FOOD, NEGATIVE, ""Gamba"")']"
222	Wir sind ganz zufällig dort gelandet und waren begeistert.	['(GENERAL-IMPRESSION, POSITIVE)']	"['(GENERAL-IMPRESSION, POSITIVE, ""NULL"")']"
224	Das ist für so ein Restaurant ein Unding.	['(GENERAL-IMPRESSION, NEGATIVE)']	"['(GENERAL-IMPRESSION, NEGATIVE, ""Restaurant"")']"
234	Hier waren wir nach einem Konzert in der LOC und es hat uns sehr gut gefallen.	['(GENERAL-IMPRESSION, POSITIVE)']	"['(GENERAL-IMPRESSION, POSITIVE, ""LOC"")']"
256	So einen schlechten Service hatten wir noch nicht erlebt.	['(SERVICE, NEGATIVE)']	"['(SERVICE, NEGATIVE, ""Service"")']"
277	!Einziger Abzug: Sauberkeit der Toiletten…	['(AMBIENCE, NEGATIVE)']	"['(AMBIENCE, NEGATIVE, ""Sauberkeit der Toiletten"")']"
279	Die Haxe war trocken und faserig, die Kruste hätte man mit dem Presslufthammer bearbeiten müssen, um sie zu zerteilen.	['(FOOD, NEGATIVE)']	"['(FOOD, NEGATIVE, ""Haxe"")']"
285	Der Service ist ok, man kennt die Gerichte und wird gut beraten.	['(SERVICE, NEUTRAL)', '(SERVICE, POSITIVE)']	"['(SERVICE, NEUTRAL, ""Service"")', '(SERVICE, POSITIVE, ""NULL"")']"
290	Sensationelle Aussicht, schönes Ambiente, nettes Personal.	['(SERVICE, POSITIVE)', '(AMBIENCE, POSITIVE)', '(AMBIENCE, POSITIVE)']	"['(SERVICE, POSITIVE, ""Personal"")', '(AMBIENCE, POSITIVE, ""Ambiente"")', '(AMBIENCE, POSITIVE, ""Aussicht"")']"
297	Klassische Gerichte modern angerichtet.	['(FOOD, POSITIVE)']	"['(FOOD, POSITIVE, ""Gerichte"")']"
303	Als wir bezahleenn wollten, war sie auch wieder nicht auffindbar, dann bekamen wir endlich die Rechnung und sie war wieder weg, bis wir dann endlich bezahlen konnten.	['(SERVICE, NEGATIVE)']	"['(SERVICE, NEGATIVE, ""NULL"")']"
304	Sehr sehr gut die Vorspeise „Gefüllte Riesenchampignons“!	['(FOOD, POSITIVE)']	"['(FOOD, POSITIVE, ""Gefüllte Riesenchampignons"")']"
308	Salate waren ok, mehr auch nicht.	['(FOOD, NEUTRAL)']	"['(FOOD, NEUTRAL, ""Salate"")']"
327	Wir haben über eine Stunde auf unser Essen warten müssen.	['(SERVICE, NEGATIVE)']	"['(SERVICE, NEGATIVE, ""NULL"")']"
333	War nichts.	['(GENERAL-IMPRESSION, NEGATIVE)']	"['(GENERAL-IMPRESSION, NEGATIVE, ""NULL"")']"
334	Insgesamt eher unterer Durchschnitt bei den örtlichen LOC.	['(GENERAL-IMPRESSION, NEGATIVE)']	"['(GENERAL-IMPRESSION, NEGATIVE, ""NULL"")']"
335	Der Lachs war gut, auf den Punkt gegrillt, daran gab es nicht auszusetzen!	['(FOOD, POSITIVE)']	"['(FOOD, POSITIVE, ""Lachs"")']"
343	Gute Qualität der Speisen und der Empfehlungen.	['(FOOD, POSITIVE)']	"['(FOOD, POSITIVE, ""Speisen"")']"
344	Als Hauptgericht war haben ein Steinbutt bestellt aber der Fish der serviert wurde hatte vielleicht mal ein Steinbutt von weitem gesehen.	['(FOOD, NEGATIVE)']	"['(FOOD, NEGATIVE, ""Fish"")']"
351	"Die ""Getrüffelte Kürbissuppe"" bestand darin, dass man statt dem üblichen LOC Kürbiskernöl einfach nur getrüffeltes Öl auf die Suppe geträufelt hatte."	['(FOOD, NEGATIVE)', '(FOOD, NEGATIVE)']	"['(FOOD, NEGATIVE, ""Getrüffelte Kürbissuppe"")', '(FOOD, NEGATIVE, ""getrüffeltes Öl"")']"
352	Die positiven Bewertungen überraschen,wir werden wahrscheinlich nie wieder hingehen.	['(GENERAL-IMPRESSION, NEGATIVE)']	"['(GENERAL-IMPRESSION, NEGATIVE, ""NULL"")']"
381	Wir waren hier essen und mit der Qualität des Essens wirklich super zufrieden.	['(FOOD, POSITIVE)']	"['(FOOD, POSITIVE, ""Essens"")']"
383	Wir haben mehrmalls die Bedienung um Bestellung gebitten, Allerdings haben diese nicht einmal reagiert.	['(SERVICE, NEGATIVE)']	"['(SERVICE, NEGATIVE, ""Bedienung"")']"
388	Bedienung sehr freundlich und flink, Ambiente sehr münchnerisch, gemütlich mit schönem Blick auf den LOC.	['(SERVICE, POSITIVE)', '(AMBIENCE, POSITIVE)', '(AMBIENCE, POSITIVE)']	"['(SERVICE, POSITIVE, ""Bedienung"")', '(AMBIENCE, POSITIVE, ""Ambiente"")', '(AMBIENCE, POSITIVE, ""Blick auf den LOC"")']"
390	Die Qualität hat nachgelassen.	['(GENERAL-IMPRESSION, NEGATIVE)']	"['(GENERAL-IMPRESSION, NEGATIVE, ""NULL"")']"
400	Wir fühlten uns sehr gestört und unwohl.	['(AMBIENCE, NEGATIVE)']	"['(AMBIENCE, NEGATIVE, ""NULL"")']"
405	Gerne beim nächsten Besuch in LOC wieder.	['(GENERAL-IMPRESSION, POSITIVE)']	"['(GENERAL-IMPRESSION, POSITIVE, ""NULL"")']"
416	Ein sehr gemütliches italienisches Restaurant mit Flair und fleißigem Personal.	['(AMBIENCE, POSITIVE)', '(SERVICE, POSITIVE)']	"['(AMBIENCE, POSITIVE, ""Restaurant"")', '(SERVICE, POSITIVE, ""Personal"")']"
422	Selbst unter Corona hatte das Restaurant sein Level gehalten.	['(GENERAL-IMPRESSION, POSITIVE)']	"['(GENERAL-IMPRESSION, POSITIVE, ""Restaurant"")']"
427	Tolle, urgemütliche Atmosphäre.	['(AMBIENCE, POSITIVE)']	"['(AMBIENCE, POSITIVE, ""Atmosphäre"")']"
445	Ich habe schon deutlich besser gegessen und nur die Hälfte bezahlt.	['(PRICE, NEGATIVE)', '(FOOD, NEGATIVE)']	"['(PRICE, NEGATIVE, ""NULL"")', '(FOOD, NEGATIVE, ""NULL"")']"
448	Wer in LOC unterwegs ist, der kann die DAMPFE ohne Bedenken in seine Reiseplanung einbeziehen.	['(GENERAL-IMPRESSION, POSITIVE)']	"['(GENERAL-IMPRESSION, POSITIVE, ""DAMPFE"")']"
451	Sehr nette Bedienung und super Service.	['(SERVICE, POSITIVE)', '(SERVICE, POSITIVE)']	"['(SERVICE, POSITIVE, ""Bedienung"")', '(SERVICE, POSITIVE, ""Service"")']"
455	Preis deutlich zu hoch.	['(PRICE, NEGATIVE)']	"['(PRICE, NEGATIVE, ""Preis"")']"
460	War an 3 Abenden nacheinander während eines Kongresses hier Abends zum Essen und hatte das Glück hier einzukehren.	['(GENERAL-IMPRESSION, POSITIVE)']	"['(GENERAL-IMPRESSION, POSITIVE, ""NULL"")']"
467	Leider nicht gerade die beste Lage.	['(AMBIENCE, NEGATIVE)']	"['(AMBIENCE, NEGATIVE, ""Lage"")']"
470	Das Essen und der Service ist immer ausgezeichnet.	['(FOOD, POSITIVE)', '(SERVICE, POSITIVE)']	"['(FOOD, POSITIVE, ""Essen"")', '(SERVICE, POSITIVE, ""Service"")']"
476	Wir kommen wieder!	['(GENERAL-IMPRESSION, POSITIVE)']	"['(GENERAL-IMPRESSION, POSITIVE, ""NULL"")']"
490	Allerdings mussten wir noch weitere 30 Minuten bis zur Lieferung warten.	['(SERVICE, NEGATIVE)']	"['(SERVICE, NEGATIVE, ""Lieferung"")']"
494	Fleissiger Service.	['(SERVICE, POSITIVE)']	"['(SERVICE, POSITIVE, ""Service"")']"
495	!Auch wenn die Bedienung sich dafür entschuldigt hat, war es kein schönes Erlebnis.	['(SERVICE, POSITIVE)', '(GENERAL-IMPRESSION, NEGATIVE)']	"['(SERVICE, POSITIVE, ""Bedienung"")', '(GENERAL-IMPRESSION, NEGATIVE, ""NULL"")']"
496	Ich wollte es unbedingt flambiert, weil das beim letzten Mal sooo gut roch.	['(FOOD, POSITIVE)']	"['(FOOD, POSITIVE, ""NULL"")']"
500	Wir hatten einen wundervollen Abend zu Viert und Kellner Maurizio hat uns sehr nett und aufmerksam durch den Abend geführt!	['(SERVICE, POSITIVE)', '(GENERAL-IMPRESSION, POSITIVE)']	"['(SERVICE, POSITIVE, ""Maurizio"")', '(GENERAL-IMPRESSION, POSITIVE, ""NULL"")']"
502	Da passt das unverschämte Servicepersonal ideal dazu.	['(SERVICE, NEGATIVE)']	"['(SERVICE, NEGATIVE, ""Servicepersonal"")']"
510	Ich kann das LOC nur empfehlen, wenn Sie die beste Bratwurst in der LOC genießen möchten!	['(FOOD, POSITIVE)']	"['(FOOD, POSITIVE, ""Bratwurst"")']"
512	Niemand war zuständig.	['(SERVICE, NEGATIVE)']	"['(SERVICE, NEGATIVE, ""NULL"")']"
519	Essen kam erst sehr spät und zu sehr unterschiedlichen Zeiten.	['(SERVICE, NEGATIVE)']	"['(SERVICE, NEGATIVE, ""NULL"")']"
527	Die Lage des Lokals am LOC ist perfekt, die Keller-Räumlichkeiten sind gemütlich - da kommen die Kunden sowieso, da braucht man sich wohl keine Mühe zu geben.	['(AMBIENCE, POSITIVE)', '(AMBIENCE, POSITIVE)']	"['(AMBIENCE, POSITIVE, ""Lage des Lokals"")', '(AMBIENCE, POSITIVE, ""Keller-Räumlichkeiten"")']"
541	Leider war das Personal völlig überfordert, denn wir mußten fast 25 Minuten warten, bis jemand eine Bestellung aufnehmen konnte.	['(SERVICE, NEGATIVE)']	"['(SERVICE, NEGATIVE, ""Personal"")']"
551	Von dünn und knusprig, goldbraun gebraten keine Spur.	['(FOOD, NEGATIVE)']	"['(FOOD, NEGATIVE, ""NULL"")']"
568	Schade.	['(GENERAL-IMPRESSION, NEGATIVE)']	"['(GENERAL-IMPRESSION, NEGATIVE, ""NULL"")']"
576	LOC, tolles Essen, und nette Bedienung.	['(FOOD, POSITIVE)', '(SERVICE, POSITIVE)']	"['(FOOD, POSITIVE, ""Essen"")', '(SERVICE, POSITIVE, ""Bedienung"")']"
578	Leider hat die Qualität massiv nachgelassen und der Preis 7,10€ hat sich fast verdoppelt, die haben wohl den Knall nicht gehört und denn rennen einen die Ratten am Stand fast über die Füße ,das geht gar nicht.	['(FOOD, NEGATIVE)', '(GENERAL-IMPRESSION, NEGATIVE)']	"['(FOOD, NEGATIVE, ""Preis"")', '(GENERAL-IMPRESSION, NEGATIVE, ""NULL"")']"
588	Ein toller Abend mit fantastischem Essen von großartiger Qualität -die Seezunge war ein Traum- und einem super Service!	['(FOOD, POSITIVE)', '(FOOD, POSITIVE)', '(SERVICE, POSITIVE)']	"['(FOOD, POSITIVE, ""Essen"")', '(FOOD, POSITIVE, ""Seezunge"")', '(SERVICE, POSITIVE, ""Service"")']"
590	Super leckeres Essen, schönes Ambiente in zentraler Lage, tolle getöpferte Kerzenständer und ein sehr freundlicher Service.	['(FOOD, POSITIVE)', '(AMBIENCE, POSITIVE)', '(AMBIENCE, POSITIVE)', '(SERVICE, POSITIVE)']	"['(FOOD, POSITIVE, ""Essen"")', '(AMBIENCE, POSITIVE, ""Ambiente"")', '(AMBIENCE, POSITIVE, ""Kerzenständer"")', '(SERVICE, POSITIVE, ""Service"")']"
602	Ich bin sehr enttäuscht und komme nicht wieder.	['(GENERAL-IMPRESSION, NEGATIVE)']	"['(GENERAL-IMPRESSION, NEGATIVE, ""NULL"")']"
612	Hatte ein sehniges Teil was nicht zu kauen war die anderen Gerichte waren akzeptabel aber nichts besonderes	['(FOOD, NEUTRAL)', '(FOOD, NEGATIVE)']	"['(FOOD, NEUTRAL, ""Gerichte"")', '(FOOD, NEGATIVE, ""NULL"")']"
619	Essen topp und Service auch, nur einen unmöglichen Kellner dabei, der mit den Tunneln im Ohr, der seine Kollegin ständig laut anpöbelt vor den Gäste, dass sie zu langsam sind und dich bewegen sollen usw.	['(FOOD, POSITIVE)', '(SERVICE, POSITIVE)', '(SERVICE, NEGATIVE)']	"['(FOOD, POSITIVE, ""Essen"")', '(SERVICE, POSITIVE, ""Service"")', '(SERVICE, NEGATIVE, ""Kellner"")']"
621	Ambiente toll , Essen überpreist und das man der Stiefmutter gratuliert ohne was zu hinterfragen ist schon sehr schmerzhaft .. brauch ich nicht nochmal .	['(AMBIENCE, POSITIVE)', '(PRICE, NEGATIVE)']	"['(AMBIENCE, POSITIVE, ""Ambiente"")', '(PRICE, NEGATIVE, ""Essen"")']"
626	Ein sehr enttäuschender Abend.	['(GENERAL-IMPRESSION, NEGATIVE)']	"['(GENERAL-IMPRESSION, NEGATIVE, ""NULL"")']"
635	Das Lokal war meiner Meinung nach völlig überfüllt, extrem laut, keine Unterhaltung mehr möglich.	['(AMBIENCE, NEGATIVE)']	"['(AMBIENCE, NEGATIVE, ""Lokal"")']"
640	Schöner Außenbereich	['(AMBIENCE, POSITIVE)']	"['(AMBIENCE, POSITIVE, ""Außenbereich"")']"
645	Das Essen hat uns auch nicht überzeugt, da es etwas lieblos zubereitet daherkam.	['(FOOD, NEGATIVE)']	"['(FOOD, NEGATIVE, ""Essen"")']"
648	Einen Punkt Abzug gibt es für mich (wobei das Restaurant nicht wirklich was dafür kann), weil darin sehr sehr laut ist und man seinen Gegenüber schon fast anschreien muss.	['(AMBIENCE, NEGATIVE)']	"['(AMBIENCE, NEGATIVE, ""NULL"")']"
654	Ein rundum leckerer Abend.	['(FOOD, POSITIVE)']	"['(FOOD, POSITIVE, ""NULL"")']"
664	Das Steak im Hauptgang war bei beiden sehr gut.	['(FOOD, POSITIVE)']	"['(FOOD, POSITIVE, ""Steak im Hauptgang"")']"
667	Kommen immer gerne wieder nur zu empfehlen:)	['(GENERAL-IMPRESSION, POSITIVE)']	"['(GENERAL-IMPRESSION, POSITIVE, ""NULL"")']"
673	Der Service ist sehr zuvorkommend und überaus freundlich.	['(SERVICE, POSITIVE)']	"['(SERVICE, POSITIVE, ""Service"")']"
683	Service war freundlich und schnell.	['(SERVICE, POSITIVE)']	"['(SERVICE, POSITIVE, ""Service"")']"
684	Muss nicht sein, kann aber.	['(GENERAL-IMPRESSION, NEUTRAL)']	"['(GENERAL-IMPRESSION, NEUTRAL, ""NULL"")']"
689	Der Apfelwein hat besch...gemeckt.	['(FOOD, NEGATIVE)']	"['(FOOD, NEGATIVE, ""Apfelwein"")']"
699	Sehr schöne Atmosphäre, guter Hauswein, freundliches Personal, haben nur was getrunken, daher kann ich Essen nicht beurteilen.	['(AMBIENCE, POSITIVE)', '(FOOD, POSITIVE)', '(SERVICE, POSITIVE)']	"['(AMBIENCE, POSITIVE, ""Atmosphäre"")', '(FOOD, POSITIVE, ""Hauswein"")', '(SERVICE, POSITIVE, ""Personal"")']"
706	Wir kommen gerne wieder!	['(GENERAL-IMPRESSION, POSITIVE)']	"['(GENERAL-IMPRESSION, POSITIVE, ""NULL"")']"
707	Ich war bereits öfter mit Familie und/oder Freunden hier und war immer sehr zufrieden.	['(GENERAL-IMPRESSION, POSITIVE)']	"['(GENERAL-IMPRESSION, POSITIVE, ""NULL"")']"
715	= Brauhaus - Service = unterste Schublade	['(SERVICE, NEGATIVE)']	"['(SERVICE, NEGATIVE, ""Brauhaus - Service"")']"
724	Die Kellner sind arrogant und respektlos!	['(SERVICE, NEGATIVE)']	"['(SERVICE, NEGATIVE, ""Kellner"")']"
725	Espresso geliefert ohne Milch und Zucker.	['(FOOD, NEGATIVE)']	"['(FOOD, NEGATIVE, ""Espresso"")']"
727	Essen war mittelmäßig, Preise Düsseldorfer Niveau	['(FOOD, NEUTRAL)', '(PRICE, NEUTRAL)']	"['(FOOD, NEUTRAL, ""Essen"")', '(PRICE, NEUTRAL, ""Preise"")']"
728	Absolut empfehlenswert.	['(GENERAL-IMPRESSION, POSITIVE)']	"['(GENERAL-IMPRESSION, POSITIVE, ""NULL"")']"
731	Speisen sehr schmackhaft.	['(FOOD, POSITIVE)']	"['(FOOD, POSITIVE, ""Speisen"")']"
733	Die Begrüßung war kühl und wirkte gezwungen und lieblos.	['(SERVICE, NEGATIVE)']	"['(SERVICE, NEGATIVE, ""Begrüßung"")']"
738	Nie wieder.	['(GENERAL-IMPRESSION, NEGATIVE)']	"['(GENERAL-IMPRESSION, NEGATIVE, ""NULL"")']"
754	Aber das Saure Lüngerl (eine der Spezialitäten des Hauses) war so sauer, dass es leider nicht essbar war, außerdem war es lauwarm.	['(FOOD, NEGATIVE)']	"['(FOOD, NEGATIVE, ""Saure Lüngerl"")']"
757	Plätze auf dem Balkon waren nicht frei und so saßen wir, abgetrennt durch ein ziemlich hässliches Seil direkt an der LOC.	['(AMBIENCE, NEGATIVE)']	"['(AMBIENCE, NEGATIVE, ""Seil"")']"
760	Glühwein wird aus dreckigen Thermoskannen für 27 Euro an der SB Theke serviert.	['(FOOD, NEGATIVE)']	"['(FOOD, NEGATIVE, ""Glühwein"")']"
771	Ich und mein Besuch, waren sehr enttäuscht.	['(GENERAL-IMPRESSION, NEGATIVE)']	"['(GENERAL-IMPRESSION, NEGATIVE, ""NULL"")']"
778	Die Preise waren echt fair!	['(PRICE, POSITIVE)']	"['(PRICE, POSITIVE, ""Preise"")']"
781	Essen war nicht gut.	['(FOOD, NEGATIVE)']	"['(FOOD, NEGATIVE, ""Essen"")']"
784	Kompliment an das Team in der Küche.	['(SERVICE, POSITIVE)']	"['(SERVICE, POSITIVE, ""Team in der Küche"")']"
785	Gutes Bier zum günstigen Preis Halbe 3,95 aber kleine BierkarteAugustiner Schmakerl mit moderaten Preis.	['(FOOD, POSITIVE)', '(PRICE, POSITIVE)', '(PRICE, POSITIVE)']	"['(FOOD, POSITIVE, ""Bier"")', '(PRICE, POSITIVE, ""Bier"")', '(PRICE, POSITIVE, ""BierkarteAugustiner Schmakerl"")']"
787	Ich war mit meiner Tochter dort und haben einen sehr schönen Abend verbracht.	['(GENERAL-IMPRESSION, POSITIVE)']	"['(GENERAL-IMPRESSION, POSITIVE, ""NULL"")']"
793	Sehr aufmerksame Mitarbeiter und das Essen wirklich in sehr guter Qualität.	['(SERVICE, POSITIVE)', '(FOOD, POSITIVE)']	"['(SERVICE, POSITIVE, ""Mitarbeiter"")', '(FOOD, POSITIVE, ""Essen"")']"
796	Nächste mal gehe ich lieber wieder zu Curry 36, da geht es 10 mal schneller und das Preis Leistungsverhältnis stimmt.	['(PRICE, NEGATIVE)', '(SERVICE, NEGATIVE)']	"['(PRICE, NEGATIVE, ""Preis Leistungsverhältnis"")', '(SERVICE, NEGATIVE, ""NULL"")']"
805	Urige Wirtschaft mit einem coolen Ambiente.	['(AMBIENCE, POSITIVE)', '(AMBIENCE, POSITIVE)']	"['(AMBIENCE, POSITIVE, ""Wirtschaft"")', '(AMBIENCE, POSITIVE, ""Ambiente"")']"
820	Hausgemachte Pommes sehr gut.	['(FOOD, POSITIVE)']	"['(FOOD, POSITIVE, ""Pommes"")']"
823	Eingekehrt, Sauerbraten bestellt, extrem humorvoller Köbes, Spaß gehabt, geschmackvolle und große Portionen bekommen.	['(SERVICE, POSITIVE)', '(FOOD, POSITIVE)']	"['(SERVICE, POSITIVE, ""Köbes"")', '(FOOD, POSITIVE, ""Portionen"")']"
832	Bier kam schnell, war frisch, kalt und gut.	['(FOOD, POSITIVE)', '(SERVICE, POSITIVE)']	"['(FOOD, POSITIVE, ""Bier"")', '(SERVICE, POSITIVE, ""NULL"")']"
844	Der Grießpudding schmeckte sehr mehlig und die Heidelbeeren waren mit 3 St. und einer Himbeere sehr überschaubar.	['(FOOD, NEGATIVE)', '(FOOD, NEGATIVE)', '(FOOD, NEGATIVE)']	"['(FOOD, NEGATIVE, ""Grießpudding"")', '(FOOD, NEGATIVE, ""Heidelbeeren"")', '(FOOD, NEGATIVE, ""Himbeere"")']"
847	Völlig überteuert, alles in allem ein Ärgernis.	['(GENERAL-IMPRESSION, NEGATIVE)', '(PRICE, NEGATIVE)']	"['(GENERAL-IMPRESSION, NEGATIVE, ""NULL"")', '(PRICE, NEGATIVE, ""NULL"")']"
859	Essen war wie immer top, jedoch bei den LOC habe ich den Ziegenkäsegeschmack des Ziegenkäses vermisst.	['(FOOD, POSITIVE)', '(FOOD, NEGATIVE)']	"['(FOOD, POSITIVE, ""Essen"")', '(FOOD, NEGATIVE, ""LOC"")']"
860	fleischqualität könnte besser sein.	['(FOOD, NEGATIVE)']	"['(FOOD, NEGATIVE, ""NULL"")']"
863	Ausser der ersten Getränke war eine weitere Getränkebestellung quasi unmöglich da kein Servicepersonal verfügbar.	['(SERVICE, NEGATIVE)']	"['(SERVICE, NEGATIVE, ""Servicepersonal"")']"
873	Das Personal ist kompetent, aber auch hier geht es dem Restaurantbetreiber wohl inzwischen mehr um die Gewinn Maximierung, als um die Zufriedenheit der verwöhnten Gästen.	['(SERVICE, POSITIVE)', '(SERVICE, NEGATIVE)', '(PRICE, NEGATIVE)']	"['(SERVICE, POSITIVE, ""Personal"")', '(SERVICE, NEGATIVE, ""Restaurantbetreiber"")', '(PRICE, NEGATIVE, ""Gewinn Maximierung"")']"
896	Die Bedienung hatte null Ahnung was welches Gericht war.	['(SERVICE, NEGATIVE)']	"['(SERVICE, NEGATIVE, ""Bedienung"")']"
905	Die enge Bestuhlung im Lokal (französische Verhältnisse) lässt keinen anderen Schluss darauf zu.	['(AMBIENCE, NEGATIVE)']	"['(AMBIENCE, NEGATIVE, ""Bestuhlung"")']"
907	Besuch in der RESTAURANT_NAME und immer wieder eine Reise wert!	['(GENERAL-IMPRESSION, POSITIVE)']	"['(GENERAL-IMPRESSION, POSITIVE, ""RESTAURANT_NAME"")']"
910	Das Gasthaus RESTAURANT_NAME ist egal zu welchem Anlass ein passendes Restaurant.	['(GENERAL-IMPRESSION, POSITIVE)']	"['(GENERAL-IMPRESSION, POSITIVE, ""RESTAURANT_NAME"")']"
921	Das Personal war entspannt und freundlich und das Interieur genau so, wie wir es erhofft hatten.	['(SERVICE, POSITIVE)', '(AMBIENCE, POSITIVE)']	"['(SERVICE, POSITIVE, ""Personal"")', '(AMBIENCE, POSITIVE, ""Interieur"")']"
922	Das Essen war völlig in Ordnung.	['(FOOD, NEUTRAL)']	"['(FOOD, NEUTRAL, ""Essen"")']"
923	Das RESTAURANT_NAME ist ein durchschnittlicher LOC, den man ab und zu einmal für ein Essen aufsuchen kann ohne etwas Besonders zu erwarten.	['(GENERAL-IMPRESSION, NEUTRAL)', '(FOOD, NEUTRAL)']	"['(GENERAL-IMPRESSION, NEUTRAL, ""RESTAURANT_NAME"")', '(FOOD, NEUTRAL, ""Essen"")']"
925	Super leckeres Essen mit einer spannenden Auswahl an Gerichten.	['(FOOD, POSITIVE)', '(FOOD, POSITIVE)']	"['(FOOD, POSITIVE, ""Essen"")', '(FOOD, POSITIVE, ""Gerichten"")']"
926	Beim zweiten Versuch fehlten dann die Trüffel.	['(FOOD, NEGATIVE)']	"['(FOOD, NEGATIVE, ""NULL"")']"
933	Die Toiletten waren sehr sauber.	['(AMBIENCE, POSITIVE)']	"['(AMBIENCE, POSITIVE, ""Toiletten"")']"
941	Das Essen war ausgezeichnet und der Preis angemessen.	['(FOOD, POSITIVE)', '(PRICE, NEUTRAL)']	"['(FOOD, POSITIVE, ""Essen"")', '(PRICE, NEUTRAL, ""Preis"")']"
944	Wir waren so enttäuscht , dass uns die Lust zum shoppen vergangen ist und wir sind nach LOC gefahren.	['(GENERAL-IMPRESSION, NEGATIVE)']	"['(GENERAL-IMPRESSION, NEGATIVE, ""NULL"")']"
956	Nicht gemütlich.	['(AMBIENCE, NEGATIVE)']	"['(AMBIENCE, NEGATIVE, ""NULL"")']"
963	Kommen immer gerne wieder hier her und das schon eine sehr sehr lange Zeit und haben bis heute keinen Tag bereut den wir hier waren.	['(GENERAL-IMPRESSION, POSITIVE)']	"['(GENERAL-IMPRESSION, POSITIVE, ""NULL"")']"
969	Alles in allem ein sehr gelungener Besuch!	['(GENERAL-IMPRESSION, POSITIVE)']	"['(GENERAL-IMPRESSION, POSITIVE, ""NULL"")']"
970	Besser nicht!	['(GENERAL-IMPRESSION, NEGATIVE)']	"['(GENERAL-IMPRESSION, NEGATIVE, ""NULL"")']"
987	Wir haben da dann offensichtlich einen schlechten Tag erwischt.	['(GENERAL-IMPRESSION, NEGATIVE)']	"['(GENERAL-IMPRESSION, NEGATIVE, ""NULL"")']"
988	Und heute -September 2023 haben wir auch gleiches bestellt,ist volle Enttäuschung -die Bratwürste sind um 2-3 cm kürzer geworden und Kartoffelsalat-wie Wassersuppe auch geschmacklos.	['(FOOD, NEGATIVE)', '(FOOD, NEGATIVE)', '(FOOD, NEGATIVE)']	"['(FOOD, NEGATIVE, ""Bratwürste"")', '(FOOD, NEGATIVE, ""Kartoffelsalat"")', '(FOOD, NEGATIVE, ""Wassersuppe"")']"
