id	text	labels	labels_phrases
361	Die Pizzen sind außergewöhnliche lecker mit dünnem Boden und sehr üppig belegt.	['(FOOD, POSITIVE)']	"['(FOOD, POSITIVE, ""Pizzen"")']"
386	Die Brez‘n Suppe ist der Hammer, das Gröstl eine Riesenportion Geschmack.	['(FOOD, POSITIVE)', '(FOOD, POSITIVE)']	"['(FOOD, POSITIVE, ""Brez‘n Suppe"")', '(FOOD, POSITIVE, ""Gröstl"")']"
391	"Aber Pommes gibts es wesentlich leckere (die ""Schalenreste"" an den Pommes vermitteln vll."	['(FOOD, NEGATIVE)']	"['(FOOD, NEGATIVE, ""Pommes"")']"
394	Eine junge Dame mit Handy lief zwar um die Tische, doch winkende Gäste, die etwas bestellen wollten, wurden geflissentlich übersehen.	['(SERVICE, NEGATIVE)']	"['(SERVICE, NEGATIVE, ""Dame"")']"
396	Das Restaurant im Keller war toll und gut besucht.	['(GENERAL-IMPRESSION, POSITIVE)']	"['(GENERAL-IMPRESSION, POSITIVE, ""Restaurant im Keller"")']"
399	"""Übrigens, das Ehepaar, welches nach uns an unserem Tisch Platz nahm, sah sich genötigt, sich persönlich auf die Suche nach einen/r Servicemitarbeiter/in zu begeben."	['(SERVICE, NEGATIVE)']	"['(SERVICE, NEGATIVE, ""Servicemitarbeiter/in"")']"
402	Leider hat die Qualität massiv nachgelassen und der Preis 7,10€ hat sich fast verdoppelt, die haben wohl den Knall nicht gehört und denn rennen einen die Ratten am Stand fast über die Füße ,das geht gar nicht.	['(FOOD, NEGATIVE)']	"['(FOOD, NEGATIVE, ""Preis"")']"
410	Wir waren geschäftlich in der RESTAURANT_NAME, und schon am Eingang haben wir das tolle Ambiente gesehen.	['(AMBIENCE, POSITIVE)']	"['(AMBIENCE, POSITIVE, ""Ambiente"")']"
413	Als wir langsam genervt das x-te mal nach gefragt haben wo die Gläser sind kam Der Chef und meinte wir sollen das Personal nicht so stressen…🤯 what??	['(SERVICE, NEGATIVE)']	"['(SERVICE, NEGATIVE, ""Chef"")']"
416	Essen - wie immer - GRANDIOS!	['(FOOD, POSITIVE)']	"['(FOOD, POSITIVE, ""Essen"")']"
426	Hatte ein sehniges Teil was nicht zu kauen war die anderen Gerichte waren akzeptabel aber nichts besonderes	['(FOOD, NEUTRAL)']	"['(FOOD, NEUTRAL, ""Gerichte"")']"
430	Mir aber zu fettig und zuviel Speck.	['(FOOD, NEGATIVE)']	"['(FOOD, NEGATIVE, ""Speck"")']"
434	Gutes Essen, freundliche Bedienung, allerdings wurde wieder bei der Abrechnung geschummelt.	['(FOOD, POSITIVE)', '(SERVICE, POSITIVE)', '(SERVICE, NEGATIVE)']	"['(FOOD, POSITIVE, ""Essen"")', '(SERVICE, POSITIVE, ""Bedienung"")', '(SERVICE, NEGATIVE, ""Abrechnung"")']"
438	Jeder Restauranttester schlägt wahrscheinlich die Hände über dem Kopf zusammen, sollte er jemals so ein Essen serviert bekomnen	['(FOOD, NEGATIVE)']	"['(FOOD, NEGATIVE, ""Essen"")']"
439	Wir, meine Frau, meine Familie, gehen immer wieder sehr gerne in die RESTAURANT_NAME zum Essen.	['(GENERAL-IMPRESSION, POSITIVE)']	"['(GENERAL-IMPRESSION, POSITIVE, ""RESTAURANT_NAME"")']"
450	!Natürlich das Bier topp und auch der Kellner topp und freundlich!!	['(FOOD, POSITIVE)', '(SERVICE, POSITIVE)']	"['(FOOD, POSITIVE, ""Bier"")', '(SERVICE, POSITIVE, ""Kellner"")']"
457	Bier schmeckt super.	['(FOOD, POSITIVE)']	"['(FOOD, POSITIVE, ""Bier"")']"
458	Das vom Kindergesicht ebenfalls, wurde aber nachträglich in Soße ertränkt, was der Panade nicht gut tat.	['(FOOD, NEGATIVE)']	"['(FOOD, NEGATIVE, ""Panade"")']"
462	Die Bedienung war freundlich, flott und gut gelaunt.	['(SERVICE, POSITIVE)']	"['(SERVICE, POSITIVE, ""Bedienung"")']"
465	Der Service ist sehr zuvorkommend und überaus freundlich.	['(SERVICE, POSITIVE)']	"['(SERVICE, POSITIVE, ""Service"")']"
469	Das Essen war sehr gut und die Herrencreme ein Gedicht.	['(FOOD, POSITIVE)', '(FOOD, POSITIVE)']	"['(FOOD, POSITIVE, ""Essen"")', '(FOOD, POSITIVE, ""Herrencreme"")']"
474	Und natürlich das Essen immer wieder super lecker.	['(FOOD, POSITIVE)']	"['(FOOD, POSITIVE, ""Essen"")']"
488	Darauf angesprochen meint der „Oberkellner“ nur: „Ich habe alles bestellt, ich bin aus dem Schneider.	['(SERVICE, NEGATIVE)']	"['(SERVICE, NEGATIVE, ""Oberkellner"")']"
489	= Brauhaus - Service = unterste Schublade	['(SERVICE, NEGATIVE)']	"['(SERVICE, NEGATIVE, ""Brauhaus - Service"")']"
492	Es gab vorweg einen Gruß aus der Küche und einen leckeren Nachtisch.	['(FOOD, POSITIVE)']	"['(FOOD, POSITIVE, ""Nachtisch"")']"
496	Espresso geliefert ohne Milch und Zucker.	['(FOOD, NEGATIVE)']	"['(FOOD, NEGATIVE, ""Espresso"")']"
502	Bedienung freundlich, aber leider war das Essen qualitativ nicht gut.	['(SERVICE, POSITIVE)', '(FOOD, NEGATIVE)']	"['(SERVICE, POSITIVE, ""Bedienung"")', '(FOOD, NEGATIVE, ""Essen"")']"
511	Über die Qualität der Gerichte muß man nicht mehr reden: hervorragend!	['(FOOD, POSITIVE)']	"['(FOOD, POSITIVE, ""Gerichte"")']"
516	Die Kellnerin hat einen genervten Eindruck gemacht.	['(SERVICE, NEGATIVE)']	"['(SERVICE, NEGATIVE, ""Kellnerin"")']"
517	Plätze auf dem Balkon waren nicht frei und so saßen wir, abgetrennt durch ein ziemlich hässliches Seil direkt an der LOC.	['(AMBIENCE, NEGATIVE)']	"['(AMBIENCE, NEGATIVE, ""Seil"")']"
522	Ich werde das Restaurant nicht mehr aufsuchen und kann es auch nicht empfehlen.	['(GENERAL-IMPRESSION, NEGATIVE)']	"['(GENERAL-IMPRESSION, NEGATIVE, ""Restaurant"")']"
526	Langsamer Service, Bestellungen falsch aufgenommen.	['(SERVICE, NEGATIVE)']	"['(SERVICE, NEGATIVE, ""Service"")']"
527	Da sollte sich das Management vom LOC schämen sowas haben wir nie erlebt.	['(SERVICE, NEGATIVE)']	"['(SERVICE, NEGATIVE, ""Management"")']"
534	Essen war nicht gut.	['(FOOD, NEGATIVE)']	"['(FOOD, NEGATIVE, ""Essen"")']"
535	Das Saisonbier schmeckte ebenfalls.	['(FOOD, POSITIVE)']	"['(FOOD, POSITIVE, ""Saisonbier"")']"
540	Über die Cocktailpreise reden wir lieber nicht.	['(PRICE, NEGATIVE)']	"['(PRICE, NEGATIVE, ""Cocktailpreise"")']"
541	Essen war ok, aber sowas verdirbt einem nur die Laune.	['(FOOD, NEUTRAL)']	"['(FOOD, NEUTRAL, ""Essen"")']"
546	Schon beim Betreten wurden vor uns 2 Damen beschimpft, weil man anscheinend nicht mit Kinderwagen das Kaffee betreten darf.	['(SERVICE, NEGATIVE)']	"['(SERVICE, NEGATIVE, ""Damen"")']"
561	Das Essen war sehr lecker und auch reichlich.	['(FOOD, POSITIVE)']	"['(FOOD, POSITIVE, ""Essen"")']"
569	Die Preise waren die gleichen wie früher: schade!	['(PRICE, NEGATIVE)']	"['(PRICE, NEGATIVE, ""Preise"")']"
576	Ein absolutes NO-GO Lokal, für Kund*innen die für sich beanspruchen, willkommen geheißen und freundlich behandelt zu werden.	['(GENERAL-IMPRESSION, NEGATIVE)']	"['(GENERAL-IMPRESSION, NEGATIVE, ""Lokal"")']"
596	Das Personal ist kompetent, aber auch hier geht es dem Restaurantbetreiber wohl inzwischen mehr um die Gewinn Maximierung, als um die Zufriedenheit der verwöhnten Gästen.	['(SERVICE, POSITIVE)', '(SERVICE, NEGATIVE)', '(PRICE, NEGATIVE)']	"['(SERVICE, POSITIVE, ""Personal"")', '(SERVICE, NEGATIVE, ""Restaurantbetreiber"")', '(PRICE, NEGATIVE, ""Gewinn Maximierung"")']"
597	Sowohl die freundlichen Bedienungen, das gute Essen und das hervorragende Bier entsprachen dabei unserer bisherigen Erfahrung.	['(SERVICE, POSITIVE)', '(FOOD, POSITIVE)', '(FOOD, POSITIVE)']	"['(SERVICE, POSITIVE, ""Bedienungen"")', '(FOOD, POSITIVE, ""Essen"")', '(FOOD, POSITIVE, ""Bier"")']"
604	Leider waren die Portionen etwas zu groß und die Akustik etwas zu laut.	['(FOOD, NEGATIVE)', '(AMBIENCE, NEGATIVE)']	"['(FOOD, NEGATIVE, ""Portionen"")', '(AMBIENCE, NEGATIVE, ""Akustik"")']"
610	Die Bedienung hatte null Ahnung was welches Gericht war.	['(SERVICE, NEGATIVE)']	"['(SERVICE, NEGATIVE, ""Bedienung"")']"
618	Besonders für die liebe Bedienung , den netten Kellner und den aufmerksamen Service von (Luca) waren wir total dankbar 🤗 und das Dessert ( Cassata Siciliana) mmm unglaublich lecker 😋	['(SERVICE, POSITIVE)', '(SERVICE, POSITIVE)', '(FOOD, POSITIVE)', '(SERVICE, POSITIVE)']	"['(SERVICE, POSITIVE, ""Bedienung"")', '(SERVICE, POSITIVE, ""Kellner"")', '(FOOD, POSITIVE, ""Dessert"")', '(SERVICE, POSITIVE, ""Luca"")']"
628	Besinders gut waren für Vegetarier die Knödel-Tris!	['(FOOD, POSITIVE)']	"['(FOOD, POSITIVE, ""Knödel-Tris"")']"
633	Das RESTAURANT_NAME ist ein durchschnittlicher LOC, den man ab und zu einmal für ein Essen aufsuchen kann ohne etwas Besonders zu erwarten.	['(GENERAL-IMPRESSION, NEUTRAL)', '(FOOD, NEUTRAL)']	"['(GENERAL-IMPRESSION, NEUTRAL, ""RESTAURANT_NAME"")', '(FOOD, NEUTRAL, ""Essen"")']"
635	Super leckeres Essen mit einer spannenden Auswahl an Gerichten.	['(FOOD, POSITIVE)', '(FOOD, POSITIVE)']	"['(FOOD, POSITIVE, ""Essen"")', '(FOOD, POSITIVE, ""Gerichten"")']"
639	Die Toiletten waren sehr sauber.	['(AMBIENCE, POSITIVE)']	"['(AMBIENCE, POSITIVE, ""Toiletten"")']"
640	Als Hauptspeise hatten wir das Rinderfilet, welches Medium sein sollte und noch nicht mal Medium Rare war, der ganze Teller war nach dem Anschnitt blutig.	['(FOOD, NEGATIVE)']	"['(FOOD, NEGATIVE, ""Rinderfilet"")']"
643	Das Restaurant scheint im vorigen Jahrhundert stehen geblieben zu sein.	['(GENERAL-IMPRESSION, NEGATIVE)']	"['(GENERAL-IMPRESSION, NEGATIVE, ""Restaurant"")']"
645	In diesem Restaurant fühlt man sich sofort willkommen.	['(GENERAL-IMPRESSION, POSITIVE)']	"['(GENERAL-IMPRESSION, POSITIVE, ""Restaurant"")']"
667	Super nette Bedienung und gute Qualität beim Essen.	['(SERVICE, POSITIVE)', '(SERVICE, POSITIVE)']	"['(SERVICE, POSITIVE, ""Bedienung"")', '(SERVICE, POSITIVE, ""Essen"")']"
676	"Diesmal überzeugte uns das ""Duett vom Hirsch, Roulade und Frikadelle"" eine äußerst gelungene Komposition, die wir mehrmals aßen, weil so noch nie gefunden."	['(FOOD, POSITIVE)', '(FOOD, POSITIVE)', '(FOOD, POSITIVE)']	"['(FOOD, POSITIVE, ""Duett vom Hirsch"")', '(FOOD, POSITIVE, ""Roulade"")', '(FOOD, POSITIVE, ""Frikadelle"")']"
678	Tolles und gemütliches Ambiente	['(AMBIENCE, POSITIVE)']	"['(AMBIENCE, POSITIVE, ""Ambiente"")']"
681	Am besten war noch der dazu bestellte große Salatteller mit Speckwürfel und die gekaufte Breze.	['(FOOD, POSITIVE)', '(FOOD, POSITIVE)']	"['(FOOD, POSITIVE, ""Salatteller mit Speckwürfel"")', '(FOOD, POSITIVE, ""Breze"")']"
683	Super Service, tolle Fotos und immer ein nettes Gespräch.	['(SERVICE, POSITIVE)', '(AMBIENCE, POSITIVE)']	"['(SERVICE, POSITIVE, ""Service"")', '(AMBIENCE, POSITIVE, ""Fotos"")']"
694	Nun - sicher , es ist Urlaubszeit, Touristen, viele Menschen, es ist warm …Aber - das Aufgeben einer Bestellung dauert sehr lange, dann auch nur, durch lautstarke Aufforderung.	['(SERVICE, NEGATIVE)']	"['(SERVICE, NEGATIVE, ""Bestellung"")']"
697	Die Gerichte waren aber keine Highlights - schmackhaft, solide ... gut!	['(FOOD, POSITIVE)']	"['(FOOD, POSITIVE, ""Gerichte"")']"
698	Denn irgendwie geht es mir mittlerweile auf den Keks diese Warterei.	['(SERVICE, NEGATIVE)']	"['(SERVICE, NEGATIVE, ""Warterei"")']"
704	Denn Erholung, was ja ein Abend mit gutem Essen, netter Unterhaltung miteinander und in stilvoller Umgebung, ausmacht, war es nicht.	['(FOOD, NEGATIVE)', '(AMBIENCE, NEGATIVE)', '(AMBIENCE, NEGATIVE)']	"['(FOOD, NEGATIVE, ""Essen"")', '(AMBIENCE, NEGATIVE, ""Unterhaltung"")', '(AMBIENCE, NEGATIVE, ""Umgebung"")']"
710	Das einzige mango ist die freundlichkeit der Servicekräfte, das könnte besser sein, ansonsten gab es nichts zu meckern.	['(SERVICE, NEGATIVE)']	"['(SERVICE, NEGATIVE, ""Servicekräfte"")']"
711	Wer noch nie im RESTAURANT_NAME war, muss unbedingt hier hin.	['(GENERAL-IMPRESSION, POSITIVE)']	"['(GENERAL-IMPRESSION, POSITIVE, ""RESTAURANT_NAME"")']"
718	Ach ne, Pampe war das seltsame Sauerkraut.	['(FOOD, NEGATIVE)']	"['(FOOD, NEGATIVE, ""Sauerkraut"")']"
729	Der schlechteste und zugleich teuerste Burger aller Zeiten für 14,90 € ohne jegliche Beilage.	['(FOOD, NEGATIVE)', '(PRICE, NEGATIVE)']	"['(FOOD, NEGATIVE, ""Burger"")', '(PRICE, NEGATIVE, ""Burger"")']"
732	Die Hauptgerichte kamen zu unterschiedlichen Zeiten, da die Bedienung nicht alles richtig aufgenommen hat.	['(SERVICE, NEGATIVE)']	"['(SERVICE, NEGATIVE, ""Bedienung"")']"
756	Alles perfekt, eindeutig griechisch lecker, ok., der Reihe nach, im Detail:die sehr gute Vorspeise weckt den Appetit auf das Hauptgericht, das sowohl als Fleisch- und als Fischvariante absolut Klasse war, Ambiente angenehme Schlichtheit und das Personal in seiner waschechten, gastfreundlichen, griechischen Art einfach super!!	['(FOOD, POSITIVE)', '(FOOD, POSITIVE)', '(AMBIENCE, POSITIVE)', '(SERVICE, POSITIVE)']	"['(FOOD, POSITIVE, ""Vorspeise"")', '(FOOD, POSITIVE, ""Fleisch- und als Fischvariante"")', '(AMBIENCE, POSITIVE, ""Ambiente"")', '(SERVICE, POSITIVE, ""Personal"")']"
765	Aber was den Besuch noch unvergesslicher gemacht hat, war der super nette und kompetente Kellner Bruno.	['(SERVICE, POSITIVE)']	"['(SERVICE, POSITIVE, ""Bruno"")']"
787	Gerichte sind eher bodenständig und nicht fein abgestimmt (trotz teilweise hochwertiger Zutaten, wie Trüffel).	['(FOOD, NEGATIVE)', '(FOOD, POSITIVE)', '(FOOD, POSITIVE)']	"['(FOOD, NEGATIVE, ""Gerichte"")', '(FOOD, POSITIVE, ""Trüffel"")', '(FOOD, POSITIVE, ""Zutaten"")']"
788	"Wir wurden von einem sehr arroganten ""Platzanweiser"" am Eingang empfangen."	['(SERVICE, NEGATIVE)']	"['(SERVICE, NEGATIVE, ""Platzanweiser"")']"
791	Tolles Essen, kompetentes Personal und gemütliches Ambiente… Ein gelungener Abend für uns und absolut weiterzuempfehlen!!	['(FOOD, POSITIVE)', '(SERVICE, POSITIVE)', '(AMBIENCE, POSITIVE)']	"['(FOOD, POSITIVE, ""Essen"")', '(SERVICE, POSITIVE, ""Personal"")', '(AMBIENCE, POSITIVE, ""Ambiente"")']"
792	Auch das Essen war so lala.	['(FOOD, NEUTRAL)']	"['(FOOD, NEUTRAL, ""Essen"")']"
793	Jedes der Gerichte, auch die Vorspeisen, haben uns sehr gut geschmeckt.	['(FOOD, POSITIVE)', '(FOOD, POSITIVE)']	"['(FOOD, POSITIVE, ""Gerichte"")', '(FOOD, POSITIVE, ""Vorspeisen"")']"
795	Der Preis mit 9.90€ definitiv nicht gerechtfertigt.	['(PRICE, NEGATIVE)']	"['(PRICE, NEGATIVE, ""Preis"")']"
798	Super leckeres Essen & super Getränke.	['(FOOD, POSITIVE)', '(FOOD, POSITIVE)']	"['(FOOD, POSITIVE, ""Essen"")', '(FOOD, POSITIVE, ""Getränke"")']"
835	Mega leckeres Essen und super freundliche Bedienung.	['(FOOD, POSITIVE)', '(SERVICE, POSITIVE)']	"['(FOOD, POSITIVE, ""Essen"")', '(SERVICE, POSITIVE, ""Bedienung"")']"
836	Sehr nette Mitarbeiter.	['(SERVICE, POSITIVE)']	"['(SERVICE, POSITIVE, ""Mitarbeiter"")']"
837	Die gute Laune der Kellner*innen und die Musik schaffen aber dennoch eine angenehme Atmosphäre.	['(SERVICE, POSITIVE)', '(AMBIENCE, POSITIVE)', '(AMBIENCE, POSITIVE)']	"['(SERVICE, POSITIVE, ""Kellner*innen"")', '(AMBIENCE, POSITIVE, ""Atmosphäre"")', '(AMBIENCE, POSITIVE, ""Musik"")']"
840	Nette freundliche Bedingungen und schnelles bringen der Speisen, obwohl es voll war.	['(SERVICE, POSITIVE)']	"['(SERVICE, POSITIVE, ""Bedingungen"")']"
846	Gut, auch von Griechen besuchtes griechisches Restaurant mit familiärer Atmosphäre.	['(GENERAL-IMPRESSION, POSITIVE)', '(AMBIENCE, POSITIVE)']	"['(GENERAL-IMPRESSION, POSITIVE, ""Restaurant"")', '(AMBIENCE, POSITIVE, ""Atmosphäre"")']"
862	Sosse selbe wie bei der Ente...= -1Darum für den Preis von fast 60 Euro kann man eigentlich was besseres erwarten...Aber das juckt dort keinen weil es die Masse macht....	['(PRICE, NEGATIVE)']	"['(PRICE, NEGATIVE, ""Preis"")']"
863	Die Bedienung hat nicht mal tschüss gesagt - wahrscheinlich waren ihr 15€ Trinkgeld zu wenig ☹️!	['(SERVICE, NEGATIVE)']	"['(SERVICE, NEGATIVE, ""Bedienung"")']"
869	Urige Kneipe auf zwei Etagen für Liebhaber deftiger Gerichte.	['(FOOD, POSITIVE)', '(AMBIENCE, POSITIVE)']	"['(FOOD, POSITIVE, ""Gerichte"")', '(AMBIENCE, POSITIVE, ""Kneipe"")']"
871	Das Essen meiner Frau war sehr lecker, mein Fleisch war leider etwas fettig.	['(FOOD, POSITIVE)', '(FOOD, NEGATIVE)']	"['(FOOD, POSITIVE, ""Essen"")', '(FOOD, NEGATIVE, ""Fleisch"")']"
889	Wir hatten einen wundervollen Abend mit einem 6-Gänge Menü mit Weinbegleitung und jeder Gang war einfach nur perfekt aufeinander abgestimmt und das beste was wir seit langem gegessen haben.	['(FOOD, POSITIVE)']	"['(FOOD, POSITIVE, ""Gang"")']"
894	Das Essen ist mit sehr viel Deko streckenweise stark überlastet, was leider beim Rindertartar dazu führte, dass das Fleisch geschmacklich komplett unter Perlzwiebeln, Sauce und Sprossen unterging.	['(FOOD, NEGATIVE)', '(FOOD, NEGATIVE)', '(FOOD, NEGATIVE)']	"['(FOOD, NEGATIVE, ""Deko"")', '(FOOD, NEGATIVE, ""Essen"")', '(FOOD, NEGATIVE, ""Rindertartar"")']"
897	Die Bedienung war sehr aufmerksam und nett und hat bis zum Ende der Zeit die Getränke stets am Tisch getauscht bzw. aktiv nachgefragt.	['(SERVICE, POSITIVE)']	"['(SERVICE, POSITIVE, ""Bedienung"")']"
904	Tolles Ambiente, sehr guter Service und vor allem exquisite und köstliche Gerichte.	['(AMBIENCE, POSITIVE)', '(SERVICE, POSITIVE)', '(FOOD, POSITIVE)']	"['(AMBIENCE, POSITIVE, ""Ambiente"")', '(SERVICE, POSITIVE, ""Service"")', '(FOOD, POSITIVE, ""Gerichte"")']"
911	Nach dem Besuch des Weihnachtsmarktes ein angenehmer Aufenthalt im Brauhaus.	['(GENERAL-IMPRESSION, POSITIVE)']	"['(GENERAL-IMPRESSION, POSITIVE, ""Brauhaus"")']"
917	Wir waren am Freitag dort in der RESTAURANT_NAME und waren von der Qualität des Essens und der Zubereitung sehr enttäuscht.	['(FOOD, NEGATIVE)']	"['(FOOD, NEGATIVE, ""Essens"")']"
921	Die Portionsgrößen sind tendenziell großzügig.	['(FOOD, POSITIVE)']	"['(FOOD, POSITIVE, ""Portionsgrößen"")']"
941	Die nächste Serviererin krachte unsere Gläser auf den Tisch und verschwand.	['(SERVICE, NEGATIVE)']	"['(SERVICE, NEGATIVE, ""Serviererin"")']"
943	Ich habe mir einen 'grossen' Salat bestellt, der nur 2-3 Salatblätter hatte, der restliche Teller war überwiegend Kartoffelsalat und das Brot war mehr alter Zwieback als ein schönes Baguette.	['(FOOD, NEGATIVE)', '(FOOD, NEGATIVE)']	"['(FOOD, NEGATIVE, ""Brot"")', '(FOOD, NEGATIVE, ""\'grossen\' Salat"")']"
946	Das LOC verbrannt,ungenießbar.	['(FOOD, NEGATIVE)']	"['(FOOD, NEGATIVE, ""LOC"")']"
953	Speisen = Imbissbudenniveau auf Porzellantellern mit Besteck - Stimmung o.k.	['(FOOD, NEGATIVE)', '(AMBIENCE, NEUTRAL)']	"['(FOOD, NEGATIVE, ""Speisen"")', '(AMBIENCE, NEUTRAL, ""Stimmung"")']"
954	Mir persönlich gefällt sehr gut, dass das Gasthaus altbewährtes Ambiente mit moderner und zeitgemäßer Küche verbindet.	['(AMBIENCE, POSITIVE)', '(FOOD, POSITIVE)']	"['(AMBIENCE, POSITIVE, ""Ambiente"")', '(FOOD, POSITIVE, ""Küche"")']"
955	"Die Weine aus dieser ""kleinen Weinregion"" passten sensationell zu den jeweiligen Gängen und zeugten von der Qualität des Sommeliers."	['(FOOD, POSITIVE)', '(SERVICE, POSITIVE)']	"['(FOOD, POSITIVE, ""Weine"")', '(SERVICE, POSITIVE, ""Sommeliers"")']"
957	Unfassbar unfreundlicher Service.	['(SERVICE, NEGATIVE)']	"['(SERVICE, NEGATIVE, ""Service"")']"
986	Uns hat das Ambiente der Metzgerei ebenfalls sehr gut gefallen.	['(AMBIENCE, POSITIVE)']	"['(AMBIENCE, POSITIVE, ""Metzgerei"")']"
1014	Egal ob Bolognese für Kids oder rafinnierte Kalbmedalliins mit Pinienkernen für uns- alles schmeckt.	['(FOOD, POSITIVE)', '(FOOD, POSITIVE)']	"['(FOOD, POSITIVE, ""Bolognese"")', '(FOOD, POSITIVE, ""Kalbmedalliins mit Pinienkernen"")']"
1016	Die Hauptgerichte waren einfach nur gutbürgerliches Mittelfeld, 08-15 zubereitet.	['(FOOD, NEUTRAL)']	"['(FOOD, NEUTRAL, ""Hauptgerichte"")']"
1029	"Kartoffelpüree zum LOC aus der Packung mit Wasser angerührt, die Rösti auch vorgefertigte TK-Ware, Anzahl der Matjes war zu wenig, der Wirsing war total verkocht und beim ""Chef Spezial"" suchte man die Kapern und das Ei vergeblich."	['(FOOD, NEGATIVE)', '(FOOD, NEGATIVE)', '(FOOD, NEGATIVE)', '(FOOD, NEGATIVE)', '(FOOD, NEGATIVE)']	"['(FOOD, NEGATIVE, ""Wirsing"")', '(FOOD, NEGATIVE, ""Chef Spezial"")', '(FOOD, NEGATIVE, ""Anzahl der Matjes"")', '(FOOD, NEGATIVE, ""Rösti"")', '(FOOD, NEGATIVE, ""Kartoffelpüree"")']"
1031	Flinker, freundlicher, zugewandter Service, was für mich inzwischen neben der Qualität der Speisen ein wichtiges Kriterium ist.	['(SERVICE, POSITIVE)', '(FOOD, POSITIVE)']	"['(SERVICE, POSITIVE, ""Service"")', '(FOOD, POSITIVE, ""Speisen"")']"
1033	Das Menü begrenzt sich zwar „nur“ auf Schnitzel, diese sind jedoch dafür geschmacklich hervorragend.	['(FOOD, POSITIVE)']	"['(FOOD, POSITIVE, ""Schnitzel"")']"
1039	Auch meine Frau war mit dem Wiener Schnitzel nicht ganz zufrieden.	['(FOOD, NEGATIVE)']	"['(FOOD, NEGATIVE, ""Wiener Schnitzel"")']"
1045	Das Essen wird auf heißen Tellern serviert, ist frisch und sehr lecker.	['(FOOD, POSITIVE)']	"['(FOOD, POSITIVE, ""Essen"")']"
1048	Das LOC für 18,60€ Ist dermaßen überbraten, dass das Fleisch trocken, hart und kaum zu schneiden war.	['(FOOD, NEGATIVE)', '(PRICE, NEGATIVE)']	"['(FOOD, NEGATIVE, ""Fleisch"")', '(PRICE, NEGATIVE, ""LOC"")']"
1052	Ein Restaurant mit einer tollen Einrichtung.	['(AMBIENCE, POSITIVE)']	"['(AMBIENCE, POSITIVE, ""Einrichtung"")']"
1061	Das Essen war auch nur ok, für den Preis eine Frechheit.	['(FOOD, NEUTRAL)', '(PRICE, NEGATIVE)']	"['(FOOD, NEUTRAL, ""Essen"")', '(PRICE, NEGATIVE, ""Essen"")']"
1064	Die Bedienung war sehr freundlich und aufmerksam.	['(SERVICE, POSITIVE)']	"['(SERVICE, POSITIVE, ""Bedienung"")']"
1065	Das Steak, das wir bestellten, war einfach himmlisch - perfekt zubereitet und unglaublich zart.	['(FOOD, POSITIVE)']	"['(FOOD, POSITIVE, ""Steak"")']"
1074	Pancakes, Brot, Brötchen, Kuchen, Müsli, Joghurt, Säfte, Tee, Kaffee, Wurst, Käse, Mett, Eier, Bacon, Würstchen usw. Einfach klasse und wenn man einen Platz an der LOC bekommt, umso schöner.	['(FOOD, POSITIVE)', '(FOOD, POSITIVE)', '(FOOD, POSITIVE)', '(FOOD, POSITIVE)', '(FOOD, POSITIVE)', '(FOOD, POSITIVE)', '(FOOD, POSITIVE)', '(FOOD, POSITIVE)', '(FOOD, POSITIVE)', '(FOOD, POSITIVE)', '(FOOD, POSITIVE)', '(FOOD, POSITIVE)', '(FOOD, POSITIVE)', '(FOOD, POSITIVE)', '(FOOD, POSITIVE)', '(AMBIENCE, POSITIVE)']	"['(FOOD, POSITIVE, ""Pancakes"")', '(FOOD, POSITIVE, ""Brot"")', '(FOOD, POSITIVE, ""Brötchen"")', '(FOOD, POSITIVE, ""Kuchen"")', '(FOOD, POSITIVE, ""Müsli"")', '(FOOD, POSITIVE, ""Joghurt"")', '(FOOD, POSITIVE, ""Säfte"")', '(FOOD, POSITIVE, ""Tee"")', '(FOOD, POSITIVE, ""Kaffee"")', '(FOOD, POSITIVE, ""Wurst"")', '(FOOD, POSITIVE, ""Käse"")', '(FOOD, POSITIVE, ""Mett"")', '(FOOD, POSITIVE, ""Eier"")', '(FOOD, POSITIVE, ""Bacon"")', '(FOOD, POSITIVE, ""Würstchen"")', '(AMBIENCE, POSITIVE, ""Platz an der LOC"")']"
1078	Waren zudem vom innerstädtischen fairen Preis überrascht.	['(PRICE, POSITIVE)']	"['(PRICE, POSITIVE, ""Preis"")']"
1084	Man sitzt draußen sehr schön auf der Terrasse unter alten Bäumen.	['(AMBIENCE, POSITIVE)']	"['(AMBIENCE, POSITIVE, ""Terrasse unter alten Bäumen"")']"
1098	Die Crew (alle im gleichen Outfit - alle sprechen italienisch mit den Gästen) soll den Kunden das Gefühl vermitteln wirklich in LOC zu sein…ähnlich kennen wir das aus LOC…hierfür würde ich für die schauspielerische Leistung glatt 3 Punkte vergeben.	['(SERVICE, NEUTRAL)']	"['(SERVICE, NEUTRAL, ""Crew"")']"
1099	Die Käsespätzle haben leider keinen Käse gesehen.	['(FOOD, NEGATIVE)']	"['(FOOD, NEGATIVE, ""Käsespätzle"")']"
1103	Die Vorspeise (rote Bete) war sehr lecker.	['(FOOD, POSITIVE)']	"['(FOOD, POSITIVE, ""Vorspeise (rote Bete)"")']"
1108	Die westfälische Küche, Zwiebelfleisch, und der Rheinische Sauerbraten überzeugen geschmacklich in jeder Hinsicht.	['(FOOD, POSITIVE)', '(FOOD, POSITIVE)', '(FOOD, POSITIVE)']	"['(FOOD, POSITIVE, ""Küche"")', '(FOOD, POSITIVE, ""Zwiebelfleisch"")', '(FOOD, POSITIVE, ""Sauerbraten"")']"
1111	Die Preise sind sehr gehoben, daher wird eher kein regelmäßiger Besuch resultieren.	['(PRICE, NEGATIVE)']	"['(PRICE, NEGATIVE, ""Preise"")']"
1116	Die Bedienung war sehr nett und zuvor kommend.	['(SERVICE, POSITIVE)']	"['(SERVICE, POSITIVE, ""Bedienung"")']"
1117	Sehr freundliche Bedienung.	['(SERVICE, POSITIVE)']	"['(SERVICE, POSITIVE, ""Bedienung"")']"
1118	Sehr leckeres Essen in einem gemütlichen Ambiente.	['(FOOD, POSITIVE)', '(AMBIENCE, POSITIVE)']	"['(FOOD, POSITIVE, ""Essen"")', '(AMBIENCE, POSITIVE, ""Ambiente"")']"
1122	Wir werden das Restaurant sicherlich noch einige Male besuchen.	['(GENERAL-IMPRESSION, POSITIVE)']	"['(GENERAL-IMPRESSION, POSITIVE, ""Restaurant"")']"
1123	Anschließend war die Bedienung völlig mit jeglicher Weinempfehlung überfordert.	['(SERVICE, NEGATIVE)']	"['(SERVICE, NEGATIVE, ""Bedienung"")']"
1126	Die Speisen sind türkische Standard Küche etwas über dem Durchschnitt.	['(FOOD, POSITIVE)']	"['(FOOD, POSITIVE, ""Speisen"")']"
1128	Service und Essen sind hervorragend.	['(SERVICE, POSITIVE)', '(FOOD, POSITIVE)']	"['(SERVICE, POSITIVE, ""Service"")', '(FOOD, POSITIVE, ""Essen"")']"
1130	Authentisches griechisches Essen für einen super Preis.	['(FOOD, POSITIVE)', '(PRICE, POSITIVE)']	"['(FOOD, POSITIVE, ""Essen"")', '(PRICE, POSITIVE, ""Essen"")']"
1132	Wir haben uns sehr wohl gefühlt , tolle Atmosphäre !	['(AMBIENCE, POSITIVE)']	"['(AMBIENCE, POSITIVE, ""Atmosphäre"")']"
1134	Der Service war auch erstklassig und das Personal war sehr freundlich.	['(SERVICE, POSITIVE)', '(SERVICE, POSITIVE)']	"['(SERVICE, POSITIVE, ""Service"")', '(SERVICE, POSITIVE, ""Personal"")']"
1137	Mitten in der LOC umgeben von einer bunten Sammlung internationaler Speiselokale sticht eine große, gepflegte Terrasse hervor.	['(AMBIENCE, POSITIVE)']	"['(AMBIENCE, POSITIVE, ""Terrasse"")']"
1138	Ein Steakhouse ohne Ofenkartoffel ist an Absurdität nicht zu überbieten!	['(GENERAL-IMPRESSION, NEGATIVE)']	"['(GENERAL-IMPRESSION, NEGATIVE, ""Steakhouse"")']"
1139	Nette Kellnerinnen und Kellner in nettem Outfit, mit Gatsby-Mütze und Hosenträger – also: Ich habe mich wohlgefühlt.	['(SERVICE, POSITIVE)', '(SERVICE, POSITIVE)']	"['(SERVICE, POSITIVE, ""Kellnerinnen"")', '(SERVICE, POSITIVE, ""Kellner"")']"
1143	Ambiente und Essen sind sehr stimmig.	['(FOOD, POSITIVE)', '(AMBIENCE, POSITIVE)']	"['(FOOD, POSITIVE, ""Essen"")', '(AMBIENCE, POSITIVE, ""Ambiente"")']"
1154	Ja, die Soße ist lecker.	['(FOOD, POSITIVE)']	"['(FOOD, POSITIVE, ""Soße"")']"
1175	Beim Thai mixed Starter fehlten unkommentiert zwei auf der Speisekarte angekündigte Komponenten.	['(FOOD, NEGATIVE)']	"['(FOOD, NEGATIVE, ""Thai mixed Starter"")']"
