id	text	labels	labels_phrases
1179	Die Bedienung war freundlich, das war aber auch das einzig positive.	['(SERVICE, POSITIVE)']	"['(SERVICE, POSITIVE, ""Bedienung"")']"
1183	Leider war das Essen nur sehr durchschnittlich.	['(FOOD, NEUTRAL)']	"['(FOOD, NEUTRAL, ""Essen"")']"
1184	Bin total enttäuscht dieses Restaurant zu so einen besonderen Tag rausgesucht zu haben.	['(GENERAL-IMPRESSION, NEGATIVE)']	"['(GENERAL-IMPRESSION, NEGATIVE, ""Restaurant"")']"
1185	Das Eis dazu war zu dominant.	['(FOOD, NEGATIVE)']	"['(FOOD, NEGATIVE, ""Eis"")']"
1187	Negatives Highlight war die verbale Begegnung mit dem Chef des Hauses.	['(SERVICE, NEGATIVE)']	"['(SERVICE, NEGATIVE, ""Chef"")']"
1196	Während die Salsiccia noch in Ordnung war, war die Pizza Gamberetti komplett trocken.	['(FOOD, NEUTRAL)', '(FOOD, NEGATIVE)']	"['(FOOD, NEUTRAL, ""Salsiccia"")', '(FOOD, NEGATIVE, ""Pizza Gamberetti"")']"
1200	Das Essen war guter Standard.	['(FOOD, POSITIVE)']	"['(FOOD, POSITIVE, ""Essen"")']"
1208	Meine Spaghetti waren das Allerletzte… so schlecht habe ich noch nie gegessen.	['(FOOD, NEGATIVE)']	"['(FOOD, NEGATIVE, ""Spaghetti"")']"
1210	Wagner muss man mögen............die Kellner sind schon seit mehr als 20 Jahren die gleichen und man muss Sie mögen.	['(SERVICE, POSITIVE)', '(GENERAL-IMPRESSION, POSITIVE)']	"['(SERVICE, POSITIVE, ""Kellner"")', '(GENERAL-IMPRESSION, POSITIVE, ""Wagner"")']"
1216	Wir hatten eine sehr freundliche Bedienung.	['(SERVICE, POSITIVE)']	"['(SERVICE, POSITIVE, ""Bedienung"")']"
1227	Ein Service der absoluten Spitzenklasse, so extrem aufmerksam und freundlich, wie es heute nur noch selten anzutreffen ist.	['(SERVICE, POSITIVE)']	"['(SERVICE, POSITIVE, ""Service"")']"
1233	Toller Service, schnelle und aufmerksame Bedienung.	['(SERVICE, POSITIVE)', '(SERVICE, POSITIVE)']	"['(SERVICE, POSITIVE, ""Service"")', '(SERVICE, POSITIVE, ""Bedienung"")']"
1236	!Dieses Lokal können wir sehr guten Gewissens nur empfehlen (und wir empfehlen nur selten Restaurants).	['(GENERAL-IMPRESSION, POSITIVE)']	"['(GENERAL-IMPRESSION, POSITIVE, ""Lokal"")']"
1241	Am LOC gelegen, wird hier leckeres Bier und zünftiges Essen serviert.	['(FOOD, POSITIVE)', '(FOOD, POSITIVE)']	"['(FOOD, POSITIVE, ""Bier"")', '(FOOD, POSITIVE, ""Essen"")']"
1252	Auch das Kalbsschnitzel mit warmen Kartoffel-Gurkensalat sehr schön auf einem Holzbrett und einem Töpfchen serviert war sehr lecker.	['(FOOD, POSITIVE)']	"['(FOOD, POSITIVE, ""Kalbsschnitzel mit warmen Kartoffel-Gurkensalat"")']"
1258	Das Lokal war trotz Wochenende wirklich schlecht besucht, so hoch wie ich die Preise in Erinnerung hatte, waren sie aber gar nicht.	['(PRICE, NEUTRAL)']	"['(PRICE, NEUTRAL, ""Preise"")']"
1264	Mitarbeiter unterhalten sich an der Küchentheke ….. macht nicht den besten Eindruck!	['(SERVICE, NEGATIVE)']	"['(SERVICE, NEGATIVE, ""Mitarbeiter"")']"
1272	Auch wenn das Ambiente nicht so ansprechend war, hat uns doch das Konzept und die Frische der Speisen überzeugt.	['(AMBIENCE, NEGATIVE)', '(FOOD, POSITIVE)']	"['(AMBIENCE, NEGATIVE, ""Ambiente"")', '(FOOD, POSITIVE, ""Speisen"")']"
1289	Parkplätze sind ausreichend vorhanden.	['(AMBIENCE, POSITIVE)']	"['(AMBIENCE, POSITIVE, ""Parkplätze"")']"
1291	Hatten vor Wochen reserviert...der zugewiesene Tisch war wirklich schlecht als wir darauf hingewiesen haben hat man uns einen noch schlechteren Tisch zugewiesen obwohl das Restaurant ziemlich leer war.	['(AMBIENCE, NEGATIVE)', '(AMBIENCE, NEGATIVE)']	"['(AMBIENCE, NEGATIVE, ""Tisch"")', '(AMBIENCE, NEGATIVE, ""Tisch"")']"
1292	LOC hat im laufe der Zeit nachgelassen.	['(GENERAL-IMPRESSION, NEGATIVE)']	"['(GENERAL-IMPRESSION, NEGATIVE, ""LOC"")']"
1294	Das war wirklich schade und hier stimmt das Preis-Leistungs-Verhältnis gar nicht.	['(PRICE, NEGATIVE)']	"['(PRICE, NEGATIVE, ""Preis-Leistungs-Verhältnis"")']"
1301	Eine Haxe für EUR 26,50 ist schon preislich ambitioniert.	['(PRICE, NEGATIVE)']	"['(PRICE, NEGATIVE, ""Haxe"")']"
1324	Der Kartoffelsalat war nicht mehr so gut.	['(FOOD, NEGATIVE)']	"['(FOOD, NEGATIVE, ""Kartoffelsalat"")']"
1330	Highlight: Aufmerksamkeit der Bedienung Marco.	['(SERVICE, POSITIVE)']	"['(SERVICE, POSITIVE, ""Marco"")']"
1343	Das Personal war herzlich und aufmerksam.	['(SERVICE, POSITIVE)']	"['(SERVICE, POSITIVE, ""Personal"")']"
1348	Meinen Vorrednern kann ich mich dahingehend anschließen, dass die bayerische Küche gut und das Augustiner -Bier sehr gepflegt ist.	['(FOOD, POSITIVE)', '(FOOD, POSITIVE)']	"['(FOOD, POSITIVE, ""Küche"")', '(FOOD, POSITIVE, ""Augustiner -Bier"")']"
1352	Wir können das Restaurant auf jeden Fall empfehlen.	['(GENERAL-IMPRESSION, POSITIVE)']	"['(GENERAL-IMPRESSION, POSITIVE, ""Restaurant"")']"
1353	Beim Bezahlen gaben wir dem Kellner dann Trinkgeld, was scheinbar nicht ausreichend war, weil er uns mit den Worten „ach heute ist nicht mehr drin?“ verabschiedete.	['(SERVICE, NEGATIVE)']	"['(SERVICE, NEGATIVE, ""Kellner"")']"
1357	Kleines Lokal mit unglaublich guter Küche !	['(FOOD, POSITIVE)']	"['(FOOD, POSITIVE, ""Küche"")']"
1367	Auch Getränke überteuert.	['(PRICE, NEGATIVE)']	"['(PRICE, NEGATIVE, ""Getränke"")']"
1368	Klasse Laden super sympathische Kellner und eine nette Atmosphäre.	['(GENERAL-IMPRESSION, POSITIVE)', '(SERVICE, POSITIVE)', '(AMBIENCE, POSITIVE)']	"['(GENERAL-IMPRESSION, POSITIVE, ""Laden"")', '(SERVICE, POSITIVE, ""Kellner"")', '(AMBIENCE, POSITIVE, ""Atmosphäre"")']"
1371	"Sehr positiv überzeugt von ""meinen"" beiden Kellnerinnen Lena und Ihre Ausbilderin Andrea."	['(SERVICE, POSITIVE)', '(SERVICE, POSITIVE)']	"['(SERVICE, POSITIVE, ""Lena"")', '(SERVICE, POSITIVE, ""Andrea"")']"
1382	Bis endlich die Rechnung kam, dauerte es wieder ca.30min.	['(SERVICE, NEGATIVE)']	"['(SERVICE, NEGATIVE, ""Rechnung"")']"
1396	und wir einen wunderbaren Abend mit extrem leckerem und einfallsreichen Essen verbrachten!	['(FOOD, POSITIVE)']	"['(FOOD, POSITIVE, ""Essen"")']"
1401	Das Fleisch des Brauhaustellers war ungenießbar!	['(FOOD, NEGATIVE)']	"['(FOOD, NEGATIVE, ""Fleisch"")']"
1425	Nudelauflauf hat leider auch nach wenig geschmeckt.	['(FOOD, NEGATIVE)']	"['(FOOD, NEGATIVE, ""Nudelauflauf"")']"
1428	Der Typ sagte zu uns, dass er bestimmen würde, welcher Tisch frei ist und welcher nicht.	['(SERVICE, NEGATIVE)']	"['(SERVICE, NEGATIVE, ""Typ"")']"
1431	Für das Ambiente 4 von 5 Sternen- man kann nichts aussetzten, ist halt Geschmackssache.	['(AMBIENCE, POSITIVE)']	"['(AMBIENCE, POSITIVE, ""Ambiente"")']"
1438	Das Personal ist leicht arrogant und nicht besonders freundlich.	['(SERVICE, NEGATIVE)']	"['(SERVICE, NEGATIVE, ""Personal"")']"
1440	Großartige Gerichte, kreiert mit besten Produkten, auch aus der Region; delikat, gradlinig, auf hohem Niveau.	['(FOOD, POSITIVE)', '(FOOD, POSITIVE)']	"['(FOOD, POSITIVE, ""Gerichte"")', '(FOOD, POSITIVE, ""Produkten"")']"
1441	Das Terrassenambiente war eine Katastrophe, viel zu eng alles und viel zu laut.	['(AMBIENCE, NEGATIVE)']	"['(AMBIENCE, NEGATIVE, ""Terrassenambiente"")']"
1444	"Pommes ok beim Schnitzel benötigt man dringend etwas zu trinken.... viel zu trocken 3 Pilze in der ""sauce"" eher Suppe."	['(FOOD, NEUTRAL)', '(FOOD, NEGATIVE)', '(FOOD, NEGATIVE)']	"['(FOOD, NEUTRAL, ""Pommes"")', '(FOOD, NEGATIVE, ""Schnitzel"")', '(FOOD, NEGATIVE, ""sauce"")']"
1449	Die Milzwurst war hart und die Panier klebte als dünne Schicht am Produkt.	['(FOOD, NEGATIVE)', '(FOOD, NEGATIVE)']	"['(FOOD, NEGATIVE, ""Milzwurst"")', '(FOOD, NEGATIVE, ""Panier"")']"
1459	Beim Schweinebraten hat die Würze gefehlt, der dazugehörige Salat war fantastisch, die Kruste auch, der Kartoffelknödel war essbar, der Semmelknödel weniger.	['(FOOD, NEGATIVE)', '(FOOD, POSITIVE)', '(FOOD, POSITIVE)', '(FOOD, POSITIVE)', '(FOOD, NEGATIVE)']	"['(FOOD, NEGATIVE, ""Schweinebraten"")', '(FOOD, POSITIVE, ""Salat"")', '(FOOD, POSITIVE, ""Kruste"")', '(FOOD, POSITIVE, ""Kartoffelknödel"")', '(FOOD, NEGATIVE, ""Semmelknödel"")']"
1462	Der junge Service ist äußerst freundlich, erklärt sehr angenehm und macht seinen Job gerne.	['(SERVICE, POSITIVE)']	"['(SERVICE, POSITIVE, ""Service"")']"
1470	Entspanntes Ambiente, auch die Grüße aus der Küche sowie Pré- und Postdesert waren unglaublich lecker und besonders!	['(AMBIENCE, POSITIVE)', '(FOOD, POSITIVE)', '(FOOD, POSITIVE)']	"['(AMBIENCE, POSITIVE, ""Ambiente"")', '(FOOD, POSITIVE, ""Grüße aus der Küche"")', '(FOOD, POSITIVE, ""Pré- und Postdesert"")']"
1475	Allerdings ist das Restaurant kein Schnäppchen.	['(PRICE, NEGATIVE)']	"['(PRICE, NEGATIVE, ""Restaurant"")']"
1482	Mehrere sehr junge Kellnerinnen waren im Außenbereich, nur war es schwer, eine Bestellung abzugeben, da sich niemand zuständig fühlte.	['(SERVICE, NEGATIVE)']	"['(SERVICE, NEGATIVE, ""Kellnerinnen"")']"
1484	Sorry, aber Hunde im Restaurant gehen garnicht.	['(AMBIENCE, NEGATIVE)']	"['(AMBIENCE, NEGATIVE, ""Hunde im Restaurant"")']"
1485	Der Fisch war sehr durch, welches vom Kellner ohne Reaktion registriert wurde!	['(SERVICE, NEGATIVE)', '(SERVICE, NEGATIVE)']	"['(SERVICE, NEGATIVE, ""Fisch"")', '(SERVICE, NEGATIVE, ""Kellner"")']"
1490	Die schlechteste Haxe, die ich in meinem Leben gegessen habe.	['(FOOD, NEGATIVE)']	"['(FOOD, NEGATIVE, ""Haxe"")']"
6	Das Personal war wirklich sehr nett.	['(SERVICE, POSITIVE)']	"['(SERVICE, POSITIVE, ""Personal"")']"
18	Sehr freundlich, auch zu unserem Hund.	['(SERVICE, POSITIVE)']	"['(SERVICE, POSITIVE, ""freundlich"")']"
23	Absolut überzogen sind die Weinpreise -für ein 0.2 Glas zwischen 6 und 12 !	['(PRICE, NEGATIVE)']	"['(PRICE, NEGATIVE, ""Weinpreise"")']"
26	Als die Hauptspeisen kamen waren wir voll zufrieden, die Steaks waren auf den Punkt gebraten und die Beilagen schmackhaft und völlig ausreichend.	['(FOOD, POSITIVE)', '(FOOD, POSITIVE)']	"['(FOOD, POSITIVE, ""Steaks"")', '(FOOD, POSITIVE, ""Beilagen"")']"
34	Die Speisen, das Kaffe-Angebot sind sehr wertig.	['(FOOD, POSITIVE)', '(FOOD, POSITIVE)']	"['(FOOD, POSITIVE, ""Speisen"")', '(FOOD, POSITIVE, ""Kaffe-Angebot"")']"
41	Eine normale Unterhaltung ist aufgrund der Lautstärke, bei vollen Lokal (Und ich glaube das Haus ist immer voll) kaum möglich.	['(AMBIENCE, NEGATIVE)']	"['(AMBIENCE, NEGATIVE, ""Lautstärke"")']"
42	Sehr leckeres Essen und aufmerksames und stets freundliches Personal.	['(FOOD, POSITIVE)', '(SERVICE, POSITIVE)']	"['(FOOD, POSITIVE, ""Essen"")', '(SERVICE, POSITIVE, ""Personal"")']"
60	Die Speisekarte ist überschaubar, bietet keine besonderen Leckereien.	['(FOOD, NEGATIVE)']	"['(FOOD, NEGATIVE, ""Speisekarte"")']"
65	Einzig die Portionen beim Essen sind mittel.	['(FOOD, NEUTRAL)']	"['(FOOD, NEUTRAL, ""Portionen beim Essen"")']"
66	Freundliche Bedienung.	['(SERVICE, POSITIVE)']	"['(SERVICE, POSITIVE, ""Bedienung"")']"
77	Der georderte vegane Bagel war köstlich was wir von den lieblos angerichteten Käsespätzle leider nicht behaupten konnten.	['(FOOD, NEGATIVE)', '(FOOD, POSITIVE)']	"['(FOOD, NEGATIVE, ""Käsespätzle"")', '(FOOD, POSITIVE, ""Bagel"")']"
91	Insgesamt ein alteingesessenes Lokal das man empfehlen kann.	['(GENERAL-IMPRESSION, POSITIVE)']	"['(GENERAL-IMPRESSION, POSITIVE, ""Lokal"")']"
93	Das Essen und der Service war ausgesprochen gut.	['(FOOD, POSITIVE)', '(SERVICE, POSITIVE)']	"['(FOOD, POSITIVE, ""Essen"")', '(SERVICE, POSITIVE, ""Service"")']"
106	Absolut schlechte Küche!	['(FOOD, NEGATIVE)']	"['(FOOD, NEGATIVE, ""Küche"")']"
107	"Diese ""Kantine""war wohl nichts für uns."	['(FOOD, NEGATIVE)']	"['(FOOD, NEGATIVE, ""Kantine"")']"
119	Das Essen ist ein Traum 😍	['(FOOD, POSITIVE)']	"['(FOOD, POSITIVE, ""Essen"")']"
126	Das Essen ist mega.	['(FOOD, POSITIVE)']	"['(FOOD, POSITIVE, ""Essen"")']"
128	Preis Leistung sind hier einfach gar nicht stimmig und man fühlt sich dann doch ein bisschen über den Tisch gezogen.	['(PRICE, NEGATIVE)']	"['(PRICE, NEGATIVE, ""Preis Leistung"")']"
129	Die Gerichte zart, aber herzhaft gewürzt rundeten den Abend ab.	['(FOOD, POSITIVE)']	"['(FOOD, POSITIVE, ""Gerichte"")']"
134	Der dazugehörige Krautsalat, welcher überhaupt keiner war, war ungenießbar.	['(FOOD, NEGATIVE)']	"['(FOOD, NEGATIVE, ""Krautsalat"")']"
141	Beim Essen wurden wir jedoch ziemlich enttäuscht.	['(FOOD, NEGATIVE)']	"['(FOOD, NEGATIVE, ""Essen"")']"
151	Beim Cheeseburger war nur eine Spur Cheese aufgelegt.	['(FOOD, NEGATIVE)', '(FOOD, NEGATIVE)']	"['(FOOD, NEGATIVE, ""Cheeseburger"")', '(FOOD, NEGATIVE, ""Cheese"")']"
159	Um dies nochmals zu verdeutlichen, zeigte es sich durch Aussagen auf portugiesisch, wie schnell sie die Gäste loswerden möchten.	['(SERVICE, NEGATIVE)']	"['(SERVICE, NEGATIVE, ""Aussagen auf portugiesisch"")']"
174	Ich würde das Lokal wieder empfehlen.	['(GENERAL-IMPRESSION, POSITIVE)']	"['(GENERAL-IMPRESSION, POSITIVE, ""Lokal"")']"
183	Im Sommer werden wir auf der netten Terrasse noch einmal die RESTAURANT_NAME besuchen.	['(AMBIENCE, POSITIVE)']	"['(AMBIENCE, POSITIVE, ""Terrasse"")']"
187	Die Beilagen hingegen waren super.	['(FOOD, POSITIVE)']	"['(FOOD, POSITIVE, ""Beilagen"")']"
191	Prima Service und sehr leckeres Essen.	['(SERVICE, POSITIVE)', '(FOOD, POSITIVE)']	"['(SERVICE, POSITIVE, ""Service"")', '(FOOD, POSITIVE, ""Essen"")']"
192	"Die Live-Musik durch einen ""Alleinunterhalter"" ist auf Pop getrimmt (mit Gesang) und viel zu laut."	['(AMBIENCE, NEGATIVE)']	"['(AMBIENCE, NEGATIVE, ""Live-Musik"")']"
197	LOC ist unterer Durchschnitt.	['(GENERAL-IMPRESSION, NEGATIVE)']	"['(GENERAL-IMPRESSION, NEGATIVE, ""LOC"")']"
202	Sehr schönes und gemütliches Restaurant.	['(AMBIENCE, POSITIVE)']	"['(AMBIENCE, POSITIVE, ""Restaurant"")']"
212	Auch wenn mich ein Restaurant schonmal enttäuscht hat, gebe ich gerne eine zweite Chance.	['(GENERAL-IMPRESSION, NEGATIVE)']	"['(GENERAL-IMPRESSION, NEGATIVE, ""Restaurant"")']"
215	Eine innovative Küche eines engagierten Kochs, wobei man es mögen muss, dass in JEDEM Gang deutliche Fruchtnoten zumindest im Hintergrund, wenn nicht im Vordergrund stehen.	['(FOOD, POSITIVE)', '(SERVICE, POSITIVE)']	"['(FOOD, POSITIVE, ""Küche"")', '(SERVICE, POSITIVE, ""Kochs"")']"
226	Der Lachs war gut, auf den Punkt gegrillt, daran gab es nicht auszusetzen!	['(FOOD, POSITIVE)']	"['(FOOD, POSITIVE, ""Lachs"")']"
241	Alle Gerichte haben total gut geschmeckt, nicht überwürzt und die Portionen genau richtig.	['(FOOD, POSITIVE)', '(FOOD, POSITIVE)']	"['(FOOD, POSITIVE, ""Gerichte"")', '(FOOD, POSITIVE, ""Portionen"")']"
245	Die Speisen sind in Ordnung.	['(FOOD, NEUTRAL)']	"['(FOOD, NEUTRAL, ""Speisen"")']"
257	Der Keller hat uns durch seine Art den Abend versaut und unsere Tradition endet somit und wir suchen ein neues Lokal.	['(SERVICE, NEGATIVE)']	"['(SERVICE, NEGATIVE, ""Keller"")']"
262	Wir waren hier essen und mit der Qualität des Essens wirklich super zufrieden.	['(FOOD, POSITIVE)']	"['(FOOD, POSITIVE, ""Essens"")']"
268	Bedienung sehr freundlich und flink, Ambiente sehr münchnerisch, gemütlich mit schönem Blick auf den LOC.	['(SERVICE, POSITIVE)', '(AMBIENCE, POSITIVE)', '(AMBIENCE, POSITIVE)']	"['(SERVICE, POSITIVE, ""Bedienung"")', '(AMBIENCE, POSITIVE, ""Ambiente"")', '(AMBIENCE, POSITIVE, ""Blick auf den LOC"")']"
271	Bratkartoffeln, Sauerkraut, Kartoffelstampf, Schnitzel, Grüne Soße - alles sehr lecker.	['(FOOD, POSITIVE)', '(FOOD, POSITIVE)', '(FOOD, POSITIVE)', '(FOOD, POSITIVE)', '(FOOD, POSITIVE)']	"['(FOOD, POSITIVE, ""Bratkartoffeln"")', '(FOOD, POSITIVE, ""Kartoffelstampf"")', '(FOOD, POSITIVE, ""Sauerkraut"")', '(FOOD, POSITIVE, ""Schnitzel"")', '(FOOD, POSITIVE, ""Grüne Soße"")']"
274	Das Altbier ist weniger süffig als anderswo und daher besser durstlöschend.	['(FOOD, NEGATIVE)']	"['(FOOD, NEGATIVE, ""Altbier"")']"
282	Meine bisherigen sehr guten Eindrücke von diesem Restaurant wurden am frühen Freitagabend sehr getrübt durch ein absolut unakzeptables, aufgewärmtes Essen von der Tageskarte: Trockener Kap-Seehecht, gekochte Salzkartoffeln, wo sich schon eine Kruste gebildet hatte.	['(FOOD, NEGATIVE)', '(FOOD, NEGATIVE)', '(FOOD, NEGATIVE)']	"['(FOOD, NEGATIVE, ""Essen"")', '(FOOD, NEGATIVE, ""Kap-Seehecht"")', '(FOOD, NEGATIVE, ""Salzkartoffeln"")']"
283	Preise für das Kölsch (0,2 l) empfinde ich etwas übertrieben.	['(PRICE, NEGATIVE)']	"['(PRICE, NEGATIVE, ""Kölsch"")']"
284	Tolle Location; super freundliches und aufmerksames Personal; gutes Essen und Bier; auch ohne Reservierung haben wir am Samstagabend einen Tisch bekommen	['(AMBIENCE, POSITIVE)', '(SERVICE, POSITIVE)', '(FOOD, POSITIVE)', '(FOOD, POSITIVE)']	"['(AMBIENCE, POSITIVE, ""Location"")', '(SERVICE, POSITIVE, ""Personal"")', '(FOOD, POSITIVE, ""Essen"")', '(FOOD, POSITIVE, ""Bier"")']"
298	Sehr gute Kohlparty, Essen ausgezeichnet, DJ spitze.	['(FOOD, POSITIVE)', '(AMBIENCE, POSITIVE)']	"['(FOOD, POSITIVE, ""Essen"")', '(AMBIENCE, POSITIVE, ""DJ"")']"
300	Das Kalbsschnitzel mit 19EUR nicht teuer aber absolut lieblos und dahin ger...zt.	['(PRICE, NEUTRAL)', '(FOOD, NEGATIVE)']	"['(PRICE, NEUTRAL, ""Kalbsschnitzel"")', '(FOOD, NEGATIVE, ""Kalbsschnitzel"")']"
301	Der Teller ist gut gefüllt, fritierte Sardinen, gegrillte Paprika, Datteln in Speck und Ziegenkäse im Speck, nichts Überraschendes, nichts Außergewöhnliches.	['(FOOD, NEUTRAL)', '(FOOD, NEUTRAL)', '(FOOD, NEUTRAL)', '(FOOD, NEUTRAL)']	"['(FOOD, NEUTRAL, ""Sardinen"")', '(FOOD, NEUTRAL, ""Paprika"")', '(FOOD, NEUTRAL, ""Datteln in Speck"")', '(FOOD, NEUTRAL, ""Ziegenkäse im Speck"")']"
303	Schade ums Geld	['(PRICE, NEGATIVE)']	"['(PRICE, NEGATIVE, ""Geld"")']"
305	Gutes Essen Schöner Spielplatz	['(FOOD, POSITIVE)', '(AMBIENCE, POSITIVE)']	"['(FOOD, POSITIVE, ""Essen"")', '(AMBIENCE, POSITIVE, ""Spielplatz"")']"
313	Sehr nette Bedienung und super Service.	['(SERVICE, POSITIVE)', '(SERVICE, POSITIVE)']	"['(SERVICE, POSITIVE, ""Bedienung"")', '(SERVICE, POSITIVE, ""Service"")']"
315	Sehr angenehme Ambiance im LOC.	['(AMBIENCE, POSITIVE)']	"['(AMBIENCE, POSITIVE, ""Ambiance"")']"
321	Ich war in der RESTAURANT_NAME mit meiner Familie und kann wirklich nur ausschließlich positiv darüber berichten.	['(GENERAL-IMPRESSION, POSITIVE)']	"['(GENERAL-IMPRESSION, POSITIVE, ""RESTAURANT_NAME"")']"
322	Unsere Bedienung an dem Abend war super und fix.	['(SERVICE, POSITIVE)']	"['(SERVICE, POSITIVE, ""Bedienung"")']"
326	Innovative Chefs mit intensivem Internet-Marketing; anfangs dachte ich, fast „zuviel des Guten“, was wird da auf mich zukommen.	['(SERVICE, POSITIVE)']	"['(SERVICE, POSITIVE, ""Chefs"")']"
335	Das Essen schmeckt einfach nur Bombe, so etwas leckeres, Megaaaa!	['(FOOD, POSITIVE)']	"['(FOOD, POSITIVE, ""Essen"")']"
341	Schon mit der Reservierung gab es Probleme.	['(SERVICE, NEGATIVE)']	"['(SERVICE, NEGATIVE, ""Reservierung"")']"
342	Allerdings mussten wir noch weitere 30 Minuten bis zur Lieferung warten.	['(SERVICE, NEGATIVE)']	"['(SERVICE, NEGATIVE, ""Lieferung"")']"
349	Der Schweinsbraten war o. k., wir haben noch Knödel nachgeordert, da es für uns ein bisschen wenig war, das hat beim Personal zusätzlichen Stress ausgelöst, der Knödel kam dann aber zeitnah.	['(FOOD, NEUTRAL)']	"['(FOOD, NEUTRAL, ""Schweinsbraten"")']"
356	Besonders charmant war unser Kellner Bruno.	['(SERVICE, POSITIVE)']	"['(SERVICE, POSITIVE, ""Bruno"")']"
365	Wir waren begeistert von der Vielfalt der Gerichte auf der Karte und hatten Schwierigkeiten, uns zu entscheiden.	['(FOOD, POSITIVE)']	"['(FOOD, POSITIVE, ""Vielfalt der Gerichte auf der Karte"")']"
366	Plätze draußen in schöner Atmosphäre.	['(AMBIENCE, POSITIVE)']	"['(AMBIENCE, POSITIVE, ""Atmosphäre"")']"
374	Sehr schönes Restaurant.	['(GENERAL-IMPRESSION, POSITIVE)']	"['(GENERAL-IMPRESSION, POSITIVE, ""Restaurant"")']"
375	Der Service ist schnell und freundlich.	['(SERVICE, POSITIVE)']	"['(SERVICE, POSITIVE, ""Service"")']"
376	Als Familie sollte man seeeehr viel Geld einplanen.	['(PRICE, NEGATIVE)']	"['(PRICE, NEGATIVE, ""Geld"")']"
380	Individuelle Gerichte, liebevoll zubereitet.	['(FOOD, POSITIVE)']	"['(FOOD, POSITIVE, ""Gerichte"")']"
383	Die Hummer Suppe ein Gaumenschmaus, gefolgt vom Heilbutt, so lecker und dann das weiße Schoko Mousse- yummy 😋.	['(FOOD, POSITIVE)', '(FOOD, POSITIVE)', '(FOOD, POSITIVE)']	"['(FOOD, POSITIVE, ""Hummer Suppe"")', '(FOOD, POSITIVE, ""Heilbutt"")', '(FOOD, POSITIVE, ""Schoko Mousse"")']"
385	Super freundliches Personal !	['(SERVICE, POSITIVE)']	"['(SERVICE, POSITIVE, ""Personal"")']"
398	Auf jeden Fall ein Besuch wert, bei den Speisen ist für jeden der Tapasliebhaber etwas dabei!	['(FOOD, POSITIVE)']	"['(FOOD, POSITIVE, ""Speisen"")']"
409	Ein toller Abend mit fantastischem Essen von großartiger Qualität -die Seezunge war ein Traum- und einem super Service!	['(FOOD, POSITIVE)', '(FOOD, POSITIVE)', '(SERVICE, POSITIVE)']	"['(FOOD, POSITIVE, ""Essen"")', '(FOOD, POSITIVE, ""Seezunge"")', '(SERVICE, POSITIVE, ""Service"")']"
411	Super leckeres Essen, schönes Ambiente in zentraler Lage, tolle getöpferte Kerzenständer und ein sehr freundlicher Service.	['(FOOD, POSITIVE)', '(AMBIENCE, POSITIVE)', '(AMBIENCE, POSITIVE)', '(SERVICE, POSITIVE)']	"['(FOOD, POSITIVE, ""Essen"")', '(AMBIENCE, POSITIVE, ""Ambiente"")', '(AMBIENCE, POSITIVE, ""Kerzenständer"")', '(SERVICE, POSITIVE, ""Service"")']"
425	Das Ambiente ist auch super und für ein Bräustüberl absolut stimmig.	['(AMBIENCE, POSITIVE)']	"['(AMBIENCE, POSITIVE, ""Ambiente"")']"
440	Das Lokal war meiner Meinung nach völlig überfüllt, extrem laut, keine Unterhaltung mehr möglich.	['(AMBIENCE, NEGATIVE)']	"['(AMBIENCE, NEGATIVE, ""Lokal"")']"
448	Auf meine Reklamation hin wurde gesagt, dass der Kartoffelsalat in Ordnung sei.	['(FOOD, NEUTRAL)']	"['(FOOD, NEUTRAL, ""Kartoffelsalat"")']"
459	Nachdem das Nudelgericht meiner Frau kalt war, und wir dieses zurückgehen ließen, wollte ich nicht auch noch meinen Surf und Turf-Burger reklamieren.	['(FOOD, NEGATIVE)']	"['(FOOD, NEGATIVE, ""Nudelgericht"")']"
480	Sehr schöne Atmosphäre, guter Hauswein, freundliches Personal, haben nur was getrunken, daher kann ich Essen nicht beurteilen.	['(AMBIENCE, POSITIVE)', '(FOOD, POSITIVE)', '(SERVICE, POSITIVE)']	"['(AMBIENCE, POSITIVE, ""Atmosphäre"")', '(FOOD, POSITIVE, ""Hauswein"")', '(SERVICE, POSITIVE, ""Personal"")']"
482	Das Essen war meiner Meinung nach okay.	['(FOOD, NEUTRAL)']	"['(FOOD, NEUTRAL, ""Essen"")']"
483	Der Service im LOC war freundlich, schnell und aufmerksam.	['(SERVICE, POSITIVE)']	"['(SERVICE, POSITIVE, ""Service"")']"
493	Der Service war sehr freundlich.	['(SERVICE, POSITIVE)']	"['(SERVICE, POSITIVE, ""Service"")']"
497	Der Service rund um Jason war von vorne bis hinten zuvorkommend und das Essen erste Klasse.	['(SERVICE, POSITIVE)', '(FOOD, POSITIVE)']	"['(SERVICE, POSITIVE, ""Service rund um Jason"")', '(FOOD, POSITIVE, ""Essen"")']"
500	Wenn es mein Kaffee wäre, würde ich diesen unzufriedenen Kellner fristlos entlassen!	['(SERVICE, NEGATIVE)', '(GENERAL-IMPRESSION, NEGATIVE)']	"['(SERVICE, NEGATIVE, ""Kellner"")', '(GENERAL-IMPRESSION, NEGATIVE, ""Kaffee"")']"
503	Die Begrüßung war kühl und wirkte gezwungen und lieblos.	['(SERVICE, NEGATIVE)']	"['(SERVICE, NEGATIVE, ""Begrüßung"")']"
515	Aber das Saure Lüngerl (eine der Spezialitäten des Hauses) war so sauer, dass es leider nicht essbar war, außerdem war es lauwarm.	['(FOOD, NEGATIVE)']	"['(FOOD, NEGATIVE, ""Saure Lüngerl"")']"
530	Ein absolutes Durstessen.	['(FOOD, NEGATIVE)']	"['(FOOD, NEGATIVE, ""Durstessen"")']"
537	Gutes Bier zum günstigen Preis Halbe 3,95 aber kleine BierkarteAugustiner Schmakerl mit moderaten Preis.	['(FOOD, POSITIVE)', '(PRICE, POSITIVE)', '(PRICE, POSITIVE)']	"['(FOOD, POSITIVE, ""Bier"")', '(PRICE, POSITIVE, ""Bier"")', '(PRICE, POSITIVE, ""BierkarteAugustiner Schmakerl"")']"
538	Die Getränke waren O.K.	['(FOOD, NEUTRAL)']	"['(FOOD, NEUTRAL, ""Getränke"")']"
543	Nächste mal gehe ich lieber wieder zu Curry 36, da geht es 10 mal schneller und das Preis Leistungsverhältnis stimmt.	['(PRICE, NEGATIVE)']	"['(PRICE, NEGATIVE, ""Preis Leistungsverhältnis"")']"
547	"Die Bedienungen verteilten die Reste aus der Theke grade untereinander und wiesen meine Frage mit barschen Worten zurück: ""Es ist geschlossen!"	['(SERVICE, NEGATIVE)']	"['(SERVICE, NEGATIVE, ""Bedienungen"")']"
549	Urige Wirtschaft mit einem coolen Ambiente.	['(AMBIENCE, POSITIVE)', '(AMBIENCE, POSITIVE)']	"['(AMBIENCE, POSITIVE, ""Wirtschaft"")', '(AMBIENCE, POSITIVE, ""Ambiente"")']"
550	Sehr leckeres Essen, tolles Ambiente, guter Service - und Highlight Turmbesteigung mit Lotter-Führung.	['(FOOD, POSITIVE)', '(AMBIENCE, POSITIVE)', '(SERVICE, POSITIVE)']	"['(FOOD, POSITIVE, ""Essen"")', '(AMBIENCE, POSITIVE, ""Ambiente"")', '(SERVICE, POSITIVE, ""Service"")']"
578	Was mich diesmal echt gestört hat war der Service.	['(SERVICE, NEGATIVE)']	"['(SERVICE, NEGATIVE, ""Service"")']"
582	Ioulianos Ist super freundlich und gibt tolle Empfehlungen denen wir gerne gefolgt sind.	['(SERVICE, POSITIVE)']	"['(SERVICE, POSITIVE, ""Ioulianos"")']"
583	Wo gibt es die beste Currywurst LOC, natürlich nur hier mitten im LOC.	['(FOOD, POSITIVE)']	"['(FOOD, POSITIVE, ""Currywurst"")']"
584	Dazu kam ein extrem unfreundlicher Kellner, der die Gäste am Nachbartisch sogar aufforderte wieder zum Weihnachtsmarkt zu gehen, wenn sie einen Tee zum Aufwärem bestellen wollten.	['(SERVICE, NEGATIVE)']	"['(SERVICE, NEGATIVE, ""Kellner"")']"
588	Ausser der ersten Getränke war eine weitere Getränkebestellung quasi unmöglich da kein Servicepersonal verfügbar.	['(SERVICE, NEGATIVE)']	"['(SERVICE, NEGATIVE, ""Servicepersonal"")']"
614	Der Senf schmeckte wie billigste Industrie.	['(FOOD, NEGATIVE)']	"['(FOOD, NEGATIVE, ""Senf"")']"
616	Darauf angesprochen, machte der Kellner keinerlei Anstalten zur Nachbesserung, sondern erklärte barsch, dies käme so aus der maschinellen Zapfanlage, da könne er gar nichts machen.	['(SERVICE, NEGATIVE)']	"['(SERVICE, NEGATIVE, ""Kellner"")']"
623	Das beste aber war der Kellner Dario Bario, er war sehr freundlich und hat sich um uns gekümmert wie es sonst noch kein Kellner gemacht hat!	['(SERVICE, POSITIVE)']	"['(SERVICE, POSITIVE, ""Dario Bario"")']"
