id	text	labels	labels_phrases
172	Auch der Starter mit ein paar Scheiben Brot und Aioli war für 9€ recht dürftig.	['(FOOD, NEGATIVE)', '(FOOD, NEGATIVE)', '(FOOD, NEGATIVE)', '(PRICE, NEGATIVE)', '(PRICE, NEGATIVE)', '(PRICE, NEGATIVE)']	"['(FOOD, NEGATIVE, ""Starter"")', '(FOOD, NEGATIVE, ""Scheiben Brot"")', '(FOOD, NEGATIVE, ""Aioli"")', '(PRICE, NEGATIVE, ""Starter"")', '(PRICE, NEGATIVE, ""Scheiben Brot"")', '(PRICE, NEGATIVE, ""Aioli"")']"
186	Beide Optionen einfach unglaublich lecker.	['(FOOD, POSITIVE)']	"['(FOOD, POSITIVE, ""Optionen"")']"
190	Die Haxe war trocken und faserig, die Kruste hätte man mit dem Presslufthammer bearbeiten müssen, um sie zu zerteilen.	['(FOOD, NEGATIVE)']	"['(FOOD, NEGATIVE, ""Haxe"")']"
193	Obwohl wir deftiges Essen schätzen, haben wir es nicht gut vertragen.	['(FOOD, NEGATIVE)']	"['(FOOD, NEGATIVE, ""Essen"")']"
194	Der Service ist ok, man kennt die Gerichte und wird gut beraten.	['(SERVICE, NEUTRAL)']	"['(SERVICE, NEUTRAL, ""Service"")']"
199	Klassische Gerichte modern angerichtet.	['(FOOD, POSITIVE)']	"['(FOOD, POSITIVE, ""Gerichte"")']"
206	Das Essen war sehr lecker und kam schnell.	['(FOOD, POSITIVE)']	"['(FOOD, POSITIVE, ""Essen"")']"
209	Der Leberkäse hingegen sehr gut.	['(FOOD, POSITIVE)']	"['(FOOD, POSITIVE, ""Leberkäse"")']"
220	Einzig das Bier war geniessbar.	['(FOOD, POSITIVE)']	"['(FOOD, POSITIVE, ""Bier"")']"
222	Der Käse war meiner Meinung nach kein Bergkäse, aber egal.	['(FOOD, NEGATIVE)']	"['(FOOD, NEGATIVE, ""Käse"")']"
223	Der sogenannte Chef de Service wurde sehr laut und wiederholte sich ständig, dass wir ja schliesslich zu spät gekommen seien.	['(SERVICE, NEGATIVE)']	"['(SERVICE, NEGATIVE, ""Chef de Service"")']"
229	Frage: Warum sollen wir das Restaurant erneut auswählen bzw. anderen Gästen empfehlen?	['(GENERAL-IMPRESSION, NEGATIVE)']	"['(GENERAL-IMPRESSION, NEGATIVE, ""Restaurant"")']"
230	Sehr schöner Gastraum.	['(AMBIENCE, POSITIVE)']	"['(AMBIENCE, POSITIVE, ""Gastraum"")']"
235	Als Hauptgericht war haben ein Steinbutt bestellt aber der Fish der serviert wurde hatte vielleicht mal ein Steinbutt von weitem gesehen.	['(FOOD, NEGATIVE)']	"['(FOOD, NEGATIVE, ""Fish"")']"
242	Preis-Leistungsverhältnis sehr gut, sehr nettes und zuvorkommendes Personal	['(PRICE, POSITIVE)', '(SERVICE, POSITIVE)']	"['(PRICE, POSITIVE, ""Preis-Leistungsverhältnis"")', '(SERVICE, POSITIVE, ""Personal"")']"
244	Typisches Münchner Lokal näher LOC gut für Bayrische Küche Stimmung wie auf dem LOC	['(FOOD, POSITIVE)']	"['(FOOD, POSITIVE, ""Küche"")']"
253	Die Vorspeise (Suppe und überbackener Ziegenkäse) war leider geschmacklich kein Hit und haben den Preis keineswegs gerechtfertigt.	['(FOOD, NEGATIVE)', '(FOOD, NEGATIVE)', '(FOOD, NEGATIVE)', '(PRICE, NEGATIVE)']	"['(FOOD, NEGATIVE, ""Vorspeise"")', '(FOOD, NEGATIVE, ""Suppe"")', '(FOOD, NEGATIVE, ""Ziegenkäse"")', '(PRICE, NEGATIVE, ""Preis"")']"
256	Auf die Bitte die Tische zusammen schieben zu können wurde uns von einer der sehr netten Bedienung gesagt - Chefin hat das Verboten.	['(SERVICE, POSITIVE)']	"['(SERVICE, POSITIVE, ""Bedienung"")']"
260	Das Essen war gut und die Portionen ausreichend groß.	['(FOOD, POSITIVE)', '(FOOD, POSITIVE)']	"['(FOOD, POSITIVE, ""Essen"")', '(FOOD, POSITIVE, ""Portionen"")']"
266	Wir werden dieses Restaurant sicher nicht noch einmal besuchen.	['(GENERAL-IMPRESSION, NEGATIVE)']	"['(GENERAL-IMPRESSION, NEGATIVE, ""Restaurant"")']"
269	Getränke sowie Vorspeise und Hauptgang ließen ebenfalls nicht lange auf sich warten & speziell das Essen war über alle Maßen ausreichend und ein wahrer Genuss.	['(SERVICE, POSITIVE)', '(SERVICE, POSITIVE)', '(SERVICE, POSITIVE)', '(FOOD, POSITIVE)']	"['(SERVICE, POSITIVE, ""Getränke"")', '(SERVICE, POSITIVE, ""Vorspeise"")', '(SERVICE, POSITIVE, ""Hauptgang"")', '(FOOD, POSITIVE, ""Essen"")']"
281	Das ambiente und der Anfang waren gut, leider kann ich den Cesarsalat ohne dressing nicht weiterempfehlen, der Hauptgang war gut wie auch das dessert , kann aber für weniger Geld im LOC besser Essen, Preis Leistung hätte noch Potenzial.	['(AMBIENCE, POSITIVE)', '(FOOD, NEGATIVE)', '(FOOD, POSITIVE)', '(FOOD, POSITIVE)', '(PRICE, NEGATIVE)']	"['(AMBIENCE, POSITIVE, ""ambiente"")', '(FOOD, NEGATIVE, ""Cesarsalat ohne dressing"")', '(FOOD, POSITIVE, ""Hauptgang"")', '(FOOD, POSITIVE, ""dessert"")', '(PRICE, NEGATIVE, ""Preis Leistung"")']"
286	Von den darin aufgeführten Speisen lief uns schon das Wasser im Mund zusammen.	['(FOOD, POSITIVE)']	"['(FOOD, POSITIVE, ""Speisen"")']"
288	Preis Leistung top.	['(PRICE, POSITIVE)']	"['(PRICE, POSITIVE, ""Preis Leistung"")']"
292	Selbst unter Corona hatte das Restaurant sein Level gehalten.	['(GENERAL-IMPRESSION, POSITIVE)']	"['(GENERAL-IMPRESSION, POSITIVE, ""Restaurant"")']"
299	Das MammaMia ist ein wahrlich schönes Restaurant mit sehr angenehmer und lockerer Atmosphäre.	['(GENERAL-IMPRESSION, POSITIVE)', '(AMBIENCE, POSITIVE)']	"['(GENERAL-IMPRESSION, POSITIVE, ""MammaMia"")', '(AMBIENCE, POSITIVE, ""Atmosphäre"")']"
302	Das angesprochene Personal unfähig, sei nicht für den Tisch zuständig, wisse auch nicht wer ihn bedient.	['(SERVICE, NEGATIVE)']	"['(SERVICE, NEGATIVE, ""Personal"")']"
319	Das Essen ist immer frisch gekocht und heiss.	['(FOOD, POSITIVE)']	"['(FOOD, POSITIVE, ""Essen"")']"
329	Wir werden also schon erwartet und sofort kümmert sich der Service um unser Wohl.	['(SERVICE, POSITIVE)']	"['(SERVICE, POSITIVE, ""Service"")']"
340	Die Schnitzel war sehr lecker und auch die Soßen waren nicht pampig.	['(FOOD, POSITIVE)', '(FOOD, POSITIVE)']	"['(FOOD, POSITIVE, ""Schnitzel"")', '(FOOD, POSITIVE, ""Soßen"")']"
344	Das Essen war sehr gut (grosse Portionen).	['(FOOD, POSITIVE)']	"['(FOOD, POSITIVE, ""Essen"")']"
345	Ein Punkt Abzug für das lange Warten.	['(SERVICE, NEGATIVE)']	"['(SERVICE, NEGATIVE, ""Warten"")']"
346	Fleissiger Service.	['(SERVICE, POSITIVE)']	"['(SERVICE, POSITIVE, ""Service"")']"
353	Da passt das unverschämte Servicepersonal ideal dazu.	['(SERVICE, NEGATIVE)']	"['(SERVICE, NEGATIVE, ""Servicepersonal"")']"
367	Darüberhinaus enthielt das verwendete Fleisch ungenießbare Anteile.	['(FOOD, NEGATIVE)']	"['(FOOD, NEGATIVE, ""Fleisch"")']"
377	Leider war das Personal völlig überfordert, denn wir mußten fast 25 Minuten warten, bis jemand eine Bestellung aufnehmen konnte.	['(SERVICE, NEGATIVE)']	"['(SERVICE, NEGATIVE, ""Personal"")']"
378	Unmögliches Raumklima innerhalb.	['(AMBIENCE, NEGATIVE)']	"['(AMBIENCE, NEGATIVE, ""Raumklima"")']"
397	Dass mir zuerst eine englische Karte präsentiert wird, lasse ich der freundlichen Kellnerin gerne durchgehen.	['(SERVICE, POSITIVE)']	"['(SERVICE, POSITIVE, ""Kellnerin"")']"
401	Das Steak war hervorragend, Kartoffelstampf und Pommes normal, gut.	['(FOOD, POSITIVE)', '(FOOD, POSITIVE)', '(FOOD, POSITIVE)']	"['(FOOD, POSITIVE, ""Steak"")', '(FOOD, POSITIVE, ""Kartoffelstampf"")', '(FOOD, POSITIVE, ""Pommes"")']"
405	Wenn man das alles berücksichtigt, konnte ich mit meinem Teller sehr zufrieden sein.	['(FOOD, POSITIVE)']	"['(FOOD, POSITIVE, ""Teller"")']"
406	Sehr freundlicher Service und das Essen war qualitativ und geschmacklich sehr gut.	['(SERVICE, POSITIVE)', '(FOOD, POSITIVE)']	"['(SERVICE, POSITIVE, ""Service"")', '(FOOD, POSITIVE, ""Essen"")']"
407	Positiv zu vermerken ist die einzigartige Lage, das traditionelle Ambiente und der freundliche Service.	['(AMBIENCE, POSITIVE)', '(AMBIENCE, POSITIVE)', '(SERVICE, POSITIVE)']	"['(AMBIENCE, POSITIVE, ""Lage"")', '(AMBIENCE, POSITIVE, ""Ambiente"")', '(SERVICE, POSITIVE, ""Service"")']"
408	So kann das mit ner Garstufe nicht klappen.	['(FOOD, NEGATIVE)']	"['(FOOD, NEGATIVE, ""Garstufe"")']"
412	Der Cappuccino leider wässrig und kaum Milchschaum.	['(FOOD, NEGATIVE)']	"['(FOOD, NEGATIVE, ""Cappuccino"")']"
417	Die Qualität des Essens fand ich aber sehr durchschnittlich.	['(FOOD, NEUTRAL)']	"['(FOOD, NEUTRAL, ""Essens"")']"
418	Sehr nette und zuvorkommende Bedienung.	['(SERVICE, POSITIVE)']	"['(SERVICE, POSITIVE, ""Bedienung"")']"
420	Das allerbeste, obwohl wir recht kurzfristig reservierten und das Lokal ausgebucht war, fand der Wirt noch ein Plätzchen für uns.	['(SERVICE, POSITIVE)']	"['(SERVICE, POSITIVE, ""Wirt"")']"
422	Mit den LOC kann man Fenster einschmeißen - jeder Bahnhof serviert bessere…Einzig und alleine die Maß war lecker.	['(FOOD, POSITIVE)', '(FOOD, NEGATIVE)']	"['(FOOD, POSITIVE, ""Maß"")', '(FOOD, NEGATIVE, ""LOC"")']"
423	Endlich die Gläser erhalten… nun müssen WIR die Osteria Mitarbeitern bitten unsere Essensbestellung aufzunehmen.	['(SERVICE, NEGATIVE)']	"['(SERVICE, NEGATIVE, ""Osteria Mitarbeitern"")']"
427	ertrank in einer Brühe, die Hackfleischbällchen (9,80) wurden schnell aufgewärmt, die Champions (8,90) waren vor sehr langer Zeit vielleicht mal frisch.	['(FOOD, NEGATIVE)', '(FOOD, NEGATIVE)']	"['(FOOD, NEGATIVE, ""Hackfleischbällchen"")', '(FOOD, NEGATIVE, ""Champions"")']"
431	Essen topp und Service auch, nur einen unmöglichen Kellner dabei, der mit den Tunneln im Ohr, der seine Kollegin ständig laut anpöbelt vor den Gäste, dass sie zu langsam sind und dich bewegen sollen usw.	['(FOOD, POSITIVE)', '(SERVICE, POSITIVE)', '(SERVICE, NEGATIVE)']	"['(FOOD, POSITIVE, ""Essen"")', '(SERVICE, POSITIVE, ""Service"")', '(SERVICE, NEGATIVE, ""Kellner"")']"
432	Früher hat man das antiquierte Ambiente nicht beachtet, weil die Steaks sehr gut waren.	['(FOOD, POSITIVE)', '(AMBIENCE, NEGATIVE)']	"['(FOOD, POSITIVE, ""Steaks"")', '(AMBIENCE, NEGATIVE, ""Ambiente"")']"
433	Ambiente toll , Essen überpreist und das man der Stiefmutter gratuliert ohne was zu hinterfragen ist schon sehr schmerzhaft .. brauch ich nicht nochmal .	['(AMBIENCE, POSITIVE)', '(PRICE, NEGATIVE)']	"['(AMBIENCE, POSITIVE, ""Ambiente"")', '(PRICE, NEGATIVE, ""Essen"")']"
436	Wahrscheinlich hat die Bedienung die Bestellung nicht verstanden, weil die Musik am Sonntag Mittag so laut war, dass man sich eigentlich auf der Terrasse nicht unterhalten konnte.	['(SERVICE, NEGATIVE)', '(AMBIENCE, NEGATIVE)']	"['(SERVICE, NEGATIVE, ""Bedienung"")', '(AMBIENCE, NEGATIVE, ""Musik"")']"
441	Das war ein Volltreffer, ich kann mich nicht daran erinnern jemals so eine gute Pasta gegessen zu haben.	['(FOOD, POSITIVE)']	"['(FOOD, POSITIVE, ""Pasta"")']"
444	Schöner Außenbereich	['(AMBIENCE, POSITIVE)']	"['(AMBIENCE, POSITIVE, ""Außenbereich"")']"
445	Anfang Dezember, trotz Weihnachtsmarkt noch spontan einen Platz für zwei bekommen, nach sehr kurzer Wartezeit.	['(SERVICE, POSITIVE)']	"['(SERVICE, POSITIVE, ""Wartezeit"")']"
446	Service war bei der Auswahl eines Schnapses auch sehr beratend unterwegs.	['(SERVICE, POSITIVE)']	"['(SERVICE, POSITIVE, ""Service"")']"
451	Authentisch, so wie ich es mag.. hatte klassisch ein schnitzel mit jägersauce… must try.	['(FOOD, POSITIVE)']	"['(FOOD, POSITIVE, ""schnitzel mit jägersauce"")']"
452	Preis-Leistungs Verhältnis katastrophal!!	['(PRICE, NEGATIVE)']	"['(PRICE, NEGATIVE, ""Preis-Leistungs Verhältnis"")']"
460	Das Steak im Hauptgang war bei beiden sehr gut.	['(FOOD, POSITIVE)']	"['(FOOD, POSITIVE, ""Steak im Hauptgang"")']"
461	Die Fläche mit den Tischen dreht sich in angenehmer Geschwindigkeit im Uhrzeigersinn, so dass man einen tollen Panoramaausblick hat.	['(AMBIENCE, POSITIVE)', '(AMBIENCE, POSITIVE)']	"['(AMBIENCE, POSITIVE, ""Fläche mit den Tischen"")', '(AMBIENCE, POSITIVE, ""Panoramaausblick"")']"
470	Hervorragender Service und Fleisch von Spitzenqualität.	['(SERVICE, POSITIVE)', '(FOOD, POSITIVE)']	"['(SERVICE, POSITIVE, ""Service"")', '(FOOD, POSITIVE, ""Fleisch"")']"
477	Der danach bestellte Glasnudelsalat war langweilig gewürzt.	['(FOOD, NEGATIVE)']	"['(FOOD, NEGATIVE, ""Glasnudelsalat"")']"
486	Mein Fleisch war schon fast wieder kalt.	['(FOOD, NEGATIVE)']	"['(FOOD, NEGATIVE, ""Fleisch"")']"
494	Nach zehn Minuten, als wir noch den zähen Braten versuchten runterzubekommen wurde die Außenbeleuchtung der LOC entfernt und die Schirme zusammengeklappt, da es etwas windig war und möglicher weiße ein Gewitter aufzog.	['(FOOD, NEGATIVE)']	"['(FOOD, NEGATIVE, ""Braten"")']"
495	Die Kellner sind arrogant und respektlos!	['(SERVICE, NEGATIVE)']	"['(SERVICE, NEGATIVE, ""Kellner"")']"
498	Essen war mittelmäßig, Preise Düsseldorfer Niveau	['(FOOD, NEUTRAL)', '(PRICE, NEUTRAL)']	"['(FOOD, NEUTRAL, ""Essen"")', '(PRICE, NEUTRAL, ""Preise"")']"
501	Speisen sehr schmackhaft.	['(FOOD, POSITIVE)']	"['(FOOD, POSITIVE, ""Speisen"")']"
508	Hatten Freunde aus den USA zu Besuch und nach gelungenen Stadtrundgang war das Abendessen ein sehr schöner Abschluss des Tages.	['(FOOD, POSITIVE)']	"['(FOOD, POSITIVE, ""Abendessen"")']"
509	Sehr freundlicher und aufmerksamer Service, breit gefächerte Karte - auch viele Speisen vegetarisch oder vegan.	['(SERVICE, POSITIVE)', '(FOOD, POSITIVE)']	"['(SERVICE, POSITIVE, ""Service"")', '(FOOD, POSITIVE, ""Karte"")']"
510	..Bei der Abrechnung wurde ein Bier falsch berechnet.	['(SERVICE, NEGATIVE)']	"['(SERVICE, NEGATIVE, ""Abrechnung"")']"
520	Kaninchen, Tintenfisch und Spinatrollen konnten uns überhaupt nicht überzeugen.	['(FOOD, NEGATIVE)', '(FOOD, NEGATIVE)', '(FOOD, NEGATIVE)']	"['(FOOD, NEGATIVE, ""Kaninchen"")', '(FOOD, NEGATIVE, ""Tintenfisch"")', '(FOOD, NEGATIVE, ""Spinatrollen"")']"
545	Das Servicepersonal ist unfreundlich bis respektlos.	['(SERVICE, NEGATIVE)']	"['(SERVICE, NEGATIVE, ""Servicepersonal"")']"
551	Ambiente toll, vielen Dank für den herrlichen Abend	['(AMBIENCE, POSITIVE)']	"['(AMBIENCE, POSITIVE, ""Ambiente"")']"
555	Massenabfertigung mit einem Zeitfenster von nicht mal 2 Stunden Aufenthalt, sehr lautes, ungemütliches, hektisches Lokal.	['(AMBIENCE, NEGATIVE)', '(FOOD, NEGATIVE)']	"['(AMBIENCE, NEGATIVE, ""Lokal"")', '(FOOD, NEGATIVE, ""Massenabfertigung"")']"
564	LOC EssenSuper BockWir hatten einen sehr schönen Abend im portugiesischen Viertel bei RESTAURANT_NAME.	['(GENERAL-IMPRESSION, POSITIVE)']	"['(GENERAL-IMPRESSION, POSITIVE, ""RESTAURANT_NAME"")']"
570	Das Essen war wirklich lecker, der Service freundlich und die Atmosphäre nett u authentisch.	['(FOOD, POSITIVE)', '(SERVICE, POSITIVE)', '(AMBIENCE, POSITIVE)']	"['(FOOD, POSITIVE, ""Essen"")', '(SERVICE, POSITIVE, ""Service"")', '(AMBIENCE, POSITIVE, ""Atmosphäre"")']"
575	Die Bedingung reagierte darauf mit einem Schulterstücken und sie essen den auch, also soll er uns schmecken.	['(SERVICE, NEGATIVE)']	"['(SERVICE, NEGATIVE, ""Bedingung"")']"
587	Auch ein «Katzentisch» direkt am Eingang kann man eigentlich nicht als solchen verkaufen (gerade im Winter wenn die Leute rein und rausgehen wird derjenige der dort mit dem Rücken zur Tür sitzt jedes Mal von kalter Zugluft eingeholt.	['(AMBIENCE, NEGATIVE)']	"['(AMBIENCE, NEGATIVE, ""Zugluft"")']"
592	Service super humorvoll und zuvorkommend!	['(SERVICE, POSITIVE)']	"['(SERVICE, POSITIVE, ""Service"")']"
593	Für den Preis eine glatte 6 oder null Punkte.	['(PRICE, NEGATIVE)']	"['(PRICE, NEGATIVE, ""Preis"")']"
599	Schneller freundlicher Service im Restaurant, Es bleibt natürlich Großgastronomie, aber eine die gut funktioniert und in der das Essen uns geschmeckt hat, das Bier ebenfalls.	['(SERVICE, POSITIVE)', '(FOOD, POSITIVE)', '(FOOD, POSITIVE)']	"['(SERVICE, POSITIVE, ""Service"")', '(FOOD, POSITIVE, ""Essen"")', '(FOOD, POSITIVE, ""Bier"")']"
601	Wenn der Betreiber mit keinem guten Beispiel vorangeht und dies der Belegschaft nicht vorlebt, dann kommt wie es kommen muss: Rundum feindseliges Ambiente.	['(AMBIENCE, NEGATIVE)', '(SERVICE, NEGATIVE)']	"['(AMBIENCE, NEGATIVE, ""Ambiente"")', '(SERVICE, NEGATIVE, ""Betreiber"")']"
602	Tolle individuelle Einrichtung.	['(AMBIENCE, POSITIVE)']	"['(AMBIENCE, POSITIVE, ""Einrichtung"")']"
607	Austern die nicht frisch waren.	['(FOOD, NEGATIVE)']	"['(FOOD, NEGATIVE, ""Austern"")']"
611	Essen war absolut in Ordnung.	['(FOOD, NEUTRAL)']	"['(FOOD, NEUTRAL, ""Essen"")']"
617	"Wir waren mittags hier, das Ambiente ist top und auch das Bier ist super, leider sind die Speisen ""nur"" Ok."	['(AMBIENCE, POSITIVE)', '(FOOD, POSITIVE)', '(FOOD, NEUTRAL)']	"['(AMBIENCE, POSITIVE, ""Ambiente"")', '(FOOD, POSITIVE, ""Bier"")', '(FOOD, NEUTRAL, ""Speisen"")']"
619	Die enge Bestuhlung im Lokal (französische Verhältnisse) lässt keinen anderen Schluss darauf zu.	['(AMBIENCE, NEGATIVE)']	"['(AMBIENCE, NEGATIVE, ""Bestuhlung"")']"
632	Das Essen war völlig in Ordnung.	['(FOOD, NEUTRAL)']	"['(FOOD, NEUTRAL, ""Essen"")']"
650	Wir Waren wieder gerne bei euch zum Essen, wie Erwartet war der Besuch im RESTAURANT_NAME eine Gaumenfreude.	['(FOOD, POSITIVE)']	"['(FOOD, POSITIVE, ""Essen"")']"
660	Vom Anfang an war die Kellnerin schon sehr nicht so freundlich.	['(SERVICE, NEGATIVE)']	"['(SERVICE, NEGATIVE, ""Kellnerin"")']"
664	So eine Esskultur möchten wir eigentlich nicht und möchten es auch LOC die nächste Generation vermitteln.	['(FOOD, NEGATIVE)']	"['(FOOD, NEGATIVE, ""Esskultur"")']"
672	Wir hatten das große Glück, einen Tisch direkt am Fenster zu bekommen, mit Blick auf die wunderschöne Binnenalster mit all den angrenzenden historischen Gebäuden.	['(AMBIENCE, POSITIVE)']	"['(AMBIENCE, POSITIVE, ""Blick auf die wunderschöne Binnenalster mit all den angrenzenden historischen Gebäuden"")']"
675	Geschätzt 10 Bedienungen haben versucht uns zu versorgen immer wieder Doppelbestellungen, weil keiner wirklich Wuste was der andere macht.	['(SERVICE, NEGATIVE)']	"['(SERVICE, NEGATIVE, ""Bedienungen"")']"
684	Spätzle weiche Teigmasse.	['(FOOD, NEGATIVE)']	"['(FOOD, NEGATIVE, ""Spätzle"")']"
686	Schönes portugiesisches Lokal mit Tapas.	['(GENERAL-IMPRESSION, POSITIVE)']	"['(GENERAL-IMPRESSION, POSITIVE, ""Lokal"")']"
700	Leider bestand die angekündigte starke Marmorierung des teuren Chuck Flap Steaks nicht aus Fett, sondern aus Sehnen, was der Kellner angesichts der Reste auf dem Teller mit einem „zu zäh?	['(FOOD, NEGATIVE)']	"['(FOOD, NEGATIVE, ""Chuck Flap Steaks"")']"
703	Das Ambiente war sehr gemütlich.	['(AMBIENCE, POSITIVE)']	"['(AMBIENCE, POSITIVE, ""Ambiente"")']"
706	Zum Eigentlichen, ja die Gerichte sind nett angerichtet, geschmacklich etwas über dem Durchschnitt der sonstigen Griechen.	['(FOOD, POSITIVE)']	"['(FOOD, POSITIVE, ""Gerichte"")']"
742	Der Blick in den tiefer liegenden Festsaal war ein kurzer Besuch wert.	['(AMBIENCE, POSITIVE)']	"['(AMBIENCE, POSITIVE, ""Blick in den tiefer liegenden Festsaal"")']"
743	Das Personal dort ist sehr freundlich und lustig.	['(SERVICE, POSITIVE)']	"['(SERVICE, POSITIVE, ""Personal"")']"
762	Tolle Beratung, tolle Bewirtung und essen der extraklasse.	['(SERVICE, POSITIVE)', '(SERVICE, POSITIVE)', '(FOOD, POSITIVE)']	"['(SERVICE, POSITIVE, ""Beratung"")', '(SERVICE, POSITIVE, ""Bewirtung"")', '(FOOD, POSITIVE, ""essen"")']"
768	Nach einem spontanen Besuch heute Mittag draußen ( es war nichts los ) sind wir zur der Einsicht gekommen, dass wir dieses Brauhaus nie wieder betreten werden.	['(GENERAL-IMPRESSION, NEGATIVE)']	"['(GENERAL-IMPRESSION, NEGATIVE, ""Brauhaus"")']"
778	Es lag nicht an den einzelnen Kellnern, sondern an der (offensichtlich gewollten) Unterbesetzung im Service.	['(SERVICE, NEGATIVE)']	"['(SERVICE, NEGATIVE, ""Unterbesetzung"")']"
779	Weitere junge Servicekräfte liefen gelangweilt umher.	['(SERVICE, NEGATIVE)']	"['(SERVICE, NEGATIVE, ""Servicekräfte"")']"
800	Beim ersten Mal nette Kellnerin und lecker Schokolade.	['(SERVICE, POSITIVE)', '(FOOD, POSITIVE)']	"['(SERVICE, POSITIVE, ""Kellnerin"")', '(FOOD, POSITIVE, ""Schokolade"")']"
805	Wir erhielten kleine Teller mit recht überschaubaren Portionen (keine Oliven, die ich bei jeder Art von Griechen erwarte ) Geschmacklich war alles in Ordnung.	['(FOOD, NEGATIVE)']	"['(FOOD, NEGATIVE, ""Portionen"")']"
815	Meine Frau war von den Königsberger Klopsen und ich von dem Rumpsteak aus dem 800° Grill begeistert.	['(FOOD, POSITIVE)', '(FOOD, POSITIVE)']	"['(FOOD, POSITIVE, ""Königsberger Klopsen"")', '(FOOD, POSITIVE, ""Rumpsteak"")']"
824	Großartiges Restaurant, toller Service, und Luca hat den Abend perfekt gemacht!	['(GENERAL-IMPRESSION, POSITIVE)', '(SERVICE, POSITIVE)', '(SERVICE, POSITIVE)']	"['(GENERAL-IMPRESSION, POSITIVE, ""Restaurant"")', '(SERVICE, POSITIVE, ""Service"")', '(SERVICE, POSITIVE, ""Luca"")']"
825	Obwohl schönes Ambiente Waren mit 4 Personen, heisse Teller wurden ohne Vorwarnung über den Köpfen anderer Gäste gereicht.	['(AMBIENCE, POSITIVE)']	"['(AMBIENCE, POSITIVE, ""Ambiente"")']"
826	Wir hatten einen schönen Abend bei gutem Rotwein, sehr zu empfehlen.	['(FOOD, POSITIVE)']	"['(FOOD, POSITIVE, ""Rotwein"")']"
831	Wir durften einen schönen Abend mit dem perfekten Service von Jason erleben!	['(SERVICE, POSITIVE)']	"['(SERVICE, POSITIVE, ""Service"")']"
832	Die Qualität des Fleisches und auch der anderen Speisen waren bisher sehr gut.	['(FOOD, POSITIVE)', '(FOOD, POSITIVE)']	"['(FOOD, POSITIVE, ""Fleisches"")', '(FOOD, POSITIVE, ""Speisen"")']"
833	Service zuvorkommend u locker, hat uns gut gefallen.	['(SERVICE, POSITIVE)']	"['(SERVICE, POSITIVE, ""Service"")']"
838	Dann war leider auch noch mein Schwertfisch nicht essbar, weil noch roh ( damit meine ich nicht glasig, sondern wirklich noch komplett roh auf einer Seite) und musste reklamiert werden.	['(FOOD, NEGATIVE)']	"['(FOOD, NEGATIVE, ""Schwertfisch"")']"
843	Das personal ist sehr freundlich.	['(SERVICE, POSITIVE)']	"['(SERVICE, POSITIVE, ""personal"")']"
845	Da wir kein Tisch reserviert haben , würden wir nicht so gerne aufgenommen und wurde nur ne Stunde Zeit gegeben zum Essen …schade sonst war das Essen sehr lecker	['(FOOD, POSITIVE)']	"['(FOOD, POSITIVE, ""Essen"")']"
850	Insgesamt wirklich gut, Currywurst mit Pommes ist auch zu empfehlen.	['(FOOD, POSITIVE)']	"['(FOOD, POSITIVE, ""Currywurst mit Pommes"")']"
855	Besonders Herr Gilles, Herr Natrup und Herr Torres (Aufzählung in alphabetischer Reihenfolge) erfreuen uns immer wieder aufs Neue durch professionellen Service.	['(SERVICE, POSITIVE)', '(SERVICE, POSITIVE)', '(SERVICE, POSITIVE)', '(SERVICE, POSITIVE)']	"['(SERVICE, POSITIVE, ""Gilles"")', '(SERVICE, POSITIVE, ""Natrup"")', '(SERVICE, POSITIVE, ""Torres"")', '(SERVICE, POSITIVE, ""Service"")']"
860	Wir hatten eine sehr freundliche Bedienung.	['(SERVICE, POSITIVE)']	"['(SERVICE, POSITIVE, ""Bedienung"")']"
872	Da ich immer sehr gerne im Tuscolo gegessen habe, war ich sehr enttäuscht als ich in der letzten Woche mit einer Freundin aus LOC, die das erste Mal in LOC war, dort gegessen habe.	['(GENERAL-IMPRESSION, NEGATIVE)']	"['(GENERAL-IMPRESSION, NEGATIVE, ""Tuscolo"")']"
873	Egal was für Extrawünsche man hat, Andrea findet eine Lösung.	['(SERVICE, POSITIVE)']	"['(SERVICE, POSITIVE, ""Andrea"")']"
885	Es ist sehr viel los gewesen und das hat man beim Service ein wenig gemerkt.	['(SERVICE, NEGATIVE)']	"['(SERVICE, NEGATIVE, ""Service"")']"
887	Aber Fernet Branca aus einem Grappaglas, das ist Stilbruch.	['(FOOD, NEGATIVE)']	"['(FOOD, NEGATIVE, ""Fernet Branca aus einem Grappaglas"")']"
890	"Die Lage ist umwerfend, der Blick auf den LOC ist ""die habe Miete""."	['(AMBIENCE, POSITIVE)', '(AMBIENCE, POSITIVE)']	"['(AMBIENCE, POSITIVE, ""Lage"")', '(AMBIENCE, POSITIVE, ""Blick auf den LOC"")']"
892	Sehr leckeres Bier.	['(FOOD, POSITIVE)']	"['(FOOD, POSITIVE, ""Bier"")']"
893	Es war das Geld nicht wert.	['(PRICE, NEGATIVE)']	"['(PRICE, NEGATIVE, ""Geld"")']"
906	Der Zander und das Kassler sind zu empfehlen.	['(FOOD, POSITIVE)', '(FOOD, POSITIVE)']	"['(FOOD, POSITIVE, ""Zander"")', '(FOOD, POSITIVE, ""Kassler"")']"
910	Schönes Ambiente.	['(AMBIENCE, POSITIVE)']	"['(AMBIENCE, POSITIVE, ""Ambiente"")']"
912	Sehr leckere Vorspeisen zum Teilen und dann das Fleisch beim Hauptgang.	['(FOOD, POSITIVE)', '(FOOD, POSITIVE)']	"['(FOOD, POSITIVE, ""Vorspeisen"")', '(FOOD, POSITIVE, ""Fleisch"")']"
913	Die perfekte Location für ein Date.	['(GENERAL-IMPRESSION, POSITIVE)']	"['(GENERAL-IMPRESSION, POSITIVE, ""Location"")']"
914	Wie immer super qualifizierter Service, leider kam heute die Küche nicht so pünktlich wie sonst immer hinterher.	['(SERVICE, POSITIVE)', '(SERVICE, NEGATIVE)']	"['(SERVICE, POSITIVE, ""Service"")', '(SERVICE, NEGATIVE, ""Küche"")']"
922	Gute Beleuchtung und Musik als Begleitung.	['(AMBIENCE, POSITIVE)', '(AMBIENCE, POSITIVE)']	"['(AMBIENCE, POSITIVE, ""Beleuchtung"")', '(AMBIENCE, POSITIVE, ""Musik"")']"
931	Wundervolles Essen.	['(FOOD, POSITIVE)']	"['(FOOD, POSITIVE, ""Essen"")']"
961	"Es ging hier offenkundig nicht um ""Menschlichkeit"", sondern Profitgier, da man sich eine neue Zeche versprach, und wohl dachte, wir seien ohnehin im begriff zu gehen."	['(PRICE, NEGATIVE)']	"['(PRICE, NEGATIVE, ""Profitgier"")']"
964	Die Quiche war okay, nichts besonderes; der Salat war gut!	['(FOOD, NEUTRAL)', '(FOOD, POSITIVE)']	"['(FOOD, NEUTRAL, ""Quiche"")', '(FOOD, POSITIVE, ""Salat"")']"
965	Denn aus dem Grundbuffet der Karte zaubert die Küche leckere Köstlichkeiten mit diversen Soßen und Beilagen.	['(FOOD, POSITIVE)', '(FOOD, POSITIVE)', '(FOOD, POSITIVE)']	"['(FOOD, POSITIVE, ""Köstlichkeiten"")', '(FOOD, POSITIVE, ""Soßen"")', '(FOOD, POSITIVE, ""Beilagen"")']"
968	Wir waren zu Weihnachtszeit dort, es war durch die Lichter sehr schön.	['(AMBIENCE, POSITIVE)']	"['(AMBIENCE, POSITIVE, ""Lichter"")']"
974	Der angeblich selbst gemachte Kartoffelsalat war relativ trocken und geschmacklich zum Vergessen.	['(FOOD, NEGATIVE)']	"['(FOOD, NEGATIVE, ""Kartoffelsalat"")']"
977	Einem männlichen Kellner bzw. Platzanweiser passte dies nicht und er blaffte uns unverschämt an.	['(SERVICE, NEGATIVE)', '(SERVICE, NEGATIVE)']	"['(SERVICE, NEGATIVE, ""Kellner"")', '(SERVICE, NEGATIVE, ""Platzanweiser"")']"
980	Leckeres Bier gab es auch!	['(FOOD, POSITIVE)']	"['(FOOD, POSITIVE, ""Bier"")']"
