id	text	labels	labels_phrases
1254	Man bekommt feinste frische und meist hausgemachte Sachen, herrliche Aufstriche, vorzügliche Käse- und Wurstvariationen, duftende Brioche, süße und salzige Spezialitäten ... alles stets liebevoll zubereitet ... dazu das stylische Ambiente; vorzüglich geführt ist es ohnehin.	['(FOOD, POSITIVE)', '(FOOD, POSITIVE)', '(FOOD, POSITIVE)', '(FOOD, POSITIVE)', '(FOOD, POSITIVE)', '(AMBIENCE, POSITIVE)']	"['(FOOD, POSITIVE, ""frische und"")', '(FOOD, POSITIVE, ""Aufstriche"")', '(FOOD, POSITIVE, ""Käse- und Wurstvariationen"")', '(FOOD, POSITIVE, ""Brioche"")', '(FOOD, POSITIVE, ""Spezialitäten"")', '(AMBIENCE, POSITIVE, ""Ambiente"")']"
1261	Sehr nettes und zuvorkommendes Personal.	['(SERVICE, POSITIVE)']	"['(SERVICE, POSITIVE, ""Personal"")']"
1270	Auch das Personal ist sehr freundlich, hilfsbereit und zuvorkommend!	['(SERVICE, POSITIVE)']	"['(SERVICE, POSITIVE, ""Personal"")']"
1271	Toll finde ich auch die Speisekarte.	['(FOOD, POSITIVE)']	"['(FOOD, POSITIVE, ""Speisekarte"")']"
1279	Mein Fazit: Aufgrund der Essensqualität würde ich dem Brauhaus noch eine Chance geben (darum auch drei Sterne), aber an der Servicequalität muss definitiv schwer gearbeitet werden.	['(FOOD, POSITIVE)', '(SERVICE, NEGATIVE)']	"['(FOOD, POSITIVE, ""Essensqualität"")', '(SERVICE, NEGATIVE, ""Servicequalität"")']"
1281	Essen und Getränke wurden in super zeitlichen Rahmen serviert.	['(FOOD, POSITIVE)', '(FOOD, POSITIVE)']	"['(FOOD, POSITIVE, ""Essen"")', '(FOOD, POSITIVE, ""Getränke"")']"
1283	Leckeres Bier, sehr freundliche Köbes, Außengastronomie trotz Baustelle ansprechend.	['(FOOD, POSITIVE)', '(SERVICE, POSITIVE)', '(AMBIENCE, POSITIVE)']	"['(FOOD, POSITIVE, ""Bier"")', '(SERVICE, POSITIVE, ""Köbes"")', '(AMBIENCE, POSITIVE, ""Außengastronomie"")']"
1286	Ist nämlich einfach nur schlechter Stil.	['(AMBIENCE, NEGATIVE)']	"['(AMBIENCE, NEGATIVE, ""Stil"")']"
1288	Für einen solchen Preis erwarte ich Qualität .	['(PRICE, NEGATIVE)']	"['(PRICE, NEGATIVE, ""Preis"")']"
1296	Man kann gerne zum Wagner weil es eine urige Kneipe ist, LOC sollte man aber nicht unbedingt.	['(GENERAL-IMPRESSION, NEUTRAL)']	"['(GENERAL-IMPRESSION, NEUTRAL, ""Wagner"")']"
1306	Das war kein Vergleich zum LOC: Hier, im LOC, gab es deutlich besseres Essen und eine bessere Serviceleistung, lag auch an einer Servicekraft (Andrea).	['(FOOD, POSITIVE)', '(SERVICE, POSITIVE)', '(SERVICE, POSITIVE)']	"['(FOOD, POSITIVE, ""Essen"")', '(SERVICE, POSITIVE, ""Serviceleistung"")', '(SERVICE, POSITIVE, ""Andrea"")']"
1307	Der Service ist gut und freundlich.	['(SERVICE, POSITIVE)']	"['(SERVICE, POSITIVE, ""Service"")']"
1312	Für diesen Preis trotzdem eine Zumutung.	['(PRICE, NEGATIVE)']	"['(PRICE, NEGATIVE, ""Preis"")']"
1317	Die Bestellung wurde aufgegeben und kurze Zeit später wurde unser Essen bereits serviert, heiß, deftig und ein Genuss!	['(FOOD, POSITIVE)']	"['(FOOD, POSITIVE, ""Essen"")']"
1319	Obwohl es ein sehr großes Lokal ist, konnten wir uns sehr gut unterhalten und fanden die Atmosphäre sehr angenehm.	['(AMBIENCE, POSITIVE)']	"['(AMBIENCE, POSITIVE, ""Atmosphäre"")']"
1327	In Bezug auf Servicequalität kann die Leitung des Hauses nach unserer Erfahrung noch deutlich nachbessern und den Anreiz für Gäste erhöhen, dort zu speisen.	['(SERVICE, NEGATIVE)']	"['(SERVICE, NEGATIVE, ""Leitung"")']"
1333	Das Personal ist sehr nett und freundlich.	['(SERVICE, POSITIVE)']	"['(SERVICE, POSITIVE, ""Personal"")']"
1339	Das Personal - drei Personen- diskutierte lautstark eigene Probleme und saß dabei phasenweise mit dem Rücken zu den wenigen Gästen an einem Tisch.	['(SERVICE, NEGATIVE)']	"['(SERVICE, NEGATIVE, ""Personal"")']"
1341	Das Preis- Leistungsverhältnis ist für die LOC eher günstig.	['(PRICE, POSITIVE)']	"['(PRICE, POSITIVE, ""Preis- Leistungsverhältnis"")']"
1345	Teilweise nur sehr enge Bestuhlung.	['(AMBIENCE, NEGATIVE)']	"['(AMBIENCE, NEGATIVE, ""Bestuhlung"")']"
1351	Immer wieder gerne, sehr nettes und kompetentes Personal.	['(SERVICE, POSITIVE)']	"['(SERVICE, POSITIVE, ""Personal"")']"
1378	Das Abendmenü hat uns sehr überzeugt und wir haben noch einen passenden Rotwein für den Hauptgang bestellt.	['(FOOD, POSITIVE)']	"['(FOOD, POSITIVE, ""Abendmenü"")']"
1403	Großer Name, schlechter Service, Essen unterirdisch.	['(SERVICE, NEGATIVE)', '(FOOD, NEGATIVE)']	"['(SERVICE, NEGATIVE, ""Service"")', '(FOOD, NEGATIVE, ""Essen"")']"
1406	Vorspeise Carpaccio und Salat war lecker … Pizza riesig!	['(FOOD, POSITIVE)', '(FOOD, POSITIVE)']	"['(FOOD, POSITIVE, ""Carpaccio"")', '(FOOD, POSITIVE, ""Salat"")']"
1409	Man schmeckt die frischen Teigwaren, durch welche sich dieses Restaurant von anderen italienischen Restaurant abhebt.	['(FOOD, POSITIVE)']	"['(FOOD, POSITIVE, ""Teigwaren"")']"
1452	"Schweinchenrosa gekachelt, Schlachthausatmosphäre, Plastiktische, Kühlschrank für ""Dry-Age Fleisch"", einfach stillos, ein no go."	['(AMBIENCE, NEGATIVE)', '(AMBIENCE, NEGATIVE)', '(AMBIENCE, NEGATIVE)']	"['(AMBIENCE, NEGATIVE, ""Schlachthausatmosphäre"")', '(AMBIENCE, NEGATIVE, ""Plastiktische"")', '(AMBIENCE, NEGATIVE, ""Kühlschrank für Dry-Age Fleisch,"")']"
1455	Aber die Kellner schaffen es sehr gut sich dort durchzuwinden und trotz des brechend vollen Hauses kam unser Essen nach normaler Wartezeit.	['(SERVICE, POSITIVE)']	"['(SERVICE, POSITIVE, ""Kellner"")']"
1468	Das Fleisch war in Ordnung, die Bratkartoffeln waren jedoch nicht knusprig, sondern trieften vor Fett.	['(FOOD, NEUTRAL)', '(FOOD, NEGATIVE)']	"['(FOOD, NEUTRAL, ""Fleisch"")', '(FOOD, NEGATIVE, ""Bratkartoffeln"")']"
1483	aber leider die Qualität der Gerichte ist echt nichts besonders.	['(FOOD, NEGATIVE)']	"['(FOOD, NEGATIVE, ""Gerichte"")']"
3	Wie kann ein Betrieb der uns immer gut gefallen hat, so schnell 3 klassig werden.	['(GENERAL-IMPRESSION, NEGATIVE)']	"['(GENERAL-IMPRESSION, NEGATIVE, ""Betrieb"")']"
8	Ebenso schwammen die Bratkartoffeln im Fett, von Speck nur ein Hauch erfahrbar.	['(FOOD, NEGATIVE)', '(FOOD, NEGATIVE)']	"['(FOOD, NEGATIVE, ""Bratkartoffeln"")', '(FOOD, NEGATIVE, ""Speck"")']"
9	Der Wein eher gewöhnungsbedürftig!	['(FOOD, NEGATIVE)']	"['(FOOD, NEGATIVE, ""Wein"")']"
29	Das LOC ist sehr zu empfehlen und war perfekt Medium Rare.	['(FOOD, POSITIVE)']	"['(FOOD, POSITIVE, ""LOC"")']"
30	Sehr schönes Ambiente und die Bedienungen haben sehr gute Laune und Spaß an ihrer Arbeit.	['(AMBIENCE, POSITIVE)', '(SERVICE, POSITIVE)']	"['(AMBIENCE, POSITIVE, ""Ambiente"")', '(SERVICE, POSITIVE, ""Bedienungen"")']"
36	Wir waren jetzt schon zum 4 Mal hier im Augustiner und es ist für uns immer eine Anlaufstelle in LOC.	['(GENERAL-IMPRESSION, POSITIVE)']	"['(GENERAL-IMPRESSION, POSITIVE, ""Augustiner"")']"
40	Mit vier Personen von Tapas, Fleisch- und Fischgerichte alles probiert und alles war sehr lecker.	['(FOOD, POSITIVE)', '(FOOD, POSITIVE)']	"['(FOOD, POSITIVE, ""Tapas"")', '(FOOD, POSITIVE, ""Fleisch- und Fischgerichte"")']"
49	Wir hatten einen super Abend hier in der RESTAURANT_NAME.	['(GENERAL-IMPRESSION, POSITIVE)']	"['(GENERAL-IMPRESSION, POSITIVE, ""RESTAURANT_NAME"")']"
50	Sehr zu empfehlen sind die Fischgerichte und der selbstgemachte Sangria.	['(FOOD, POSITIVE)', '(FOOD, POSITIVE)']	"['(FOOD, POSITIVE, ""Fischgerichte"")', '(FOOD, POSITIVE, ""Sangria"")']"
57	Die Bedienung ist super nett und das Essen war wirklich wunderbar!	['(SERVICE, POSITIVE)', '(FOOD, POSITIVE)']	"['(SERVICE, POSITIVE, ""Bedienung"")', '(FOOD, POSITIVE, ""Essen"")']"
69	Aus Spaß habe ich auch einmal in den großen Speisesaal geschaut, in welchem schon ein relativ hoher Lärmpegel herrscht.	['(AMBIENCE, NEGATIVE)', '(AMBIENCE, NEGATIVE)']	"['(AMBIENCE, NEGATIVE, ""Lärmpegel"")', '(AMBIENCE, NEGATIVE, ""Speisesaal"")']"
79	Ein sehr freundlicher Service, Essen qualitativ ausgezeichnet!	['(SERVICE, POSITIVE)', '(FOOD, POSITIVE)']	"['(SERVICE, POSITIVE, ""Service"")', '(FOOD, POSITIVE, ""Essen"")']"
92	Wir wurden sehr, sehr freundlich von LUCA bedient.	['(SERVICE, POSITIVE)']	"['(SERVICE, POSITIVE, ""LUCA"")']"
95	Service war nicht so schnell und man musste zu viel warten.	['(SERVICE, NEGATIVE)']	"['(SERVICE, NEGATIVE, ""Service"")']"
155	Toller, liebevoller Service & gute Weine!	['(SERVICE, POSITIVE)', '(FOOD, POSITIVE)']	"['(SERVICE, POSITIVE, ""Service"")', '(FOOD, POSITIVE, ""Weine"")']"
160	Klares Empfehlung, wer gutes Essen zum fairen Preis haben möchte.	['(FOOD, POSITIVE)', '(PRICE, POSITIVE)']	"['(FOOD, POSITIVE, ""Essen"")', '(PRICE, POSITIVE, ""Essen"")']"
161	Nette Bedienung, schönes Ambiente.	['(SERVICE, POSITIVE)', '(AMBIENCE, POSITIVE)']	"['(SERVICE, POSITIVE, ""Bedienung"")', '(AMBIENCE, POSITIVE, ""Ambiente"")']"
166	Dario war ein super Kellner und hat den Abend zu einer sehr schönen Erinnerung gemacht.	['(SERVICE, POSITIVE)']	"['(SERVICE, POSITIVE, ""Dario"")']"
172	Auch der Starter mit ein paar Scheiben Brot und Aioli war für 9€ recht dürftig.	['(FOOD, NEGATIVE)', '(FOOD, NEGATIVE)', '(FOOD, NEGATIVE)', '(PRICE, NEGATIVE)', '(PRICE, NEGATIVE)', '(PRICE, NEGATIVE)']	"['(FOOD, NEGATIVE, ""Starter"")', '(FOOD, NEGATIVE, ""Scheiben Brot"")', '(FOOD, NEGATIVE, ""Aioli"")', '(PRICE, NEGATIVE, ""Starter"")', '(PRICE, NEGATIVE, ""Scheiben Brot"")', '(PRICE, NEGATIVE, ""Aioli"")']"
190	Die Haxe war trocken und faserig, die Kruste hätte man mit dem Presslufthammer bearbeiten müssen, um sie zu zerteilen.	['(FOOD, NEGATIVE)']	"['(FOOD, NEGATIVE, ""Haxe"")']"
193	Obwohl wir deftiges Essen schätzen, haben wir es nicht gut vertragen.	['(FOOD, NEGATIVE)']	"['(FOOD, NEGATIVE, ""Essen"")']"
194	Der Service ist ok, man kennt die Gerichte und wird gut beraten.	['(SERVICE, NEUTRAL)']	"['(SERVICE, NEUTRAL, ""Service"")']"
199	Klassische Gerichte modern angerichtet.	['(FOOD, POSITIVE)']	"['(FOOD, POSITIVE, ""Gerichte"")']"
206	Das Essen war sehr lecker und kam schnell.	['(FOOD, POSITIVE)']	"['(FOOD, POSITIVE, ""Essen"")']"
220	Einzig das Bier war geniessbar.	['(FOOD, POSITIVE)']	"['(FOOD, POSITIVE, ""Bier"")']"
223	Der sogenannte Chef de Service wurde sehr laut und wiederholte sich ständig, dass wir ja schliesslich zu spät gekommen seien.	['(SERVICE, NEGATIVE)']	"['(SERVICE, NEGATIVE, ""Chef de Service"")']"
229	Frage: Warum sollen wir das Restaurant erneut auswählen bzw. anderen Gästen empfehlen?	['(GENERAL-IMPRESSION, NEGATIVE)']	"['(GENERAL-IMPRESSION, NEGATIVE, ""Restaurant"")']"
230	Sehr schöner Gastraum.	['(AMBIENCE, POSITIVE)']	"['(AMBIENCE, POSITIVE, ""Gastraum"")']"
242	Preis-Leistungsverhältnis sehr gut, sehr nettes und zuvorkommendes Personal	['(PRICE, POSITIVE)', '(SERVICE, POSITIVE)']	"['(PRICE, POSITIVE, ""Preis-Leistungsverhältnis"")', '(SERVICE, POSITIVE, ""Personal"")']"
244	Typisches Münchner Lokal näher LOC gut für Bayrische Küche Stimmung wie auf dem LOC	['(FOOD, POSITIVE)']	"['(FOOD, POSITIVE, ""Küche"")']"
253	Die Vorspeise (Suppe und überbackener Ziegenkäse) war leider geschmacklich kein Hit und haben den Preis keineswegs gerechtfertigt.	['(FOOD, NEGATIVE)', '(FOOD, NEGATIVE)', '(FOOD, NEGATIVE)', '(PRICE, NEGATIVE)']	"['(FOOD, NEGATIVE, ""Vorspeise"")', '(FOOD, NEGATIVE, ""Suppe"")', '(FOOD, NEGATIVE, ""Ziegenkäse"")', '(PRICE, NEGATIVE, ""Preis"")']"
256	Auf die Bitte die Tische zusammen schieben zu können wurde uns von einer der sehr netten Bedienung gesagt - Chefin hat das Verboten.	['(SERVICE, POSITIVE)']	"['(SERVICE, POSITIVE, ""Bedienung"")']"
266	Wir werden dieses Restaurant sicher nicht noch einmal besuchen.	['(GENERAL-IMPRESSION, NEGATIVE)']	"['(GENERAL-IMPRESSION, NEGATIVE, ""Restaurant"")']"
269	Getränke sowie Vorspeise und Hauptgang ließen ebenfalls nicht lange auf sich warten & speziell das Essen war über alle Maßen ausreichend und ein wahrer Genuss.	['(SERVICE, POSITIVE)', '(SERVICE, POSITIVE)', '(SERVICE, POSITIVE)', '(FOOD, POSITIVE)']	"['(SERVICE, POSITIVE, ""Getränke"")', '(SERVICE, POSITIVE, ""Vorspeise"")', '(SERVICE, POSITIVE, ""Hauptgang"")', '(FOOD, POSITIVE, ""Essen"")']"
281	Das ambiente und der Anfang waren gut, leider kann ich den Cesarsalat ohne dressing nicht weiterempfehlen, der Hauptgang war gut wie auch das dessert , kann aber für weniger Geld im LOC besser Essen, Preis Leistung hätte noch Potenzial.	['(AMBIENCE, POSITIVE)', '(FOOD, NEGATIVE)', '(FOOD, POSITIVE)', '(FOOD, POSITIVE)', '(PRICE, NEGATIVE)']	"['(AMBIENCE, POSITIVE, ""ambiente"")', '(FOOD, NEGATIVE, ""Cesarsalat ohne dressing"")', '(FOOD, POSITIVE, ""Hauptgang"")', '(FOOD, POSITIVE, ""dessert"")', '(PRICE, NEGATIVE, ""Preis Leistung"")']"
286	Von den darin aufgeführten Speisen lief uns schon das Wasser im Mund zusammen.	['(FOOD, POSITIVE)']	"['(FOOD, POSITIVE, ""Speisen"")']"
288	Preis Leistung top.	['(PRICE, POSITIVE)']	"['(PRICE, POSITIVE, ""Preis Leistung"")']"
292	Selbst unter Corona hatte das Restaurant sein Level gehalten.	['(GENERAL-IMPRESSION, POSITIVE)']	"['(GENERAL-IMPRESSION, POSITIVE, ""Restaurant"")']"
299	Das MammaMia ist ein wahrlich schönes Restaurant mit sehr angenehmer und lockerer Atmosphäre.	['(GENERAL-IMPRESSION, POSITIVE)', '(AMBIENCE, POSITIVE)']	"['(GENERAL-IMPRESSION, POSITIVE, ""MammaMia"")', '(AMBIENCE, POSITIVE, ""Atmosphäre"")']"
302	Das angesprochene Personal unfähig, sei nicht für den Tisch zuständig, wisse auch nicht wer ihn bedient.	['(SERVICE, NEGATIVE)']	"['(SERVICE, NEGATIVE, ""Personal"")']"
319	Das Essen ist immer frisch gekocht und heiss.	['(FOOD, POSITIVE)']	"['(FOOD, POSITIVE, ""Essen"")']"
329	Wir werden also schon erwartet und sofort kümmert sich der Service um unser Wohl.	['(SERVICE, POSITIVE)']	"['(SERVICE, POSITIVE, ""Service"")']"
340	Die Schnitzel war sehr lecker und auch die Soßen waren nicht pampig.	['(FOOD, POSITIVE)', '(FOOD, POSITIVE)']	"['(FOOD, POSITIVE, ""Schnitzel"")', '(FOOD, POSITIVE, ""Soßen"")']"
344	Das Essen war sehr gut (grosse Portionen).	['(FOOD, POSITIVE)']	"['(FOOD, POSITIVE, ""Essen"")']"
346	Fleissiger Service.	['(SERVICE, POSITIVE)']	"['(SERVICE, POSITIVE, ""Service"")']"
353	Da passt das unverschämte Servicepersonal ideal dazu.	['(SERVICE, NEGATIVE)']	"['(SERVICE, NEGATIVE, ""Servicepersonal"")']"
367	Darüberhinaus enthielt das verwendete Fleisch ungenießbare Anteile.	['(FOOD, NEGATIVE)']	"['(FOOD, NEGATIVE, ""Fleisch"")']"
377	Leider war das Personal völlig überfordert, denn wir mußten fast 25 Minuten warten, bis jemand eine Bestellung aufnehmen konnte.	['(SERVICE, NEGATIVE)']	"['(SERVICE, NEGATIVE, ""Personal"")']"
378	Unmögliches Raumklima innerhalb.	['(AMBIENCE, NEGATIVE)']	"['(AMBIENCE, NEGATIVE, ""Raumklima"")']"
405	Wenn man das alles berücksichtigt, konnte ich mit meinem Teller sehr zufrieden sein.	['(FOOD, POSITIVE)']	"['(FOOD, POSITIVE, ""Teller"")']"
407	Positiv zu vermerken ist die einzigartige Lage, das traditionelle Ambiente und der freundliche Service.	['(AMBIENCE, POSITIVE)', '(AMBIENCE, POSITIVE)', '(SERVICE, POSITIVE)']	"['(AMBIENCE, POSITIVE, ""Lage"")', '(AMBIENCE, POSITIVE, ""Ambiente"")', '(SERVICE, POSITIVE, ""Service"")']"
408	So kann das mit ner Garstufe nicht klappen.	['(FOOD, NEGATIVE)']	"['(FOOD, NEGATIVE, ""Garstufe"")']"
412	Der Cappuccino leider wässrig und kaum Milchschaum.	['(FOOD, NEGATIVE)']	"['(FOOD, NEGATIVE, ""Cappuccino"")']"
417	Die Qualität des Essens fand ich aber sehr durchschnittlich.	['(FOOD, NEUTRAL)']	"['(FOOD, NEUTRAL, ""Essens"")']"
418	Sehr nette und zuvorkommende Bedienung.	['(SERVICE, POSITIVE)']	"['(SERVICE, POSITIVE, ""Bedienung"")']"
420	Das allerbeste, obwohl wir recht kurzfristig reservierten und das Lokal ausgebucht war, fand der Wirt noch ein Plätzchen für uns.	['(SERVICE, POSITIVE)']	"['(SERVICE, POSITIVE, ""Wirt"")']"
423	Endlich die Gläser erhalten… nun müssen WIR die Osteria Mitarbeitern bitten unsere Essensbestellung aufzunehmen.	['(SERVICE, NEGATIVE)']	"['(SERVICE, NEGATIVE, ""Osteria Mitarbeitern"")']"
427	ertrank in einer Brühe, die Hackfleischbällchen (9,80) wurden schnell aufgewärmt, die Champions (8,90) waren vor sehr langer Zeit vielleicht mal frisch.	['(FOOD, NEGATIVE)', '(FOOD, NEGATIVE)']	"['(FOOD, NEGATIVE, ""Hackfleischbällchen"")', '(FOOD, NEGATIVE, ""Champions"")']"
431	Essen topp und Service auch, nur einen unmöglichen Kellner dabei, der mit den Tunneln im Ohr, der seine Kollegin ständig laut anpöbelt vor den Gäste, dass sie zu langsam sind und dich bewegen sollen usw.	['(FOOD, POSITIVE)', '(SERVICE, POSITIVE)', '(SERVICE, NEGATIVE)']	"['(FOOD, POSITIVE, ""Essen"")', '(SERVICE, POSITIVE, ""Service"")', '(SERVICE, NEGATIVE, ""Kellner"")']"
433	Ambiente toll , Essen überpreist und das man der Stiefmutter gratuliert ohne was zu hinterfragen ist schon sehr schmerzhaft .. brauch ich nicht nochmal .	['(AMBIENCE, POSITIVE)', '(PRICE, NEGATIVE)']	"['(AMBIENCE, POSITIVE, ""Ambiente"")', '(PRICE, NEGATIVE, ""Essen"")']"
436	Wahrscheinlich hat die Bedienung die Bestellung nicht verstanden, weil die Musik am Sonntag Mittag so laut war, dass man sich eigentlich auf der Terrasse nicht unterhalten konnte.	['(SERVICE, NEGATIVE)', '(AMBIENCE, NEGATIVE)']	"['(SERVICE, NEGATIVE, ""Bedienung"")', '(AMBIENCE, NEGATIVE, ""Musik"")']"
441	Das war ein Volltreffer, ich kann mich nicht daran erinnern jemals so eine gute Pasta gegessen zu haben.	['(FOOD, POSITIVE)']	"['(FOOD, POSITIVE, ""Pasta"")']"
445	Anfang Dezember, trotz Weihnachtsmarkt noch spontan einen Platz für zwei bekommen, nach sehr kurzer Wartezeit.	['(SERVICE, POSITIVE)']	"['(SERVICE, POSITIVE, ""Wartezeit"")']"
446	Service war bei der Auswahl eines Schnapses auch sehr beratend unterwegs.	['(SERVICE, POSITIVE)']	"['(SERVICE, POSITIVE, ""Service"")']"
451	Authentisch, so wie ich es mag.. hatte klassisch ein schnitzel mit jägersauce… must try.	['(FOOD, POSITIVE)']	"['(FOOD, POSITIVE, ""schnitzel mit jägersauce"")']"
452	Preis-Leistungs Verhältnis katastrophal!!	['(PRICE, NEGATIVE)']	"['(PRICE, NEGATIVE, ""Preis-Leistungs Verhältnis"")']"
461	Die Fläche mit den Tischen dreht sich in angenehmer Geschwindigkeit im Uhrzeigersinn, so dass man einen tollen Panoramaausblick hat.	['(AMBIENCE, POSITIVE)', '(AMBIENCE, POSITIVE)']	"['(AMBIENCE, POSITIVE, ""Fläche mit den Tischen"")', '(AMBIENCE, POSITIVE, ""Panoramaausblick"")']"
470	Hervorragender Service und Fleisch von Spitzenqualität.	['(SERVICE, POSITIVE)', '(FOOD, POSITIVE)']	"['(SERVICE, POSITIVE, ""Service"")', '(FOOD, POSITIVE, ""Fleisch"")']"
477	Der danach bestellte Glasnudelsalat war langweilig gewürzt.	['(FOOD, NEGATIVE)']	"['(FOOD, NEGATIVE, ""Glasnudelsalat"")']"
494	Nach zehn Minuten, als wir noch den zähen Braten versuchten runterzubekommen wurde die Außenbeleuchtung der LOC entfernt und die Schirme zusammengeklappt, da es etwas windig war und möglicher weiße ein Gewitter aufzog.	['(FOOD, NEGATIVE)']	"['(FOOD, NEGATIVE, ""Braten"")']"
498	Essen war mittelmäßig, Preise Düsseldorfer Niveau	['(FOOD, NEUTRAL)', '(PRICE, NEUTRAL)']	"['(FOOD, NEUTRAL, ""Essen"")', '(PRICE, NEUTRAL, ""Preise"")']"
508	Hatten Freunde aus den USA zu Besuch und nach gelungenen Stadtrundgang war das Abendessen ein sehr schöner Abschluss des Tages.	['(FOOD, POSITIVE)']	"['(FOOD, POSITIVE, ""Abendessen"")']"
509	Sehr freundlicher und aufmerksamer Service, breit gefächerte Karte - auch viele Speisen vegetarisch oder vegan.	['(SERVICE, POSITIVE)', '(FOOD, POSITIVE)']	"['(SERVICE, POSITIVE, ""Service"")', '(FOOD, POSITIVE, ""Karte"")']"
520	Kaninchen, Tintenfisch und Spinatrollen konnten uns überhaupt nicht überzeugen.	['(FOOD, NEGATIVE)', '(FOOD, NEGATIVE)', '(FOOD, NEGATIVE)']	"['(FOOD, NEGATIVE, ""Kaninchen"")', '(FOOD, NEGATIVE, ""Tintenfisch"")', '(FOOD, NEGATIVE, ""Spinatrollen"")']"
551	Ambiente toll, vielen Dank für den herrlichen Abend	['(AMBIENCE, POSITIVE)']	"['(AMBIENCE, POSITIVE, ""Ambiente"")']"
564	LOC EssenSuper BockWir hatten einen sehr schönen Abend im portugiesischen Viertel bei RESTAURANT_NAME.	['(GENERAL-IMPRESSION, POSITIVE)']	"['(GENERAL-IMPRESSION, POSITIVE, ""RESTAURANT_NAME"")']"
575	Die Bedingung reagierte darauf mit einem Schulterstücken und sie essen den auch, also soll er uns schmecken.	['(SERVICE, NEGATIVE)']	"['(SERVICE, NEGATIVE, ""Bedingung"")']"
592	Service super humorvoll und zuvorkommend!	['(SERVICE, POSITIVE)']	"['(SERVICE, POSITIVE, ""Service"")']"
593	Für den Preis eine glatte 6 oder null Punkte.	['(PRICE, NEGATIVE)']	"['(PRICE, NEGATIVE, ""Preis"")']"
599	Schneller freundlicher Service im Restaurant, Es bleibt natürlich Großgastronomie, aber eine die gut funktioniert und in der das Essen uns geschmeckt hat, das Bier ebenfalls.	['(SERVICE, POSITIVE)', '(FOOD, POSITIVE)', '(FOOD, POSITIVE)']	"['(SERVICE, POSITIVE, ""Service"")', '(FOOD, POSITIVE, ""Essen"")', '(FOOD, POSITIVE, ""Bier"")']"
601	Wenn der Betreiber mit keinem guten Beispiel vorangeht und dies der Belegschaft nicht vorlebt, dann kommt wie es kommen muss: Rundum feindseliges Ambiente.	['(AMBIENCE, NEGATIVE)', '(SERVICE, NEGATIVE)']	"['(AMBIENCE, NEGATIVE, ""Ambiente"")', '(SERVICE, NEGATIVE, ""Betreiber"")']"
607	Austern die nicht frisch waren.	['(FOOD, NEGATIVE)']	"['(FOOD, NEGATIVE, ""Austern"")']"
619	Die enge Bestuhlung im Lokal (französische Verhältnisse) lässt keinen anderen Schluss darauf zu.	['(AMBIENCE, NEGATIVE)']	"['(AMBIENCE, NEGATIVE, ""Bestuhlung"")']"
632	Das Essen war völlig in Ordnung.	['(FOOD, NEUTRAL)']	"['(FOOD, NEUTRAL, ""Essen"")']"
660	Vom Anfang an war die Kellnerin schon sehr nicht so freundlich.	['(SERVICE, NEGATIVE)']	"['(SERVICE, NEGATIVE, ""Kellnerin"")']"
664	So eine Esskultur möchten wir eigentlich nicht und möchten es auch LOC die nächste Generation vermitteln.	['(FOOD, NEGATIVE)']	"['(FOOD, NEGATIVE, ""Esskultur"")']"
684	Spätzle weiche Teigmasse.	['(FOOD, NEGATIVE)']	"['(FOOD, NEGATIVE, ""Spätzle"")']"
700	Leider bestand die angekündigte starke Marmorierung des teuren Chuck Flap Steaks nicht aus Fett, sondern aus Sehnen, was der Kellner angesichts der Reste auf dem Teller mit einem „zu zäh?	['(FOOD, NEGATIVE)']	"['(FOOD, NEGATIVE, ""Chuck Flap Steaks"")']"
703	Das Ambiente war sehr gemütlich.	['(AMBIENCE, POSITIVE)']	"['(AMBIENCE, POSITIVE, ""Ambiente"")']"
706	Zum Eigentlichen, ja die Gerichte sind nett angerichtet, geschmacklich etwas über dem Durchschnitt der sonstigen Griechen.	['(FOOD, POSITIVE)']	"['(FOOD, POSITIVE, ""Gerichte"")']"
743	Das Personal dort ist sehr freundlich und lustig.	['(SERVICE, POSITIVE)']	"['(SERVICE, POSITIVE, ""Personal"")']"
768	Nach einem spontanen Besuch heute Mittag draußen ( es war nichts los ) sind wir zur der Einsicht gekommen, dass wir dieses Brauhaus nie wieder betreten werden.	['(GENERAL-IMPRESSION, NEGATIVE)']	"['(GENERAL-IMPRESSION, NEGATIVE, ""Brauhaus"")']"
778	Es lag nicht an den einzelnen Kellnern, sondern an der (offensichtlich gewollten) Unterbesetzung im Service.	['(SERVICE, NEGATIVE)']	"['(SERVICE, NEGATIVE, ""Unterbesetzung"")']"
779	Weitere junge Servicekräfte liefen gelangweilt umher.	['(SERVICE, NEGATIVE)']	"['(SERVICE, NEGATIVE, ""Servicekräfte"")']"
805	Wir erhielten kleine Teller mit recht überschaubaren Portionen (keine Oliven, die ich bei jeder Art von Griechen erwarte ) Geschmacklich war alles in Ordnung.	['(FOOD, NEGATIVE)']	"['(FOOD, NEGATIVE, ""Portionen"")']"
815	Meine Frau war von den Königsberger Klopsen und ich von dem Rumpsteak aus dem 800° Grill begeistert.	['(FOOD, POSITIVE)', '(FOOD, POSITIVE)']	"['(FOOD, POSITIVE, ""Königsberger Klopsen"")', '(FOOD, POSITIVE, ""Rumpsteak"")']"
825	Obwohl schönes Ambiente Waren mit 4 Personen, heisse Teller wurden ohne Vorwarnung über den Köpfen anderer Gäste gereicht.	['(AMBIENCE, POSITIVE)']	"['(AMBIENCE, POSITIVE, ""Ambiente"")']"
831	Wir durften einen schönen Abend mit dem perfekten Service von Jason erleben!	['(SERVICE, POSITIVE)']	"['(SERVICE, POSITIVE, ""Service"")']"
838	Dann war leider auch noch mein Schwertfisch nicht essbar, weil noch roh ( damit meine ich nicht glasig, sondern wirklich noch komplett roh auf einer Seite) und musste reklamiert werden.	['(FOOD, NEGATIVE)']	"['(FOOD, NEGATIVE, ""Schwertfisch"")']"
843	Das personal ist sehr freundlich.	['(SERVICE, POSITIVE)']	"['(SERVICE, POSITIVE, ""personal"")']"
845	Da wir kein Tisch reserviert haben , würden wir nicht so gerne aufgenommen und wurde nur ne Stunde Zeit gegeben zum Essen …schade sonst war das Essen sehr lecker	['(FOOD, POSITIVE)']	"['(FOOD, POSITIVE, ""Essen"")']"
850	Insgesamt wirklich gut, Currywurst mit Pommes ist auch zu empfehlen.	['(FOOD, POSITIVE)']	"['(FOOD, POSITIVE, ""Currywurst mit Pommes"")']"
860	Wir hatten eine sehr freundliche Bedienung.	['(SERVICE, POSITIVE)']	"['(SERVICE, POSITIVE, ""Bedienung"")']"
885	Es ist sehr viel los gewesen und das hat man beim Service ein wenig gemerkt.	['(SERVICE, NEGATIVE)']	"['(SERVICE, NEGATIVE, ""Service"")']"
890	"Die Lage ist umwerfend, der Blick auf den LOC ist ""die habe Miete""."	['(AMBIENCE, POSITIVE)', '(AMBIENCE, POSITIVE)']	"['(AMBIENCE, POSITIVE, ""Lage"")', '(AMBIENCE, POSITIVE, ""Blick auf den LOC"")']"
892	Sehr leckeres Bier.	['(FOOD, POSITIVE)']	"['(FOOD, POSITIVE, ""Bier"")']"
906	Der Zander und das Kassler sind zu empfehlen.	['(FOOD, POSITIVE)', '(FOOD, POSITIVE)']	"['(FOOD, POSITIVE, ""Zander"")', '(FOOD, POSITIVE, ""Kassler"")']"
910	Schönes Ambiente.	['(AMBIENCE, POSITIVE)']	"['(AMBIENCE, POSITIVE, ""Ambiente"")']"
912	Sehr leckere Vorspeisen zum Teilen und dann das Fleisch beim Hauptgang.	['(FOOD, POSITIVE)', '(FOOD, POSITIVE)']	"['(FOOD, POSITIVE, ""Vorspeisen"")', '(FOOD, POSITIVE, ""Fleisch"")']"
913	Die perfekte Location für ein Date.	['(GENERAL-IMPRESSION, POSITIVE)']	"['(GENERAL-IMPRESSION, POSITIVE, ""Location"")']"
914	Wie immer super qualifizierter Service, leider kam heute die Küche nicht so pünktlich wie sonst immer hinterher.	['(SERVICE, POSITIVE)', '(SERVICE, NEGATIVE)']	"['(SERVICE, POSITIVE, ""Service"")', '(SERVICE, NEGATIVE, ""Küche"")']"
931	Wundervolles Essen.	['(FOOD, POSITIVE)']	"['(FOOD, POSITIVE, ""Essen"")']"
