id	text	labels	labels_phrases
798	Super leckeres Essen & super Getränke.	['(FOOD, POSITIVE)', '(FOOD, POSITIVE)']	"['(FOOD, POSITIVE, ""Essen"")', '(FOOD, POSITIVE, ""Getränke"")']"
835	Mega leckeres Essen und super freundliche Bedienung.	['(FOOD, POSITIVE)', '(SERVICE, POSITIVE)']	"['(FOOD, POSITIVE, ""Essen"")', '(SERVICE, POSITIVE, ""Bedienung"")']"
836	Sehr nette Mitarbeiter.	['(SERVICE, POSITIVE)']	"['(SERVICE, POSITIVE, ""Mitarbeiter"")']"
837	Die gute Laune der Kellner*innen und die Musik schaffen aber dennoch eine angenehme Atmosphäre.	['(SERVICE, POSITIVE)', '(AMBIENCE, POSITIVE)', '(AMBIENCE, POSITIVE)']	"['(SERVICE, POSITIVE, ""Kellner*innen"")', '(AMBIENCE, POSITIVE, ""Atmosphäre"")', '(AMBIENCE, POSITIVE, ""Musik"")']"
840	Nette freundliche Bedingungen und schnelles bringen der Speisen, obwohl es voll war.	['(SERVICE, POSITIVE)']	"['(SERVICE, POSITIVE, ""Bedingungen"")']"
862	Sosse selbe wie bei der Ente...= -1Darum für den Preis von fast 60 Euro kann man eigentlich was besseres erwarten...Aber das juckt dort keinen weil es die Masse macht....	['(PRICE, NEGATIVE)']	"['(PRICE, NEGATIVE, ""Preis"")']"
889	Wir hatten einen wundervollen Abend mit einem 6-Gänge Menü mit Weinbegleitung und jeder Gang war einfach nur perfekt aufeinander abgestimmt und das beste was wir seit langem gegessen haben.	['(FOOD, POSITIVE)']	"['(FOOD, POSITIVE, ""Gang"")']"
894	Das Essen ist mit sehr viel Deko streckenweise stark überlastet, was leider beim Rindertartar dazu führte, dass das Fleisch geschmacklich komplett unter Perlzwiebeln, Sauce und Sprossen unterging.	['(FOOD, NEGATIVE)', '(FOOD, NEGATIVE)', '(FOOD, NEGATIVE)']	"['(FOOD, NEGATIVE, ""Deko"")', '(FOOD, NEGATIVE, ""Essen"")', '(FOOD, NEGATIVE, ""Rindertartar"")']"
897	Die Bedienung war sehr aufmerksam und nett und hat bis zum Ende der Zeit die Getränke stets am Tisch getauscht bzw. aktiv nachgefragt.	['(SERVICE, POSITIVE)']	"['(SERVICE, POSITIVE, ""Bedienung"")']"
904	Tolles Ambiente, sehr guter Service und vor allem exquisite und köstliche Gerichte.	['(AMBIENCE, POSITIVE)', '(SERVICE, POSITIVE)', '(FOOD, POSITIVE)']	"['(AMBIENCE, POSITIVE, ""Ambiente"")', '(SERVICE, POSITIVE, ""Service"")', '(FOOD, POSITIVE, ""Gerichte"")']"
921	Die Portionsgrößen sind tendenziell großzügig.	['(FOOD, POSITIVE)']	"['(FOOD, POSITIVE, ""Portionsgrößen"")']"
943	Ich habe mir einen 'grossen' Salat bestellt, der nur 2-3 Salatblätter hatte, der restliche Teller war überwiegend Kartoffelsalat und das Brot war mehr alter Zwieback als ein schönes Baguette.	['(FOOD, NEGATIVE)', '(FOOD, NEGATIVE)']	"['(FOOD, NEGATIVE, ""Brot"")', '(FOOD, NEGATIVE, ""\'grossen\' Salat"")']"
946	Das LOC verbrannt,ungenießbar.	['(FOOD, NEGATIVE)']	"['(FOOD, NEGATIVE, ""LOC"")']"
953	Speisen = Imbissbudenniveau auf Porzellantellern mit Besteck - Stimmung o.k.	['(FOOD, NEGATIVE)', '(AMBIENCE, NEUTRAL)']	"['(FOOD, NEGATIVE, ""Speisen"")', '(AMBIENCE, NEUTRAL, ""Stimmung"")']"
954	Mir persönlich gefällt sehr gut, dass das Gasthaus altbewährtes Ambiente mit moderner und zeitgemäßer Küche verbindet.	['(AMBIENCE, POSITIVE)', '(FOOD, POSITIVE)']	"['(AMBIENCE, POSITIVE, ""Ambiente"")', '(FOOD, POSITIVE, ""Küche"")']"
955	"Die Weine aus dieser ""kleinen Weinregion"" passten sensationell zu den jeweiligen Gängen und zeugten von der Qualität des Sommeliers."	['(FOOD, POSITIVE)', '(SERVICE, POSITIVE)']	"['(FOOD, POSITIVE, ""Weine"")', '(SERVICE, POSITIVE, ""Sommeliers"")']"
957	Unfassbar unfreundlicher Service.	['(SERVICE, NEGATIVE)']	"['(SERVICE, NEGATIVE, ""Service"")']"
986	Uns hat das Ambiente der Metzgerei ebenfalls sehr gut gefallen.	['(AMBIENCE, POSITIVE)']	"['(AMBIENCE, POSITIVE, ""Metzgerei"")']"
1014	Egal ob Bolognese für Kids oder rafinnierte Kalbmedalliins mit Pinienkernen für uns- alles schmeckt.	['(FOOD, POSITIVE)', '(FOOD, POSITIVE)']	"['(FOOD, POSITIVE, ""Bolognese"")', '(FOOD, POSITIVE, ""Kalbmedalliins mit Pinienkernen"")']"
1016	Die Hauptgerichte waren einfach nur gutbürgerliches Mittelfeld, 08-15 zubereitet.	['(FOOD, NEUTRAL)']	"['(FOOD, NEUTRAL, ""Hauptgerichte"")']"
1039	Auch meine Frau war mit dem Wiener Schnitzel nicht ganz zufrieden.	['(FOOD, NEGATIVE)']	"['(FOOD, NEGATIVE, ""Wiener Schnitzel"")']"
1048	Das LOC für 18,60€ Ist dermaßen überbraten, dass das Fleisch trocken, hart und kaum zu schneiden war.	['(FOOD, NEGATIVE)', '(PRICE, NEGATIVE)']	"['(FOOD, NEGATIVE, ""Fleisch"")', '(PRICE, NEGATIVE, ""LOC"")']"
1052	Ein Restaurant mit einer tollen Einrichtung.	['(AMBIENCE, POSITIVE)']	"['(AMBIENCE, POSITIVE, ""Einrichtung"")']"
1074	Pancakes, Brot, Brötchen, Kuchen, Müsli, Joghurt, Säfte, Tee, Kaffee, Wurst, Käse, Mett, Eier, Bacon, Würstchen usw. Einfach klasse und wenn man einen Platz an der LOC bekommt, umso schöner.	['(FOOD, POSITIVE)', '(FOOD, POSITIVE)', '(FOOD, POSITIVE)', '(FOOD, POSITIVE)', '(FOOD, POSITIVE)', '(FOOD, POSITIVE)', '(FOOD, POSITIVE)', '(FOOD, POSITIVE)', '(FOOD, POSITIVE)', '(FOOD, POSITIVE)', '(FOOD, POSITIVE)', '(FOOD, POSITIVE)', '(FOOD, POSITIVE)', '(FOOD, POSITIVE)', '(FOOD, POSITIVE)', '(AMBIENCE, POSITIVE)']	"['(FOOD, POSITIVE, ""Pancakes"")', '(FOOD, POSITIVE, ""Brot"")', '(FOOD, POSITIVE, ""Brötchen"")', '(FOOD, POSITIVE, ""Kuchen"")', '(FOOD, POSITIVE, ""Müsli"")', '(FOOD, POSITIVE, ""Joghurt"")', '(FOOD, POSITIVE, ""Säfte"")', '(FOOD, POSITIVE, ""Tee"")', '(FOOD, POSITIVE, ""Kaffee"")', '(FOOD, POSITIVE, ""Wurst"")', '(FOOD, POSITIVE, ""Käse"")', '(FOOD, POSITIVE, ""Mett"")', '(FOOD, POSITIVE, ""Eier"")', '(FOOD, POSITIVE, ""Bacon"")', '(FOOD, POSITIVE, ""Würstchen"")', '(AMBIENCE, POSITIVE, ""Platz an der LOC"")']"
1078	Waren zudem vom innerstädtischen fairen Preis überrascht.	['(PRICE, POSITIVE)']	"['(PRICE, POSITIVE, ""Preis"")']"
1099	Die Käsespätzle haben leider keinen Käse gesehen.	['(FOOD, NEGATIVE)']	"['(FOOD, NEGATIVE, ""Käsespätzle"")']"
1103	Die Vorspeise (rote Bete) war sehr lecker.	['(FOOD, POSITIVE)']	"['(FOOD, POSITIVE, ""Vorspeise (rote Bete)"")']"
1111	Die Preise sind sehr gehoben, daher wird eher kein regelmäßiger Besuch resultieren.	['(PRICE, NEGATIVE)']	"['(PRICE, NEGATIVE, ""Preise"")']"
1116	Die Bedienung war sehr nett und zuvor kommend.	['(SERVICE, POSITIVE)']	"['(SERVICE, POSITIVE, ""Bedienung"")']"
1117	Sehr freundliche Bedienung.	['(SERVICE, POSITIVE)']	"['(SERVICE, POSITIVE, ""Bedienung"")']"
1118	Sehr leckeres Essen in einem gemütlichen Ambiente.	['(FOOD, POSITIVE)', '(AMBIENCE, POSITIVE)']	"['(FOOD, POSITIVE, ""Essen"")', '(AMBIENCE, POSITIVE, ""Ambiente"")']"
1122	Wir werden das Restaurant sicherlich noch einige Male besuchen.	['(GENERAL-IMPRESSION, POSITIVE)']	"['(GENERAL-IMPRESSION, POSITIVE, ""Restaurant"")']"
1126	Die Speisen sind türkische Standard Küche etwas über dem Durchschnitt.	['(FOOD, POSITIVE)']	"['(FOOD, POSITIVE, ""Speisen"")']"
1130	Authentisches griechisches Essen für einen super Preis.	['(FOOD, POSITIVE)', '(PRICE, POSITIVE)']	"['(FOOD, POSITIVE, ""Essen"")', '(PRICE, POSITIVE, ""Essen"")']"
1132	Wir haben uns sehr wohl gefühlt , tolle Atmosphäre !	['(AMBIENCE, POSITIVE)']	"['(AMBIENCE, POSITIVE, ""Atmosphäre"")']"
1134	Der Service war auch erstklassig und das Personal war sehr freundlich.	['(SERVICE, POSITIVE)', '(SERVICE, POSITIVE)']	"['(SERVICE, POSITIVE, ""Service"")', '(SERVICE, POSITIVE, ""Personal"")']"
1137	Mitten in der LOC umgeben von einer bunten Sammlung internationaler Speiselokale sticht eine große, gepflegte Terrasse hervor.	['(AMBIENCE, POSITIVE)']	"['(AMBIENCE, POSITIVE, ""Terrasse"")']"
1139	Nette Kellnerinnen und Kellner in nettem Outfit, mit Gatsby-Mütze und Hosenträger – also: Ich habe mich wohlgefühlt.	['(SERVICE, POSITIVE)', '(SERVICE, POSITIVE)']	"['(SERVICE, POSITIVE, ""Kellnerinnen"")', '(SERVICE, POSITIVE, ""Kellner"")']"
1143	Ambiente und Essen sind sehr stimmig.	['(FOOD, POSITIVE)', '(AMBIENCE, POSITIVE)']	"['(FOOD, POSITIVE, ""Essen"")', '(AMBIENCE, POSITIVE, ""Ambiente"")']"
1175	Beim Thai mixed Starter fehlten unkommentiert zwei auf der Speisekarte angekündigte Komponenten.	['(FOOD, NEGATIVE)']	"['(FOOD, NEGATIVE, ""Thai mixed Starter"")']"
1179	Die Bedienung war freundlich, das war aber auch das einzig positive.	['(SERVICE, POSITIVE)']	"['(SERVICE, POSITIVE, ""Bedienung"")']"
1184	Bin total enttäuscht dieses Restaurant zu so einen besonderen Tag rausgesucht zu haben.	['(GENERAL-IMPRESSION, NEGATIVE)']	"['(GENERAL-IMPRESSION, NEGATIVE, ""Restaurant"")']"
1185	Das Eis dazu war zu dominant.	['(FOOD, NEGATIVE)']	"['(FOOD, NEGATIVE, ""Eis"")']"
1187	Negatives Highlight war die verbale Begegnung mit dem Chef des Hauses.	['(SERVICE, NEGATIVE)']	"['(SERVICE, NEGATIVE, ""Chef"")']"
1196	Während die Salsiccia noch in Ordnung war, war die Pizza Gamberetti komplett trocken.	['(FOOD, NEUTRAL)', '(FOOD, NEGATIVE)']	"['(FOOD, NEUTRAL, ""Salsiccia"")', '(FOOD, NEGATIVE, ""Pizza Gamberetti"")']"
1200	Das Essen war guter Standard.	['(FOOD, POSITIVE)']	"['(FOOD, POSITIVE, ""Essen"")']"
1210	Wagner muss man mögen............die Kellner sind schon seit mehr als 20 Jahren die gleichen und man muss Sie mögen.	['(SERVICE, POSITIVE)', '(GENERAL-IMPRESSION, POSITIVE)']	"['(SERVICE, POSITIVE, ""Kellner"")', '(GENERAL-IMPRESSION, POSITIVE, ""Wagner"")']"
1227	Ein Service der absoluten Spitzenklasse, so extrem aufmerksam und freundlich, wie es heute nur noch selten anzutreffen ist.	['(SERVICE, POSITIVE)']	"['(SERVICE, POSITIVE, ""Service"")']"
1233	Toller Service, schnelle und aufmerksame Bedienung.	['(SERVICE, POSITIVE)', '(SERVICE, POSITIVE)']	"['(SERVICE, POSITIVE, ""Service"")', '(SERVICE, POSITIVE, ""Bedienung"")']"
1236	!Dieses Lokal können wir sehr guten Gewissens nur empfehlen (und wir empfehlen nur selten Restaurants).	['(GENERAL-IMPRESSION, POSITIVE)']	"['(GENERAL-IMPRESSION, POSITIVE, ""Lokal"")']"
1241	Am LOC gelegen, wird hier leckeres Bier und zünftiges Essen serviert.	['(FOOD, POSITIVE)', '(FOOD, POSITIVE)']	"['(FOOD, POSITIVE, ""Bier"")', '(FOOD, POSITIVE, ""Essen"")']"
1258	Das Lokal war trotz Wochenende wirklich schlecht besucht, so hoch wie ich die Preise in Erinnerung hatte, waren sie aber gar nicht.	['(PRICE, NEUTRAL)']	"['(PRICE, NEUTRAL, ""Preise"")']"
1264	Mitarbeiter unterhalten sich an der Küchentheke ….. macht nicht den besten Eindruck!	['(SERVICE, NEGATIVE)']	"['(SERVICE, NEGATIVE, ""Mitarbeiter"")']"
1272	Auch wenn das Ambiente nicht so ansprechend war, hat uns doch das Konzept und die Frische der Speisen überzeugt.	['(AMBIENCE, NEGATIVE)', '(FOOD, POSITIVE)']	"['(AMBIENCE, NEGATIVE, ""Ambiente"")', '(FOOD, POSITIVE, ""Speisen"")']"
1292	LOC hat im laufe der Zeit nachgelassen.	['(GENERAL-IMPRESSION, NEGATIVE)']	"['(GENERAL-IMPRESSION, NEGATIVE, ""LOC"")']"
1294	Das war wirklich schade und hier stimmt das Preis-Leistungs-Verhältnis gar nicht.	['(PRICE, NEGATIVE)']	"['(PRICE, NEGATIVE, ""Preis-Leistungs-Verhältnis"")']"
1301	Eine Haxe für EUR 26,50 ist schon preislich ambitioniert.	['(PRICE, NEGATIVE)']	"['(PRICE, NEGATIVE, ""Haxe"")']"
1324	Der Kartoffelsalat war nicht mehr so gut.	['(FOOD, NEGATIVE)']	"['(FOOD, NEGATIVE, ""Kartoffelsalat"")']"
1343	Das Personal war herzlich und aufmerksam.	['(SERVICE, POSITIVE)']	"['(SERVICE, POSITIVE, ""Personal"")']"
1348	Meinen Vorrednern kann ich mich dahingehend anschließen, dass die bayerische Küche gut und das Augustiner -Bier sehr gepflegt ist.	['(FOOD, POSITIVE)', '(FOOD, POSITIVE)']	"['(FOOD, POSITIVE, ""Küche"")', '(FOOD, POSITIVE, ""Augustiner -Bier"")']"
1353	Beim Bezahlen gaben wir dem Kellner dann Trinkgeld, was scheinbar nicht ausreichend war, weil er uns mit den Worten „ach heute ist nicht mehr drin?“ verabschiedete.	['(SERVICE, NEGATIVE)']	"['(SERVICE, NEGATIVE, ""Kellner"")']"
1368	Klasse Laden super sympathische Kellner und eine nette Atmosphäre.	['(GENERAL-IMPRESSION, POSITIVE)', '(SERVICE, POSITIVE)', '(AMBIENCE, POSITIVE)']	"['(GENERAL-IMPRESSION, POSITIVE, ""Laden"")', '(SERVICE, POSITIVE, ""Kellner"")', '(AMBIENCE, POSITIVE, ""Atmosphäre"")']"
1371	"Sehr positiv überzeugt von ""meinen"" beiden Kellnerinnen Lena und Ihre Ausbilderin Andrea."	['(SERVICE, POSITIVE)', '(SERVICE, POSITIVE)']	"['(SERVICE, POSITIVE, ""Lena"")', '(SERVICE, POSITIVE, ""Andrea"")']"
1396	und wir einen wunderbaren Abend mit extrem leckerem und einfallsreichen Essen verbrachten!	['(FOOD, POSITIVE)']	"['(FOOD, POSITIVE, ""Essen"")']"
1401	Das Fleisch des Brauhaustellers war ungenießbar!	['(FOOD, NEGATIVE)']	"['(FOOD, NEGATIVE, ""Fleisch"")']"
1428	Der Typ sagte zu uns, dass er bestimmen würde, welcher Tisch frei ist und welcher nicht.	['(SERVICE, NEGATIVE)']	"['(SERVICE, NEGATIVE, ""Typ"")']"
1431	Für das Ambiente 4 von 5 Sternen- man kann nichts aussetzten, ist halt Geschmackssache.	['(AMBIENCE, POSITIVE)']	"['(AMBIENCE, POSITIVE, ""Ambiente"")']"
1438	Das Personal ist leicht arrogant und nicht besonders freundlich.	['(SERVICE, NEGATIVE)']	"['(SERVICE, NEGATIVE, ""Personal"")']"
1440	Großartige Gerichte, kreiert mit besten Produkten, auch aus der Region; delikat, gradlinig, auf hohem Niveau.	['(FOOD, POSITIVE)', '(FOOD, POSITIVE)']	"['(FOOD, POSITIVE, ""Gerichte"")', '(FOOD, POSITIVE, ""Produkten"")']"
1459	Beim Schweinebraten hat die Würze gefehlt, der dazugehörige Salat war fantastisch, die Kruste auch, der Kartoffelknödel war essbar, der Semmelknödel weniger.	['(FOOD, NEGATIVE)', '(FOOD, POSITIVE)', '(FOOD, POSITIVE)', '(FOOD, POSITIVE)', '(FOOD, NEGATIVE)']	"['(FOOD, NEGATIVE, ""Schweinebraten"")', '(FOOD, POSITIVE, ""Salat"")', '(FOOD, POSITIVE, ""Kruste"")', '(FOOD, POSITIVE, ""Kartoffelknödel"")', '(FOOD, NEGATIVE, ""Semmelknödel"")']"
1470	Entspanntes Ambiente, auch die Grüße aus der Küche sowie Pré- und Postdesert waren unglaublich lecker und besonders!	['(AMBIENCE, POSITIVE)', '(FOOD, POSITIVE)', '(FOOD, POSITIVE)']	"['(AMBIENCE, POSITIVE, ""Ambiente"")', '(FOOD, POSITIVE, ""Grüße aus der Küche"")', '(FOOD, POSITIVE, ""Pré- und Postdesert"")']"
1475	Allerdings ist das Restaurant kein Schnäppchen.	['(PRICE, NEGATIVE)']	"['(PRICE, NEGATIVE, ""Restaurant"")']"
1482	Mehrere sehr junge Kellnerinnen waren im Außenbereich, nur war es schwer, eine Bestellung abzugeben, da sich niemand zuständig fühlte.	['(SERVICE, NEGATIVE)']	"['(SERVICE, NEGATIVE, ""Kellnerinnen"")']"
1484	Sorry, aber Hunde im Restaurant gehen garnicht.	['(AMBIENCE, NEGATIVE)']	"['(AMBIENCE, NEGATIVE, ""Hunde im Restaurant"")']"
1485	Der Fisch war sehr durch, welches vom Kellner ohne Reaktion registriert wurde!	['(SERVICE, NEGATIVE)', '(SERVICE, NEGATIVE)']	"['(SERVICE, NEGATIVE, ""Fisch"")', '(SERVICE, NEGATIVE, ""Kellner"")']"
1490	Die schlechteste Haxe, die ich in meinem Leben gegessen habe.	['(FOOD, NEGATIVE)']	"['(FOOD, NEGATIVE, ""Haxe"")']"
18	Sehr freundlich, auch zu unserem Hund.	['(SERVICE, POSITIVE)']	"['(SERVICE, POSITIVE, ""freundlich"")']"
23	Absolut überzogen sind die Weinpreise -für ein 0.2 Glas zwischen 6 und 12 !	['(PRICE, NEGATIVE)']	"['(PRICE, NEGATIVE, ""Weinpreise"")']"
26	Als die Hauptspeisen kamen waren wir voll zufrieden, die Steaks waren auf den Punkt gebraten und die Beilagen schmackhaft und völlig ausreichend.	['(FOOD, POSITIVE)', '(FOOD, POSITIVE)']	"['(FOOD, POSITIVE, ""Steaks"")', '(FOOD, POSITIVE, ""Beilagen"")']"
41	Eine normale Unterhaltung ist aufgrund der Lautstärke, bei vollen Lokal (Und ich glaube das Haus ist immer voll) kaum möglich.	['(AMBIENCE, NEGATIVE)']	"['(AMBIENCE, NEGATIVE, ""Lautstärke"")']"
66	Freundliche Bedienung.	['(SERVICE, POSITIVE)']	"['(SERVICE, POSITIVE, ""Bedienung"")']"
93	Das Essen und der Service war ausgesprochen gut.	['(FOOD, POSITIVE)', '(SERVICE, POSITIVE)']	"['(FOOD, POSITIVE, ""Essen"")', '(SERVICE, POSITIVE, ""Service"")']"
106	Absolut schlechte Küche!	['(FOOD, NEGATIVE)']	"['(FOOD, NEGATIVE, ""Küche"")']"
107	"Diese ""Kantine""war wohl nichts für uns."	['(FOOD, NEGATIVE)']	"['(FOOD, NEGATIVE, ""Kantine"")']"
126	Das Essen ist mega.	['(FOOD, POSITIVE)']	"['(FOOD, POSITIVE, ""Essen"")']"
128	Preis Leistung sind hier einfach gar nicht stimmig und man fühlt sich dann doch ein bisschen über den Tisch gezogen.	['(PRICE, NEGATIVE)']	"['(PRICE, NEGATIVE, ""Preis Leistung"")']"
129	Die Gerichte zart, aber herzhaft gewürzt rundeten den Abend ab.	['(FOOD, POSITIVE)']	"['(FOOD, POSITIVE, ""Gerichte"")']"
134	Der dazugehörige Krautsalat, welcher überhaupt keiner war, war ungenießbar.	['(FOOD, NEGATIVE)']	"['(FOOD, NEGATIVE, ""Krautsalat"")']"
141	Beim Essen wurden wir jedoch ziemlich enttäuscht.	['(FOOD, NEGATIVE)']	"['(FOOD, NEGATIVE, ""Essen"")']"
151	Beim Cheeseburger war nur eine Spur Cheese aufgelegt.	['(FOOD, NEGATIVE)', '(FOOD, NEGATIVE)']	"['(FOOD, NEGATIVE, ""Cheeseburger"")', '(FOOD, NEGATIVE, ""Cheese"")']"
159	Um dies nochmals zu verdeutlichen, zeigte es sich durch Aussagen auf portugiesisch, wie schnell sie die Gäste loswerden möchten.	['(SERVICE, NEGATIVE)']	"['(SERVICE, NEGATIVE, ""Aussagen auf portugiesisch"")']"
183	Im Sommer werden wir auf der netten Terrasse noch einmal die RESTAURANT_NAME besuchen.	['(AMBIENCE, POSITIVE)']	"['(AMBIENCE, POSITIVE, ""Terrasse"")']"
187	Die Beilagen hingegen waren super.	['(FOOD, POSITIVE)']	"['(FOOD, POSITIVE, ""Beilagen"")']"
191	Prima Service und sehr leckeres Essen.	['(SERVICE, POSITIVE)', '(FOOD, POSITIVE)']	"['(SERVICE, POSITIVE, ""Service"")', '(FOOD, POSITIVE, ""Essen"")']"
192	"Die Live-Musik durch einen ""Alleinunterhalter"" ist auf Pop getrimmt (mit Gesang) und viel zu laut."	['(AMBIENCE, NEGATIVE)']	"['(AMBIENCE, NEGATIVE, ""Live-Musik"")']"
197	LOC ist unterer Durchschnitt.	['(GENERAL-IMPRESSION, NEGATIVE)']	"['(GENERAL-IMPRESSION, NEGATIVE, ""LOC"")']"
212	Auch wenn mich ein Restaurant schonmal enttäuscht hat, gebe ich gerne eine zweite Chance.	['(GENERAL-IMPRESSION, NEGATIVE)']	"['(GENERAL-IMPRESSION, NEGATIVE, ""Restaurant"")']"
241	Alle Gerichte haben total gut geschmeckt, nicht überwürzt und die Portionen genau richtig.	['(FOOD, POSITIVE)', '(FOOD, POSITIVE)']	"['(FOOD, POSITIVE, ""Gerichte"")', '(FOOD, POSITIVE, ""Portionen"")']"
245	Die Speisen sind in Ordnung.	['(FOOD, NEUTRAL)']	"['(FOOD, NEUTRAL, ""Speisen"")']"
262	Wir waren hier essen und mit der Qualität des Essens wirklich super zufrieden.	['(FOOD, POSITIVE)']	"['(FOOD, POSITIVE, ""Essens"")']"
271	Bratkartoffeln, Sauerkraut, Kartoffelstampf, Schnitzel, Grüne Soße - alles sehr lecker.	['(FOOD, POSITIVE)', '(FOOD, POSITIVE)', '(FOOD, POSITIVE)', '(FOOD, POSITIVE)', '(FOOD, POSITIVE)']	"['(FOOD, POSITIVE, ""Bratkartoffeln"")', '(FOOD, POSITIVE, ""Kartoffelstampf"")', '(FOOD, POSITIVE, ""Sauerkraut"")', '(FOOD, POSITIVE, ""Schnitzel"")', '(FOOD, POSITIVE, ""Grüne Soße"")']"
274	Das Altbier ist weniger süffig als anderswo und daher besser durstlöschend.	['(FOOD, NEGATIVE)']	"['(FOOD, NEGATIVE, ""Altbier"")']"
282	Meine bisherigen sehr guten Eindrücke von diesem Restaurant wurden am frühen Freitagabend sehr getrübt durch ein absolut unakzeptables, aufgewärmtes Essen von der Tageskarte: Trockener Kap-Seehecht, gekochte Salzkartoffeln, wo sich schon eine Kruste gebildet hatte.	['(FOOD, NEGATIVE)', '(FOOD, NEGATIVE)', '(FOOD, NEGATIVE)']	"['(FOOD, NEGATIVE, ""Essen"")', '(FOOD, NEGATIVE, ""Kap-Seehecht"")', '(FOOD, NEGATIVE, ""Salzkartoffeln"")']"
283	Preise für das Kölsch (0,2 l) empfinde ich etwas übertrieben.	['(PRICE, NEGATIVE)']	"['(PRICE, NEGATIVE, ""Kölsch"")']"
284	Tolle Location; super freundliches und aufmerksames Personal; gutes Essen und Bier; auch ohne Reservierung haben wir am Samstagabend einen Tisch bekommen	['(AMBIENCE, POSITIVE)', '(SERVICE, POSITIVE)', '(FOOD, POSITIVE)', '(FOOD, POSITIVE)']	"['(AMBIENCE, POSITIVE, ""Location"")', '(SERVICE, POSITIVE, ""Personal"")', '(FOOD, POSITIVE, ""Essen"")', '(FOOD, POSITIVE, ""Bier"")']"
298	Sehr gute Kohlparty, Essen ausgezeichnet, DJ spitze.	['(FOOD, POSITIVE)', '(AMBIENCE, POSITIVE)']	"['(FOOD, POSITIVE, ""Essen"")', '(AMBIENCE, POSITIVE, ""DJ"")']"
300	Das Kalbsschnitzel mit 19EUR nicht teuer aber absolut lieblos und dahin ger...zt.	['(PRICE, NEUTRAL)', '(FOOD, NEGATIVE)']	"['(PRICE, NEUTRAL, ""Kalbsschnitzel"")', '(FOOD, NEGATIVE, ""Kalbsschnitzel"")']"
303	Schade ums Geld	['(PRICE, NEGATIVE)']	"['(PRICE, NEGATIVE, ""Geld"")']"
305	Gutes Essen Schöner Spielplatz	['(FOOD, POSITIVE)', '(AMBIENCE, POSITIVE)']	"['(FOOD, POSITIVE, ""Essen"")', '(AMBIENCE, POSITIVE, ""Spielplatz"")']"
313	Sehr nette Bedienung und super Service.	['(SERVICE, POSITIVE)', '(SERVICE, POSITIVE)']	"['(SERVICE, POSITIVE, ""Bedienung"")', '(SERVICE, POSITIVE, ""Service"")']"
315	Sehr angenehme Ambiance im LOC.	['(AMBIENCE, POSITIVE)']	"['(AMBIENCE, POSITIVE, ""Ambiance"")']"
321	Ich war in der RESTAURANT_NAME mit meiner Familie und kann wirklich nur ausschließlich positiv darüber berichten.	['(GENERAL-IMPRESSION, POSITIVE)']	"['(GENERAL-IMPRESSION, POSITIVE, ""RESTAURANT_NAME"")']"
322	Unsere Bedienung an dem Abend war super und fix.	['(SERVICE, POSITIVE)']	"['(SERVICE, POSITIVE, ""Bedienung"")']"
326	Innovative Chefs mit intensivem Internet-Marketing; anfangs dachte ich, fast „zuviel des Guten“, was wird da auf mich zukommen.	['(SERVICE, POSITIVE)']	"['(SERVICE, POSITIVE, ""Chefs"")']"
335	Das Essen schmeckt einfach nur Bombe, so etwas leckeres, Megaaaa!	['(FOOD, POSITIVE)']	"['(FOOD, POSITIVE, ""Essen"")']"
341	Schon mit der Reservierung gab es Probleme.	['(SERVICE, NEGATIVE)']	"['(SERVICE, NEGATIVE, ""Reservierung"")']"
342	Allerdings mussten wir noch weitere 30 Minuten bis zur Lieferung warten.	['(SERVICE, NEGATIVE)']	"['(SERVICE, NEGATIVE, ""Lieferung"")']"
356	Besonders charmant war unser Kellner Bruno.	['(SERVICE, POSITIVE)']	"['(SERVICE, POSITIVE, ""Bruno"")']"
365	Wir waren begeistert von der Vielfalt der Gerichte auf der Karte und hatten Schwierigkeiten, uns zu entscheiden.	['(FOOD, POSITIVE)']	"['(FOOD, POSITIVE, ""Vielfalt der Gerichte auf der Karte"")']"
366	Plätze draußen in schöner Atmosphäre.	['(AMBIENCE, POSITIVE)']	"['(AMBIENCE, POSITIVE, ""Atmosphäre"")']"
374	Sehr schönes Restaurant.	['(GENERAL-IMPRESSION, POSITIVE)']	"['(GENERAL-IMPRESSION, POSITIVE, ""Restaurant"")']"
383	Die Hummer Suppe ein Gaumenschmaus, gefolgt vom Heilbutt, so lecker und dann das weiße Schoko Mousse- yummy 😋.	['(FOOD, POSITIVE)', '(FOOD, POSITIVE)', '(FOOD, POSITIVE)']	"['(FOOD, POSITIVE, ""Hummer Suppe"")', '(FOOD, POSITIVE, ""Heilbutt"")', '(FOOD, POSITIVE, ""Schoko Mousse"")']"
385	Super freundliches Personal !	['(SERVICE, POSITIVE)']	"['(SERVICE, POSITIVE, ""Personal"")']"
409	Ein toller Abend mit fantastischem Essen von großartiger Qualität -die Seezunge war ein Traum- und einem super Service!	['(FOOD, POSITIVE)', '(FOOD, POSITIVE)', '(SERVICE, POSITIVE)']	"['(FOOD, POSITIVE, ""Essen"")', '(FOOD, POSITIVE, ""Seezunge"")', '(SERVICE, POSITIVE, ""Service"")']"
411	Super leckeres Essen, schönes Ambiente in zentraler Lage, tolle getöpferte Kerzenständer und ein sehr freundlicher Service.	['(FOOD, POSITIVE)', '(AMBIENCE, POSITIVE)', '(AMBIENCE, POSITIVE)', '(SERVICE, POSITIVE)']	"['(FOOD, POSITIVE, ""Essen"")', '(AMBIENCE, POSITIVE, ""Ambiente"")', '(AMBIENCE, POSITIVE, ""Kerzenständer"")', '(SERVICE, POSITIVE, ""Service"")']"
440	Das Lokal war meiner Meinung nach völlig überfüllt, extrem laut, keine Unterhaltung mehr möglich.	['(AMBIENCE, NEGATIVE)']	"['(AMBIENCE, NEGATIVE, ""Lokal"")']"
480	Sehr schöne Atmosphäre, guter Hauswein, freundliches Personal, haben nur was getrunken, daher kann ich Essen nicht beurteilen.	['(AMBIENCE, POSITIVE)', '(FOOD, POSITIVE)', '(SERVICE, POSITIVE)']	"['(AMBIENCE, POSITIVE, ""Atmosphäre"")', '(FOOD, POSITIVE, ""Hauswein"")', '(SERVICE, POSITIVE, ""Personal"")']"
482	Das Essen war meiner Meinung nach okay.	['(FOOD, NEUTRAL)']	"['(FOOD, NEUTRAL, ""Essen"")']"
483	Der Service im LOC war freundlich, schnell und aufmerksam.	['(SERVICE, POSITIVE)']	"['(SERVICE, POSITIVE, ""Service"")']"
493	Der Service war sehr freundlich.	['(SERVICE, POSITIVE)']	"['(SERVICE, POSITIVE, ""Service"")']"
497	Der Service rund um Jason war von vorne bis hinten zuvorkommend und das Essen erste Klasse.	['(SERVICE, POSITIVE)', '(FOOD, POSITIVE)']	"['(SERVICE, POSITIVE, ""Service rund um Jason"")', '(FOOD, POSITIVE, ""Essen"")']"
500	Wenn es mein Kaffee wäre, würde ich diesen unzufriedenen Kellner fristlos entlassen!	['(SERVICE, NEGATIVE)', '(GENERAL-IMPRESSION, NEGATIVE)']	"['(SERVICE, NEGATIVE, ""Kellner"")', '(GENERAL-IMPRESSION, NEGATIVE, ""Kaffee"")']"
503	Die Begrüßung war kühl und wirkte gezwungen und lieblos.	['(SERVICE, NEGATIVE)']	"['(SERVICE, NEGATIVE, ""Begrüßung"")']"
530	Ein absolutes Durstessen.	['(FOOD, NEGATIVE)']	"['(FOOD, NEGATIVE, ""Durstessen"")']"
538	Die Getränke waren O.K.	['(FOOD, NEUTRAL)']	"['(FOOD, NEUTRAL, ""Getränke"")']"
543	Nächste mal gehe ich lieber wieder zu Curry 36, da geht es 10 mal schneller und das Preis Leistungsverhältnis stimmt.	['(PRICE, NEGATIVE)']	"['(PRICE, NEGATIVE, ""Preis Leistungsverhältnis"")']"
547	"Die Bedienungen verteilten die Reste aus der Theke grade untereinander und wiesen meine Frage mit barschen Worten zurück: ""Es ist geschlossen!"	['(SERVICE, NEGATIVE)']	"['(SERVICE, NEGATIVE, ""Bedienungen"")']"
549	Urige Wirtschaft mit einem coolen Ambiente.	['(AMBIENCE, POSITIVE)', '(AMBIENCE, POSITIVE)']	"['(AMBIENCE, POSITIVE, ""Wirtschaft"")', '(AMBIENCE, POSITIVE, ""Ambiente"")']"
550	Sehr leckeres Essen, tolles Ambiente, guter Service - und Highlight Turmbesteigung mit Lotter-Führung.	['(FOOD, POSITIVE)', '(AMBIENCE, POSITIVE)', '(SERVICE, POSITIVE)']	"['(FOOD, POSITIVE, ""Essen"")', '(AMBIENCE, POSITIVE, ""Ambiente"")', '(SERVICE, POSITIVE, ""Service"")']"
578	Was mich diesmal echt gestört hat war der Service.	['(SERVICE, NEGATIVE)']	"['(SERVICE, NEGATIVE, ""Service"")']"
582	Ioulianos Ist super freundlich und gibt tolle Empfehlungen denen wir gerne gefolgt sind.	['(SERVICE, POSITIVE)']	"['(SERVICE, POSITIVE, ""Ioulianos"")']"
