id	text	labels	labels_phrases
0	Gemütliche Atmung und rustikale Deko an Wänden.	['(AMBIENCE, POSITIVE)', '(AMBIENCE, POSITIVE)']	"['(AMBIENCE, POSITIVE, ""Atmung"")', '(AMBIENCE, POSITIVE, ""Deko an Wänden"")']"
1	Zum Servicepersonal, der Küche und dem „Chef im Ring“ bleibt zu sagen: umsichtig, freundlich und gut eingestimmt machten uns die Stunden im Biergarten recht viel Freude!	['(SERVICE, POSITIVE)', '(SERVICE, POSITIVE)']	"['(SERVICE, POSITIVE, ""Servicepersonal"")', '(SERVICE, POSITIVE, ""Chef im Ring"")']"
11	Im Vergleich zum Personal im Schlüssel und LOC bleibt das Uerige aber doch zurück.	['(GENERAL-IMPRESSION, NEGATIVE)']	"['(GENERAL-IMPRESSION, NEGATIVE, ""Uerige"")']"
17	Speise- und Getränkekarten waren heute Mangelware.	['(SERVICE, NEGATIVE)']	"['(SERVICE, NEGATIVE, ""Speise- und Getränkekarten"")']"
21	"Sehr schade, da sitzt man im ""LOC"", einem der schönsten Münchner Innenhöfen, und die Qualität vom Essen ist einfach nur enttäuschend - in keiner Relation, weder zum Ruf des Hauses noch zu den Preisen, ob Knödel, Schnitzel, Pommes, Bratwürste oder Bratkartoffeln."	['(AMBIENCE, POSITIVE)', '(FOOD, POSITIVE)', '(PRICE, NEGATIVE)', '(PRICE, NEGATIVE)', '(PRICE, NEGATIVE)', '(PRICE, NEGATIVE)', '(PRICE, NEGATIVE)']	"['(AMBIENCE, POSITIVE, ""Innenhöfen"")', '(FOOD, POSITIVE, ""Essen"")', '(PRICE, NEGATIVE, ""Knödel"")', '(PRICE, NEGATIVE, ""Schnitzel"")', '(PRICE, NEGATIVE, ""Pommes"")', '(PRICE, NEGATIVE, ""Bratwürste"")', '(PRICE, NEGATIVE, ""Bratkartoffeln"")']"
27	Mein Rollo war so ungewürzt … unsere Freunde ließen eine Pfannen-Spezialität des Hauses nach der Hälfte stehen (sonst sei dieses Gericht wirklich gut).	['(FOOD, NEGATIVE)', '(FOOD, NEGATIVE)']	"['(FOOD, NEGATIVE, ""Rollo"")', '(FOOD, NEGATIVE, ""Pfannen-Spezialität"")']"
28	"Das ""neue"" Thai & Turf hat leider nichts mehr mit unseren Erfahrungen an der alten Location zu tun."	['(GENERAL-IMPRESSION, NEGATIVE)']	"['(GENERAL-IMPRESSION, NEGATIVE, ""Thai & Turf"")']"
32	Positiv zu bewerten ist das Personal, welches uns am Eingang sogar ein kleines Bier brachte, weil noch kein Platz frei war.	['(SERVICE, POSITIVE)']	"['(SERVICE, POSITIVE, ""Personal"")']"
43	Die Platte mit Sushi hervorragend!	['(FOOD, POSITIVE)']	"['(FOOD, POSITIVE, ""Platte mit Sushi"")']"
47	Wir haben bei dem herrlichen Wetter draußen gesessen.	['(AMBIENCE, POSITIVE)']	"['(AMBIENCE, POSITIVE, ""Wetter"")']"
59	Das Kartoffelgratin war ebenfalls von trockener Konsistenz.	['(FOOD, NEGATIVE)']	"['(FOOD, NEGATIVE, ""Kartoffelgratin"")']"
73	Wir wurden bedient von dem netten Fräulein Susanna.	['(SERVICE, POSITIVE)']	"['(SERVICE, POSITIVE, ""Susanna"")']"
74	Der Kellner war unfreundlich, langsam und hat uns auch einmal angebrüllt weil wir mehr Alt wollten.	['(SERVICE, NEGATIVE)']	"['(SERVICE, NEGATIVE, ""Kellner"")']"
87	Portion direkt bestellt) mit leckeren Knödel.	['(FOOD, POSITIVE)']	"['(FOOD, POSITIVE, ""Knödel"")']"
109	Preise sind ok und Service auch.	['(PRICE, NEUTRAL)', '(SERVICE, NEUTRAL)']	"['(PRICE, NEUTRAL, ""Preise"")', '(SERVICE, NEUTRAL, ""Service"")']"
111	Gut es war ziemlich voll und somit war alles etwas gestresst, aber unser Kellner war höflich und bemüht.	['(SERVICE, POSITIVE)']	"['(SERVICE, POSITIVE, ""Kellner"")']"
117	Ja, das Lokal ist sehr gut gelegen.	['(AMBIENCE, POSITIVE)']	"['(AMBIENCE, POSITIVE, ""Lokal"")']"
118	Bayrisch Essen und Gastfreundschaft geht anders.	['(FOOD, NEGATIVE)', '(SERVICE, NEGATIVE)']	"['(FOOD, NEGATIVE, ""Essen"")', '(SERVICE, NEGATIVE, ""Gastfreundschaft"")']"
121	Das Ambiente war dementsprechend durchschnittlich und die Umgebungsgeräusche sehr laut.	['(AMBIENCE, NEUTRAL)', '(AMBIENCE, NEGATIVE)']	"['(AMBIENCE, NEUTRAL, ""Ambiente"")', '(AMBIENCE, NEGATIVE, ""Umgebungsgeräusche"")']"
122	Leckerer Wein, super Tapas!	['(PRICE, POSITIVE)', '(FOOD, POSITIVE)']	"['(PRICE, POSITIVE, ""Wein"")', '(FOOD, POSITIVE, ""Tapas"")']"
123	Sowohl Hähnchenfleisch als auch Garnelen waren komplett übergart und trocken.	['(FOOD, NEGATIVE)', '(FOOD, NEGATIVE)']	"['(FOOD, NEGATIVE, ""Garnelen"")', '(FOOD, NEGATIVE, ""Hähnchenfleisch"")']"
130	Die Speisen waren sehr gut.	['(FOOD, POSITIVE)']	"['(FOOD, POSITIVE, ""Speisen"")']"
132	Tapas waren für uns nichts besonderes, haben wir auch in LOC schon viel besser/geschmacklich interessanter gehabt.	['(FOOD, NEUTRAL)']	"['(FOOD, NEUTRAL, ""Tapas"")']"
149	Das Bier war sehr gut, das Essen auch.	['(FOOD, POSITIVE)', '(FOOD, POSITIVE)']	"['(FOOD, POSITIVE, ""Bier"")', '(FOOD, POSITIVE, ""Essen"")']"
153	Kein traditioneller Bacalhau oder Arroz de marisco.	['(FOOD, NEGATIVE)', '(FOOD, NEGATIVE)']	"['(FOOD, NEGATIVE, ""Bacalhau"")', '(FOOD, NEGATIVE, ""Arroz de marisco"")']"
188	!Einziger Abzug: Sauberkeit der Toiletten…	['(AMBIENCE, NEGATIVE)']	"['(AMBIENCE, NEGATIVE, ""Sauberkeit der Toiletten"")']"
189	Wir wurden am Eingang richtig freundlich in Empfang genommen.	['(AMBIENCE, POSITIVE)']	"['(AMBIENCE, POSITIVE, ""Empfang"")']"
198	Wir kommen seit Jahren in die RESTAURANT_NAME: immer wieder gut.	['(GENERAL-IMPRESSION, POSITIVE)']	"['(GENERAL-IMPRESSION, POSITIVE, ""RESTAURANT_NAME"")']"
211	Das wir uns für den LOC entschieden haben, bereuen wir in keinster Weise.	['(GENERAL-IMPRESSION, POSITIVE)']	"['(GENERAL-IMPRESSION, POSITIVE, ""LOC"")']"
217	Wir haben 5 Gänge Summer Breeze gewählt und wurden begeistert.	['(FOOD, POSITIVE)']	"['(FOOD, POSITIVE, ""5 Gänge Summer Breeze"")']"
227	Sehr schlechtes, versalzenes Essen.	['(FOOD, NEGATIVE)']	"['(FOOD, NEGATIVE, ""Essen"")']"
232	Ich habe hier einen wirklich leckeren Burger gegessen und die Atmosphäre war einfach toll!	['(FOOD, POSITIVE)', '(AMBIENCE, POSITIVE)']	"['(FOOD, POSITIVE, ""Burger"")', '(AMBIENCE, POSITIVE, ""Atmosphäre"")']"
233	Ein sehr unfreundlicher Gastronomiebetrieb, bei Raklamationen wegen falscher Abrechnung wird der LOC Herr Morawek ausfallend und beleidigend.	['(SERVICE, NEGATIVE)']	"['(SERVICE, NEGATIVE, ""Morawek"")']"
236	Die Lage direkt an der LOC ist nicht zu übertreffen.	['(AMBIENCE, POSITIVE)']	"['(AMBIENCE, POSITIVE, ""Lage"")']"
265	Auch für den Rest, ist die Preisleistung nicht unbedingt passend.	['(PRICE, NEGATIVE)']	"['(PRICE, NEGATIVE, ""Preisleistung"")']"
272	Das Personal war sehr freundlich und aufmerksam.	['(SERVICE, POSITIVE)']	"['(SERVICE, POSITIVE, ""Personal"")']"
290	Das Essen war sonst allenfalls ok.	['(FOOD, NEUTRAL)']	"['(FOOD, NEUTRAL, ""Essen"")']"
293	Sehr gutes Essen, nettes Ambiente und besonders nett war der Kellner „Bruno“.	['(FOOD, POSITIVE)', '(AMBIENCE, POSITIVE)', '(SERVICE, POSITIVE)']	"['(FOOD, POSITIVE, ""Essen"")', '(AMBIENCE, POSITIVE, ""Ambiente"")', '(SERVICE, POSITIVE, ""Bruno"")']"
294	Das Gasthaus lebt von der Atmosphäre.	['(AMBIENCE, POSITIVE)']	"['(AMBIENCE, POSITIVE, ""Atmosphäre"")']"
309	Wirklich lecker, ein grosses Angebot und eine tolle Atmosphäre.	['(FOOD, POSITIVE)', '(AMBIENCE, POSITIVE)']	"['(FOOD, POSITIVE, ""Angebot"")', '(AMBIENCE, POSITIVE, ""Atmosphäre"")']"
311	Wer in LOC unterwegs ist, der kann die DAMPFE ohne Bedenken in seine Reiseplanung einbeziehen.	['(GENERAL-IMPRESSION, POSITIVE)']	"['(GENERAL-IMPRESSION, POSITIVE, ""DAMPFE"")']"
347	!Auch wenn die Bedienung sich dafür entschuldigt hat, war es kein schönes Erlebnis.	['(SERVICE, POSITIVE)']	"['(SERVICE, POSITIVE, ""Bedienung"")']"
348	Die Zutaten für den Salat sind auf keinen Fall frisch.	['(FOOD, POSITIVE)']	"['(FOOD, POSITIVE, ""Zutaten für den Salat"")']"
363	Der Auslieferungsfahrer war sehr nett und hat sich entschuldigt.	['(SERVICE, POSITIVE)']	"['(SERVICE, POSITIVE, ""Auslieferungsfahrer"")']"
371	Dann, keine 10 Minuten später, bekam ich ein neues Steak, das auf den Punkt zubereitet war.	['(FOOD, POSITIVE)']	"['(FOOD, POSITIVE, ""Steak"")']"
382	Service war freundlich und zügig.	['(SERVICE, POSITIVE)']	"['(SERVICE, POSITIVE, ""Service"")']"
387	Fleisch war keine Qualität auf jeden nicht nochmal	['(FOOD, NEGATIVE)']	"['(FOOD, NEGATIVE, ""Fleisch"")']"
415	Bedienung sehr zuvorkommend	['(SERVICE, POSITIVE)']	"['(SERVICE, POSITIVE, ""Bedienung"")']"
421	100g auf einer durchweichten Scheibe Brot mit Ruccolasalat 14€.	['(FOOD, NEGATIVE)', '(PRICE, NEGATIVE)']	"['(FOOD, NEGATIVE, ""Scheibe Brot mit Ruccolasalat"")', '(PRICE, NEGATIVE, ""Scheibe Brot mit Ruccolasalat"")']"
429	Das Essen war in Ordnung, die Portionen groß und der Service nett.	['(FOOD, NEUTRAL)', '(SERVICE, POSITIVE)']	"['(FOOD, NEUTRAL, ""Essen"")', '(SERVICE, POSITIVE, ""Service"")']"
442	Die sehr große Lokation ist gut für Gruppen geeignet, so dass wir im hinteren Bereich einen ruhigeren Platz fanden.	['(AMBIENCE, POSITIVE)', '(AMBIENCE, POSITIVE)']	"['(AMBIENCE, POSITIVE, ""Lokation"")', '(AMBIENCE, POSITIVE, ""Platz"")']"
449	Das Essen hat uns auch nicht überzeugt, da es etwas lieblos zubereitet daherkam.	['(FOOD, NEGATIVE)']	"['(FOOD, NEGATIVE, ""Essen"")']"
453	Kurze Zeit später folgt die Hauptspeise, wieder gut gefüllter Teller, gegrillter Fisch und Gemüse, gedünstete Meeresfrüchte in LOC.	['(FOOD, POSITIVE)']	"['(FOOD, POSITIVE, ""Teller"")']"
454	Diese angeblich bayerische Brauerei ist ein No-Go.	['(GENERAL-IMPRESSION, NEGATIVE)']	"['(GENERAL-IMPRESSION, NEGATIVE, ""Brauerei"")']"
463	Aufgrund des LOC war leider das Essen auch nur mittelmäßig.	['(FOOD, NEUTRAL)']	"['(FOOD, NEUTRAL, ""Essen"")']"
464	Das HRC in LOC zählt leider zu den schlechtesten Cafés die wir je erlebt haben.	['(GENERAL-IMPRESSION, NEGATIVE)']	"['(GENERAL-IMPRESSION, NEGATIVE, ""HRC"")']"
466	Leckere Suppen und Fischgerichte wie Dorade.	['(FOOD, POSITIVE)', '(FOOD, POSITIVE)', '(FOOD, POSITIVE)']	"['(FOOD, POSITIVE, ""Suppen"")', '(FOOD, POSITIVE, ""Fischgerichte"")', '(FOOD, POSITIVE, ""Dorade"")']"
471	Service war freundlich und schnell.	['(SERVICE, POSITIVE)']	"['(SERVICE, POSITIVE, ""Service"")']"
473	Auch das Ambiente ist schön (alte Kupferkessel) und vor allem hat die sehr freundliche Bedienung (Magdalena) zu einem gelungenem Abend beigetragen.	['(AMBIENCE, POSITIVE)', '(SERVICE, POSITIVE)']	"['(AMBIENCE, POSITIVE, ""Ambiente"")', '(SERVICE, POSITIVE, ""Magdalena"")']"
476	3 Damen hinter der Kuchentheke mit einer wahnsinnigen Motivation uns zu bedienen.	['(SERVICE, POSITIVE)']	"['(SERVICE, POSITIVE, ""Damen"")']"
481	Bier wird zwischenzeitlich warm.	['(FOOD, NEGATIVE)']	"['(FOOD, NEGATIVE, ""Bier"")']"
485	Burger geschmacklich Ok, Burger-Buns zu hart, Bedienung hektisch, aber trotzdem langsam und planlos (Bestellungen falsch ausgeführt).	['(FOOD, NEUTRAL)', '(FOOD, NEGATIVE)', '(SERVICE, NEGATIVE)']	"['(FOOD, NEUTRAL, ""Burger"")', '(FOOD, NEGATIVE, ""Burger-Buns"")', '(SERVICE, NEGATIVE, ""Bedienung"")']"
487	Und natürlich die -manchmal vielleicht etwas überzogene- Freundlichkeit der Inhaberin.	['(SERVICE, NEGATIVE)']	"['(SERVICE, NEGATIVE, ""Inhaberin"")']"
499	Kurz zusammengefasst: Schlechter Service, hohe Preise, durchschnittliche Qualität.	['(SERVICE, NEGATIVE)', '(PRICE, NEGATIVE)']	"['(SERVICE, NEGATIVE, ""Service"")', '(PRICE, NEGATIVE, ""Preise"")']"
506	Preis-/Leistungsverhältnis ebenfalls gut.	['(PRICE, POSITIVE)']	"['(PRICE, POSITIVE, ""Preis-/Leistungsverhältnis"")']"
524	Sehr leckeres Essen und super Happy Hour für Cocktails!	['(FOOD, POSITIVE)', '(FOOD, POSITIVE)']	"['(FOOD, POSITIVE, ""Essen"")', '(FOOD, POSITIVE, ""Cocktails"")']"
532	Das Essen und die Bedienung ist wunderbar.	['(FOOD, POSITIVE)', '(SERVICE, POSITIVE)']	"['(FOOD, POSITIVE, ""Essen"")', '(SERVICE, POSITIVE, ""Bedienung"")']"
552	Ich hatte das Rumpsteak und es war Saigneau gebraten wie gewünscht.	['(FOOD, POSITIVE)']	"['(FOOD, POSITIVE, ""Rumpsteak"")']"
559	Das Essen war gut und frisch, eine Hausfrau die frisch kocht, merkt dies und die Bedienung war schnell.	['(FOOD, POSITIVE)', '(SERVICE, POSITIVE)']	"['(FOOD, POSITIVE, ""Essen"")', '(SERVICE, POSITIVE, ""Bedienung"")']"
563	Eingekehrt, Sauerbraten bestellt, extrem humorvoller Köbes, Spaß gehabt, geschmackvolle und große Portionen bekommen.	['(SERVICE, POSITIVE)', '(FOOD, POSITIVE)']	"['(SERVICE, POSITIVE, ""Köbes"")', '(FOOD, POSITIVE, ""Portionen"")']"
591	Allein die Auswahl an Torten ist sehr breit gefächert und bereitet fast die Qual der Wahl.	['(FOOD, POSITIVE)']	"['(FOOD, POSITIVE, ""Auswahl an Torten"")']"
603	Super Service, schönes Ambiente und sehr gutes Essen.	['(SERVICE, POSITIVE)', '(AMBIENCE, POSITIVE)', '(FOOD, POSITIVE)']	"['(SERVICE, POSITIVE, ""Service"")', '(AMBIENCE, POSITIVE, ""Ambiente"")', '(FOOD, POSITIVE, ""Essen"")']"
605	Aufbackbrötchen (heutzutage ein No-Go) 2 Löffel Rührei, ein Scheibe Käse, etwas Frischkäse etc..	['(FOOD, NEGATIVE)']	"['(FOOD, NEGATIVE, ""Aufbackbrötchen"")']"
606	Die beiden Hauprgerichte - LOC Gesellenstück und Schweineschnitzel Braumeister Art - waren allerdings hervorragend und meeeeehr als riechlich.	['(FOOD, POSITIVE)', '(FOOD, POSITIVE)']	"['(FOOD, POSITIVE, ""LOC Gesellenstück"")', '(FOOD, POSITIVE, ""Schweineschnitzel Braumeister Art"")']"
609	Der LOC (42,50€) aus der Flasche war ordentlich, nicht mehr, der offene Sauvignon im Glas dagegen sehr blass und mit 6,90€ entschieden zu teuer veranschlagt.	['(FOOD, NEUTRAL)', '(FOOD, NEGATIVE)', '(PRICE, NEGATIVE)']	"['(FOOD, NEUTRAL, ""LOC"")', '(FOOD, NEGATIVE, ""Sauvignon im Glas"")', '(PRICE, NEGATIVE, ""Sauvignon im Glas"")']"
624	Das Gasthaus RESTAURANT_NAME ist egal zu welchem Anlass ein passendes Restaurant.	['(GENERAL-IMPRESSION, POSITIVE)']	"['(GENERAL-IMPRESSION, POSITIVE, ""RESTAURANT_NAME"")']"
641	(Tripadvisor die Bewertung gut leider nicht) Die Lammhaxe war sehr gut!	['(FOOD, POSITIVE)']	"['(FOOD, POSITIVE, ""Lammhaxe"")']"
654	15 Pommes und davon 5 ungenießbar, da fast verkohlt.	['(FOOD, NEGATIVE)']	"['(FOOD, NEGATIVE, ""Pommes"")']"
656	6 Salatblätter Frisee und 2/3 Croutons sind keine 12,50€ wert!	['(PRICE, NEGATIVE)', '(PRICE, NEGATIVE)']	"['(PRICE, NEGATIVE, ""Salatblätter Frisee"")', '(PRICE, NEGATIVE, ""Croutons"")']"
662	Das Schnitzel war das Fleisch gut jedoch weder Fleisch noch Panade gesalzen und Gewürzt nach würzen bringt es nicht die Bratkartoffeln auch beim Tagesgericht verdienen das Wort nicht nur wenige waren gebraten alle anderen offensichtlich in noch nich erhitzten Fett oder Öl warm gemacht dadurch haben sie sich vollgesogen so was darf man nicht servieren den Kellnern den wir das dagegen interessieren sich nicht	['(FOOD, POSITIVE)', '(FOOD, NEGATIVE)', '(FOOD, NEGATIVE)', '(FOOD, NEGATIVE)', '(SERVICE, NEGATIVE)']	"['(FOOD, POSITIVE, ""Fleisch"")', '(FOOD, NEGATIVE, ""Fleisch"")', '(FOOD, NEGATIVE, ""Panade"")', '(FOOD, NEGATIVE, ""Bratkartoffeln"")', '(SERVICE, NEGATIVE, ""Kellnern"")']"
677	Auf jeden Fall eine Lokalität die man besuchen sollte wenn man in LOC ist.	['(GENERAL-IMPRESSION, POSITIVE)']	"['(GENERAL-IMPRESSION, POSITIVE, ""Lokalität"")']"
693	"Der ""zuständige"" Kellner schnauzte uns über sämtliche Tische sehr laut an, dass man kein ""mitgebrachtes Essen"" verzehren dürfte....(Eis: mitgebrachtes Essen????"	['(SERVICE, NEGATIVE)']	"['(SERVICE, NEGATIVE, ""Kellner"")']"
741	An einem Samstagabend ist es unmöglich ohne langes Warten gemütlich zu essen.	['(SERVICE, NEGATIVE)']	"['(SERVICE, NEGATIVE, ""Warten"")']"
748	LOC, Getränke auf sehr hohem Niveau.	['(GENERAL-IMPRESSION, POSITIVE)', '(FOOD, POSITIVE)']	"['(GENERAL-IMPRESSION, POSITIVE, ""LOC"")', '(FOOD, POSITIVE, ""Getränke"")']"
755	Weiterhin waren die Schnitzel viel zu dick, ungewürzt und mit Fettrand.	['(FOOD, NEGATIVE)']	"['(FOOD, NEGATIVE, ""Schnitzel"")']"
758	Ich bin bereits schon öfters mal im RESTAURANT_NAME gewesen (hauptsächlich in LOC) und bis her war ich sehr begeistert vom dem guten Bier.	['(FOOD, POSITIVE)']	"['(FOOD, POSITIVE, ""Bier"")']"
772	lokale Küche (Töttchen), ein eigenes Bier und vor allem super Service.	['(SERVICE, POSITIVE)']	"['(SERVICE, POSITIVE, ""Service"")']"
780	Die Haxe war extrem fett und der Knödel poppig und geschmacklos.	['(FOOD, NEGATIVE)', '(FOOD, NEGATIVE)']	"['(FOOD, NEGATIVE, ""Knödel"")', '(FOOD, NEGATIVE, ""Haxe"")']"
781	Belebter Laden, in dem man von Frau Maar an der Reservierung schon mit einem herzlichen Lächeln empfangen wird.	['(SERVICE, POSITIVE)']	"['(SERVICE, POSITIVE, ""Maar"")']"
786	Wir waren vom Ambiente und der warmen Herzlichkeit sehr angetan und haben uns sofort sehr wohl und sehr gut gefühlt.	['(AMBIENCE, POSITIVE)', '(SERVICE, POSITIVE)']	"['(AMBIENCE, POSITIVE, ""Ambiente"")', '(SERVICE, POSITIVE, ""Herzlichkeit"")']"
796	"Als ich beim Rausgehen, dem Betreiber sagte: ""Ich werde nicht bleiben wegen Ihrer Unfreundlichkeit"" schrie er ich würde ""undeutlich"" sprechen."	['(SERVICE, NEGATIVE)']	"['(SERVICE, NEGATIVE, ""Betreiber"")']"
820	Ich war jetzt schon oft bei Momo, da man in LOC ja keine Wahl hat, will man eine gute Pizza essen.	['(FOOD, POSITIVE)']	"['(FOOD, POSITIVE, ""Pizza"")']"
823	Wurde nicht hinein gelassen😤Was soll ich weiter schreiben- der „Türsteher“ der dt Sprache nicht mächtig - Freunde waren im Lokal- Tisch war reserviert- einfach ein Arschlocg	['(SERVICE, NEGATIVE)']	"['(SERVICE, NEGATIVE, ""Türsteher"")']"
827	Nettes Brauhaus mit leckeren Speisen und leckerem Bier.	['(GENERAL-IMPRESSION, POSITIVE)', '(FOOD, POSITIVE)', '(FOOD, POSITIVE)']	"['(GENERAL-IMPRESSION, POSITIVE, ""Brauhaus"")', '(FOOD, POSITIVE, ""Speisen"")', '(FOOD, POSITIVE, ""Bier"")']"
829	Das Ambiente ist stimmig.	['(AMBIENCE, POSITIVE)']	"['(AMBIENCE, POSITIVE, ""Ambiente"")']"
844	Haben lecker gegessen....Fisch... Steak...alles geschmacklich gut.... leider ist das Küchenpersonal wohl etwas unfähig...wurden von der Bedienung informiert, dass Vorspeise gleichzeitig mit Hauptspeise gereicht wird, ( beim Alex im Hafen war es besser)....auch was knusprige Bratkartoffeln sind weiß das Küchenpersonal hier wohl nicht, bzw kennt sich mit der eigenen Karte wohl nicht aus.	['(FOOD, POSITIVE)', '(FOOD, POSITIVE)', '(SERVICE, NEGATIVE)', '(FOOD, NEGATIVE)', '(SERVICE, NEGATIVE)', '(SERVICE, NEGATIVE)']	"['(FOOD, POSITIVE, ""Fisch"")', '(FOOD, POSITIVE, ""Steak"")', '(SERVICE, NEGATIVE, ""Küchenpersonal"")', '(FOOD, NEGATIVE, ""Bratkartoffeln"")', '(SERVICE, NEGATIVE, ""Küchenpersonal"")', '(SERVICE, NEGATIVE, ""Bedienung"")']"
854	Bedienungen sprechen teilweise nur gebrochen deutsch, ich wurde trotz vieler freier Tische abgewiesen mit der Begründung „nicht genügend Personal“ …..	['(SERVICE, NEGATIVE)']	"['(SERVICE, NEGATIVE, ""Bedienungen"")']"
859	Service ließ leider zu Wünschen übrig.	['(SERVICE, NEGATIVE)']	"['(SERVICE, NEGATIVE, ""Service"")']"
861	Sehr freundliches Personal, mit dem italienischen Outfit ein Stück LOC in LOC.	['(SERVICE, POSITIVE)']	"['(SERVICE, POSITIVE, ""Personal"")']"
874	War das erste Mal hier und muss sagen das Essen war sehr lecker!	['(FOOD, POSITIVE)']	"['(FOOD, POSITIVE, ""Essen"")']"
877	Das Ambiente ist richtig toll, die Auswahl an Gerichten super.	['(AMBIENCE, POSITIVE)', '(FOOD, POSITIVE)']	"['(AMBIENCE, POSITIVE, ""Ambiente"")', '(FOOD, POSITIVE, ""Gerichten"")']"
880	Das Restaurant insgesamt machte den lieblosen, rein praktischen Eindruck eines schlechten Imbiss.	['(GENERAL-IMPRESSION, NEGATIVE)']	"['(GENERAL-IMPRESSION, NEGATIVE, ""Restaurant"")']"
883	Das LOC war ebenfalls trocken und hart und die „LOC“ hatte definitiv auch schon bessere Tage gesehen.	['(FOOD, NEGATIVE)', '(FOOD, NEGATIVE)']	"['(FOOD, NEGATIVE, ""LOC"")', '(FOOD, NEGATIVE, ""LOC"")']"
901	Die Garnelen waren köstlich, die knoblauch hatte eine perfekte Note dazu gegeben und LOC noch einen leichten bis gehabt und einen runden Geschmack verleiht.	['(FOOD, POSITIVE)', '(FOOD, POSITIVE)']	"['(FOOD, POSITIVE, ""Garnelen"")', '(FOOD, POSITIVE, ""knoblauch"")']"
907	Aber leider lässt die Qualität des Essens zu wünschen übrig.	['(FOOD, NEGATIVE)']	"['(FOOD, NEGATIVE, ""Essens"")']"
915	Insgesamt empfand ich das gesamte Servicepersonal als herablassend.	['(SERVICE, NEGATIVE)']	"['(SERVICE, NEGATIVE, ""Servicepersonal"")']"
923	Die bestellten Wiener Schnitzel waren leider zäh und fest deshalb wurde auch eine Portion zurückgenommen.	['(FOOD, NEGATIVE)']	"['(FOOD, NEGATIVE, ""Wiener Schnitzel"")']"
928	Eine Reservierung für 2 Personen war im Vorfeld (Tage vorher) nicht möglich.	['(SERVICE, NEGATIVE)']	"['(SERVICE, NEGATIVE, ""Reservierung"")']"
934	Kaeufer ging einige Tage spaeter mit Quittung um dies zu klaeren und wurde als Luegner dargestellt.	['(SERVICE, NEGATIVE)']	"['(SERVICE, NEGATIVE, ""Quittung"")']"
938	Ein LOC mir wirklich leckerem Essen bei schöner Aussicht.	['(FOOD, POSITIVE)', '(AMBIENCE, POSITIVE)']	"['(FOOD, POSITIVE, ""Essen"")', '(AMBIENCE, POSITIVE, ""Aussicht"")']"
942	Auch extrawünsche konnten wir problemlos äußern.	['(SERVICE, POSITIVE)']	"['(SERVICE, POSITIVE, ""extrawünsche"")']"
971	Für 4 kleine Vorspeisen 80 Euro zu verlangen ist nicht akzeptabel.	['(PRICE, NEGATIVE)']	"['(PRICE, NEGATIVE, ""kleine Vorspeisen"")']"
976	Das kross gebratene Zanderfilet waren drei Fischspitzen in der Pfanne platt gedrückt, ungewürzt, um die Stücke kross zu beikommen.	['(FOOD, NEGATIVE)', '(FOOD, NEGATIVE)']	"['(FOOD, NEGATIVE, ""Zanderfilet"")', '(FOOD, NEGATIVE, ""Fischspitzen"")']"
978	Location wunderbar Essen war exzellent Die Kellnerin war super nett freundlichen und hat uns gut beraten Bier war auch super	['(FOOD, POSITIVE)', '(SERVICE, POSITIVE)', '(FOOD, POSITIVE)']	"['(FOOD, POSITIVE, ""Essen"")', '(SERVICE, POSITIVE, ""Kellnerin"")', '(FOOD, POSITIVE, ""Bier"")']"
998	Als Dessert ein sehr gut geschenkter Sambuca (7,50 €) und ein Linie-Aquavit (4,90 €).	['(FOOD, POSITIVE)']	"['(FOOD, POSITIVE, ""Sambuca"")']"
1001	Und ich weiß dass ich niemals irgendwo anders eine Haxe testen werde und hoffe einfach nur dass dieses Lokal uns noch lange erhalten bleibt.	['(GENERAL-IMPRESSION, POSITIVE)']	"['(GENERAL-IMPRESSION, POSITIVE, ""Lokal"")']"
1018	Davon wusste der Empfang allerdings nichts und reagierte sehr unwirsch, am Ende hat es aber geklappt.	['(SERVICE, NEGATIVE)']	"['(SERVICE, NEGATIVE, ""Empfang"")']"
1019	Wir freuten uns sehr, dass es mit demWunsch nach einemschönen Ecktisch geklappt hat.	['(AMBIENCE, POSITIVE)']	"['(AMBIENCE, POSITIVE, ""Ecktisch"")']"
1032	In Summe Preis-/Leistung aber nicht angemessen.	['(PRICE, NEGATIVE)']	"['(PRICE, NEGATIVE, ""Preis-/Leistung"")']"
1050	Sehr leckeres Essen und super Kellner (Jacques).	['(FOOD, POSITIVE)', '(SERVICE, POSITIVE)']	"['(FOOD, POSITIVE, ""Essen"")', '(SERVICE, POSITIVE, ""Kellner"")']"
1054	Von den Getränke, über das zuvorkommende Personal, bis hin zu den Gerichten, ist alles sensationell und immer ein Besuch wert!!!!!!	['(FOOD, POSITIVE)', '(SERVICE, POSITIVE)', '(FOOD, POSITIVE)']	"['(FOOD, POSITIVE, ""Getränke"")', '(SERVICE, POSITIVE, ""Personal"")', '(FOOD, POSITIVE, ""Gerichten"")']"
1076	Die Sosse war eine Dillpampe aus der Tüte.	['(FOOD, NEGATIVE)']	"['(FOOD, NEGATIVE, ""Sosse"")']"
1077	Essen sehr schnell an Tisch geliefert Filet auf den Punkt und alles super lecker.	['(FOOD, POSITIVE)']	"['(FOOD, POSITIVE, ""Filet"")']"
1082	Die herzliche Begrüßung und die freundliche Bedienung sowie das gemütliche Ambiente haben uns sehr gefallen.	['(SERVICE, POSITIVE)', '(AMBIENCE, POSITIVE)', '(AMBIENCE, POSITIVE)']	"['(SERVICE, POSITIVE, ""Bedienung"")', '(AMBIENCE, POSITIVE, ""Ambiente"")', '(AMBIENCE, POSITIVE, ""Begrüßung"")']"
1085	Die von uns ausgewählten Salate waren frisch, lecker und reichhaltig.	['(FOOD, POSITIVE)']	"['(FOOD, POSITIVE, ""Salate"")']"
1090	Das Essen ist ok soweit, nothing special und dafür ist es mindestens 30% zu teuer.	['(FOOD, NEUTRAL)']	"['(FOOD, NEUTRAL, ""Essen"")']"
1105	Essen lecker, jedoch überteuert.	['(FOOD, POSITIVE)']	"['(FOOD, POSITIVE, ""Essen"")']"
1110	Man sollte auf festes Schuhwerk achten, da einen ansonsten bei dem klebenden Boden die selbigen ausgezogen werden.	['(AMBIENCE, NEGATIVE)']	"['(AMBIENCE, NEGATIVE, ""Boden"")']"
1115	Außerordentlich freundliches und aufmerksames Personal.	['(SERVICE, POSITIVE)']	"['(SERVICE, POSITIVE, ""Personal"")']"
1119	Bifteki nicht gefüllt, aber dafür mit guter Schafskäse Sauce, Lammmediallions zäh und doch eher trocken.	['(FOOD, NEGATIVE)', '(FOOD, NEGATIVE)', '(FOOD, POSITIVE)']	"['(FOOD, NEGATIVE, ""Lammmediallions"")', '(FOOD, NEGATIVE, ""Bifteki"")', '(FOOD, POSITIVE, ""Schafskäse Sauce"")']"
1133	Der Kartoffelsalat schmeckte wie aus dem Eimer und war eiskalt.	['(FOOD, NEGATIVE)']	"['(FOOD, NEGATIVE, ""Kartoffelsalat"")']"
1147	Super Restaurant, wir hatten das gar nicht erwartet und wollten nur kurz vor dem Starlight Express noch was essen.	['(GENERAL-IMPRESSION, POSITIVE)']	"['(GENERAL-IMPRESSION, POSITIVE, ""Restaurant"")']"
1160	Gericht 1: Spaghetti Deluxe, mit Sauce aus Steinpilzen, knusprigen Speck und Grana Padano: Das Gericht an sich war lecker und hatte einen guten Geschmack.	['(FOOD, POSITIVE)', '(FOOD, POSITIVE)', '(FOOD, POSITIVE)', '(FOOD, POSITIVE)']	"['(FOOD, POSITIVE, ""Spaghetti Deluxe"")', '(FOOD, POSITIVE, ""Sauce aus Steinpilzen"")', '(FOOD, POSITIVE, ""Speck"")', '(FOOD, POSITIVE, ""Grana Padano"")']"
1163	War zwar viel los, dennoch hat das Personal nicht an Höflichkeit und Spaß verloren.	['(SERVICE, POSITIVE)']	"['(SERVICE, POSITIVE, ""Personal"")']"
1169	Die Klimaanlage hatte wohl Pause.	['(AMBIENCE, NEGATIVE)']	"['(AMBIENCE, NEGATIVE, ""Klimaanlage"")']"
1178	Der Leberkäse war eher ein Fleischkäse und hatte mit einem bayerischen Leberkäse nichts zu tun.	['(FOOD, NEGATIVE)']	"['(FOOD, NEGATIVE, ""Leberkäse"")']"
1203	Leider ist es Massenabfertigung.	['(FOOD, NEGATIVE)']	"['(FOOD, NEGATIVE, ""Massenabfertigung"")']"
1223	Fränkische Bratwürste, die waren gut, aber das Sauerkraut dazu hat nach gar nichts geschmeckt.	['(FOOD, POSITIVE)', '(FOOD, NEGATIVE)']	"['(FOOD, POSITIVE, ""Fränkische Bratwürste"")', '(FOOD, NEGATIVE, ""Sauerkraut"")']"
