id	text	labels	labels_phrases
1936	Es sei denn, man steht darauf, vom Eigentümer beleidigt zu werden.	['(SERVICE, NEGATIVE)']	"['(SERVICE, NEGATIVE, ""Eigentümer"")']"
1939	Wir waren hier zum Mittagessen und wurden eher enttäuscht.	['(GENERAL-IMPRESSION, NEGATIVE)']	"['(GENERAL-IMPRESSION, NEGATIVE, ""NULL"")']"
1961	Immer wieder gerne, sehr nettes und kompetentes Personal.	['(SERVICE, POSITIVE)', '(GENERAL-IMPRESSION, POSITIVE)']	"['(SERVICE, POSITIVE, ""Personal"")', '(GENERAL-IMPRESSION, POSITIVE, ""NULL"")']"
1971	Qualität der Speisen und Optik in Ordnung.	['(FOOD, NEUTRAL)']	"['(FOOD, NEUTRAL, ""Speisen"")']"
1975	Der Blick von der Dachterasse ist der Wahnsinn.	['(AMBIENCE, POSITIVE)']	"['(AMBIENCE, POSITIVE, ""Blick von der Dachterasse"")']"
1996	Hier stimmt alles!	['(GENERAL-IMPRESSION, POSITIVE)']	"['(GENERAL-IMPRESSION, POSITIVE, ""NULL"")']"
2001	Tolle Auswahl an Speisen und Getränken.	['(FOOD, POSITIVE)', '(FOOD, POSITIVE)']	"['(FOOD, POSITIVE, ""Speisen"")', '(FOOD, POSITIVE, ""Getränken"")']"
2031	Mal dort und werde wiederkommen wenn ich wieder in LOC bin.	['(GENERAL-IMPRESSION, POSITIVE)']	"['(GENERAL-IMPRESSION, POSITIVE, ""NULL"")']"
2085	Atmosphäre des Lokals ist gut, Personal reagierte auf den Wunsch, beim Salat eine Zutat wegzulassen allerdings unflexibel und der Inhaber ist mehr als unfreundlich.	['(AMBIENCE, POSITIVE)', '(SERVICE, NEGATIVE)', '(SERVICE, NEGATIVE)']	"['(AMBIENCE, POSITIVE, ""Atmosphäre"")', '(SERVICE, NEGATIVE, ""Inhaber"")', '(SERVICE, NEGATIVE, ""Personal"")']"
2100	Gastfreundschaft geht anders.	['(SERVICE, NEGATIVE)']	"['(SERVICE, NEGATIVE, ""Gastfreundschaft"")']"
2126	Das Essen war außerdem nicht warm genug, die Gambas trocken und der Lauch war alt und hart und ungenießbar.	['(FOOD, NEGATIVE)', '(FOOD, NEGATIVE)', '(FOOD, NEGATIVE)']	"['(FOOD, NEGATIVE, ""Essen"")', '(FOOD, NEGATIVE, ""Gambas"")', '(FOOD, NEGATIVE, ""Lauch"")']"
2136	Wir haben Entrecotes/Filets, dazu superfeine Beilagen (zB Stampf, Schlotze oder Spinat) gegessen, im Nachgang noch die Spaghetti mit Tomatensauce (Eis-Dessert).	['(FOOD, POSITIVE)', '(FOOD, POSITIVE)', '(FOOD, POSITIVE)', '(FOOD, POSITIVE)']	"['(FOOD, POSITIVE, ""Beilagen"")', '(FOOD, POSITIVE, ""Stampf"")', '(FOOD, POSITIVE, ""Schlotze"")', '(FOOD, POSITIVE, ""Spinat"")']"
2147	Für uns hat es sich erledigt!	['(GENERAL-IMPRESSION, NEGATIVE)']	"['(GENERAL-IMPRESSION, NEGATIVE, ""NULL"")']"
27	"Sehr schade, da sitzt man im ""LOC"", einem der schönsten Münchner Innenhöfen, und die Qualität vom Essen ist einfach nur enttäuschend - in keiner Relation, weder zum Ruf des Hauses noch zu den Preisen, ob Knödel, Schnitzel, Pommes, Bratwürste oder Bratkartoffeln."	['(AMBIENCE, POSITIVE)', '(FOOD, POSITIVE)', '(PRICE, NEGATIVE)', '(PRICE, NEGATIVE)', '(PRICE, NEGATIVE)', '(PRICE, NEGATIVE)', '(PRICE, NEGATIVE)']	"['(AMBIENCE, POSITIVE, ""Innenhöfen"")', '(FOOD, POSITIVE, ""Essen"")', '(PRICE, NEGATIVE, ""Knödel"")', '(PRICE, NEGATIVE, ""Schnitzel"")', '(PRICE, NEGATIVE, ""Pommes"")', '(PRICE, NEGATIVE, ""Bratwürste"")', '(PRICE, NEGATIVE, ""Bratkartoffeln"")']"
63	Nicht zu empfehlen!	['(GENERAL-IMPRESSION, NEGATIVE)']	"['(GENERAL-IMPRESSION, NEGATIVE, ""NULL"")']"
86	Die Bedienung ist super nett und das Essen war wirklich wunderbar!	['(SERVICE, POSITIVE)', '(FOOD, POSITIVE)']	"['(SERVICE, POSITIVE, ""Bedienung"")', '(FOOD, POSITIVE, ""Essen"")']"
93	Wir hatten zunächst eine Gans zu Weihnachten, die war spektakulär und braucht keinen Vergleich zu scheuen.	['(FOOD, POSITIVE)']	"['(FOOD, POSITIVE, ""Gans"")']"
103	Wir wurden bedient von dem netten Fräulein Susanna.	['(SERVICE, POSITIVE)']	"['(SERVICE, POSITIVE, ""Susanna"")']"
176	Das Essen ist ein Traum 😍	['(FOOD, POSITIVE)']	"['(FOOD, POSITIVE, ""Essen"")']"
198	Einfaches Restaurant mit schlechten Service und kaum glutenfreie Speisen.	['(FOOD, NEGATIVE)', '(SERVICE, NEGATIVE)']	"['(FOOD, NEGATIVE, ""Speisen"")', '(SERVICE, NEGATIVE, ""Service"")']"
202	Es war ein wunderschönes Erlebnisses, ein Hochgenuss der Suchtpotential hat.	['(FOOD, POSITIVE)']	"['(FOOD, POSITIVE, ""NULL"")']"
258	Wir wurden auch sehr nett begrüßt und an unseren Platz gebracht.	['(SERVICE, POSITIVE)']	"['(SERVICE, POSITIVE, ""NULL"")']"
265	Unterm Strich: einfache Biergartenküche zu gehobenen Preisen.	['(FOOD, NEGATIVE)', '(PRICE, NEGATIVE)']	"['(FOOD, NEGATIVE, ""Biergartenküche"")', '(PRICE, NEGATIVE, ""Preisen"")']"
313	Das wir uns für den LOC entschieden haben, bereuen wir in keinster Weise.	['(GENERAL-IMPRESSION, POSITIVE)']	"['(GENERAL-IMPRESSION, POSITIVE, ""LOC"")']"
347	Wir haben draußen gesessen und wurde sehr freundlich bedient.	['(SERVICE, POSITIVE)']	"['(SERVICE, POSITIVE, ""NULL"")']"
369	Eigentlich fehlen mir die Worte!!	['(GENERAL-IMPRESSION, NEGATIVE)']	"['(GENERAL-IMPRESSION, NEGATIVE, ""NULL"")']"
384	Ideal für ein Essen mit einer größeren Gruppe.	['(GENERAL-IMPRESSION, POSITIVE)']	"['(GENERAL-IMPRESSION, POSITIVE, ""NULL"")']"
415	Wir waren schon öfters hier, war immer top.	['(GENERAL-IMPRESSION, POSITIVE)']	"['(GENERAL-IMPRESSION, POSITIVE, ""NULL"")']"
431	Das Kalbsschnitzel mit 19EUR nicht teuer aber absolut lieblos und dahin ger...zt.	['(PRICE, NEUTRAL)', '(FOOD, NEGATIVE)']	"['(PRICE, NEUTRAL, ""Kalbsschnitzel"")', '(FOOD, NEGATIVE, ""Kalbsschnitzel"")']"
437	Gutes Essen Schöner Spielplatz	['(FOOD, POSITIVE)', '(AMBIENCE, POSITIVE)']	"['(FOOD, POSITIVE, ""Essen"")', '(AMBIENCE, POSITIVE, ""Spielplatz"")']"
447	Wir sind maximal enttäuscht und werden uns überlegen, ob wir wirklich nochmal hingehen.	['(GENERAL-IMPRESSION, NEGATIVE)']	"['(GENERAL-IMPRESSION, NEGATIVE, ""NULL"")']"
499	Der Hähnchen Döner wird durch zwei Soßen, Gemüse, Salat, Fetakäse verfeinert und durch einen spitzer Zitrone abgerundet.	['(FOOD, POSITIVE)', '(FOOD, POSITIVE)', '(FOOD, POSITIVE)', '(FOOD, POSITIVE)', '(FOOD, POSITIVE)', '(FOOD, POSITIVE)']	"['(FOOD, POSITIVE, ""Hähnchen Döner"")', '(FOOD, POSITIVE, ""Soßen"")', '(FOOD, POSITIVE, ""Gemüse"")', '(FOOD, POSITIVE, ""Salat"")', '(FOOD, POSITIVE, ""Fetakäse"")', '(FOOD, POSITIVE, ""Zitrone"")']"
513	Die Pizzen sind außergewöhnliche lecker mit dünnem Boden und sehr üppig belegt.	['(FOOD, POSITIVE)']	"['(FOOD, POSITIVE, ""Pizzen"")']"
530	Auch die Scherben wurden nicht alle entfernt.	['(SERVICE, NEGATIVE)']	"['(SERVICE, NEGATIVE, ""NULL"")']"
558	"Der Service, vor allem von ""LOC"" war sehr freundlich und erstklassig."	['(SERVICE, POSITIVE)']	"['(SERVICE, POSITIVE, ""Service"")']"
574	Auf jeden Fall ein Besuch wert, bei den Speisen ist für jeden der Tapasliebhaber etwas dabei!	['(FOOD, POSITIVE)', '(GENERAL-IMPRESSION, POSITIVE)']	"['(FOOD, POSITIVE, ""Speisen"")', '(GENERAL-IMPRESSION, POSITIVE, ""NULL"")']"
587	So kann das mit ner Garstufe nicht klappen.	['(FOOD, NEGATIVE)']	"['(FOOD, NEGATIVE, ""Garstufe"")']"
629	Das Essen ist mittelmäßig, geschmacklich kein Highlight, kein Unterschied zu einem normalen Asia Imbiss.	['(FOOD, NEUTRAL)']	"['(FOOD, NEUTRAL, ""Essen"")']"
633	Ich kann es nur empfehlen.	['(GENERAL-IMPRESSION, POSITIVE)']	"['(GENERAL-IMPRESSION, POSITIVE, ""NULL"")']"
652	Kurze Zeit später folgt die Hauptspeise, wieder gut gefüllter Teller, gegrillter Fisch und Gemüse, gedünstete Meeresfrüchte in LOC.	['(FOOD, POSITIVE)']	"['(FOOD, POSITIVE, ""Teller"")']"
656	befriedigendes Ausflugslokal, leider sehr dreckige Tische, Platzangebot direkt vor LOC obwohl LOC nur zu ca.	['(GENERAL-IMPRESSION, NEUTRAL)', '(AMBIENCE, NEGATIVE)']	"['(GENERAL-IMPRESSION, NEUTRAL, ""Ausflugslokal"")', '(AMBIENCE, NEGATIVE, ""Tische"")']"
730	Wenn es mein Kaffee wäre, würde ich diesen unzufriedenen Kellner fristlos entlassen!	['(SERVICE, NEGATIVE)', '(GENERAL-IMPRESSION, NEGATIVE)']	"['(SERVICE, NEGATIVE, ""Kellner"")', '(GENERAL-IMPRESSION, NEGATIVE, ""Kaffee"")']"
734	Das Essen - Haxe wir Kaiserschmarrn - war ein kompletter Reinfall.	['(FOOD, NEGATIVE)', '(FOOD, NEGATIVE)', '(FOOD, NEGATIVE)']	"['(FOOD, NEGATIVE, ""Essen"")', '(FOOD, NEGATIVE, ""Kaiserschmarrn"")', '(FOOD, NEGATIVE, ""Haxe"")']"
744	Wir haben uns sehr wohl gefühlt.	['(AMBIENCE, POSITIVE)']	"['(AMBIENCE, POSITIVE, ""NULL"")']"
824	LOC EssenSuper BockWir hatten einen sehr schönen Abend im portugiesischen Viertel bei RESTAURANT_NAME.	['(GENERAL-IMPRESSION, POSITIVE)']	"['(GENERAL-IMPRESSION, POSITIVE, ""RESTAURANT_NAME"")']"
826	Das Essen war wirklich mega lecker und abwechslungsreich.	['(FOOD, POSITIVE)']	"['(FOOD, POSITIVE, ""Essen"")']"
854	Nach 2 Stunden fragten wir, wo der Hauptgang bleibt.	['(SERVICE, NEGATIVE)']	"['(SERVICE, NEGATIVE, ""NULL"")']"
862	Auch ein «Katzentisch» direkt am Eingang kann man eigentlich nicht als solchen verkaufen (gerade im Winter wenn die Leute rein und rausgehen wird derjenige der dort mit dem Rücken zur Tür sitzt jedes Mal von kalter Zugluft eingeholt.	['(AMBIENCE, NEGATIVE)']	"['(AMBIENCE, NEGATIVE, ""Zugluft"")']"
872	Steak Menü für 5 Personen ist mega mickrig!!	['(FOOD, NEGATIVE)']	"['(FOOD, NEGATIVE, ""Steak Menü"")']"
892	Austern die nicht frisch waren.	['(FOOD, NEGATIVE)']	"['(FOOD, NEGATIVE, ""Austern"")']"
894	Der LOC (42,50€) aus der Flasche war ordentlich, nicht mehr, der offene Sauvignon im Glas dagegen sehr blass und mit 6,90€ entschieden zu teuer veranschlagt.	['(FOOD, NEUTRAL)', '(FOOD, NEGATIVE)', '(PRICE, NEGATIVE)']	"['(FOOD, NEUTRAL, ""LOC"")', '(FOOD, NEGATIVE, ""Sauvignon im Glas"")', '(PRICE, NEGATIVE, ""Sauvignon im Glas"")']"
954	Es war für uns echt unangenehm.	['(GENERAL-IMPRESSION, NEGATIVE)']	"['(GENERAL-IMPRESSION, NEGATIVE, ""NULL"")']"
960	Wenn wir mal wieder in LOC sind, werden wir sicher wieder da essen gehen ☺️	['(GENERAL-IMPRESSION, POSITIVE)']	"['(GENERAL-IMPRESSION, POSITIVE, ""NULL"")']"
977	Einzig unsere Bedienung hätte etwas freundlicher sein können.	['(SERVICE, NEGATIVE)']	"['(SERVICE, NEGATIVE, ""Bedienung"")']"
979	Super nette Bedienung und gute Qualität beim Essen.	['(SERVICE, POSITIVE)', '(SERVICE, POSITIVE)']	"['(SERVICE, POSITIVE, ""Bedienung"")', '(SERVICE, POSITIVE, ""Essen"")']"
991	Geschätzt 10 Bedienungen haben versucht uns zu versorgen immer wieder Doppelbestellungen, weil keiner wirklich Wuste was der andere macht.	['(SERVICE, NEGATIVE)']	"['(SERVICE, NEGATIVE, ""Bedienungen"")']"
996	Die gewählten Gerichte: Cordon Blue, doppelter Schaschlik-Spieß, Pfefferlendchen, zwei Kindergerichte und eine „kleine Portion Rippchen“ waren schmackhaft, appetitlich angerichtet und so reichlich konzipiert, dass eine große „in weiser Voraussicht“ mitgebrachte Dose auch das Mittagessen für den morgigen Tag gesichert hat.	['(FOOD, POSITIVE)', '(FOOD, POSITIVE)', '(FOOD, POSITIVE)', '(FOOD, POSITIVE)', '(FOOD, POSITIVE)']	"['(FOOD, POSITIVE, ""Cordon Blue"")', '(FOOD, POSITIVE, ""Schaschlik-Spieß"")', '(FOOD, POSITIVE, ""Pfefferlendchen"")', '(FOOD, POSITIVE, ""Kindergerichte"")', '(FOOD, POSITIVE, ""Rippchen"")']"
997	Für jeden Geschmack, auch vegan 🌱, war etwas dabei.	['(FOOD, POSITIVE)']	"['(FOOD, POSITIVE, ""NULL"")']"
1037	Denn Erholung, was ja ein Abend mit gutem Essen, netter Unterhaltung miteinander und in stilvoller Umgebung, ausmacht, war es nicht.	['(FOOD, NEGATIVE)', '(AMBIENCE, NEGATIVE)', '(AMBIENCE, NEGATIVE)']	"['(FOOD, NEGATIVE, ""Essen"")', '(AMBIENCE, NEGATIVE, ""Unterhaltung"")', '(AMBIENCE, NEGATIVE, ""Umgebung"")']"
1065	Das vorab..Wir wurden sehr freundlich empfangen, zum Platz geleitet und auch die Bedienung war sehr kompetent und zuvorkommend.	['(SERVICE, POSITIVE)', '(SERVICE, POSITIVE)']	"['(SERVICE, POSITIVE, ""NULL"")', '(SERVICE, POSITIVE, ""Bedienung"")']"
1088	Das ungute Gefühl ist geblieben.	['(GENERAL-IMPRESSION, NEGATIVE)']	"['(GENERAL-IMPRESSION, NEGATIVE, ""NULL"")']"
1097	Super Fleisch Beratung, essen gleichzeitig auf dem Tisch.	['(SERVICE, POSITIVE)']	"['(SERVICE, POSITIVE, ""Beratung"")']"
1108	"Wir hätten uns dann wohl im Sinne dieser "" Menschlichkeit"" in den Regen setzen dürfen."	['(SERVICE, NEGATIVE)']	"['(SERVICE, NEGATIVE, ""NULL"")']"
1110	Alle arbeiteten Hand in Hand.	['(SERVICE, POSITIVE)']	"['(SERVICE, POSITIVE, ""NULL"")']"
1129	Schade dass bei so einer super Lage der Service so zu wünschen übrig lässt.	['(SERVICE, NEGATIVE)', '(AMBIENCE, POSITIVE)']	"['(SERVICE, NEGATIVE, ""Service"")', '(AMBIENCE, POSITIVE, ""Lage"")']"
1161	Durchaus einen Besuch wert.	['(GENERAL-IMPRESSION, POSITIVE)']	"['(GENERAL-IMPRESSION, POSITIVE, ""NULL"")']"
1191	Der wirklich hervorragende Service hat den Besuch abgerundet.	['(SERVICE, POSITIVE)']	"['(SERVICE, POSITIVE, ""Service"")']"
1196	Das Personal war sehr freundlich und zuvorkommend.	['(SERVICE, POSITIVE)']	"['(SERVICE, POSITIVE, ""Personal"")']"
1246	Insgesamt wirklich gut, Currywurst mit Pommes ist auch zu empfehlen.	['(GENERAL-IMPRESSION, POSITIVE)', '(FOOD, POSITIVE)']	"['(GENERAL-IMPRESSION, POSITIVE, ""NULL"")', '(FOOD, POSITIVE, ""Currywurst mit Pommes"")']"
1279	Das Ambiente ist richtig toll, die Auswahl an Gerichten super.	['(AMBIENCE, POSITIVE)', '(FOOD, POSITIVE)']	"['(AMBIENCE, POSITIVE, ""Ambiente"")', '(FOOD, POSITIVE, ""Gerichten"")']"
1318	Die Garnelen waren köstlich, die knoblauch hatte eine perfekte Note dazu gegeben und LOC noch einen leichten bis gehabt und einen runden Geschmack verleiht.	['(FOOD, POSITIVE)', '(FOOD, POSITIVE)']	"['(FOOD, POSITIVE, ""Garnelen"")', '(FOOD, POSITIVE, ""knoblauch"")']"
1405	Insgesamt nicht weiterzuempfehlen.	['(GENERAL-IMPRESSION, NEGATIVE)']	"['(GENERAL-IMPRESSION, NEGATIVE, ""NULL"")']"
1418	Am Rand kalt, in der Mitte heiß.	['(FOOD, NEGATIVE)']	"['(FOOD, NEGATIVE, ""NULL"")']"
1446	Die bestellten Biersorten waren lecker!	['(FOOD, POSITIVE)']	"['(FOOD, POSITIVE, ""Biersorten"")']"
1455	Wir wollten uns zum Hochzeitstag mal was besonderes gönnen , doch sind wir beide sehr entäuscht worden , das Schnitzel war nicht nur schlabberig sondern auch ungewürzt , die Jägersoße war auch nicht besser , ein kleiner Salat sollte eigentlich zu jedem Gericht gehören , einzig die Bedienung war freundlich .	['(FOOD, NEGATIVE)', '(FOOD, NEGATIVE)', '(SERVICE, POSITIVE)']	"['(FOOD, NEGATIVE, ""Schnitzel"")', '(FOOD, NEGATIVE, ""Jägersoße"")', '(SERVICE, POSITIVE, ""Bedienung"")']"
1505	Ist ganz nett.	['(GENERAL-IMPRESSION, POSITIVE)']	"['(GENERAL-IMPRESSION, POSITIVE, ""NULL"")']"
1519	Preis-Leistung ust mit sehr schlecht zu bewerten.	['(PRICE, NEGATIVE)']	"['(PRICE, NEGATIVE, ""Preis-Leistung"")']"
1529	Wer auf Haxe steht macht hier gar nichts falsch ...	['(FOOD, POSITIVE)']	"['(FOOD, POSITIVE, ""Haxe"")']"
1542	Wir mussten fast 2 Stunden auf den Hauptgang warten!	['(SERVICE, NEGATIVE)']	"['(SERVICE, NEGATIVE, ""NULL"")']"
1562	Das Fleisch vom Hauptgang war Ihnen kalt.	['(FOOD, NEGATIVE)']	"['(FOOD, NEGATIVE, ""Fleisch"")']"
1604	Die LOC war hart, das Fett darunter fest und das Fleisch zäh, trocken und ging nur schwer zu schneiden.	['(FOOD, NEGATIVE)', '(FOOD, NEGATIVE)', '(FOOD, NEGATIVE)']	"['(FOOD, NEGATIVE, ""LOC"")', '(FOOD, NEGATIVE, ""Fleisch"")', '(FOOD, NEGATIVE, ""Fett"")']"
1638	Wir werden das Restaurant sicherlich noch einige Male besuchen.	['(GENERAL-IMPRESSION, POSITIVE)']	"['(GENERAL-IMPRESSION, POSITIVE, ""Restaurant"")']"
1639	Anschließend war die Bedienung völlig mit jeglicher Weinempfehlung überfordert.	['(SERVICE, NEGATIVE)']	"['(SERVICE, NEGATIVE, ""Bedienung"")']"
1686	Ja, die Soße ist lecker.	['(FOOD, POSITIVE)']	"['(FOOD, POSITIVE, ""Soße"")']"
1706	Die Klimaanlage hatte wohl Pause.	['(AMBIENCE, NEGATIVE)']	"['(AMBIENCE, NEGATIVE, ""Klimaanlage"")']"
1780	Gutes Preiswertes Essen, sehr gute Atmosphäre, vielen Dank an Victor für den tollen Service.	['(PRICE, POSITIVE)', '(AMBIENCE, POSITIVE)', '(SERVICE, POSITIVE)']	"['(PRICE, POSITIVE, ""Essen"")', '(AMBIENCE, POSITIVE, ""Atmosphäre"")', '(SERVICE, POSITIVE, ""Service"")']"
1784	Am Ende waren wir sehr enttäuscht von dem sehr unfreundlichen Service, weshalb wir kein Trinkgeld gegeben haben, daraufhin bekamen wir zum Abschied nicht Mal ein Tschüss.	['(SERVICE, NEGATIVE)']	"['(SERVICE, NEGATIVE, ""Service"")']"
1797	Insgesamt schöne Beauhausatmosphäre mit nettem Personal.	['(AMBIENCE, POSITIVE)', '(SERVICE, POSITIVE)']	"['(AMBIENCE, POSITIVE, ""Beauhausatmosphäre"")', '(SERVICE, POSITIVE, ""Personal"")']"
1799	!Dieses Lokal können wir sehr guten Gewissens nur empfehlen (und wir empfehlen nur selten Restaurants).	['(GENERAL-IMPRESSION, POSITIVE)']	"['(GENERAL-IMPRESSION, POSITIVE, ""Lokal"")']"
1896	Das war kein Vergleich zum LOC: Hier, im LOC, gab es deutlich besseres Essen und eine bessere Serviceleistung, lag auch an einer Servicekraft (Andrea).	['(FOOD, POSITIVE)', '(SERVICE, POSITIVE)', '(SERVICE, POSITIVE)']	"['(FOOD, POSITIVE, ""Essen"")', '(SERVICE, POSITIVE, ""Serviceleistung"")', '(SERVICE, POSITIVE, ""Andrea"")']"
1913	Das Essen war soweit in Ordnung, Standard würde ich sagen dafür aber 2-3 Euro zu teuer.	['(FOOD, NEUTRAL)', '(PRICE, NEGATIVE)']	"['(FOOD, NEUTRAL, ""Essen"")', '(PRICE, NEGATIVE, ""Essen"")']"
1934	Schon beim betreten hat der Wirt respektlose und super unfreundliche Bemerkungen gemacht, ging dann so weiter und beim Bezahlungen hat ein anderer angestellter auch angefangen zu meckern.	['(SERVICE, NEGATIVE)', '(SERVICE, NEGATIVE)']	"['(SERVICE, NEGATIVE, ""Wirt"")', '(SERVICE, NEGATIVE, ""angestellter"")']"
1946	Man sitzt sehr schön, vor allem LOC Weihnachtszeit.	['(AMBIENCE, POSITIVE)']	"['(AMBIENCE, POSITIVE, ""NULL"")']"
2063	Der Kellner war unhöflich und völlig unfreundlich.	['(SERVICE, NEGATIVE)']	"['(SERVICE, NEGATIVE, ""Kellner"")']"
2089	Wir werden nach unserem eigenen Erlebnis nicht mehr dort hingehen.	['(GENERAL-IMPRESSION, NEGATIVE)']	"['(GENERAL-IMPRESSION, NEGATIVE, ""NULL"")']"
2112	Verstehe 0 warum die Leute es gut finden	['(GENERAL-IMPRESSION, NEGATIVE)']	"['(GENERAL-IMPRESSION, NEGATIVE, ""NULL"")']"
0	Gemütliche Atmung und rustikale Deko an Wänden.	['(AMBIENCE, POSITIVE)', '(AMBIENCE, POSITIVE)']	"['(AMBIENCE, POSITIVE, ""Atmung"")', '(AMBIENCE, POSITIVE, ""Deko an Wänden"")']"
119	Super Abend, ich komme regelmäßig zum Steak essen in die RESTAURANT_NAME.	['(GENERAL-IMPRESSION, POSITIVE)']	"['(GENERAL-IMPRESSION, POSITIVE, ""RESTAURANT_NAME"")']"
185	Es gibt auch eine große Auswahl an Bieren.	['(FOOD, POSITIVE)']	"['(FOOD, POSITIVE, ""Bieren"")']"
205	Uns hat es leider nicht überzeugt.	['(GENERAL-IMPRESSION, NEGATIVE)']	"['(GENERAL-IMPRESSION, NEGATIVE, ""NULL"")']"
242	Allein der Rotwein war nichts Besonderes.	['(FOOD, NEUTRAL)']	"['(FOOD, NEUTRAL, ""Rotwein"")']"
314	Unsere Erwartungen wurden sogar noch übertroffen.	['(GENERAL-IMPRESSION, POSITIVE)']	"['(GENERAL-IMPRESSION, POSITIVE, ""NULL"")']"
329	Der sogenannte Chef de Service wurde sehr laut und wiederholte sich ständig, dass wir ja schliesslich zu spät gekommen seien.	['(SERVICE, NEGATIVE)']	"['(SERVICE, NEGATIVE, ""Chef de Service"")']"
341	Ich habe hier einen wirklich leckeren Burger gegessen und die Atmosphäre war einfach toll!	['(FOOD, POSITIVE)', '(AMBIENCE, POSITIVE)']	"['(FOOD, POSITIVE, ""Burger"")', '(AMBIENCE, POSITIVE, ""Atmosphäre"")']"
345	Die Lage direkt an der LOC ist nicht zu übertreffen.	['(AMBIENCE, POSITIVE)']	"['(AMBIENCE, POSITIVE, ""Lage"")']"
393	Dass man dort nicht ein einziges Gewürz in der Küche stehen hat, muss ich wohl kaum betonen.	['(FOOD, NEGATIVE)']	"['(FOOD, NEGATIVE, ""NULL"")']"
419	Super für sorglose, entspannte Familienfeiern, große Auswahl, viele Getränke inklusive, super Service	['(FOOD, POSITIVE)', '(FOOD, POSITIVE)', '(SERVICE, POSITIVE)', '(GENERAL-IMPRESSION, POSITIVE)']	"['(FOOD, POSITIVE, ""Auswahl"")', '(FOOD, POSITIVE, ""Getränke"")', '(SERVICE, POSITIVE, ""Service"")', '(GENERAL-IMPRESSION, POSITIVE, ""NULL"")']"
459	Der Service war trotz des Trubels aufmerksam und sehr freundlich.	['(SERVICE, POSITIVE)']	"['(SERVICE, POSITIVE, ""Service"")']"
465	Leider war der Hauptgang Rinderfilet so zäh und durchwachsen dass dies den guten Gesamteindruck nachhaltig beschädigt hat.	['(FOOD, NEGATIVE)']	"['(FOOD, NEGATIVE, ""Rinderfilet"")']"
473	Sie war super freundlich, zuvorkommend und kompetent :)	['(SERVICE, POSITIVE)']	"['(SERVICE, POSITIVE, ""NULL"")']"
480	Leider schlecht.	['(GENERAL-IMPRESSION, NEGATIVE)']	"['(GENERAL-IMPRESSION, NEGATIVE, ""NULL"")']"
484	Besonders hervorzuheben, war der Kellner Jacques.	['(SERVICE, POSITIVE)']	"['(SERVICE, POSITIVE, ""Jacques"")']"
488	Die Schnitzel war sehr lecker und auch die Soßen waren nicht pampig.	['(FOOD, POSITIVE)', '(FOOD, POSITIVE)']	"['(FOOD, POSITIVE, ""Schnitzel"")', '(FOOD, POSITIVE, ""Soßen"")']"
520	Das findet man sonst nicht, und macht die Faszination LOC aus.	['(GENERAL-IMPRESSION, POSITIVE)']	"['(GENERAL-IMPRESSION, POSITIVE, ""LOC"")']"
594	Der laue Sommerabend unter den grossen Sonnensegeln war schoen, allerdings wirkt der Aussenbereich etwas sehr „selbstgemacht“, das kann sicher boch etwas schöner werden.	['(AMBIENCE, POSITIVE)', '(AMBIENCE, NEGATIVE)']	"['(AMBIENCE, POSITIVE, ""Sommerabend unter den grossen Sonnensegeln"")', '(AMBIENCE, NEGATIVE, ""Aussenbereich"")']"
611	Schade.	['(GENERAL-IMPRESSION, NEGATIVE)']	"['(GENERAL-IMPRESSION, NEGATIVE, ""NULL"")']"
649	Kein Danke, kein Auf Wiedersehen .	['(SERVICE, NEGATIVE)']	"['(SERVICE, NEGATIVE, ""NULL"")']"
650	Authentisch, so wie ich es mag.. hatte klassisch ein schnitzel mit jägersauce… must try.	['(FOOD, POSITIVE)']	"['(FOOD, POSITIVE, ""schnitzel mit jägersauce"")']"
657	Fazit: Geht gar nicht !	['(GENERAL-IMPRESSION, NEGATIVE)']	"['(GENERAL-IMPRESSION, NEGATIVE, ""NULL"")']"
663	Um uns zu unterhalten, mussten wir uns fast schon anschreien.	['(AMBIENCE, NEGATIVE)']	"['(AMBIENCE, NEGATIVE, ""NULL"")']"
680	Es ist sehr schade, dass die Gäste in diesem Restaurant so behandelt werden.	['(SERVICE, NEGATIVE)']	"['(SERVICE, NEGATIVE, ""NULL"")']"
685	Dafür ohne Reservierung im überfüllten RESTAURANT_NAME trotzdem eine angenehme Platz-Zuweisung vor Ort,naja,bei DEN Preisen…	['(PRICE, NEGATIVE)', '(SERVICE, POSITIVE)', '(AMBIENCE, NEGATIVE)']	"['(PRICE, NEGATIVE, ""Preisen"")', '(SERVICE, POSITIVE, ""Platz-Zuweisung"")', '(AMBIENCE, NEGATIVE, ""RESTAURANT_NAME"")']"
692	Der danach bestellte Glasnudelsalat war langweilig gewürzt.	['(FOOD, NEGATIVE)']	"['(FOOD, NEGATIVE, ""Glasnudelsalat"")']"
723	Nach zehn Minuten, als wir noch den zähen Braten versuchten runterzubekommen wurde die Außenbeleuchtung der LOC entfernt und die Schirme zusammengeklappt, da es etwas windig war und möglicher weiße ein Gewitter aufzog.	['(FOOD, NEGATIVE)']	"['(FOOD, NEGATIVE, ""Braten"")']"
750	Ein tolles Gewölbe, gutes Konzept, angenehme jazzige Hintergrundmusik, gute Speisekarte.	['(AMBIENCE, POSITIVE)', '(AMBIENCE, POSITIVE)', '(FOOD, POSITIVE)']	"['(AMBIENCE, POSITIVE, ""Gewölbe"")', '(AMBIENCE, POSITIVE, ""Hintergrundmusik"")', '(FOOD, POSITIVE, ""Speisekarte"")']"
766	Sehr leckeres Essen und super Happy Hour für Cocktails!	['(FOOD, POSITIVE)', '(FOOD, POSITIVE)']	"['(FOOD, POSITIVE, ""Essen"")', '(FOOD, POSITIVE, ""Cocktails"")']"
865	Die Speisen sind einfache, bayerische Klassiker in guter Qualität.	['(FOOD, POSITIVE)']	"['(FOOD, POSITIVE, ""Speisen"")']"
893	Mit leckerem Wein tollem Essen und einem super Service.	['(FOOD, POSITIVE)', '(FOOD, POSITIVE)', '(SERVICE, POSITIVE)']	"['(FOOD, POSITIVE, ""Wein"")', '(FOOD, POSITIVE, ""Essen"")', '(SERVICE, POSITIVE, ""Service"")']"
897	Essen war absolut in Ordnung.	['(FOOD, NEUTRAL)']	"['(FOOD, NEUTRAL, ""Essen"")']"
915	Kommen bestimmt wieder.	['(GENERAL-IMPRESSION, POSITIVE)']	"['(GENERAL-IMPRESSION, POSITIVE, ""NULL"")']"
951	Die Mitarbeiter waren sehr freundlich und schnell obwohl es sehr voll war.	['(SERVICE, POSITIVE)']	"['(SERVICE, POSITIVE, ""Mitarbeiter"")']"
1070	Der schlechteste und zugleich teuerste Burger aller Zeiten für 14,90 € ohne jegliche Beilage.	['(FOOD, NEGATIVE)', '(PRICE, NEGATIVE)']	"['(FOOD, NEGATIVE, ""Burger"")', '(PRICE, NEGATIVE, ""Burger"")']"
1094	"Nie wieder ""Früh am LOC""...Soviel Arroganz, Ignoranz und Unfreundlichkeit kann EIN (1) Mensch doch gar nicht alleine haben!!"	['(SERVICE, NEGATIVE)', '(GENERAL-IMPRESSION, NEGATIVE)']	"['(SERVICE, NEGATIVE, ""NULL"")', '(GENERAL-IMPRESSION, NEGATIVE, ""NULL"")']"
1139	Mit der Reservierung des Tisches ( 4 Personen -( satte 120 €) - mit diesen 4 Burgern und 4 kleinen Getränken haben wir schließlich 245 € gezahlt !	['(PRICE, NEGATIVE)']	"['(PRICE, NEGATIVE, ""NULL"")']"
1179	Wir erhielten kleine Teller mit recht überschaubaren Portionen (keine Oliven, die ich bei jeder Art von Griechen erwarte ) Geschmacklich war alles in Ordnung.	['(FOOD, NEUTRAL)', '(FOOD, NEGATIVE)']	"['(FOOD, NEUTRAL, ""NULL"")', '(FOOD, NEGATIVE, ""Portionen"")']"
1181	Bier kann man gut trinken und der Service war sehr nett.	['(FOOD, POSITIVE)', '(SERVICE, POSITIVE)']	"['(FOOD, POSITIVE, ""Bier"")', '(SERVICE, POSITIVE, ""Service"")']"
1195	Allerdings dauerte es ewig bis das Essen kam, obwohl das Lokal nur zu 1/3 gefüllt war.	['(SERVICE, NEGATIVE)']	"['(SERVICE, NEGATIVE, ""NULL"")']"
1217	Das geht gar nicht, wenn man zu zweit essen geht!!	['(GENERAL-IMPRESSION, NEGATIVE)']	"['(GENERAL-IMPRESSION, NEGATIVE, ""NULL"")']"
1288	Mit eine Männergruppe wären alle verhungert!	['(FOOD, NEGATIVE)']	"['(FOOD, NEGATIVE, ""NULL"")']"
1306	Unglaublich enttäuschend.	['(GENERAL-IMPRESSION, NEGATIVE)']	"['(GENERAL-IMPRESSION, NEGATIVE, ""NULL"")']"
1319	Richtig cool sind die vielen Stammtische, wo jeder ein eigenes Wappen hat, sowie die versperrten Bierkrüge.	['(AMBIENCE, POSITIVE)', '(FOOD, POSITIVE)']	"['(AMBIENCE, POSITIVE, ""Stammtische"")', '(FOOD, POSITIVE, ""Bierkrüge"")']"
1335	Schönes Ambiente.	['(AMBIENCE, POSITIVE)']	"['(AMBIENCE, POSITIVE, ""Ambiente"")']"
1341	Insgesamt empfand ich das gesamte Servicepersonal als herablassend.	['(SERVICE, NEGATIVE)']	"['(SERVICE, NEGATIVE, ""Servicepersonal"")']"
1349	Als Kommentar kam nur der freche Spruch: das ist ebenso, da die Toilette im Untergeschoss sei.	['(SERVICE, NEGATIVE)']	"['(SERVICE, NEGATIVE, ""NULL"")']"
