id	text	labels	labels_phrases
1356	Die Kellner sind alle sehr nett und zuvorkommend	['(SERVICE, POSITIVE)']	"['(SERVICE, POSITIVE, ""Kellner"")']"
1357	Ein tolles italienisches Restaurant.	['(GENERAL-IMPRESSION, POSITIVE)']	"['(GENERAL-IMPRESSION, POSITIVE, ""Restaurant"")']"
1453	Schlechtester Service ever!	['(SERVICE, NEGATIVE)']	"['(SERVICE, NEGATIVE, ""Service"")']"
1478	Selbst am Nachbartisch hat eine Frau nur ein paar Happen von Ihrer Haxe und dem Knödel gegessen und den Rest zurückgegeben.	['(FOOD, NEGATIVE)']	"['(FOOD, NEGATIVE, ""NULL"")']"
1530	Auf meine Beschwerde hin wurde mir gesagt, dass das bayrische Bier eben viel Schaum habe.	['(SERVICE, NEGATIVE)']	"['(SERVICE, NEGATIVE, ""NULL"")']"
1536	Preis / Leistung stimmt.	['(PRICE, POSITIVE)']	"['(PRICE, POSITIVE, ""Preis / Leistung"")']"
1568	Die Möglichkeit online zu bestellen ist innovativ.	['(SERVICE, POSITIVE)']	"['(SERVICE, POSITIVE, ""NULL"")']"
1581	wahren alle super zuvorkommend und lieb.	['(SERVICE, POSITIVE)']	"['(SERVICE, POSITIVE, ""NULL"")']"
1593	Die von uns ausgewählten Salate waren frisch, lecker und reichhaltig.	['(FOOD, POSITIVE)']	"['(FOOD, POSITIVE, ""Salate"")']"
1601	Wir haben dann Lasagne bestellt, die leider ziemlich kalt serviert wurde und auch sonst nur durchschnittlich geschmeckt hat.	['(FOOD, NEGATIVE)']	"['(FOOD, NEGATIVE, ""Lasagne"")']"
1622	Es gab keine reine Rebe und zudem recht teuer.	['(FOOD, NEGATIVE)', '(PRICE, NEGATIVE)']	"['(FOOD, NEGATIVE, ""NULL"")', '(PRICE, NEGATIVE, ""NULL"")']"
1629	Das LOC schmeckte sehr gut, die hausgemachten Spätzle exzellent.	['(FOOD, POSITIVE)', '(FOOD, POSITIVE)']	"['(FOOD, POSITIVE, ""LOC"")', '(FOOD, POSITIVE, ""Spätzle"")']"
1771	Anschließend hatte jeder ein Maß bestellt, wo die fast die Hälfte des Bieres aus Schaum bestand, allein das grenzte an Betrug.	['(FOOD, NEGATIVE)']	"['(FOOD, NEGATIVE, ""Bieres"")']"
1779	Hier werden Sie mit leckerem Sardellencreme serviert.	['(FOOD, POSITIVE)']	"['(FOOD, POSITIVE, ""Sardellencreme"")']"
1783	Fränkische Bratwürste, die waren gut, aber das Sauerkraut dazu hat nach gar nichts geschmeckt.	['(FOOD, POSITIVE)', '(FOOD, NEGATIVE)']	"['(FOOD, POSITIVE, ""Fränkische Bratwürste"")', '(FOOD, NEGATIVE, ""Sauerkraut"")']"
1801	Für uns steht klar ,es war das erste und letzte mal .	['(GENERAL-IMPRESSION, NEGATIVE)']	"['(GENERAL-IMPRESSION, NEGATIVE, ""NULL"")']"
1819	Das Essen war sehr gut!	['(FOOD, POSITIVE)']	"['(FOOD, POSITIVE, ""Essen"")']"
1836	Schnelle Küche mit geringem Anspruch.	['(SERVICE, NEGATIVE)']	"['(SERVICE, NEGATIVE, ""Küche"")']"
1841	Ein solides italienisches Restaurant in der LOC, mit selbstgemachte Pasta, guter Auswahl und immer wieder ein Besuch wert.	['(GENERAL-IMPRESSION, POSITIVE)', '(FOOD, POSITIVE)', '(GENERAL-IMPRESSION, POSITIVE)']	"['(GENERAL-IMPRESSION, POSITIVE, ""Restaurant"")', '(FOOD, POSITIVE, ""Auswahl"")', '(GENERAL-IMPRESSION, POSITIVE, ""NULL"")']"
1843	Ganz klare Empfehlungen unsererseits.	['(GENERAL-IMPRESSION, POSITIVE)']	"['(GENERAL-IMPRESSION, POSITIVE, ""NULL"")']"
1844	Toll finde ich auch die Speisekarte.	['(FOOD, POSITIVE)']	"['(FOOD, POSITIVE, ""Speisekarte"")']"
1866	30% - ausreichend Personal, System der Annahme von Bestellungen nicht erkennbar.	['(SERVICE, NEGATIVE)']	"['(SERVICE, NEGATIVE, ""System der Annahme von Bestellungen"")']"
1879	Es war ein toller Abend.	['(GENERAL-IMPRESSION, POSITIVE)']	"['(GENERAL-IMPRESSION, POSITIVE, ""NULL"")']"
1918	23 abends dann doch etwas frisch auf der Terrasse.	['(AMBIENCE, NEGATIVE)']	"['(AMBIENCE, NEGATIVE, ""Terrasse"")']"
1920	Auch die Schnitzel kamen innerhalb einer 5-Minuten Frist und waren Massenware.	['(FOOD, NEGATIVE)']	"['(FOOD, NEGATIVE, ""Schnitzel"")']"
1933	Hier wird man schlicht verarscht.	['(GENERAL-IMPRESSION, NEGATIVE)']	"['(GENERAL-IMPRESSION, NEGATIVE, ""NULL"")']"
1940	Hätte gerne nach dem tollen Essen einen Fernet Branca bestellt.	['(FOOD, POSITIVE)']	"['(FOOD, POSITIVE, ""Essen"")']"
1972	Nix zu bemängeln.	['(GENERAL-IMPRESSION, POSITIVE)']	"['(GENERAL-IMPRESSION, POSITIVE, ""NULL"")']"
1976	Die Vorspeisen sind normalerweise sehr zu empfehlen,aber hier stimmt das Preis-Leistungsverhältnis überhaupt nicht mehr.	['(FOOD, POSITIVE)', '(PRICE, NEGATIVE)']	"['(FOOD, POSITIVE, ""Vorspeisen"")', '(PRICE, NEGATIVE, ""Vorspeisen"")']"
1992	Ich ziehe meinen Hut vor den Kollegen und Kolleginnen aus der Küche und dem Service.	['(SERVICE, POSITIVE)', '(SERVICE, POSITIVE)']	"['(SERVICE, POSITIVE, ""Service"")', '(SERVICE, POSITIVE, ""Kollegen und Kolleginnen aus der Küche"")']"
2011	Eine der Servicekräfte deutete auf die Uhr und teilte mir in einem barschen Tonfall mit, dass man um 22:00 Uhr schließe.	['(SERVICE, NEGATIVE)']	"['(SERVICE, NEGATIVE, ""Servicekräfte"")']"
2088	Getränke und Speisen standen ruckzuck auf dem Tisch.	['(SERVICE, POSITIVE)']	"['(SERVICE, POSITIVE, ""NULL"")']"
2095	unumgängliches Restaurant!	['(GENERAL-IMPRESSION, POSITIVE)']	"['(GENERAL-IMPRESSION, POSITIVE, ""Restaurant"")']"
2110	Der junge Service ist äußerst freundlich, erklärt sehr angenehm und macht seinen Job gerne.	['(SERVICE, POSITIVE)']	"['(SERVICE, POSITIVE, ""Service"")']"
2128	Sehr nettes Ambiente drin wie draußen.	['(AMBIENCE, POSITIVE)', '(AMBIENCE, POSITIVE)']	"['(AMBIENCE, POSITIVE, ""drin"")', '(AMBIENCE, POSITIVE, ""draußen"")']"
