id	text	labels	labels_phrases
1614	The manager came to the table and said we can do what we want, so we paid for what we did enjoy, the drinks and appetizers, and walked out.	['(SERVICE#GENERAL, NEGATIVE)', '(DRINKS#QUALITY, POSITIVE)', '(FOOD#QUALITY, POSITIVE)']	"['(SERVICE#GENERAL, NEGATIVE, ""manager"")', '(DRINKS#QUALITY, POSITIVE, ""drinks"")', '(FOOD#QUALITY, POSITIVE, ""appetizers"")']"
1635	But nonetheless--great spot, great food.	['(RESTAURANT#GENERAL, POSITIVE)', '(FOOD#QUALITY, POSITIVE)']	"['(RESTAURANT#GENERAL, POSITIVE, ""spot"")', '(FOOD#QUALITY, POSITIVE, ""food"")']"
1639	As BFC doesn't take reservations you almost always have to wait by the bar - and be abused by the front of house staff until you are seated, which can be over an hour later!	['(RESTAURANT#MISCELLANEOUS, NEGATIVE)', '(SERVICE#GENERAL, NEGATIVE)', '(SERVICE#GENERAL, NEGATIVE)']	"['(RESTAURANT#MISCELLANEOUS, NEGATIVE, ""BFC"")', '(SERVICE#GENERAL, NEGATIVE, ""front of house staff"")', '(SERVICE#GENERAL, NEGATIVE, ""NULL"")']"
1642	I'd be horrified if my staff were turning away customers so early and so rudely!	['(SERVICE#GENERAL, NEGATIVE)']	"['(SERVICE#GENERAL, NEGATIVE, ""staff"")']"
1653	"A word to the wise: you can't dine here and disturb the maitre-D's sense of "" table turnover"", as whacked as it is, or else."	['(SERVICE#GENERAL, NEGATIVE)']	"['(SERVICE#GENERAL, NEGATIVE, ""maitre-D"")']"
1655	Best meal in a long time!	['(FOOD#QUALITY, POSITIVE)']	"['(FOOD#QUALITY, POSITIVE, ""meal"")']"
1662	Highly recommend it!	['(RESTAURANT#GENERAL, POSITIVE)']	"['(RESTAURANT#GENERAL, POSITIVE, ""NULL"")']"
1663	Taking Hot Dogs to the next level	['(FOOD#QUALITY, POSITIVE)']	"['(FOOD#QUALITY, POSITIVE, ""Hot Dogs"")']"
1666	Great Atmosphere	['(AMBIENCE#GENERAL, POSITIVE)']	"['(AMBIENCE#GENERAL, POSITIVE, ""Atmosphere"")']"
1668	Cool atmosphere, the fire place in the back really ads to it but needs a bit more heat throughout on a cold night.	['(AMBIENCE#GENERAL, POSITIVE)', '(AMBIENCE#GENERAL, POSITIVE)', '(AMBIENCE#GENERAL, NEGATIVE)']	"['(AMBIENCE#GENERAL, POSITIVE, ""atmosphere"")', '(AMBIENCE#GENERAL, POSITIVE, ""fire place"")', '(AMBIENCE#GENERAL, NEGATIVE, ""NULL"")']"
1670	Don’t go to this place!	['(RESTAURANT#GENERAL, NEGATIVE)']	"['(RESTAURANT#GENERAL, NEGATIVE, ""place"")']"
1676	When we threatened to leave, we were offered a meager discount even though half the order was missing.	['(SERVICE#GENERAL, NEGATIVE)']	"['(SERVICE#GENERAL, NEGATIVE, ""NULL"")']"
1678	Can’t believe how an expensive NYC restaurant can be so disrespectful to its clients.	['(RESTAURANT#PRICES, NEGATIVE)', '(SERVICE#GENERAL, NEGATIVE)']	"['(RESTAURANT#PRICES, NEGATIVE, ""restaurant"")', '(SERVICE#GENERAL, NEGATIVE, ""NULL"")']"
1684	Expensive	['(RESTAURANT#PRICES, NEGATIVE)']	"['(RESTAURANT#PRICES, NEGATIVE, ""NULL"")']"
1686	The pasta was well cooked, didn't have enough sauce though or flavor.	['(FOOD#QUALITY, POSITIVE)', '(FOOD#QUALITY, NEGATIVE)', '(FOOD#STYLE_OPTIONS, NEGATIVE)']	"['(FOOD#QUALITY, POSITIVE, ""pasta"")', '(FOOD#QUALITY, NEGATIVE, ""pasta"")', '(FOOD#STYLE_OPTIONS, NEGATIVE, ""pasta"")']"
1705	I couldn't ignore the fact that she reach over the plate of one of my friends, who was in mid bite, to clear the table.	['(SERVICE#GENERAL, NEGATIVE)']	"['(SERVICE#GENERAL, NEGATIVE, ""NULL"")']"
10	For the price, you cannot eat this well in Manhattan.	['(RESTAURANT#PRICES, POSITIVE)', '(FOOD#QUALITY, POSITIVE)']	"['(RESTAURANT#PRICES, POSITIVE, ""NULL"")', '(FOOD#QUALITY, POSITIVE, ""NULL"")']"
11	I was very disappointed with this restaurant.	['(RESTAURANT#GENERAL, NEGATIVE)']	"['(RESTAURANT#GENERAL, NEGATIVE, ""restaurant"")']"
23	Can't wait wait for my next visit.	['(RESTAURANT#GENERAL, POSITIVE)']	"['(RESTAURANT#GENERAL, POSITIVE, ""NULL"")']"
27	I had never had Edamame pureed before but I thought it was innovative and tasty (could've used a bit more salt).	['(FOOD#QUALITY, POSITIVE)', '(FOOD#STYLE_OPTIONS, POSITIVE)']	"['(FOOD#QUALITY, POSITIVE, ""Edamame pureed"")', '(FOOD#STYLE_OPTIONS, POSITIVE, ""Edamame pureed"")']"
48	I have been going back again and again.	['(RESTAURANT#GENERAL, POSITIVE)']	"['(RESTAURANT#GENERAL, POSITIVE, ""NULL"")']"
60	I will be going back and heartily recommend it!	['(RESTAURANT#GENERAL, POSITIVE)']	"['(RESTAURANT#GENERAL, POSITIVE, ""NULL"")']"
62	$6 and there is much tasty food, all of it fresh and continually refilled.	['(FOOD#STYLE_OPTIONS, POSITIVE)', '(FOOD#QUALITY, POSITIVE)', '(FOOD#PRICES, POSITIVE)']	"['(FOOD#STYLE_OPTIONS, POSITIVE, ""food"")', '(FOOD#QUALITY, POSITIVE, ""food"")', '(FOOD#PRICES, POSITIVE, ""food"")']"
64	Go hungry and enjoy.	['(RESTAURANT#GENERAL, POSITIVE)']	"['(RESTAURANT#GENERAL, POSITIVE, ""NULL"")']"
67	The service varys from day to day- sometimes they're very nice, and sometimes not.	['(SERVICE#GENERAL, NEGATIVE)']	"['(SERVICE#GENERAL, NEGATIVE, ""service"")']"
68	The kitchen however, is almost always slow.	['(SERVICE#GENERAL, NEGATIVE)']	"['(SERVICE#GENERAL, NEGATIVE, ""kitchen"")']"
70	The ambience is pretty and nice for conversation, so a casual lunch here would probably be best.	['(AMBIENCE#GENERAL, POSITIVE)', '(RESTAURANT#MISCELLANEOUS, POSITIVE)']	"['(AMBIENCE#GENERAL, POSITIVE, ""ambience"")', '(RESTAURANT#MISCELLANEOUS, POSITIVE, ""NULL"")']"
80	It looked like shredded cheese partly done - still in strips.	['(FOOD#STYLE_OPTIONS, NEGATIVE)']	"['(FOOD#STYLE_OPTIONS, NEGATIVE, ""NULL"")']"
86	The seafood is amazing, there's a good wine list, and the ever-changing menu always offers some great surprises.	['(FOOD#QUALITY, POSITIVE)', '(DRINKS#STYLE_OPTIONS, POSITIVE)', '(FOOD#STYLE_OPTIONS, POSITIVE)']	"['(FOOD#QUALITY, POSITIVE, ""seafood"")', '(DRINKS#STYLE_OPTIONS, POSITIVE, ""wine list"")', '(FOOD#STYLE_OPTIONS, POSITIVE, ""menu"")']"
91	As a Japanese native, I've lived in the Tristate area for over 8 years, but I was just so amazed at this place.	['(RESTAURANT#GENERAL, POSITIVE)']	"['(RESTAURANT#GENERAL, POSITIVE, ""place"")']"
92	This place is the most Japanese it can ever get.	['(RESTAURANT#MISCELLANEOUS, POSITIVE)']	"['(RESTAURANT#MISCELLANEOUS, POSITIVE, ""place"")']"
97	My wife and I always enjoy the young, not always well trained but nevertheless friendly, staff, all of whom have a story.	['(SERVICE#GENERAL, POSITIVE)']	"['(SERVICE#GENERAL, POSITIVE, ""staff"")']"
104	I'm partial to the Gnocchi.	['(RESTAURANT#GENERAL, POSITIVE)']	"['(RESTAURANT#GENERAL, POSITIVE, ""Gnocchi"")']"
105	This place is incredibly tiny.	['(RESTAURANT#MISCELLANEOUS, NEGATIVE)']	"['(RESTAURANT#MISCELLANEOUS, NEGATIVE, ""place"")']"
109	I just don't understand all the hype...	['(RESTAURANT#GENERAL, NEGATIVE)']	"['(RESTAURANT#GENERAL, NEGATIVE, ""NULL"")']"
121	Sauce was watery and the food didn't have much flavor.	['(FOOD#QUALITY, NEGATIVE)', '(FOOD#QUALITY, NEGATIVE)']	"['(FOOD#QUALITY, NEGATIVE, ""Sauce"")', '(FOOD#QUALITY, NEGATIVE, ""food"")']"
124	I had a huge group for my birthday and we were well taken care of.	['(SERVICE#GENERAL, POSITIVE)']	"['(SERVICE#GENERAL, POSITIVE, ""NULL"")']"
128	Great pizza and fantastic service.	['(FOOD#QUALITY, POSITIVE)', '(SERVICE#GENERAL, POSITIVE)']	"['(FOOD#QUALITY, POSITIVE, ""pizza"")', '(SERVICE#GENERAL, POSITIVE, ""service"")']"
137	With the great variety on the menu , I eat here often and never get bored .	['(FOOD#STYLE_OPTIONS, POSITIVE)']	"['(FOOD#STYLE_OPTIONS, POSITIVE, ""menu"")']"
158	I've been there three times and have always had wonderful experiences.	['(RESTAURANT#GENERAL, POSITIVE)']	"['(RESTAURANT#GENERAL, POSITIVE, ""NULL"")']"
162	Make sure you have the Spicy Scallop roll.. .	['(FOOD#QUALITY, POSITIVE)']	"['(FOOD#QUALITY, POSITIVE, ""Spicy Scallop roll"")']"
165	Took my mom for Mother's Day, and the maitre d' was pretty rude.	['(SERVICE#GENERAL, NEGATIVE)']	"['(SERVICE#GENERAL, NEGATIVE, ""maitre d\'"")']"
172	Downstairs lounge is always a good attraction	['(AMBIENCE#GENERAL, POSITIVE)']	"['(AMBIENCE#GENERAL, POSITIVE, ""Downstairs lounge"")']"
174	The exotic food is beautifully presented and is a delight in delicious combinations.	['(FOOD#STYLE_OPTIONS, POSITIVE)', '(FOOD#QUALITY, POSITIVE)']	"['(FOOD#STYLE_OPTIONS, POSITIVE, ""exotic food"")', '(FOOD#QUALITY, POSITIVE, ""exotic food"")']"
175	It is also extremely well priced.	['(FOOD#PRICES, POSITIVE)']	"['(FOOD#PRICES, POSITIVE, ""NULL"")']"
182	Then, to top things off, she dropped used silverware on my boyfriend's jacket and did not stop to apologize or clean the mess that was left on clothes. 	['(SERVICE#GENERAL, NEGATIVE)']	"['(SERVICE#GENERAL, NEGATIVE, ""NULL"")']"
184	Rude service, medicore food...there are tons of restaurants in NY...stay away from this one	['(SERVICE#GENERAL, NEGATIVE)', '(FOOD#QUALITY, NEUTRAL)', '(RESTAURANT#GENERAL, NEGATIVE)']	"['(SERVICE#GENERAL, NEGATIVE, ""service"")', '(FOOD#QUALITY, NEUTRAL, ""food"")', '(RESTAURANT#GENERAL, NEGATIVE, ""NULL"")']"
186	I loved everythig about it-especially the shows and actors.	['(RESTAURANT#GENERAL, POSITIVE)', '(AMBIENCE#GENERAL, POSITIVE)', '(AMBIENCE#GENERAL, POSITIVE)']	"['(RESTAURANT#GENERAL, POSITIVE, ""NULL"")', '(AMBIENCE#GENERAL, POSITIVE, ""shows"")', '(AMBIENCE#GENERAL, POSITIVE, ""actors"")']"
191	The outdoor atmosphere of sitting on the sidewalk watching the world go by 50 feet away on 6th avenue on a cool evening was wonderful.	['(LOCATION#GENERAL, POSITIVE)']	"['(LOCATION#GENERAL, POSITIVE, ""outdoor atmosphere"")']"
220	Food was very good as well, considering that we tried the budget selection (though I wish the pork belly that I ordered was roasted a bit longer, so that fat was more of a melt-in-your-mouth experience).	['(FOOD#QUALITY, POSITIVE)', '(FOOD#QUALITY, NEGATIVE)']	"['(FOOD#QUALITY, POSITIVE, ""Food"")', '(FOOD#QUALITY, NEGATIVE, ""pork belly"")']"
227	As many other reviewers noticed, your order is often slow to arrive - this is particularly true in the evening but is not a problem during lunch time.	['(SERVICE#GENERAL, NEUTRAL)']	"['(SERVICE#GENERAL, NEUTRAL, ""NULL"")']"
237	It's one of our favorite places to eat in NY.	['(RESTAURANT#GENERAL, POSITIVE)']	"['(RESTAURANT#GENERAL, POSITIVE, ""NULL"")']"
239	After really enjoying ourselves at the bar we sat down at a table and had dinner.	['(RESTAURANT#GENERAL, POSITIVE)']	"['(RESTAURANT#GENERAL, POSITIVE, ""bar"")']"
251	They were served warm and had a soft fluffy interior.	['(FOOD#QUALITY, POSITIVE)']	"['(FOOD#QUALITY, POSITIVE, ""NULL"")']"
258	All the staff is absolutely professional!! 	['(SERVICE#GENERAL, POSITIVE)']	"['(SERVICE#GENERAL, POSITIVE, ""staff"")']"
260	(that is A MUST, but not every restaurant can do...) 	['(SERVICE#GENERAL, POSITIVE)']	"['(SERVICE#GENERAL, POSITIVE, ""NULL"")']"
271	fresh restaurant was amazing........ food was delicious and of course fresh.	['(RESTAURANT#GENERAL, POSITIVE)', '(FOOD#QUALITY, POSITIVE)']	"['(RESTAURANT#GENERAL, POSITIVE, ""fresh restaurant"")', '(FOOD#QUALITY, POSITIVE, ""food"")']"
272	great for a romantic evening, or a fun evening with friends...	['(AMBIENCE#GENERAL, POSITIVE)', '(RESTAURANT#MISCELLANEOUS, POSITIVE)']	"['(AMBIENCE#GENERAL, POSITIVE, ""NULL"")', '(RESTAURANT#MISCELLANEOUS, POSITIVE, ""NULL"")']"
277	the salads are delicious, both refreshing and very spicy.	['(FOOD#QUALITY, POSITIVE)']	"['(FOOD#QUALITY, POSITIVE, ""salads"")']"
279	too large for just two people but nothing was left.	['(FOOD#STYLE_OPTIONS, NEUTRAL)', '(FOOD#QUALITY, POSITIVE)']	"['(FOOD#STYLE_OPTIONS, NEUTRAL, ""NULL"")', '(FOOD#QUALITY, POSITIVE, ""NULL"")']"
281	My husbands was perfect, my was well done and dry.	['(FOOD#QUALITY, POSITIVE)', '(FOOD#QUALITY, NEGATIVE)']	"['(FOOD#QUALITY, POSITIVE, ""NULL"")', '(FOOD#QUALITY, NEGATIVE, ""NULL"")']"
284	Ambience is so cute and quaint, good for business although we were there on vacation.	['(AMBIENCE#GENERAL, POSITIVE)', '(RESTAURANT#MISCELLANEOUS, POSITIVE)']	"['(AMBIENCE#GENERAL, POSITIVE, ""Ambience"")', '(RESTAURANT#MISCELLANEOUS, POSITIVE, ""NULL"")']"
290	The spicy Tuna roll is huge and probably the best that I've had at this price range.	['(FOOD#STYLE_OPTIONS, POSITIVE)', '(FOOD#QUALITY, POSITIVE)', '(FOOD#PRICES, POSITIVE)']	"['(FOOD#STYLE_OPTIONS, POSITIVE, ""spicy Tuna roll"")', '(FOOD#QUALITY, POSITIVE, ""spicy Tuna roll"")', '(FOOD#PRICES, POSITIVE, ""spicy Tuna roll"")']"
291	The Yellowtail was particularly good as well.	['(FOOD#QUALITY, POSITIVE)']	"['(FOOD#QUALITY, POSITIVE, ""Yellowtail"")']"
298	And it all comes at a very reasonable price (congee, noodles, and rice dishes are no more than $3-6 each).	['(FOOD#PRICES, POSITIVE)', '(FOOD#PRICES, POSITIVE)', '(FOOD#PRICES, POSITIVE)', '(FOOD#PRICES, POSITIVE)']	"['(FOOD#PRICES, POSITIVE, ""NULL"")', '(FOOD#PRICES, POSITIVE, ""congee"")', '(FOOD#PRICES, POSITIVE, ""noodles"")', '(FOOD#PRICES, POSITIVE, ""rice dishes"")']"
301	Enjoyed a very nice Caesar Salad while my wife had arugula and goat cheese....both very tasty.	['(FOOD#QUALITY, POSITIVE)', '(FOOD#QUALITY, POSITIVE)']	"['(FOOD#QUALITY, POSITIVE, ""Caesar Salad"")', '(FOOD#QUALITY, POSITIVE, ""arugula and goat cheese"")']"
306	The staff was accomodating, the food was absolutely delicious and the place is lovely.	['(SERVICE#GENERAL, POSITIVE)', '(FOOD#QUALITY, POSITIVE)', '(AMBIENCE#GENERAL, POSITIVE)']	"['(SERVICE#GENERAL, POSITIVE, ""staff"")', '(FOOD#QUALITY, POSITIVE, ""food"")', '(AMBIENCE#GENERAL, POSITIVE, ""place"")']"
314	And where does Patis go wrong; no where. 	['(RESTAURANT#GENERAL, POSITIVE)']	"['(RESTAURANT#GENERAL, POSITIVE, ""Patis"")']"
316	And evaluated on those terms Pastis is simply wonderful.	['(RESTAURANT#GENERAL, POSITIVE)']	"['(RESTAURANT#GENERAL, POSITIVE, ""Pastis"")']"
321	Kind of a small place but I guess if they are not too busy might be able to fit a group or kids.	['(RESTAURANT#MISCELLANEOUS, NEUTRAL)']	"['(RESTAURANT#MISCELLANEOUS, NEUTRAL, ""place"")']"
326	It's a nice place to relax and have conversation.	['(AMBIENCE#GENERAL, POSITIVE)']	"['(AMBIENCE#GENERAL, POSITIVE, ""place"")']"
328	The food is authentic Italian - delicious!	['(FOOD#QUALITY, POSITIVE)']	"['(FOOD#QUALITY, POSITIVE, ""food"")']"
332	The hanger steak was like rubber and the tuna was flavorless not to mention it tasted like it had just been thawed.	['(FOOD#QUALITY, NEGATIVE)', '(FOOD#QUALITY, NEGATIVE)']	"['(FOOD#QUALITY, NEGATIVE, ""hanger steak"")', '(FOOD#QUALITY, NEGATIVE, ""tuna"")']"
338	I would defiantly come back here again as one of my top choices.	['(RESTAURANT#GENERAL, POSITIVE)']	"['(RESTAURANT#GENERAL, POSITIVE, ""NULL"")']"
346	We ordered some beef and noodle soup dishes from the Thai section of the menu but nothing we got was Thai.	['(FOOD#QUALITY, NEGATIVE)']	"['(FOOD#QUALITY, NEGATIVE, ""beef and noodle soup dishes"")']"
347	We were very disappointed.	['(FOOD#QUALITY, NEGATIVE)']	"['(FOOD#QUALITY, NEGATIVE, ""NULL"")']"
356	First of all, this place is *not* romantic, as claimed by Citysearch's editorial review.	['(AMBIENCE#GENERAL, NEGATIVE)']	"['(AMBIENCE#GENERAL, NEGATIVE, ""place"")']"
357	Either that, or the editor's idea of romance must be sharing a conversation with the next table, while trying to speak louder than the traffic on 57th.	['(AMBIENCE#GENERAL, NEGATIVE)']	"['(AMBIENCE#GENERAL, NEGATIVE, ""NULL"")']"
361	For instance, plates were just dumped on the table, I was handed the wine list upside down, etc.... 	['(SERVICE#GENERAL, NEGATIVE)']	"['(SERVICE#GENERAL, NEGATIVE, ""NULL"")']"
371	I've never had bad service and the fish is fresh and delicious.	['(SERVICE#GENERAL, POSITIVE)', '(FOOD#QUALITY, POSITIVE)']	"['(SERVICE#GENERAL, POSITIVE, ""service"")', '(FOOD#QUALITY, POSITIVE, ""fish"")']"
372	Their tuna tartar appetizer is to die for.	['(FOOD#QUALITY, POSITIVE)']	"['(FOOD#QUALITY, POSITIVE, ""tuna tartar appetizer"")']"
381	The service was impeccable and unobtrusive -- the staff knows what they are there to do -- to know their menu, present your meal, and attend to your needs.	['(SERVICE#GENERAL, POSITIVE)', '(SERVICE#GENERAL, POSITIVE)']	"['(SERVICE#GENERAL, POSITIVE, ""service"")', '(SERVICE#GENERAL, POSITIVE, ""staff"")']"
389	My boyfriend had Prime Rib it was good .	['(FOOD#QUALITY, POSITIVE)']	"['(FOOD#QUALITY, POSITIVE, ""Prime Rib"")']"
390	We didn't want a bottle of bubbly on a weekday so we each got little bottles of Korbett it was just enough. 	['(DRINKS#STYLE_OPTIONS, POSITIVE)']	"['(DRINKS#STYLE_OPTIONS, POSITIVE, ""bottles of Korbett"")']"
401	The place is small and intimate and you may feel a little crowded, but the service is excellent and it's great for friends out, a romantic date, or a special occassion.	['(SERVICE#GENERAL, POSITIVE)', '(AMBIENCE#GENERAL, NEGATIVE)', '(RESTAURANT#MISCELLANEOUS, POSITIVE)']	"['(SERVICE#GENERAL, POSITIVE, ""service"")', '(AMBIENCE#GENERAL, NEGATIVE, ""place"")', '(RESTAURANT#MISCELLANEOUS, POSITIVE, ""place"")']"
408	Problem is nothing at Prune is particularly memorable.	['(RESTAURANT#GENERAL, NEGATIVE)']	"['(RESTAURANT#GENERAL, NEGATIVE, ""Prune"")']"
412	Our food was great too!	['(FOOD#QUALITY, POSITIVE)']	"['(FOOD#QUALITY, POSITIVE, ""food"")']"
414	The staff was the friendliest that have seen in New York.	['(SERVICE#GENERAL, POSITIVE)']	"['(SERVICE#GENERAL, POSITIVE, ""staff"")']"
422	The characters really make for an enjoyable experience.	['(AMBIENCE#GENERAL, POSITIVE)']	"['(AMBIENCE#GENERAL, POSITIVE, ""characters"")']"
424	It is very overpriced and not very tasty.	['(FOOD#QUALITY, NEGATIVE)', '(FOOD#PRICES, NEGATIVE)']	"['(FOOD#QUALITY, NEGATIVE, ""NULL"")', '(FOOD#PRICES, NEGATIVE, ""NULL"")']"
425	However, I think Jeckll and Hydes t is one of those places that is fun to do once.	['(RESTAURANT#GENERAL, POSITIVE)']	"['(RESTAURANT#GENERAL, POSITIVE, ""Jeckll and Hydes"")']"
428	Service was slow had to wait to order and get food although not crowded.	['(SERVICE#GENERAL, NEGATIVE)']	"['(SERVICE#GENERAL, NEGATIVE, ""Service"")']"
434	And it was quick which is very important.	['(SERVICE#GENERAL, POSITIVE)']	"['(SERVICE#GENERAL, POSITIVE, ""NULL"")']"
451	The ambience was nice, but service wasn't so great.	['(AMBIENCE#GENERAL, POSITIVE)', '(SERVICE#GENERAL, NEGATIVE)']	"['(AMBIENCE#GENERAL, POSITIVE, ""ambience"")', '(SERVICE#GENERAL, NEGATIVE, ""service"")']"
461	This restaurant was recommended by a local...as a matter of fact, he made the reservation for us and said we would not be disappointed!	['(RESTAURANT#GENERAL, POSITIVE)']	"['(RESTAURANT#GENERAL, POSITIVE, ""NULL"")']"
464	The location and ambience is Ok but the food is what makes up for it.	['(LOCATION#GENERAL, NEUTRAL)', '(AMBIENCE#GENERAL, NEUTRAL)', '(FOOD#QUALITY, POSITIVE)']	"['(LOCATION#GENERAL, NEUTRAL, ""location"")', '(AMBIENCE#GENERAL, NEUTRAL, ""ambience"")', '(FOOD#QUALITY, POSITIVE, ""food"")']"
473	A little noise but I think that was because of our party!	['(AMBIENCE#GENERAL, NEUTRAL)']	"['(AMBIENCE#GENERAL, NEUTRAL, ""NULL"")']"
478	A guaranteeed delight!	['(RESTAURANT#GENERAL, POSITIVE)']	"['(RESTAURANT#GENERAL, POSITIVE, ""NULL"")']"
482	I pray it stays open forever.	['(RESTAURANT#GENERAL, POSITIVE)']	"['(RESTAURANT#GENERAL, POSITIVE, ""NULL"")']"
490	Who has room for Cheesesticks with the best pizza in NYC!	['(FOOD#QUALITY, POSITIVE)']	"['(FOOD#QUALITY, POSITIVE, ""pizza"")']"
492	Great staff.	['(SERVICE#GENERAL, POSITIVE)']	"['(SERVICE#GENERAL, POSITIVE, ""staff"")']"
497	But the staff was so horrible to us.	['(SERVICE#GENERAL, NEGATIVE)']	"['(SERVICE#GENERAL, NEGATIVE, ""staff"")']"
502	Amma is nothing special.	['(RESTAURANT#GENERAL, NEUTRAL)']	"['(RESTAURANT#GENERAL, NEUTRAL, ""Amma"")']"
505	Don't dine at Tamarind for the vegetarian dishes, they are simply not up to par with the non-veg selections.	['(FOOD#QUALITY, NEGATIVE)', '(FOOD#QUALITY, POSITIVE)']	"['(FOOD#QUALITY, NEGATIVE, ""vegetarian dishes"")', '(FOOD#QUALITY, POSITIVE, ""non-veg selections"")']"
506	Decor is nice though service can be spotty.	['(AMBIENCE#GENERAL, POSITIVE)', '(SERVICE#GENERAL, NEGATIVE)']	"['(AMBIENCE#GENERAL, POSITIVE, ""Decor"")', '(SERVICE#GENERAL, NEGATIVE, ""service"")']"
510	Highly recommended.	['(RESTAURANT#GENERAL, POSITIVE)']	"['(RESTAURANT#GENERAL, POSITIVE, ""NULL"")']"
511	First of all Dal Bukhara Rocks.	['(FOOD#QUALITY, POSITIVE)']	"['(FOOD#QUALITY, POSITIVE, ""Dal Bukhara"")']"
528	I have been to Roth's twice and both times were very disappointing.	['(RESTAURANT#GENERAL, NEGATIVE)']	"['(RESTAURANT#GENERAL, NEGATIVE, ""Roth\'s"")']"
530	They wouldnt even let me finish my glass of wine before offering another.	['(SERVICE#GENERAL, NEGATIVE)']	"['(SERVICE#GENERAL, NEGATIVE, ""NULL"")']"
531	Much of the time it seems like they do not care about you.	['(SERVICE#GENERAL, NEGATIVE)']	"['(SERVICE#GENERAL, NEGATIVE, ""NULL"")']"
532	The dinner was ok, nothing I would have again.	['(FOOD#QUALITY, NEGATIVE)']	"['(FOOD#QUALITY, NEGATIVE, ""dinner"")']"
534	This was a great surprise.	['(RESTAURANT#GENERAL, POSITIVE)']	"['(RESTAURANT#GENERAL, POSITIVE, ""NULL"")']"
539	We love the food, drinks, and atmosphere!	['(FOOD#QUALITY, POSITIVE)', '(DRINKS#QUALITY, POSITIVE)', '(AMBIENCE#GENERAL, POSITIVE)']	"['(FOOD#QUALITY, POSITIVE, ""food"")', '(DRINKS#QUALITY, POSITIVE, ""drinks"")', '(AMBIENCE#GENERAL, POSITIVE, ""atmosphere"")']"
542	Just because it's cheap does NOT mean the portions are small or the food is nasty, IT IS GREAT!	['(FOOD#STYLE_OPTIONS, POSITIVE)', '(FOOD#QUALITY, POSITIVE)', '(RESTAURANT#PRICES, POSITIVE)']	"['(FOOD#STYLE_OPTIONS, POSITIVE, ""portions"")', '(FOOD#QUALITY, POSITIVE, ""food"")', '(RESTAURANT#PRICES, POSITIVE, ""NULL"")']"
546	Eating in, the atmosphere saves it, but at your desk, it's a very disappointing experience.	['(AMBIENCE#GENERAL, POSITIVE)', '(RESTAURANT#GENERAL, NEGATIVE)']	"['(AMBIENCE#GENERAL, POSITIVE, ""atmosphere"")', '(RESTAURANT#GENERAL, NEGATIVE, ""NULL"")']"
554	This is a nice restaurant if you are looking for a good place to host an intimate dinner meeting with business associates.	['(RESTAURANT#MISCELLANEOUS, POSITIVE)']	"['(RESTAURANT#MISCELLANEOUS, POSITIVE, ""restaurant"")']"
558	Fish is so very fresh.	['(FOOD#QUALITY, POSITIVE)']	"['(FOOD#QUALITY, POSITIVE, ""Fish"")']"
565	The only fallback on this restaurant is the prices.	['(RESTAURANT#PRICES, NEGATIVE)']	"['(RESTAURANT#PRICES, NEGATIVE, ""restaurant"")']"
571	Truly the mark of an attentive waiter.	['(SERVICE#GENERAL, POSITIVE)']	"['(SERVICE#GENERAL, POSITIVE, ""waiter"")']"
585	Wine list is extensive without being over-priced.	['(DRINKS#STYLE_OPTIONS, POSITIVE)', '(DRINKS#PRICES, POSITIVE)']	"['(DRINKS#STYLE_OPTIONS, POSITIVE, ""Wine list"")', '(DRINKS#PRICES, POSITIVE, ""Wine list"")']"
590	The food was very good, a great deal, and the place its self was great.	['(FOOD#QUALITY, POSITIVE)', '(FOOD#PRICES, POSITIVE)', '(AMBIENCE#GENERAL, POSITIVE)']	"['(FOOD#QUALITY, POSITIVE, ""food"")', '(FOOD#PRICES, POSITIVE, ""food"")', '(AMBIENCE#GENERAL, POSITIVE, ""place"")']"
594	The waitress, seems to be more concerned of looking good than actually waitressing.	['(SERVICE#GENERAL, NEGATIVE)']	"['(SERVICE#GENERAL, NEGATIVE, ""waitress"")']"
605	The ambience was so fun, and the prices were great, on top of the fact that the food was really tasty.	['(AMBIENCE#GENERAL, POSITIVE)', '(RESTAURANT#PRICES, POSITIVE)', '(FOOD#QUALITY, POSITIVE)']	"['(AMBIENCE#GENERAL, POSITIVE, ""ambience"")', '(RESTAURANT#PRICES, POSITIVE, ""NULL"")', '(FOOD#QUALITY, POSITIVE, ""food"")']"
607	I would definitely recommend SEA if you like thai cuisine!	['(FOOD#QUALITY, POSITIVE)']	"['(FOOD#QUALITY, POSITIVE, ""thai cuisine"")']"
612	Never again!	['(RESTAURANT#GENERAL, NEGATIVE)']	"['(RESTAURANT#GENERAL, NEGATIVE, ""NULL"")']"
627	Considering we were the last patrons there and it was after the closing time, the waitstaff did not rush us at all and made us feel comfortable and relaxed.	['(SERVICE#GENERAL, POSITIVE)']	"['(SERVICE#GENERAL, POSITIVE, ""waitstaff"")']"
628	I highly recommend Caviar Russe to anyone who wants delicious top grade caviar and fantastic service.	['(FOOD#QUALITY, POSITIVE)', '(SERVICE#GENERAL, POSITIVE)']	"['(FOOD#QUALITY, POSITIVE, ""caviar"")', '(SERVICE#GENERAL, POSITIVE, ""service"")']"
631	I was pleasantly surprised to find this gem in Hoboken.	['(RESTAURANT#GENERAL, POSITIVE)']	"['(RESTAURANT#GENERAL, POSITIVE, ""NULL"")']"
635	My friends settled for rice dishes, but we came back the following day to try the dim sum, which was good...not outstanding, but good.	['(FOOD#QUALITY, NEUTRAL)']	"['(FOOD#QUALITY, NEUTRAL, ""dim sum"")']"
636	We ate out in the back patio, which is worth it as it's cool and the music is hear well there.	['(AMBIENCE#GENERAL, POSITIVE)', '(AMBIENCE#GENERAL, POSITIVE)']	"['(AMBIENCE#GENERAL, POSITIVE, ""back patio"")', '(AMBIENCE#GENERAL, POSITIVE, ""music"")']"
641	The buffet had a nice selection.	['(FOOD#STYLE_OPTIONS, POSITIVE)']	"['(FOOD#STYLE_OPTIONS, POSITIVE, ""buffet"")']"
645	I got an excellent piece of cheesecake and we had several other nice pastries.	['(FOOD#QUALITY, POSITIVE)', '(FOOD#QUALITY, POSITIVE)']	"['(FOOD#QUALITY, POSITIVE, ""cheesecake"")', '(FOOD#QUALITY, POSITIVE, ""pastries"")']"
658	The pesto pizza was excellent, thin-crust pizza with a nice amount of spicy Italian cheese that I'd never heard of before.	['(FOOD#QUALITY, POSITIVE)', '(FOOD#QUALITY, POSITIVE)']	"['(FOOD#QUALITY, POSITIVE, ""pesto pizza"")', '(FOOD#QUALITY, POSITIVE, ""spicy Italian cheese"")']"
662	We had the lobster sandwich and it was FANTASTIC.	['(FOOD#QUALITY, POSITIVE)']	"['(FOOD#QUALITY, POSITIVE, ""lobster sandwich"")']"
682	I've waited over one hour for food.	['(SERVICE#GENERAL, NEGATIVE)']	"['(SERVICE#GENERAL, NEGATIVE, ""NULL"")']"
694	Guacamole+shrimp appetizer was really great, we both had the filet, very good, didn't much like the frites that came with, but the filet was so good, neither of us cared.	['(FOOD#QUALITY, POSITIVE)', '(FOOD#QUALITY, POSITIVE)', '(FOOD#QUALITY, NEGATIVE)']	"['(FOOD#QUALITY, POSITIVE, ""Guacamole+shrimp appetizer"")', '(FOOD#QUALITY, POSITIVE, ""filet"")', '(FOOD#QUALITY, NEGATIVE, ""frites"")']"
