id	text	labels	labels_phrases
2	They never brought us complimentary noodles, ignored repeated requests for sugar, and threw our dishes on the table.	['(SERVICE#GENERAL, NEGATIVE)']	"['(SERVICE#GENERAL, NEGATIVE, ""NULL"")']"
4	After all that, they complained to me about the small tip.	['(SERVICE#GENERAL, NEGATIVE)']	"['(SERVICE#GENERAL, NEGATIVE, ""NULL"")']"
26	The only thing I moderately enjoyed was their Grilled Chicken special with Edamame Puree.	['(FOOD#QUALITY, POSITIVE)']	"['(FOOD#QUALITY, POSITIVE, ""Grilled Chicken special with Edamame Puree"")']"
28	The decor is night tho...but they REALLY need to clean that vent in the ceiling...its quite un-appetizing, and kills your effort to make this place look sleek and modern.	['(AMBIENCE#GENERAL, NEGATIVE)', '(AMBIENCE#GENERAL, POSITIVE)', '(AMBIENCE#GENERAL, NEGATIVE)']	"['(AMBIENCE#GENERAL, NEGATIVE, ""place"")', '(AMBIENCE#GENERAL, POSITIVE, ""decor"")', '(AMBIENCE#GENERAL, NEGATIVE, ""vent"")']"
29	Their sake list was extensive, but we were looking for Purple Haze, which wasn't listed but made for us upon request!	['(DRINKS#STYLE_OPTIONS, POSITIVE)', '(SERVICE#GENERAL, POSITIVE)']	"['(DRINKS#STYLE_OPTIONS, POSITIVE, ""sake list"")', '(SERVICE#GENERAL, POSITIVE, ""NULL"")']"
31	We went around 9:30 on a Friday and it had died down a bit by then so the service was great!	['(SERVICE#GENERAL, POSITIVE)']	"['(SERVICE#GENERAL, POSITIVE, ""service"")']"
52	The rice to fish ration was also good--they didn't try to overpack the rice.	['(FOOD#STYLE_OPTIONS, POSITIVE)']	"['(FOOD#STYLE_OPTIONS, POSITIVE, ""rice to fish ration"")']"
55	In the evening, this place attracted a well dressed, with it, NY crowd.	['(RESTAURANT#MISCELLANEOUS, POSITIVE)']	"['(RESTAURANT#MISCELLANEOUS, POSITIVE, ""crowd"")']"
73	The lava cake dessert was incredible and I recommend it.	['(FOOD#QUALITY, POSITIVE)']	"['(FOOD#QUALITY, POSITIVE, ""lava cake dessert"")']"
85	I think I've had some the best meals of my life at minnow.	['(FOOD#QUALITY, POSITIVE)']	"['(FOOD#QUALITY, POSITIVE, ""meals"")']"
87	The combination of super-fresh ingredients in the dishes are unusual but really delicious.	['(FOOD#QUALITY, POSITIVE)']	"['(FOOD#QUALITY, POSITIVE, ""ingredients"")']"
88	Worth the trip from Manhattan.	['(RESTAURANT#GENERAL, POSITIVE)']	"['(RESTAURANT#GENERAL, POSITIVE, ""NULL"")']"
90	My wife had the fried shrimp which are huge and loved it.	['(FOOD#STYLE_OPTIONS, POSITIVE)', '(FOOD#QUALITY, POSITIVE)']	"['(FOOD#STYLE_OPTIONS, POSITIVE, ""fried shrimp"")', '(FOOD#QUALITY, POSITIVE, ""fried shrimp"")']"
100	Our teenage kids love it, too.	['(RESTAURANT#GENERAL, POSITIVE)']	"['(RESTAURANT#GENERAL, POSITIVE, ""NULL"")']"
102	This is by far my favorite place in the neighborhood.	['(RESTAURANT#GENERAL, POSITIVE)']	"['(RESTAURANT#GENERAL, POSITIVE, ""place"")']"
103	The service is excellent, the decor is great, and the food is delicious and comes in large portions.	['(SERVICE#GENERAL, POSITIVE)', '(AMBIENCE#GENERAL, POSITIVE)', '(FOOD#QUALITY, POSITIVE)', '(FOOD#STYLE_OPTIONS, POSITIVE)']	"['(SERVICE#GENERAL, POSITIVE, ""service"")', '(AMBIENCE#GENERAL, POSITIVE, ""decor"")', '(FOOD#QUALITY, POSITIVE, ""food"")', '(FOOD#STYLE_OPTIONS, POSITIVE, ""portions"")']"
112	As always we had a great glass of wine while we waited.	['(DRINKS#QUALITY, POSITIVE)']	"['(DRINKS#QUALITY, POSITIVE, ""glass of wine"")']"
115	Make sure you try this place as often as you can.	['(RESTAURANT#GENERAL, POSITIVE)']	"['(RESTAURANT#GENERAL, POSITIVE, ""place"")']"
127	Slightly on the pricey side but worth it!	['(RESTAURANT#PRICES, NEGATIVE)', '(RESTAURANT#GENERAL, POSITIVE)']	"['(RESTAURANT#PRICES, NEGATIVE, ""NULL"")', '(RESTAURANT#GENERAL, POSITIVE, ""NULL"")']"
129	There was a small wait, but shorter than I expected.	['(SERVICE#GENERAL, POSITIVE)']	"['(SERVICE#GENERAL, POSITIVE, ""wait"")']"
139	It's all about the food !!	['(FOOD#QUALITY, POSITIVE)']	"['(FOOD#QUALITY, POSITIVE, ""food"")']"
141	but when we looked at the menu, there weren't a lot of choices, most of them were dumplings in the appetizer section.	['(FOOD#STYLE_OPTIONS, NEGATIVE)']	"['(FOOD#STYLE_OPTIONS, NEGATIVE, ""menu"")']"
143	they were dry and disgusting, i didn't even finish my first piece.	['(FOOD#QUALITY, NEGATIVE)']	"['(FOOD#QUALITY, NEGATIVE, ""NULL"")']"
145	Try the crunchy tuna, it is to die for.	['(FOOD#QUALITY, POSITIVE)']	"['(FOOD#QUALITY, POSITIVE, ""crunchy tuna"")']"
156	I take all my NYC guests to VT's.	['(RESTAURANT#MISCELLANEOUS, POSITIVE)']	"['(RESTAURANT#MISCELLANEOUS, POSITIVE, ""VT\'s"")']"
167	Stepped on my foot on the SECOND time he reached over me to adjust lighting.	['(SERVICE#GENERAL, NEGATIVE)']	"['(SERVICE#GENERAL, NEGATIVE, ""NULL"")']"
170	Try their chef's specials-- they are to die for.	['(FOOD#QUALITY, POSITIVE)']	"['(FOOD#QUALITY, POSITIVE, ""chef\'s specials"")']"
192	Inside is a little cramped, but to be expected.	['(AMBIENCE#GENERAL, NEUTRAL)']	"['(AMBIENCE#GENERAL, NEUTRAL, ""NULL"")']"
193	Service was prompt and courteous.	['(SERVICE#GENERAL, POSITIVE)']	"['(SERVICE#GENERAL, POSITIVE, ""Service"")']"
201	Wait staff is blantently unappreciative of your business but its the best pie on the UWS!	['(SERVICE#GENERAL, NEGATIVE)', '(FOOD#QUALITY, POSITIVE)']	"['(SERVICE#GENERAL, NEGATIVE, ""Wait staff"")', '(FOOD#QUALITY, POSITIVE, ""pie"")']"
204	Over 100 different choices to create your own.	['(FOOD#STYLE_OPTIONS, POSITIVE)']	"['(FOOD#STYLE_OPTIONS, POSITIVE, ""NULL"")']"
210	We will return many times for this oasis in mid-town.	['(RESTAURANT#GENERAL, POSITIVE)']	"['(RESTAURANT#GENERAL, POSITIVE, ""NULL"")']"
214	Worth visiting the 1st Ave spot because it is the original store.	['(RESTAURANT#MISCELLANEOUS, POSITIVE)']	"['(RESTAURANT#MISCELLANEOUS, POSITIVE, ""1st Ave spot"")']"
215	He served me an Uni Hand roll, which I never had before, and let me tell you...IT WAS HEAVEN!	['(FOOD#QUALITY, POSITIVE)']	"['(FOOD#QUALITY, POSITIVE, ""Uni Hand roll"")']"
236	I would highly recommend it.	['(RESTAURANT#GENERAL, POSITIVE)']	"['(RESTAURANT#GENERAL, POSITIVE, ""NULL"")']"
238	We had a great time at the Jekyll and hyde Pub last night.	['(RESTAURANT#GENERAL, POSITIVE)']	"['(RESTAURANT#GENERAL, POSITIVE, ""Jekyll and hyde Pub"")']"
241	The place's decor and hidden bathrooms made for a good laugh.	['(AMBIENCE#GENERAL, POSITIVE)', '(AMBIENCE#GENERAL, POSITIVE)']	"['(AMBIENCE#GENERAL, POSITIVE, ""decor"")', '(AMBIENCE#GENERAL, POSITIVE, ""hidden bathrooms"")']"
242	I highly recommend visiting this restaurant and having dinner and drinks!	['(RESTAURANT#GENERAL, POSITIVE)']	"['(RESTAURANT#GENERAL, POSITIVE, ""restaurant"")']"
265	The scallion pancakes and fried dumplings were nothing out of the ordinary.	['(FOOD#QUALITY, NEUTRAL)', '(FOOD#QUALITY, NEUTRAL)']	"['(FOOD#QUALITY, NEUTRAL, ""scallion pancakes"")', '(FOOD#QUALITY, NEUTRAL, ""fried dumplings"")']"
273	I will be going back very soon.	['(RESTAURANT#GENERAL, POSITIVE)']	"['(RESTAURANT#GENERAL, POSITIVE, ""NULL"")']"
275	Hats off to the chef.	['(FOOD#QUALITY, POSITIVE)']	"['(FOOD#QUALITY, POSITIVE, ""chef"")']"
287	Ingredients are organic which is a real plus for me.	['(FOOD#QUALITY, POSITIVE)']	"['(FOOD#QUALITY, POSITIVE, ""Ingredients"")']"
288	We will be back.	['(RESTAURANT#GENERAL, POSITIVE)']	"['(RESTAURANT#GENERAL, POSITIVE, ""NULL"")']"
302	We both opted for a pasta dish and they were served timely and fresh.	['(SERVICE#GENERAL, POSITIVE)', '(FOOD#QUALITY, POSITIVE)']	"['(SERVICE#GENERAL, POSITIVE, ""NULL"")', '(FOOD#QUALITY, POSITIVE, ""pasta dish"")']"
305	I recently went to this restaurant with some co-workers for lunch and had an amazing time.	['(RESTAURANT#GENERAL, POSITIVE)']	"['(RESTAURANT#GENERAL, POSITIVE, ""restaurant"")']"
308	Yes, the prices are high, but I felt it was worth it.	['(RESTAURANT#PRICES, NEGATIVE)', '(RESTAURANT#GENERAL, POSITIVE)']	"['(RESTAURANT#PRICES, NEGATIVE, ""NULL"")', '(RESTAURANT#GENERAL, POSITIVE, ""NULL"")']"
315	You are not eating haut cuisine with subtle hints of whatever but: Cassuolet, Steake Fritte, Tripe Stew, etc; simple stuff.	['(FOOD#STYLE_OPTIONS, POSITIVE)', '(FOOD#QUALITY, POSITIVE)']	"['(FOOD#STYLE_OPTIONS, POSITIVE, ""NULL"")', '(FOOD#QUALITY, POSITIVE, ""NULL"")']"
329	Pizza is terrific, as is homemade pasta.	['(FOOD#QUALITY, POSITIVE)', '(FOOD#QUALITY, POSITIVE)']	"['(FOOD#QUALITY, POSITIVE, ""Pizza"")', '(FOOD#QUALITY, POSITIVE, ""homemade pasta"")']"
330	Ambience is delightful, service impeccable.	['(AMBIENCE#GENERAL, POSITIVE)', '(SERVICE#GENERAL, POSITIVE)']	"['(AMBIENCE#GENERAL, POSITIVE, ""Ambience"")', '(SERVICE#GENERAL, POSITIVE, ""service"")']"
331	I'm still mad that i had to pay for lousy food.	['(FOOD#QUALITY, NEGATIVE)']	"['(FOOD#QUALITY, NEGATIVE, ""food"")']"
334	DO not try unless you're just going there to hang out like the rest of the hipsters who apparently have no sense of taste.	['(RESTAURANT#MISCELLANEOUS, NEGATIVE)']	"['(RESTAURANT#MISCELLANEOUS, NEGATIVE, ""NULL"")']"
336	This is my first time writing a review for a restaurant because the food and service was excellent.	['(FOOD#QUALITY, POSITIVE)', '(SERVICE#GENERAL, POSITIVE)']	"['(FOOD#QUALITY, POSITIVE, ""food"")', '(SERVICE#GENERAL, POSITIVE, ""service"")']"
343	And amazingly cheap.	['(FOOD#PRICES, POSITIVE)']	"['(FOOD#PRICES, POSITIVE, ""NULL"")']"
349	However, I think this place is a good hang out spot.	['(AMBIENCE#GENERAL, POSITIVE)']	"['(AMBIENCE#GENERAL, POSITIVE, ""place"")']"
367	Someone else recommended the dessert - we also left that.	['(FOOD#QUALITY, NEGATIVE)']	"['(FOOD#QUALITY, NEGATIVE, ""dessert"")']"
369	Skip this restaurant, it's a big disappointment.	['(RESTAURANT#GENERAL, NEGATIVE)']	"['(RESTAURANT#GENERAL, NEGATIVE, ""restaurant"")']"
370	Myagi is one of my favorite restaurants in the City; the place the negative reviews describe sound like they were somewhere else.	['(RESTAURANT#GENERAL, POSITIVE)']	"['(RESTAURANT#GENERAL, POSITIVE, ""Myagi"")']"
373	I come from a family of pizzeria owners, and I'm almost ashamed to say that the pizza in Fornino's blows my families receipies away.	['(FOOD#QUALITY, POSITIVE)']	"['(FOOD#QUALITY, POSITIVE, ""pizza"")']"
391	It's cuz it's so good you need to taste it!!! 	['(FOOD#QUALITY, POSITIVE)']	"['(FOOD#QUALITY, POSITIVE, ""NULL"")']"
410	This place is so much fun.	['(AMBIENCE#GENERAL, POSITIVE)']	"['(AMBIENCE#GENERAL, POSITIVE, ""place"")']"
420	The place is a lot of fun.	['(AMBIENCE#GENERAL, POSITIVE)']	"['(AMBIENCE#GENERAL, POSITIVE, ""place"")']"
426	We had a good time.	['(RESTAURANT#GENERAL, POSITIVE)']	"['(RESTAURANT#GENERAL, POSITIVE, ""NULL"")']"
432	Service was quick.	['(SERVICE#GENERAL, POSITIVE)']	"['(SERVICE#GENERAL, POSITIVE, ""Service"")']"
437	Whenever you need a Sushi fix, Mizu will be there with quality fish and great service.	['(FOOD#QUALITY, POSITIVE)', '(SERVICE#GENERAL, POSITIVE)']	"['(FOOD#QUALITY, POSITIVE, ""fish"")', '(SERVICE#GENERAL, POSITIVE, ""service"")']"
438	Delivery is fast too.	['(SERVICE#GENERAL, POSITIVE)']	"['(SERVICE#GENERAL, POSITIVE, ""Delivery"")']"
439	Great friendly service, Fast seating, Fast Delivery, Excellent sushi.	['(SERVICE#GENERAL, POSITIVE)', '(SERVICE#GENERAL, POSITIVE)', '(SERVICE#GENERAL, POSITIVE)', '(FOOD#QUALITY, POSITIVE)']	"['(SERVICE#GENERAL, POSITIVE, ""service"")', '(SERVICE#GENERAL, POSITIVE, ""seating"")', '(SERVICE#GENERAL, POSITIVE, ""Delivery"")', '(FOOD#QUALITY, POSITIVE, ""sushi"")']"
445	Highly recommended to all!	['(RESTAURANT#GENERAL, POSITIVE)']	"['(RESTAURANT#GENERAL, POSITIVE, ""NULL"")']"
447	Prices too high for this cramped and unappealing resturant.	['(RESTAURANT#PRICES, NEGATIVE)', '(AMBIENCE#GENERAL, NEGATIVE)']	"['(RESTAURANT#PRICES, NEGATIVE, ""resturant"")', '(AMBIENCE#GENERAL, NEGATIVE, ""resturant"")']"
480	If you go, try the marinara/arrabiatta sauce, the mozzarella en Carozza is mmmmmmmm..... everything is just delicious.	['(FOOD#QUALITY, POSITIVE)', '(FOOD#QUALITY, POSITIVE)', '(FOOD#QUALITY, POSITIVE)']	"['(FOOD#QUALITY, POSITIVE, ""marinara/arrabiatta sauce"")', '(FOOD#QUALITY, POSITIVE, ""mozzarella en Carozza"")', '(FOOD#QUALITY, POSITIVE, ""NULL"")']"
485	The food was authentic.	['(FOOD#QUALITY, POSITIVE)']	"['(FOOD#QUALITY, POSITIVE, ""food"")']"
494	I go twice a month!	['(RESTAURANT#GENERAL, POSITIVE)']	"['(RESTAURANT#GENERAL, POSITIVE, ""NULL"")']"
495	Fantastic!	['(RESTAURANT#GENERAL, POSITIVE)']	"['(RESTAURANT#GENERAL, POSITIVE, ""NULL"")']"
496	The food is good, I can't lie.	['(FOOD#QUALITY, POSITIVE)']	"['(FOOD#QUALITY, POSITIVE, ""food"")']"
498	The hostess and the waitress were incredibly rude and did everything they could to rush us out.	['(SERVICE#GENERAL, NEGATIVE)', '(SERVICE#GENERAL, NEGATIVE)']	"['(SERVICE#GENERAL, NEGATIVE, ""hostess"")', '(SERVICE#GENERAL, NEGATIVE, ""waitress"")']"
499	We were planning to get dessert but the waitress basically through the bill at us before we had a chance to order.	['(SERVICE#GENERAL, NEGATIVE)']	"['(SERVICE#GENERAL, NEGATIVE, ""waitress"")']"
500	This place is pricey, and yes, the food is worth it; but the service makes you feel like you should be paying a quater of the price.	['(RESTAURANT#PRICES, NEGATIVE)', '(FOOD#QUALITY, POSITIVE)', '(SERVICE#GENERAL, NEGATIVE)']	"['(RESTAURANT#PRICES, NEGATIVE, ""place"")', '(FOOD#QUALITY, POSITIVE, ""food"")', '(SERVICE#GENERAL, NEGATIVE, ""service"")']"
503	I ate here a week ago and found most dishes average at best and too expensive.	['(FOOD#QUALITY, NEGATIVE)', '(FOOD#PRICES, NEGATIVE)']	"['(FOOD#QUALITY, NEGATIVE, ""dishes"")', '(FOOD#PRICES, NEGATIVE, ""dishes"")']"
507	This place is always packed.	['(RESTAURANT#MISCELLANEOUS, NEUTRAL)']	"['(RESTAURANT#MISCELLANEOUS, NEUTRAL, ""place"")']"
513	JUST AWSOME.	['(FOOD#QUALITY, POSITIVE)']	"['(FOOD#QUALITY, POSITIVE, ""NULL"")']"
516	10	['(RESTAURANT#GENERAL, POSITIVE)']	"['(RESTAURANT#GENERAL, POSITIVE, ""NULL"")']"
519	Quite frankly, this is some of the worst sushi I have ever tried.	['(FOOD#QUALITY, NEGATIVE)']	"['(FOOD#QUALITY, NEGATIVE, ""sushi"")']"
520	Will never be back.	['(RESTAURANT#GENERAL, NEGATIVE)']	"['(RESTAURANT#GENERAL, NEGATIVE, ""NULL"")']"
523	the all-u-can-eat sushi is definitely in very poor quality.	['(FOOD#QUALITY, NEGATIVE)']	"['(FOOD#QUALITY, NEGATIVE, ""all-u-can-eat sushi"")']"
524	limited menu, no-so-fresh ingredients, thinly-sliced fish, fall-apart rice. 	['(FOOD#STYLE_OPTIONS, NEGATIVE)', '(FOOD#QUALITY, NEGATIVE)', '(FOOD#STYLE_OPTIONS, NEGATIVE)', '(FOOD#STYLE_OPTIONS, NEGATIVE)']	"['(FOOD#STYLE_OPTIONS, NEGATIVE, ""menu"")', '(FOOD#QUALITY, NEGATIVE, ""ingredients"")', '(FOOD#STYLE_OPTIONS, NEGATIVE, ""fish"")', '(FOOD#STYLE_OPTIONS, NEGATIVE, ""rice"")']"
527	wont come back again for sure!	['(RESTAURANT#GENERAL, NEGATIVE)']	"['(RESTAURANT#GENERAL, NEGATIVE, ""NULL"")']"
536	The service was attentive.	['(SERVICE#GENERAL, POSITIVE)']	"['(SERVICE#GENERAL, POSITIVE, ""service"")']"
547	Chennai Garden is my favorite Indian restaurant in the city.	['(RESTAURANT#GENERAL, POSITIVE)']	"['(RESTAURANT#GENERAL, POSITIVE, ""Chennai Garden"")']"
557	Food is excellent.	['(FOOD#QUALITY, POSITIVE)']	"['(FOOD#QUALITY, POSITIVE, ""Food"")']"
563	The lobster sandwich is good and the spaghetti with Scallops and Shrimp is great.	['(FOOD#QUALITY, POSITIVE)', '(FOOD#QUALITY, POSITIVE)']	"['(FOOD#QUALITY, POSITIVE, ""lobster sandwich"")', '(FOOD#QUALITY, POSITIVE, ""spaghetti with Scallops and Shrimp"")']"
569	The food was delicious (I had a halibut special, my husband had steak), and the service was top-notch.	['(FOOD#QUALITY, POSITIVE)', '(FOOD#QUALITY, POSITIVE)', '(FOOD#QUALITY, POSITIVE)', '(SERVICE#GENERAL, POSITIVE)']	"['(FOOD#QUALITY, POSITIVE, ""food"")', '(FOOD#QUALITY, POSITIVE, ""halibut special"")', '(FOOD#QUALITY, POSITIVE, ""steak"")', '(SERVICE#GENERAL, POSITIVE, ""service"")']"
572	I highly recommend the restaurant based on our experience last night.	['(RESTAURANT#GENERAL, POSITIVE)']	"['(RESTAURANT#GENERAL, POSITIVE, ""restaurant"")']"
573	We ate at this Thai place following the reviews but very unhappy with the foods.	['(FOOD#QUALITY, NEGATIVE)']	"['(FOOD#QUALITY, NEGATIVE, ""foods"")']"
578	The food is so cheap and the waiters are nice.	['(FOOD#PRICES, POSITIVE)', '(SERVICE#GENERAL, POSITIVE)']	"['(FOOD#PRICES, POSITIVE, ""food"")', '(SERVICE#GENERAL, POSITIVE, ""waiters"")']"
589	I almost hesititate to write a review because the atmosphere was so great and I would hate for it too become to crowded.	['(AMBIENCE#GENERAL, POSITIVE)']	"['(AMBIENCE#GENERAL, POSITIVE, ""atmosphere"")']"
599	Salads are a delicious way to begin the meal.	['(FOOD#QUALITY, POSITIVE)']	"['(FOOD#QUALITY, POSITIVE, ""Salads"")']"
600	You should pass on the calamari.	['(FOOD#QUALITY, NEGATIVE)']	"['(FOOD#QUALITY, NEGATIVE, ""calamari"")']"
603	Service is average.	['(SERVICE#GENERAL, NEUTRAL)']	"['(SERVICE#GENERAL, NEUTRAL, ""Service"")']"
606	I wasn't thrilled to have to wait on line for thirty minutes, but I guess that's the price you pay for a popular place.	['(SERVICE#GENERAL, NEUTRAL)']	"['(SERVICE#GENERAL, NEUTRAL, ""NULL"")']"
615	this is can became on e of the NY Italian Food fare institutions.	['(RESTAURANT#GENERAL, POSITIVE)']	"['(RESTAURANT#GENERAL, POSITIVE, ""NULL"")']"
629	Nice Family owned traditional restaurant.	['(RESTAURANT#GENERAL, POSITIVE)']	"['(RESTAURANT#GENERAL, POSITIVE, ""restaurant"")']"
646	I would recommend Roxy's for that, but not for their food.	['(FOOD#QUALITY, NEGATIVE)', '(FOOD#QUALITY, POSITIVE)']	"['(FOOD#QUALITY, NEGATIVE, ""food"")', '(FOOD#QUALITY, POSITIVE, ""NULL"")']"
648	But, they were too big for the bun.	['(FOOD#STYLE_OPTIONS, NEGATIVE)']	"['(FOOD#STYLE_OPTIONS, NEGATIVE, ""NULL"")']"
653	This place is really trendi but they have forgotten about the most important part of a  restaurant, the food.	['(FOOD#QUALITY, NEGATIVE)', '(AMBIENCE#GENERAL, POSITIVE)']	"['(FOOD#QUALITY, NEGATIVE, ""food"")', '(AMBIENCE#GENERAL, POSITIVE, ""place"")']"
661	I will definetly be going back.	['(RESTAURANT#GENERAL, POSITIVE)']	"['(RESTAURANT#GENERAL, POSITIVE, ""NULL"")']"
664	We had the scallops as an appetizer and they were delicious and the sauce was wonderful.	['(FOOD#QUALITY, POSITIVE)', '(FOOD#QUALITY, POSITIVE)']	"['(FOOD#QUALITY, POSITIVE, ""scallops"")', '(FOOD#QUALITY, POSITIVE, ""sauce"")']"
676	Also very inexpensive.	['(RESTAURANT#PRICES, POSITIVE)']	"['(RESTAURANT#PRICES, POSITIVE, ""NULL"")']"
679	We are very particular about sushi and were both please with every choice which included: ceviche mix (special), crab dumplings, assorted sashimi, sushi and rolls, two types of sake, and the banana tempura.	['(FOOD#QUALITY, POSITIVE)', '(FOOD#QUALITY, POSITIVE)', '(FOOD#QUALITY, POSITIVE)', '(FOOD#QUALITY, POSITIVE)', '(FOOD#QUALITY, POSITIVE)', '(FOOD#QUALITY, POSITIVE)', '(DRINKS#QUALITY, POSITIVE)', '(FOOD#QUALITY, POSITIVE)']	"['(FOOD#QUALITY, POSITIVE, ""sushi"")', '(FOOD#QUALITY, POSITIVE, ""ceviche mix (special)"")', '(FOOD#QUALITY, POSITIVE, ""crab dumplings"")', '(FOOD#QUALITY, POSITIVE, ""assorted sashimi"")', '(FOOD#QUALITY, POSITIVE, ""sushi"")', '(FOOD#QUALITY, POSITIVE, ""rolls"")', '(DRINKS#QUALITY, POSITIVE, ""sake"")', '(FOOD#QUALITY, POSITIVE, ""banana tempura"")']"
687	An excellent service	['(SERVICE#GENERAL, POSITIVE)']	"['(SERVICE#GENERAL, POSITIVE, ""service"")']"
688	We were greeted promptly by the waiter who was very nice and cordial.	['(SERVICE#GENERAL, POSITIVE)']	"['(SERVICE#GENERAL, POSITIVE, ""waiter"")']"
689	She was very helpful in suggesting us drinks and helped us in ordering a lot of good dishes since we knew nothing about Indian food.	['(SERVICE#GENERAL, POSITIVE)', '(FOOD#QUALITY, POSITIVE)']	"['(SERVICE#GENERAL, POSITIVE, ""NULL"")', '(FOOD#QUALITY, POSITIVE, ""dishes"")']"
690	The food looked very appetizing and delicious since it came on a variety of fancy plates.	['(FOOD#STYLE_OPTIONS, POSITIVE)']	"['(FOOD#STYLE_OPTIONS, POSITIVE, ""food"")']"
691	We ended our great experience by having Gulab Jamun (dessert) recommended by the waiter.	['(FOOD#QUALITY, POSITIVE)']	"['(FOOD#QUALITY, POSITIVE, ""Gulab Jamun (dessert)"")']"
692	I thanked my friend who recommended me this restaurant and will certainly recommend it to others.	['(RESTAURANT#GENERAL, POSITIVE)']	"['(RESTAURANT#GENERAL, POSITIVE, ""restaurant"")']"
698	Always a nice crowd, but never loud.	['(RESTAURANT#MISCELLANEOUS, POSITIVE)', '(AMBIENCE#GENERAL, POSITIVE)']	"['(RESTAURANT#MISCELLANEOUS, POSITIVE, ""crowd"")', '(AMBIENCE#GENERAL, POSITIVE, ""NULL"")']"
717	I'm sure I'll return for a final judgement tho.	['(RESTAURANT#GENERAL, NEUTRAL)']	"['(RESTAURANT#GENERAL, NEUTRAL, ""NULL"")']"
719	Mizu is the Japenese find in Grammercy.	['(RESTAURANT#GENERAL, POSITIVE)']	"['(RESTAURANT#GENERAL, POSITIVE, ""Mizu"")']"
728	The view is spectacular, and the food is great.	['(LOCATION#GENERAL, POSITIVE)', '(FOOD#QUALITY, POSITIVE)']	"['(LOCATION#GENERAL, POSITIVE, ""view"")', '(FOOD#QUALITY, POSITIVE, ""food"")']"
730	Definitely worth the trip to Battery Park City!	['(RESTAURANT#GENERAL, POSITIVE)']	"['(RESTAURANT#GENERAL, POSITIVE, ""NULL"")']"
732	Authentic Taiwanese food that's cheap... what more could you ask for?	['(FOOD#QUALITY, POSITIVE)', '(FOOD#PRICES, POSITIVE)']	"['(FOOD#QUALITY, POSITIVE, ""Taiwanese food"")', '(FOOD#PRICES, POSITIVE, ""Taiwanese food"")']"
737	I really like both the scallops and the mahi mahi (on saffron risotto-yum!).	['(FOOD#QUALITY, POSITIVE)', '(FOOD#QUALITY, POSITIVE)']	"['(FOOD#QUALITY, POSITIVE, ""scallops"")', '(FOOD#QUALITY, POSITIVE, ""mahi mahi (on saffron risotto"")']"
743	Their calzones are horrific, bad, vomit-inducing, YUCK.	['(FOOD#QUALITY, NEGATIVE)']	"['(FOOD#QUALITY, NEGATIVE, ""calzones"")']"
746	They charge different prices all the time.	['(SERVICE#GENERAL, NEGATIVE)']	"['(SERVICE#GENERAL, NEGATIVE, ""NULL"")']"
752	Calling the place Hampton Chutney Co. does warn you that these folks offer more style than substance, but in this unattractive room with unhelpful clerks there was a dearth of the former too.	['(RESTAURANT#GENERAL, NEGATIVE)', '(AMBIENCE#GENERAL, NEGATIVE)', '(SERVICE#GENERAL, NEGATIVE)']	"['(RESTAURANT#GENERAL, NEGATIVE, ""place"")', '(AMBIENCE#GENERAL, NEGATIVE, ""room"")', '(SERVICE#GENERAL, NEGATIVE, ""clerks"")']"
754	The atmosphere is unheralded, the service impecible, and the food magnificant.	['(AMBIENCE#GENERAL, POSITIVE)', '(SERVICE#GENERAL, POSITIVE)', '(FOOD#QUALITY, POSITIVE)']	"['(AMBIENCE#GENERAL, POSITIVE, ""atmosphere"")', '(SERVICE#GENERAL, POSITIVE, ""service"")', '(FOOD#QUALITY, POSITIVE, ""food"")']"
767	THE BIG COMPLAINT: NO TOASTING AVAILABLE.	['(SERVICE#GENERAL, NEGATIVE)']	"['(SERVICE#GENERAL, NEGATIVE, ""NULL"")']"
776	Love Pizza 33..	['(RESTAURANT#GENERAL, POSITIVE)']	"['(RESTAURANT#GENERAL, POSITIVE, ""Pizza 33"")']"
782	They even scoop it out nice (for those on a diet) not too much not to little.	['(FOOD#STYLE_OPTIONS, POSITIVE)']	"['(FOOD#STYLE_OPTIONS, POSITIVE, ""NULL"")']"
786	Bagels are ok, but be sure not to make any special requests!	['(FOOD#QUALITY, NEUTRAL)', '(SERVICE#GENERAL, NEGATIVE)']	"['(FOOD#QUALITY, NEUTRAL, ""Bagels"")', '(SERVICE#GENERAL, NEGATIVE, ""NULL"")']"
819	The place was quiet and delightful.	['(AMBIENCE#GENERAL, POSITIVE)']	"['(AMBIENCE#GENERAL, POSITIVE, ""place"")']"
827	You can get a completely delish martini in a glass (that's about 2 1/2 drinks) for $8.50 (I recommend the Vanilla Shanty, mmmm!) in a great homey setting with great music.	['(DRINKS#QUALITY, POSITIVE)', '(DRINKS#STYLE_OPTIONS, POSITIVE)', '(DRINKS#PRICES, POSITIVE)', '(DRINKS#QUALITY, POSITIVE)', '(AMBIENCE#GENERAL, POSITIVE)', '(AMBIENCE#GENERAL, POSITIVE)']	"['(DRINKS#QUALITY, POSITIVE, ""martini"")', '(DRINKS#STYLE_OPTIONS, POSITIVE, ""martini"")', '(DRINKS#PRICES, POSITIVE, ""martini"")', '(DRINKS#QUALITY, POSITIVE, ""Vanilla Shanty"")', '(AMBIENCE#GENERAL, POSITIVE, ""setting"")', '(AMBIENCE#GENERAL, POSITIVE, ""music"")']"
831	Its location is good and the fact that Hutner College is near and their prices are very reasonable, makes students go back to Suan again and again.	['(LOCATION#GENERAL, POSITIVE)', '(RESTAURANT#PRICES, POSITIVE)']	"['(LOCATION#GENERAL, POSITIVE, ""location"")', '(RESTAURANT#PRICES, POSITIVE, ""Suan"")']"
836	I cannot imagine a friendlier staff working in a restaurant.	['(SERVICE#GENERAL, POSITIVE)']	"['(SERVICE#GENERAL, POSITIVE, ""staff"")']"
850	Steamed fresh so brought hot hot hot to your table.	['(FOOD#QUALITY, POSITIVE)']	"['(FOOD#QUALITY, POSITIVE, ""NULL"")']"
851	The wait here is long for dim sum, but if you don't like sharing tables or if the typical raucous dim sum atmosphere is not your gig, this is a sleek (for Chinatown) alternative.	['(SERVICE#GENERAL, NEGATIVE)', '(AMBIENCE#GENERAL, NEGATIVE)', '(RESTAURANT#MISCELLANEOUS, NEGATIVE)']	"['(SERVICE#GENERAL, NEGATIVE, ""wait"")', '(AMBIENCE#GENERAL, NEGATIVE, ""atmosphere"")', '(RESTAURANT#MISCELLANEOUS, NEGATIVE, ""NULL"")']"
852	A few tips: skip the turnip cake, roast pork buns and egg custards.	['(FOOD#QUALITY, NEGATIVE)', '(FOOD#QUALITY, NEGATIVE)', '(FOOD#QUALITY, NEGATIVE)']	"['(FOOD#QUALITY, NEGATIVE, ""turnip cake"")', '(FOOD#QUALITY, NEGATIVE, ""roast pork buns"")', '(FOOD#QUALITY, NEGATIVE, ""egg custards"")']"
858	The restaurant is a bit noisy but that is something that can be overlooked once you sit down and enjoy a great meal	['(FOOD#QUALITY, POSITIVE)', '(AMBIENCE#GENERAL, NEUTRAL)']	"['(FOOD#QUALITY, POSITIVE, ""meal"")', '(AMBIENCE#GENERAL, NEUTRAL, ""restaurant"")']"
861	Have eaten at Ginger House several times, and it's always good.	['(RESTAURANT#GENERAL, POSITIVE)']	"['(RESTAURANT#GENERAL, POSITIVE, ""Ginger House"")']"
868	Terrible, terrible management - deserves to be shut-down.	['(SERVICE#GENERAL, NEGATIVE)', '(RESTAURANT#GENERAL, NEGATIVE)']	"['(SERVICE#GENERAL, NEGATIVE, ""management"")', '(RESTAURANT#GENERAL, NEGATIVE, ""NULL"")']"
